position,title,query,snippet_highlighted_words,rich_snippet_list,snippet,link74,Boys Pajamas and Sleepwear – Chasing Fireflies,boy's Pajamas,"['pajamas', 'sleepwear', 'boys']",[],"Discover the cutest pajamas and sleepwear for boys at Chasing Fireflies. We offer lots of exclusive, playful prints and patterns of things kids like…sharks, ...",https://www.chasing-fireflies.com/collections/boys-pajamas-sleepwear
75,Boys Red Pajamas - Target,boy's Pajamas,"['boys', 'pajamas']",[],"Shop Target for boys red pajamas you will love at great low prices. Choose from Same Day Delivery, Drive Up or Order Pickup plus free shipping on orders ...",https://www.target.com/s/boys+red+pajamas
76,Boys Fire Truck Pajamas - Amazon.com,boy's Pajamas,"['Pajama', 'Pjs']",[],"Price and other details may vary based on product size and color. A&J DESIGN Toddler Kids Pajama Sets, 100% Cotton 2 Piece Pjs.",https://www.amazon.com/boys-fire-truck-pajamas/s?k=boys+fire+truck+pajamas&page=2
77,Baby Boys' Pajama Sets - Amazon.com,boy's Pajamas,['Pajamas'],[],"Price and other details may vary based on product size and color. The Children's Place Family Matching Christmas Holiday Pajamas Sets, Snug Fit 100 ...",https://www.amazon.com/Baby-Boys-Pajama-Sets-9-12-mo/s?keywords=Baby+Boys%27+Pajama+Sets&rh=n%3A2475839011%2Cp_n_size_two_browse-vebin%3A1289785011&c=ts&ts_id=2475839011
78,Boys Pajama Sale | Tea Collection,boy's Pajamas,"['boys pajamas', 'boys pjs']",[],Shop now for Tea boys pajamas on sale. Stock up and save on boys pjs and sleepwear.,https://www.teacollection.com/sale/boys-pajamas
79,Pajama Shorts Boys - Target,boy's Pajamas,"['pajama', 'boys']",[],"Shop Target for pajama shorts boys you will love at great low prices. Choose from Same Day Delivery, Drive Up or Order Pickup plus free shipping on orders ...",https://www.target.com/s/pajama+shorts+boys
80,Sale : Boys' Pajamas & Robes - Target,boy's Pajamas,"['Boys', 'Pajama']",[],Lands' End Boys Short Sleeve Tee and Shorts Pajama Set · Lands' End. milky way galaxy. napstronaut sloth. $31.96 reg $39.95. Sale. When purchased online.,https://www.target.com/c/pajamas-robes-boys-clothing-kids/sale/-/N-5xtxuZ5tdv0
81,Space Jam Boys' Sleepwear in Kids' Pajamas & Robes(23),boy's Pajamas,"['Boys', 'Sleepwear']",[],Shop for Space Jam Boys' Sleepwear in Kids' Pajamas & Robes at Walmart and save.,https://www.walmart.com/browse/clothing/boys-sleepwear/space-jam/5438_1228539_9216494_444554/YnJhbmQ6U3BhY2UgSmFt
82,Boys' Pajamas & Boxers | J.Crew,boy's Pajamas,"['Boys', 'pajamas']",[],Shop Boys' pajamas & boxers at J.Crew. Find the best pajamas & boxers and see the entire selection of Boys' clothing.,https://www.jcrew.com/plp/boys/categories/clothing/pajamas
83,Boys' Pajamas & Sleepwear | Old Navy,boy's Pajamas,"['boys', 'sleepwear']",[],Tuck them in for a night's recharge with boys' sleepwear and pajamas from Old Navy. Find sleepwear separates in a range of styles.,https://oldnavy.gap.com/browse/category.do?cid=36319&style=1149956
84,Boys' Pajama Sets - Sonic The Hedgehog ... - Amazon.com,boy's Pajamas,"['Boys', 'Pajama']",[],Price and other details may vary based on product size and color. Sonic The Hedgehog Boys Two Piece Long Sleeve Shirt And Pants Pajama Set.,https://www.amazon.com/Boys-Pajama-Sets-Sonic-Hedgehog-Sleepwear/s?keywords=Boys%27+Pajama+Sets&rh=n%3A1046024%2Cp_lbr_characters_browse-bin%3ASonic+the+Hedgehog&c=ts&ts_id=1046024
85,Big Boys Long Sleeve Plaid Pajamas Cotton Young Teens ...,boy's Pajamas,"['Boys', 'Pajamas', 'Sleepwear', 'Pajama']",[],Buy Big Boys Long Sleeve Plaid Pajamas Cotton Young Teens Sleepwear 10-16Years and other Pajama Sets at Amazon.com. Our wide selection is elegible for free ...,https://www.amazon.com/Sleeve-Pajamas-Cotton-Sleepwear-10-16Years/dp/B08YNN9VPX
86,Boys' One-Pieces Pajamas - Old Navy,boy's Pajamas,"['Boys', 'Pajamas']",[],"Shop Old Navy for Boys' One-Pieces Pajamas, find essential styles & fashion trends for the family at amazing prices.",https://oldnavy.gap.com/browse/category.do?cid=36319&style=1002576
87,Boys Superhero Pajamas - Amazon.com,boy's Pajamas,"['Boys', 'Boys', 'Pajamas', 'Pajama']",[],"Spotted Zebra Disney | Marvel | Star Wars | Frozen Babies, Toddlers, and Boys · Marvel Boys' Avengers Pajamas · DC Comics Justice League Superman Pajama Shirt & ...",https://www.amazon.com/boys-superhero-pajamas/s?k=boys+superhero+pajamas
88,Fortnite Pajamas For Boys - Amazon.com,boy's Pajamas,"['Boys', 'Pajamas']",[],Price and other details may vary based on product size and color. Battle Royale Boys' Gaming Pajamas Size 8 Multicolored. Pinch to zoom-in further ...,https://www.amazon.com/fortnite-pajamas-boys/s?k=fortnite+pajamas+for+boys
89,Boys Sports Pajamas - Target,boy's Pajamas,"['boys', 'pajamas']",[],"Shop Target for boys sports pajamas you will love at great low prices. Choose from Same Day Delivery, Drive Up or Order Pickup plus free shipping on orders ...",https://www.target.com/s/boys+sports+pajamas
90,Boys Glow Dark Pajamas - Walmart.com,boy's Pajamas,"['Boys Pajamas', 'Boys Pajamas']",[],Little Boys Pajamas Cartoon Car 100% Cotton Long Sleeve Toddler Pjs Toddler Clothes Kids Sleepwear. +8 options. From $12.99. Popshion. Little Boys Pajamas ...,https://www.walmart.com/c/kp/boys-glow-dark-pajamas
91,Pajamas & Robes - Boys - Neiman Marcus,boy's Pajamas,['boys pajamas'],[],"Shop boys pajamas and robes at Neiman Marcus. Find these matching pajama sets, robes, and more for your little one.",https://www.neimanmarcus.com/c/kids-boys-pajamas-robes-cat73900736
1,Boys' Pajamas & Robes - Target,boy's Pajamas,['Pajamas'],[],"Shop Target for Pajamas & Robes you will love at great low prices. Choose from Same Day Delivery, Drive Up or Order Pickup. Free standard shipping with $35 ...",https://www.target.com/c/pajamas-robes-boys-clothing-kids/-/N-5xtxu
2,Boys' Pajama Sets - Target,boy's Pajamas,"['Kids', 'Boys', 'Pajamas', 'Pajama']",[],"Target/Clothing, Shoes & Accessories/Kids' Clothing/Boys' Clothing/Pajamas & Robes/Pajama Sets (487)‎. How are you shopping today? Pickup.",https://www.target.com/c/pajama-sets-pajamas-robes-boys-clothing-kids/-/N-4xnwk
3,Boys' Pajamas: Cute PJs and Sleepwear For Kids | Kohl's,boy's Pajamas,"['Boys', 'Pajamas']",[],Enjoy free shipping and easy returns every day at Kohl's. Find great deals on Boys' Pajamas at Kohl's today!,https://www.kohls.com/catalog/boys-kids-sleepwear-clothing.jsp?CN=Gender:Boys+AgeAppropriate:Kids+Category:Sleepwear+Department:Clothing
4,Boys Pajamas - Macy's,boy's Pajamas,['Boys Pajamas'],[],"Boys Pajamas at Macy's come in all styles & colors. Buy boys footed, fleece, short pajamas & more at Macy's! Free shipping: Macy's Star Rewards Members!",https://www.macys.com/shop/kids-clothes/boys-pajamas?id=188759
5,"Boys Pajamas, PJ Sets & Sleepwear | The Children's Place",boy's Pajamas,"['boys pajamas', 'boys pjs']",[],"Shop for boys pajamas. Find comfy boys pjs and sleepwear at The Children's Place, where big fashion meets little prices with free shipping!",https://www.childrensplace.com/us/c/boys-clothing-sleepwear
6,Boys' Sleepwear / Boys' Clothing - Amazon.com,boy's Pajamas,['boys sleepwear'],[],Shop for boys sleepwear and robes on Amazon.com. Free shipping and free returns on eligible ... Boys' Single Long Sleeve Top and Pants 2 Piece Pajamas Sets.,https://www.amazon.com/Boys-Sleepwear/b?ie=UTF8&node=3455651
7,Boys' Pajamas & Sleepwear - Old Navy,boy's Pajamas,"['boys', 'sleepwear']",[],Tuck them in for a night's recharge with boys' sleepwear and pajamas from Old Navy. Find sleepwear separates in a range of styles.,https://oldnavy.gap.com/browse/category.do?cid=36319
8,Boys' Sleepwear in Kids' Pajamas & Robes - Walmart.com,boy's Pajamas,"['Boys', 'Sleepwear', 'Kids', 'Pajamas']",[],"Shop for Boys' Sleepwear in Kids' Pajamas & Robes. Buy products such as Minecraft Boys Long Sleeve Top and Pants, 2-Piece Pajamas Set, Sizes 4-16 at Walmart ...",https://www.walmart.com/browse/clothing/boys-sleepwear/5438_1228539_9216494_444554
9,Boys' Pajamas & Robes - JCPenney,boy's Pajamas,"['boys', 'pajamas']",[],"Shop JCPenney and save on boys' pajamas, pajama sets from Carter's, Arizona, and many more for toddler, big and little boys. Free shipping available.",https://www.jcpenney.com/g/baby-kids/pajamas-robes/boys?id=cat11100000057
10,Boys' Pajamas & Robes - Nordstrom,boy's Pajamas,"['boys', 'pajamas']",[],"Free shipping on boys' pajamas, robes and sleepwear at Nordstrom.com. Totally free shipping and returns.",https://www.nordstrom.com/browse/kids/boys-clothing/pajamas
11,boys pajamas | abercrombie kids,boy's Pajamas,"['boys pajamas', 'boys sleepwear']",[],Check out boys pajamas at abercrombie kids. Cozy boys sleepwear and boys sleep sets that bring on the sweet dreams.,https://www.abercrombie.com/shop/us/kids/boys-sleep
12,Boys' Sleepwear | Pajamas & Bathrobes | H&M US,boy's Pajamas,"['boys', 'sleepwear']",[],Get him ready for a dreamy sleep with our boys' sleepwear. Browse pajamas and bathrobes in soft fabrics online at H&M.,https://www2.hm.com/en_us/kids/boys/clothing/sleepwear.html
13,Size 6 Boys Pajamas - Target,boy's Pajamas,['boys pajamas'],[],"Shop Target for size 6 boys pajamas you will love at great low prices. Choose from Same Day Delivery, Drive Up or Order Pickup plus free shipping on orders ...",https://www.target.com/s/size+6+boys+pajamas
14,"Boys' Pajamas: Sets, Robes & Sleepers | Lands' End",boy's Pajamas,"['boys', 'pajamas']",[],"Browse boys' pajamas at Lands' End. Find sleepwear such as fleece pajama sets, robes & footed onesies. Choose from summer & winter pajamas.",https://www.landsend.com/shop/boys-sleepwear/S-xfj-xez-y5e-xec
15,Boys Pajama Sets in Boys Pajamas(1000+) - Walmart.com,boy's Pajamas,"['Boys Pajama', 'Boys Pajamas']",[],"Shop for Boys Pajama Sets in Boys Pajamas. Buy products such as Jurassic Park Boys Long Sleeve Pajamas Set, 2-Piece at Walmart and save.",https://www.walmart.com/browse/clothing/boys-pajama-sets/5438_1228539_9216494_7223575_5059183
16,Little Boys Pajama Sets in Little Boys Pajamas - Walmart.com,boy's Pajamas,"['Boys Pajama', 'Boys Pajamas']",[],"Shop for Little Boys Pajama Sets in Little Boys Pajamas. Buy products such as Ryan's World Little Boys Long Sleeve Pajamas Set, 2-Piece, Sizes 4-12 at ...",https://www.walmart.com/browse/clothing/little-boys-pajama-sets/5438_7712430_7809949_9487749_3435235_3930670
17,Boys' Pajamas - Belk,boy's Pajamas,"['Boys', 'Pajamas']",[],Boys' Pajamas (162) · Avengers Boys 8-20 2 Piece Pajama Set · AME Toddlers Boys Trains 4 Piece Pajama Set · AME Boys 4-7 Pokemon 2-Piece Pajama Set · AME Boys 4-7 ...,https://www.belk.com/kids/boys-clothing/pajamas/
18,Boys' Pajamas | Dillard's,boy's Pajamas,"['Boys', 'Pajamas']",[],"Shop our collection of Boys' Pajamas available at Dillard's. Choose from top brands as Burt's Bees, Dream Life, and more.",https://www.dillards.com/c/kids-boys-pajamas
19,Kids' Pajamas and Slippers - Target,boy's Pajamas,"['kids', 'pajamas', 'pajamas', 'pajama']",[],"Shop at Target for kids, toddler, and baby pajamas. Find our wide selection of Christmas pajamas, pajama sets, union suits, and more!",https://www.target.com/c/kids-pajamas-and-slippers/-/N-627hi
20,Boys Pajamas Sizes 7 - Target,boy's Pajamas,['boys pajamas'],[],"Shop Target for boys pajamas sizes 7 you will love at great low prices. Choose from Same Day Delivery, Drive Up or Order Pickup plus free shipping on orders ...",https://www.target.com/s/boys+pajamas+sizes+7
21,Boys Pajamas in Boys Clothing - Walmart.com,boy's Pajamas,['Boys Pajamas'],[],"Shop for Boys Pajamas in Boys Clothing. Buy products such as Lego Ninjago Boys Classic 2 Piece Long Sleeve and Long Pant Pajama Set with Slippers, ...",https://www.walmart.com/browse/clothing/boys-pajamas/5438_7712430_7809949_7223575
22,Home - Shop - Boys - Categories - Sleepwear - Hatley US,boy's Pajamas,"['Boys Sleepwear', 'boys', 'pajamas']",[],"Boys Sleepwear. Crafted with love and made with 100% cotton for a softer-than-soft feel, our boys' pajamas are a ...",https://www.hatley.com/categories/boys-sleepwear
23,Boys Pajamas 6t - Amazon.com,boy's Pajamas,['boys pajamas'],[],"Amazon.com: boys pajamas 6t. ... Prime Try Before You Buy · Burt's Bees Baby Baby Boys' Pj Set, Tee and Pant 2-Piece Pajamas. Pinch to zoom-in further ...",https://www.amazon.com/boys-pajamas-6t/s?k=boys+pajamas+6t
24,Boys Pajamas Size 6 Long Sleeve - Amazon.com,boy's Pajamas,"['Kids', 'Pajama']",[],"Boys and Toddlers' 4-Piece Pajama Set (Cotton Top & Fleece Bottom) · Warm Long-Sleeve PJ Sets for Girls and Boys, Cozy, Comfy, Funny Kids' Pajama Sets, Animal, ...",https://www.amazon.com/boys-pajamas-size-6-long-sleeve/s?k=boys+pajamas+size+6+long+sleeve
25,Boys Pajamas Size 8 - Amazon.com,boy's Pajamas,"['Boys', 'Pajama', 'Boys', 'Pajama', 'Boys']",[],"Babies, Toddlers, and Boys' 6-Piece Snug-Fit Cotton Pajama Set · Boys' Long Sleeve Top and Pants Snug Fit 100% Cotton 2 Piece Pajama Sets · Boys' Black Panther | ...",https://www.amazon.com/boys-pajamas-size-8/s?k=boys+pajamas+size+8
26,Boys' Pajamas & Sleepwear - Old Navy,boy's Pajamas,"['boys', 'sleepwear']",[],Tuck them in for a night's recharge with boys' sleepwear and pajamas from Old Navy. Find sleepwear separates in a range of styles.,https://oldnavy.gap.com/browse/category.do?cid=36319&style=1127896
27,Boys Pajamas: Boys Sleepwear & Boys PJs | Tea Collection,boy's Pajamas,['boys PJs'],[],Discover adorable boys' animal pajamas with bold and bright prints he's sure to love. Shop all our boys PJs at Tea Collection.,https://www.teacollection.com/boys-pajamas-sleepwear
28,Amazon Best Sellers: Best Boys' Pajama Sets,boy's Pajamas,"['Boys', 'Pajama']",[],"Discover the best Boys' Pajama Sets in Best Sellers. Find the top 100 most popular items in Amazon Clothing, Shoes & Jewelry Best Sellers.",https://www.amazon.com/Best-Sellers-Boys'-Pajama-Sets/zgbs/fashion/1046024
29,Boys Pajamas 5t - Amazon.com,boy's Pajamas,"['Boys', 'Boys', 'Pajama']",[],"Simple Joys by Carter's Babies, Toddlers, and Boys' 6-Piece Snug- · Simple Joys by Carter's Boys and Toddlers' 4-Piece Pajama Set (Cotton Top · Burt's Bees Baby ...",https://www.amazon.com/boys-pajamas-5t/s?k=boys+pajamas+5t
30,Boys Pajamas Size 5 - Amazon.com,boy's Pajamas,['boys pajamas'],[],"Amazon.com: boys pajamas size 5. ... Babies, Toddlers, and Boys' 6-Piece Snug-Fit Cotton Pajama Set. 4.8 out of 5 stars 34,329. $22.50$22.50$23.99$23.99.",https://www.amazon.com/boys-pajamas-size-5/s?k=boys+pajamas+size+5
31,5t Boys Pajamas - Target,boy's Pajamas,['boys pajamas'],[],"Shop Target for 5t boys pajamas you will love at great low prices. Choose from Same Day Delivery, Drive Up or Order Pickup plus free shipping on orders ...",https://www.target.com/s/5t+boys+pajamas
32,Sleepwear for Boys - Costco Wholesale,boy's Pajamas,"['Sleepwear', 'Boys', 'Sleepwear', 'Boys']",[],Find a great collection of Sleepwear for Boys at Costco. Enjoy low warehouse prices on name-brand Sleepwear for Boys products.,https://www.costco.com/boys-sleepwear.html
33,Toddler Boys Pajamas in Toddler Boys (12M-5T) Clothing,boy's Pajamas,['Boys Pajamas'],[],"Shop for Toddler Boys Pajamas in Toddler Boys (12M-5T) Clothing. Buy products such as Gerber Baby Boy & Toddler Boy Microfleece Blanket Sleeper Pajamas, ...",https://www.walmart.com/browse/clothing/toddler-boys-pajamas/5438_7712430_2700757_9326390_2199183
34,Big Boys Pajamas & Robes - Walmart.com,boy's Pajamas,"['Boys Pajamas', 'Kids', 'Sleepwear']",[],Shop for Big Boys Pajamas & Robes in Kids' Sleepwear. Buy products such as Micro Fleece Sleep Pants Value 2 Pack (Little Boy & Big Boy) at Walmart and save.,https://www.walmart.com/browse/clothing/big-boys-pajamas-robes/5438_7712430_7809949_3361927_8291446
35,Only Boys Kids' Pajamas & Robes in Pajama Shop(26),boy's Pajamas,"['Kids', 'Pajamas']",[],Shop for Only Boys Kids' Pajamas & Robes in Pajama Shop at Walmart and save.,https://www.walmart.com/browse/clothing/kids-pajamas-robes/only-boys/5438_1228539_9216494/YnJhbmQ6T25seSBCb3lz
36,Boys Pajamas Size 7 - Amazon.com,boy's Pajamas,"['Boys', 'Pajamas']",[],"Baby Boys' Pj Set, Tee and Pant 2-Piece Pajamas, 100% Organic Cotton ... Global Organic Textile Standard certifies each step of the organic textile supply chain ...",https://www.amazon.com/boys-pajamas-size-7/s?k=boys+pajamas+size+7
37,Boys Sports Pajamas - Amazon.com,boy's Pajamas,"['Boys', 'Pajamas', 'Boys', 'Sleepwear', 'Pajama', ""Boy's""]",[],The Children's Place Boys Long Sleeve Snug Fit Cotton 2 Piece Pajamas · Calvin Klein Boys' 2 Piece Sleepwear Top and Bottom Pajama Set Pj · Mad Dog Concepts Boy's ...,https://www.amazon.com/boys-sports-pajamas/s?k=boys+sports+pajamas
38,Boys Pajamas Size 14-16 - Amazon.com,boy's Pajamas,"['Boys', 'Pajama', 'Boys', 'Pajamas', 'Boys', 'Pajama']",[],"Calvin Klein Boys' Lounge Pajama Shorts, 2 Pack · The Children's Place Boys Long Sleeve Snug Fit Cotton 2 Piece Pajamas · The Children's Place Boys' Fleece Pajama ...",https://www.amazon.com/boys-pajamas-size-14-16/s?k=boys+pajamas+size+14-16
39,Boys' Shark Pajamas - Amazon.com,boy's Pajamas,['Boys Pajamas'],[],Price and other details may vary based on product size and color. Boys Pajamas 100% Cotton Toddler Clothes Set Planet Dinosaur Long Sleeve Sleepwear 2 Piece ...,https://www.amazon.com/shark-pajamas-boys/s?k=shark+pajamas+boys
40,Summer Pajamas For Boys - Amazon.com,boy's Pajamas,"['Boys', 'Pajama']",[],Price and other details may vary based on product size and color. The Children's Place Boys Sleeve Top and Shorts Snug Fit 100% Cotton 2 Piece Pajama.,https://www.amazon.com/Summer-Pajamas-Boys/s?k=Summer+Pajamas+for+Boys
41,Button Down Pajamas Boys - Amazon.com,boy's Pajamas,"['Kids', 'Pajamas']",[],RESULTS. Price and other details may vary based on product size and color. The Children's Place Kids' Holiday Plaid Flannel 2 Piece Button Down Pajamas.,https://www.amazon.com/button-down-pajamas-boys/s?k=button+down+pajamas+boys
42,Boys Pajamas - Amazon.com,boy's Pajamas,"['Boys', 'Pajama Sleepwear', 'Pajama']",[],"Disney | Marvel | Star Wars | Frozen Babies, Toddlers, and Boys' Snug-Fit Cotton Pajama Sleepwear Sets · Marvel Family Matching Pajama Sleep Sets · Babies, ...",https://www.amazon.com/boys-pajamas/s?k=boys+pajamas
43,Boys' Sleepwear & Pajamas | Boden US,boy's Pajamas,"['boys', 'sleepwear']",[],Discover our range of boys' sleepwear at Boden. Browse our cosy collection of printed pajamas and soft slippers sure to keep things snug at bedtime.,https://www.bodenusa.com/en-us/boys-sleepwear
44,Boys Pajamas Size 12 - Target,boy's Pajamas,['boys pajamas'],[],"Shop Target for boys pajamas size 12 you will love at great low prices. Choose from Same Day Delivery, Drive Up or Order Pickup plus free shipping on orders ...",https://www.target.com/s/boys+pajamas+size+12
45,Size 10 Boys Pajamas - Target,boy's Pajamas,['boys pajamas'],[],"Shop Target for size 10 boys pajamas you will love at great low prices. Choose from Same Day Delivery, Drive Up or Order Pickup plus free shipping on orders ...",https://www.target.com/s/size+10+boys+pajamas
46,Toddler Boys' Pajamas & Robes - Target,boy's Pajamas,"['Boys', 'Pajamas', 'Pajama']",[],"Target/Clothing, Shoes & Accessories/Toddler Clothing/Toddler Boys' Clothing/Pajamas & Robes (408)‎. Shop by category. Pajama Sets.",https://www.target.com/c/pajamas-robes-toddler-boys-clothing-kids/-/N-4tfpx
47,Boys Pajamas Size 8 - Target,boy's Pajamas,['boys pajamas'],[],"Shop Target for boys pajamas size 8 you will love at great low prices. Choose from Same Day Delivery, Drive Up or Order Pickup plus free shipping on orders ...",https://www.target.com/s/boys+pajamas+size+8
48,Boys Pajamas Size 14 - Amazon.com,boy's Pajamas,"['Boys', 'Pajama', 'Boys', 'Sleepwear', 'Pajama', 'Boys', 'Pajamas']",[],Boys' Long Sleeve Top and Pants Snug Fit 100% Cotton 2 Piece Pajama Sets · Boys' 2 Piece Sleepwear Top and Bottom Pajama Set Pj · Boys Long Sleeve 2 Piece Pajamas.,https://www.amazon.com/boys-pajamas-size-14/s?k=boys+pajamas+size+14
49,Airplane Pajamas Boys - Amazon.com,boy's Pajamas,"['Pajamas', 'Boys', 'PJs', 'Sleepwear']",[],RESULTS. Price and other details may vary based on product size and color. Pajamas for Boys Dinosaur Rocket Space 4-Piece PJs Long Sleeve Sets Sleepwear 2-.,https://www.amazon.com/airplane-pajamas-boys/s?k=airplane+pajamas+boys
50,Boys Pajamas Size 6 - Amazon.com,boy's Pajamas,"['Boys', 'Pajama']",[],RESULTS. Price and other details may vary based on product size and color. Simple Joys by Carter's Boys and Toddlers' 4-Piece Pajama Set (Cotton Top.,https://www.amazon.com/boys-pajamas-size-6/s?k=boys+pajamas+size+6
51,Kids Pajamas - Sam's Club,boy's Pajamas,['Kids Pajamas'],[],Kids Pajamas. 6 results. Sort & filter(1). Prices may vary in club and online. Member's Mark Boys 8-Piece Snug Fit Pajamas. View more options ...,https://www.samsclub.com/b/boys-clothing/13180126?rootDimension=pcs_availability%3AOnlinepipsymbProduct%20Type%3AKids%20Pajamas
52,Toddler Boys Pajama Sets in Toddler Boys Pajamas - Walmart,boy's Pajamas,"['Boys Pajama', 'Boys Pajamas']",[],"Shop for Toddler Boys Pajama Sets in Toddler Boys Pajamas. Buy products such as Wonder Nation Toddler Boy Pajamas Cotton Tight Fit, 4pc pack, ...",https://www.walmart.com/browse/clothing/toddler-boys-pajama-sets/5438_7712430_2700757_9326390_2199183_3751593
53,Boys Pajamas in Kids' Pajamas & Robes - Walmart.com,boy's Pajamas,"['Boys Pajamas', 'Kids', 'Pajamas']",[],Shop for Boys Pajamas in Kids' Pajamas & Robes. Buy products such as Maxcozy Kids Big Girls Boys Satin Silk Pajamas Set Top Shirt + Pants Sleepwear at ...,https://www.walmart.com/browse/clothing/boys-pajamas/5438_1228539_9216494_7223575
54,"Star Wars, Marvel & Disney Pajamas for Boys | shopDisney",boy's Pajamas,"['Boys', 'Pajamas']",[],Boys' Pajamas & Sleepwear. Get into character before you jump into bed with an awesome array of sleepwear. 35 Products.,https://www.shopdisney.com/clothing/boys/sleepwear/
55,Kids' Pajamas & Robes in Pajama Shop - Walmart.com,boy's Pajamas,"['Kids', 'Pajamas']",[],"Shop for Kids' Pajamas & Robes in Pajama Shop. Buy products such as Jurassic Park Boys Long Sleeve Pajamas Set, 2-Piece at Walmart and save.",https://www.walmart.com/browse/clothing/kids-pajamas-robes/5438_1228539_9216494
56,Minecraft Boys' Sleepwear in Kids' Pajamas & Robes - Walmart,boy's Pajamas,"['Boys', 'Sleepwear', 'Kids', 'Pajamas']",[],Shop for Minecraft Boys' Sleepwear in Kids' Pajamas & Robes at Walmart and save.,https://www.walmart.com/browse/clothing/boys-sleepwear/minecraft/5438_1228539_9216494_444554/YnJhbmQ6TWluZWNyYWZ0
57,Boys Pajama Shorts in Boys Pajamas - Walmart.com,boy's Pajamas,"['Boys Pajama', 'Boys Pajamas']",[],"Shop for Boys Pajama Shorts in Boys Pajamas. Buy products such as Umbro Boys' Solid and Print Pajama Sleep Shorts, 2-Pack, Sizes 4-14 at Walmart and save.",https://www.walmart.com/browse/clothing/boys-pajama-shorts/5438_1228539_9216494_7223575_8740815
58,Boys Xl Pajamas - Target,boy's Pajamas,"['boys', 'pajamas']",[],"Shop Target for boys xl pajamas you will love at great low prices. Choose from Same Day Delivery, Drive Up or Order Pickup plus free shipping on orders ...",https://www.target.com/s/boys+xl+pajamas
59,Boys Pajamas - Etsy,boy's Pajamas,['boys pajamas'],[],"Check out our boys pajamas selection for the very best in unique or custom, handmade pieces from our pajamas shops.",https://www.etsy.com/market/boys_pajamas
60,Carters Boys Pajamas - Amazon.com,boy's Pajamas,"['Boys', 'Boys', 'Pajamas']",[],"Simple Joys by Carter's Babies, Toddlers, and Boys' 6-Piece Snug- · Simple Joys by Carter's Toddlers and Baby Boys' Snug-Fit Footed Cotton Pajamas, · Simple Joys ...",https://www.amazon.com/carters-boys-pajamas/s?k=carters+boys+pajamas
61,Amazon.com: Boys' Pajama Sets,boy's Pajamas,"[""Boy's Pajama""]",[],Shop for Boy's Pajama Sets at Amazon.com. Eligible for free shipping and free returns.,https://www.amazon.com/Boys-Pajama-Sets/b?ie=UTF8&node=1046024
62,Boys' Pajamas & Sleepwear - Old Navy,boy's Pajamas,"['boys', 'sleepwear']",[],Tuck them in for a night's recharge with boys' sleepwear and pajamas from Old Navy. Find sleepwear separates in a range of styles.,https://oldnavy.gap.com/browse/category.do?cid=36319&style=1149956
63,Boys Pajamas - Hanna Andersson,boy's Pajamas,"['boys', 'pajamas']",[],"A family favorite since 1983, Hanna Andersson boys' pajamas are made from the ... Hanna quality is what made us the original sustainable kids' ...",https://www.hannaandersson.com/pajamas-gender-boys/
64,Leisure Home Boys Pajamas Sets Long Short Loose Cotton ...,boy's Pajamas,['Boys Pajamas'],[],Buy Leisure Home Boys Pajamas Sets Long Short Loose Cotton Sleepwear 2 Pieces PJS Big Kids 10-18 and other Pajama Sets at Amazon.com.,https://www.amazon.com/Leisure-Home-Pajamas-Sleepwear-12y-20y/dp/B07GYQXQFH
65,Boys Pajamas Size 16 - Amazon.com,boy's Pajamas,['boys pajamas'],[],Amazon.com: boys pajamas size 16. ... Boys' Long Sleeve Top and Pants Snug Fit 100% Cotton 2 Piece Pajama Sets. 4.5 out of 5 stars 407. $29.98$29.98.,https://www.amazon.com/boys-pajamas-size-16/s?k=boys+pajamas+size+16
66,Big Boys Pajamas Size 18-20 - Amazon.com,boy's Pajamas,['boys pajamas'],[],Amazon.com: big boys pajamas size 18-20.,https://www.amazon.com/big-boys-pajamas-size-18-20/s?k=big+boys+pajamas+size+18-20
67,Roblox Pajamas For Boys - Amazon.com,boy's Pajamas,['Boys Pajamas'],[],Amazon.com: roblox pajamas for boys. ... Minecraft Big Boys' Cotton Pajama Set ... Rainbow Friends Boys Pajamas Kids 2pcs/set Pjs Child Home Pants Set ...,https://www.amazon.com/roblox-pajamas-boys/s?k=roblox+pajamas+for+boys
