position,title,query,snippet_highlighted_words,rich_snippet_list,snippet,link69,"The Delineator - Volume 62, Issue 5 - Page 737 - Google Books result",boy's Pajamas,"['BOYS', 'PAJAMAS']",[],... LENGTH OR ELBOW SLEEVES OR TIE SKIRT 7236 - GIRLS ' OR BOYS ' PAJAMAS- The pajamas picRUFFLE . tured below are suitable for either a girl or boy and are ...,https://books.google.co.in/books?id=VD1RAAAAYAAJ&pg=PA737&lpg=PA737&dq=boy's+Pajamas&source=bl&ots=P6UaBZ0uWj&sig=ACfU3U0fh6IFhawrSb034uIxM_0R9rfLmw&hl=en&sa=X&ved=2ahUKEwiKz62Q_Mv8AhVdNEQIHfNZCJY4rAIQ6AF6BAhkEAM
70,All Sale Styles - Peter Alexander,boy's Pajamas,"['sleepwear', 'pyjamas', 'pjs']",[],"Love a sleepwear sale? Find pyjamas for women, men and kids at discounted prices at Peter Alexander online. Shop our latest pjs sale now before they're ...",https://www.peteralexander.com.au/shop/en/peteralexander/sale-all
71,Girls & Teen Girls Pyjamas & Sleepwear - Peter Alexander,boy's Pajamas,"['pyjamas', 'PJs']",[],Shop Peter Alexander junior range of teen girls pyjamas & clothes in sizes 8 to 14 years old. Buy girl's PJs now & pay later with Afterpay online & in ...,https://www.peteralexander.com.au/shop/en/peteralexander/girls-sleep-8-14
72,Women's Pyjama Shorts & Sleep Shorts | Peter Alexander,boy's Pajamas,['pyjama'],[],"Shop Peter Alexander's most popular women's pyjama shorts! Find printed sleep shorts in a range of styles from mini, lace, floral, classic check & more.",https://www.peteralexander.com.au/shop/en/peteralexander/shorts
73,Red Cross Magazine - Volume 1 - Page 42 - Google Books result,boy's Pajamas,"['Pajamas', 'Nightgown', 'Boys']",[],... 98 Suits ; i barrel Underwear ; 18 Overcoats ; 6 pairs Pajamas ; 66 Coats ... i Nightgown ; 25 Waists ; 1 pair Shoes ; 4 Girl's Suits ; 14 pairs Boys ...,https://books.google.co.in/books?id=JOw9AQAAMAAJ&pg=RA3-PA42&lpg=RA3-PA42&dq=boy's+Pajamas&source=bl&ots=9kZRoNQIIP&sig=ACfU3U3GLfgfHes8OYmi_z8osX7iSH_bmg&hl=en&sa=X&ved=2ahUKEwiKz62Q_Mv8AhVdNEQIHfNZCJY4rAIQ6AF6BAhUEAM
1,Pajamas & Sleepwear: Shop All | Hanna Andersson,boy's Pajamas,['pajama'],[],"Smooth seams, all-over warmth, and surrounding softness combine for a truly blissful night's sleep. Find a cute family pajama sets that are organic ...",https://www.hannaandersson.com/pajamas-collection-shop-all/
2,Baby Boy Clearance | Carter's | Free Shipping,boy's Pajamas,"['boy', 'boys', 'boys', 'PJs']",[],Shop baby boy clothes clearance including infant boys clothes clearance and newborn boys clothes ... Baby 1-Piece Dinosaur 100% Snug Fit Cotton Footie PJs.,https://www.carters.com/carters-baby-boy-clearance
3,Same Day In-Store Pickup | JCPenney,boy's Pajamas,"['Pajamas', 'Boys', 'Boy', 'Boy', 'Boy', 'Boys']",[],"... JeggingsPajamas & RobesPants & LeggingsSets & OutfitsShirts & TopsUnderwear, Bras & Socks · BoysToddler Boy 2T-5TLittle Boy 4-7Big Boy 8-22Boys' ...",https://www.jcpenney.com/m/same-day-pickup
4,Women's Pyjama Shorts & Sleep Shorts | Peter Alexander,boy's Pajamas,['pyjama'],[],"Shop Peter Alexander's most popular women's pyjama shorts! Find printed sleep shorts in a range of styles from mini, lace, floral, classic check & more.",https://www.peteralexander.com.au/shop/en/peteralexander/shorts
