position,title,query,snippet_highlighted_words,rich_snippet_list,snippet,link68,2 Piece Boy Pajamas - Amazon.com,boy's Pajamas,"['Boys', 'Pajamas']",[],"Baby Boys' Pj Set, Tee and Pant 2-Piece Pajamas, 100% Organic Cotton. 4.8 out of 5 stars 5,059. $14.36$ ...",https://www.amazon.com/2-piece-boy-pajamas/s?k=2+piece+boy+pajamas
69,Boys' Pajamas & Robes - Nordstrom Rack,boy's Pajamas,"['Boys', 'Pajamas', 'Boys', 'Pajamas']",[],Shop a great selection of Boys' Pajamas & Robes at Nordstrom Rack. Find designer Boys' Pajamas & Robes up to 70% off and get free shipping on orders over ...,https://www.nordstromrack.com/shop/kids/boy/pajamas-and-robes
70,Boys' Pajamas Boys Shop By Size 5-20 | Old Navy,boy's Pajamas,"['boys pajamas', 'boys pajamas']",[],We're having a technical problem on this page. Refresh the page and try your search again. Related Items. boys pajamas bottoms · boys pajamas sleepwear ...,https://oldnavy.gap.com/browse/category.do?cid=39659&style=53671
71,Toddler Boy Pajamas - Amazon.com,boy's Pajamas,"['Boys', 'Pajamas', 'Boys', 'Pajama']",[],"Baby Boys' Pj Set, Tee and Pant 2-Piece Pajamas, 100% Organic Cotton · Babies, Toddlers, and Boys' 6-Piece Snug-Fit Cotton Pajama Set · Disney Family Matching ...",https://www.amazon.com/Toddler-Boy-Pajamas/s?k=Toddler+Boy+Pajamas
72,Boys Pajamas Size 14-16 - Amazon.com,boy's Pajamas,"['Pajama', 'PJs', 'Boys']",[],"FREE delivery Mon, Jan 23 on $25 of items shipped by Amazon. Prime Try Before You Buy · PRINCE OF SLEEP Plush Pajama Pants - Fleece PJs for Boys.",https://www.amazon.com/boys-pajamas-size-14-16/s?k=boys+pajamas+size+14-16&rh=n%3A7141123011
73,Toddler Boy Pajamas 4t - Amazon.com,boy's Pajamas,"['Boys', 'Pajamas Sleepwear', 'Pajama']",[],"Spotted Zebra Babies, Toddlers, and Boys' Snug-Fit Cotton Pajamas Sleepwear Sets · Carter's 4 Piece Pajama Set · Spotted Zebra Disney | Marvel | Star Wars | ...",https://www.amazon.com/toddler-boy-pajamas-4t/s?k=toddler+boy+pajamas+4t&page=2
74,Boys Plaid Pajamas - Amazon.com,boy's Pajamas,"['Kids', 'Pajamas']",[],RESULTS. Price and other details may vary based on product size and color. The Children's Place Kids' Holiday Plaid Flannel 2 Piece Button Down Pajamas.,https://www.amazon.com/boys-plaid-pajamas/s?k=boys+plaid+pajamas
75,Boys' Pajamas & Boxers - J.Crew,boy's Pajamas,"['Boys', 'pajamas']",[],Shop Boys' pajamas & boxers at J.Crew. Find the best pajamas & boxers and see the entire selection of Boys' clothing.,https://www.jcrew.com/ca/plp/boys/categories/clothing/pajamas
76,Boys Pajamas - Bloomingdale's,boy's Pajamas,['Boys Pajamas'],[],"Shop Boys Pajamas at Bloomingdales.com. Free Shipping and Free Returns available, or buy online and pick up in store!",https://www.bloomingdales.com/buy/boys-pajamas
77,Carter Boys Pajamas - Target,boy's Pajamas,['boys pajamas'],[],"Shop Target for carter boys pajamas you will love at great low prices. Choose from Same Day Delivery, Drive Up or Order Pickup plus free shipping on orders ...",https://www.target.com/s/carter+boys+pajamas
78,Toddler Boys' Pajamas & Sleepwear - Old Navy,boy's Pajamas,['boys pajamas'],[],Find cool toddler boys pajamas at Old Navy. Get separates and sets in this stock of pajamas for little boys.,https://oldnavy.gap.com/browse/category.do?cid=34722
79,Designer Boy Pajamas - Amazon.com,boy's Pajamas,"['Boys', 'Pajama', 'Boys', 'Pajama Sleepwear']",[],"Toddlers and Baby Boys' 4-Piece Loose-Fit Fleece Pajama Set · Disney | Marvel | Star Wars | Frozen Babies, Toddlers, and Boys' Snug-Fit Cotton Pajama Sleepwear ...",https://www.amazon.com/Designer-Boy-Pajamas/s?k=Designer+Boy+Pajamas
80,Boys Camo Pajamas - Amazon.com,boy's Pajamas,"['Boys', 'Pajamas']",[],Select delivery location. Filters. RESULTS. Price and other details may vary based on product size and color. PRINCE OF SLEEP Boys Cotton Pajamas Sets.,https://www.amazon.com/boys-camo-pajamas/s?k=boys+camo+pajamas
81,Funny Kids Pajamas - Amazon.com,boy's Pajamas,"['kids pajamas', 'Kids', 'Pajama']",[],"Amazon.com: funny kids pajamas. ... Warm Long-Sleeve PJ Sets for Girls and Boys, Funny Animal Kids' Pajama Sets, Cozy, Comfy. 4.8 out of 5 stars 748.",https://www.amazon.com/funny-kids-pajamas/s?k=funny+kids+pajamas
82,Shop All Boys' Pajama Sets | Maisonette,boy's Pajamas,"['boys', 'pajamas', 'boys pajama', 'kids', 'sleepwear']",[],Shop boys' pajamas from your favorite kid and toddler brands at Maisonette. Discover toddler and boys pajama sets in a one-stop shop for kids' sleepwear and ...,https://www.maisonette.com/shop/kids/boy-clothing/sleepwear
83,Boy Pajamas | OshKosh | Free Shipping,boy's Pajamas,['boys pajamas'],[],"Catch some zzzz's in Carter's soft, comfy boys pajamas with fun prints for every night!",https://www.oshkosh.com/oshkosh-kid-boy-pajamas
84,Star Wars Boys Pajamas - Target,boy's Pajamas,['boys pajamas'],[],"Shop Target for star wars boys pajamas you will love at great low prices. Choose from Same Day Delivery, Drive Up or Order Pickup plus free shipping on ...",https://www.target.com/s/star+wars+boys+pajamas
85,Boy Pajamas | Carter's | Free Shipping,boy's Pajamas,['Kids'],[],Carter's Inc. Life with Kids · Baby of the Month Contest · All Store Locations · Join Carter's Affiliate Program · Investor Relations · Careers · Raise the ...,https://www.carters.com/carters-kid-boy-pajamas
86,Hanes Boys' Sleepwear in Kids' Pajamas & Robes(11),boy's Pajamas,"['Boys', 'Sleepwear', 'Kids', 'Pajamas']",[],Shop for Hanes Boys' Sleepwear in Kids' Pajamas & Robes at Walmart and save.,https://www.walmart.com/browse/clothing/boys-sleepwear/hanes/5438_1228539_9216494_444554/YnJhbmQ6SGFuZXMie
1,"Baby Boys' Clothes | Outfits, Pants & More | H&M US",boy's Pajamas,"['boys', 'Pajama']",[],"Add all the essential style staples to his closet with our baby boys' clothes. We have T-shirts, jeans and shorts in ... 3-pack Pajama Jumpsuits with Zipper.",https://www2.hm.com/en_us/baby/boys/clothing.html
2,"Boys' Winter Clothes | Jackets, Thermals, PJs & More | H&M US",boy's Pajamas,"['boys', 'PJs']",[],Shop our collection of boys' winter clothes and find cosy coats and jackets for him to wear with any outfits. Browse thermals for layering and warm PJs at ...,https://www2.hm.com/en_us/kids/boys/clothing.html?seasonality=Winter&id=ap1
3,Baby Boys' Clothes Online | H&M GB,boy's Pajamas,"['boys', 'nightwear']",[],"Keep little ones kitted out with our baby boys' clothes range. Discover T-Shirts, rompers, jeans, nightwear and more at H&M online.",https://www2.hm.com/en_gb/baby/boys/clothing.html
4,Little Sleepies: Bamboo Viscose Pajamas | Matching PJs for ...,boy's Pajamas,"['pajamas', 'sleepwear']",[],"Snuggle up in the coziest bamboo viscose pajamas. With sizes for the entire family, from babies to adults, our sleepwear is perfect for matching moments!",https://littlesleepies.com/
5,John Boyne - Wikipedia,boy's Pajamas,"['Boy', 'Pyjamas']",[],John Boyne (born 30 April 1971) is an Irish novelist. He is the author of eleven novels for ... His 2006 novel The Boy in the Striped Pyjamas was adapted into a 2008 ...,https://en.wikipedia.org/wiki/John_Boyne
6,"Official Site of PajamaJeans® | Pajamas you live in, Jeans you ...",boy's Pajamas,['pjs'],[],"Three styles, six colors. Unique Pajamajeans designed to give you the style and look of crisp denim with the comfort of your favorite pjs.",https://www.pajamajeans.com/
7,F&F boys' & girls' clothes | Kids' Clothes - Tesco,boy's Pajamas,[],[],"Check out the latest baby and kids' clothes from F&F at Tesco, keeping them stylish and comfortable. Browse clothes online and shop in selected Tesco ...",https://www.tesco.com/zones/clothing/kids
8,Boys Clothing | The Childrens Place | Free Shipping*,boy's Pajamas,"['boys', 'Boys', 'Pajamas']",[],The Childrens Place has the best quality and variety of boys clothing around. Shop at the PLACE ... The Children's PlaceBoys Smart Strong Kind Pajamas. (4).,https://www.childrensplace.com/us/c/boys-clothing
9,Kids Jeans Boys Light Blue - First Order Free Shipping - Temu,boy's Pajamas,['Boys Pajamas'],[],Boys Fashion Denim Dinosaur Print Jeans For Kids Children ... Children's Boys Pajamas Blue Astronaut Print Round Neck Short Sleeve Top & Pants Kids Clothes ...,https://www.temu.com/subject/n2/search-recommend-a-psurl.html?search_key=kids%20jeans%20boys%20light%20blue
10,Kids' Clothes | Great Value Kidswear - George at ASDA,boy's Pajamas,"['boys', 'nightwear']",[],"Shop boys' and girls' tops, party dresses, jeans, T-shirts and more. ... to our colourful and cool girls' nightwear and boys' nightwear, including pyjamas, ...","https://direct.asda.com/george/kids/D25,default,sc.html"
11,Minecraft Pajamas For Adults - pimp my trax,boy's Pajamas,['Boys Pajamas'],[],"Minecraft Boys Long Sleeve Top and Pants, 2-Piece Pajamas Set, ... Pet Supplies Minecraft Boys Pajamas Minecraft Creeper Pajama Set 3 ...",https://pimpmytrax.de/minecraft-pajamas-for-adults.html
12,Boy In Striped Pyjamas Study Guide,boy's Pajamas,"['Boy', 'Pajamas', 'boys']",[],"The Boy in the Striped Pajamas - Kristen Kemp 2015-05-01. Encourage students to spend some time in the lives of two innocent young boys, who befriend each ...",http://www.sim.utu.ac.id/viewcontent?eav=1733571&article=4731157_Boy-In-Striped-Pyjamas-Study-Guide&lang=en_US&context=L
13,supernatural pyjamas - TIMEOUT CENTRO SPORTIVO VEGLIE,boy's Pajamas,"['Boy', 'Pyjamas', 'Pajamas']",[],The Boy in the Striped Pyjamas. Find great designs on super comfy t-shirts and pick out a pair of soft cotton patterned bottoms to go with Soft Pajamas ...,https://timeoutcentrosportivo.it/supernatural-pyjamas.html
14,sizes made simple - Carter's,boy's Pajamas,['Pajamas'],[],Our easy sizing chart for Carter's will help you understand the fit of our garments in relation to your child's weight and height. Pajamas.,https://www.carters.com/size-chart
15,Tottini: Quality Children Clothes at Affordable Prices,boy's Pajamas,"['Pajamas', 'boys']",[],"Everything from Baby's layette through teen sizes. Skirts, Shirts, Pants, Tshirts, Pajamas, etc. ... New Arrivals. boys girls infants new-arrivals.",https://tottini.com/
16,Vishal Mega Mart India | Official Website,boy's Pajamas,"['Pyjamas', 'Sleepwear', 'Boys', 'Boys']",[],"... Jeans, Trousers & Capri · Leggings & Pyjamas · Skirts & Shorts · Jackets & Pullovers · Innerwear & Sleepwear · Boys (2 - 8 years). Boys (2 - 8 years).",https://www.vishalmegamart.com/
17,carters toddler boy pajamas,boy's Pajamas,"['Boys Pajama', 'boy pajamas']",[],Selling preloved Carter's Toddler Boys Pajama Set - Size 3T. ... Shop online at buybuy BABY to find just the carters toddler boy pajamas you are looking for ...,https://d-tooth.lol/carters-toddler-boy-pajamas.html
18,The Boy in the Striped Pajamas Intro - YouTube,boy's Pajamas,[],[],I DO NOT OWN THIS BOOK NOR OWN THE RIGHTS. ALL CREDIT GOES TO JOHN BOYNE AND THE PUBLISHERS***,https://www.youtube.com/watch?v=K7VaYeuNgS4
19,Amazon prime family christmas pajamas - Cuore di Mamma APS,boy's Pajamas,"['Pajamas', 'Nightwear', 'boys']",[],"Big And Tall Christmas Pajamas for Family Nightwear Pants ... men, boys, girls, dads, moms, grandparents, adults, and children.",https://magicocuoredimamma.it/amazon-prime-family-christmas-pajamas.html
20,Blue Boys Fluffy Fleece Pyjamas (2-14 years) - Dunnes Stores,boy's Pajamas,['pyjamas'],[],"Crafted in a gorgeously fluffy fleece fabric, these pyjamas will keep the chill at bay. Adorned with fun graphics, they're a fun, cosy choice for bed.",https://www.dunnesstores.com/p/boys-fluffy-fleece-pyjamas---years-/6850260
21,Clothing for Boys - Costco Wholesale,boy's Pajamas,"['Boys', 'Boys']",[],Find a great collection of Clothing for Boys at Costco. Enjoy low warehouse prices on name-brand Clothing for Boys products.,https://www.costco.com/boys-clothing.html
22,Boys' Clothes - Target,boy's Pajamas,"['Pajamas', 'Boys', 'Boys']",[],Pajamas & Robes ... Top rated in Boys' Clothing ... Boys' Valentine's Day Short Sleeve Graphic T-Shirt - Cat & Jack™ · Cat & JackNew at target¬.,https://www.target.com/c/boys-clothing-kids/-/N-5xty4
23,Baby Boy Clothing - Target,boy's Pajamas,"['Boy', 'Pajamas']",[],"Target/Clothing, Shoes & Accessories/Baby Clothing/Baby Boy Clothing (4072)‎. Bodysuits · Bottoms · Dresswear · One-pieces · Outfits · Pajamas.",https://www.target.com/c/baby-boy-clothing-kids/-/N-4y6l9
24,"Peter Alexander™ Shop Gifts, Pyjamas, Sleepwear & More",boy's Pajamas,['Boys'],[],"Save time, save your bag! ; What's New · All What's New. Shop By. Women · Women Plus · Men · Girls · Boys · Baby ; Women · All Women; Style. Pants · Shorts · Tops ...",https://www.peteralexander.com.au/shop/en/peteralexander
25,Kids Pajamas - Hanna Andersson,boy's Pajamas,"['pajamas', 'boys']",[],"Perfect for sleep and play, Hanna Andersson organic cotton pajamas for boys and girls feature bold colors, smooth seams, and cozy softness for ...",https://www.hannaandersson.com/pajamas-kids/
26,Sweet Bamboo | Luxury. Eco. Everyday. | Luxury Clothing for ...,boy's Pajamas,['boys pajama'],[],"Shop our incredibly soft bamboo pieces that make for perfect outfits – ideal for little lifestyles. Shop cute baby clothes, girls dresses, boys pajama sets, ...",https://sweetbamboo.co/
27,Eberjey - For The Softer Side Of Life,boy's Pajamas,['sleepwear'],[],"A state of mind where the outside world fades and your inner voice reigns. Learn more about what has inspired our sleepwear, loungewear, lingerie, swimwear, ...",https://eberjey.com/
28,Gap pajama,boy's Pajamas,"['Boy', 'Pajamas']",[],"Size: 10 (Boy) GAP. Gap Logo Hoodie. 991. Located at 6800 N 95 AVE, shop the latest Gap Factory. 20 shipping SPONSORED Gap Kids Girls 5 Halloween Pajamas ...",https://taralligenghi.it/gap-pajama.html
29,"Women's Pajamas | Robes, Nightgowns & Pajama Sets",boy's Pajamas,['pajamas'],[],"Dwell in ultimate comfort with women's pajamas at JCPenney. Made from soft fabric, shop our various colors & fits. Free shipping and curbside pickup ...",https://www.jcpenney.com/g/women/pajamas-robes?id=cat1003610003
30,Boy in the Striped Pajamas: Study Guide and Student Workbook,boy's Pajamas,"['boy', 'boys']",[],What does Bruno immediately notice about the boy that he sees before him? ... Identify one difference and one similarity that the boys notice about each ...,https://books.google.co.in/books?id=zHS0ruOjqPIC&pg=PA72&lpg=PA72&dq=boy's+Pajamas&source=bl&ots=_6N7H-XbeO&sig=ACfU3U09VDxsRZ1M2VPhnLSVnopQ-I-iYg&hl=en&sa=X&ved=2ahUKEwiKz62Q_Mv8AhVdNEQIHfNZCJY4rAIQ6AF6BAhcEAM
31,Kid Boys - Boys & Girls - Junaid Jamshed,boy's Pajamas,['PAJAMA'],[],"BLACK BLENDED KURTA PAJAMA | JCKP-44184. 30% OFF. Special Price PKR2,723.00 Regular Price PKR3,890.00. Add to Bag. Quick Shop.",https://www.junaidjamshed.com/boys-girls/kids-boys.html
32,"Boys' Winter Shoes | Boots, Trainers & High Tops | H&M IN",boy's Pajamas,['boys'],[],Explore our range of boys' winter shoes. Choose from cosy fur-lined boots and smart school shoes. Look for warm high top trainers for weekend wear at H&M.,https://www2.hm.com/en_in/kids/boys-9-14y/shoes.html?seasonality=Winter&id=ap1
33,Kmart Australia - Low Prices for Life - Kmart,boy's Pajamas,"['Boys', 'Boys', 'Boys', 'Boys', 'Boys', 'Boys', 'sleepwear']",[],... JacketsBoys Jeans & PantsBoys Jumpers & KnitwearBoys ShortsBoys SwimwearBoys TopsBoys Track PantsKids License ClothingUnderwear & sleepwearKids ...,https://www.kmart.com.au/
34,Shop Kids Pyjamas & Sleepwear on Sale | Peter Alexander,boy's Pajamas,"['pyjamas', 'Boys']",[],"Shop the kids pyjamas sale at Peter Alexander. Huge range of kids pj sets on sale as well as baby bodysuits, ... Jnr Boys Guardians Of The Galaxy Pj Set.",https://www.peteralexander.com.au/shop/en/peteralexander/kids-sale
35,Cecil and Lou: Classic Outfits for Boys & Girls,boy's Pajamas,"['boys', 'pajamas']",[],"We carry heirloom-quality, traditional, smocked, & monogrammed styles for boys and girls. ... sleeping baby in a ribbon pajamas ...",https://www.cecilandlou.com/
36,Baby Boy Clothes (Preemie-24M) | Carter's | Free Shipping,boy's Pajamas,['BOY PAJAMAS'],[],Shop baby boy clothes & accessories at Carters.com. Find fashionable & affordable baby boy clothing. ... Pajamas. SHOP BABY BOY PAJAMAS ...,https://www.carters.com/carters-baby-boy
37,"Children - Boys, Girls & Infants Clothing & Nursery | Farmers NZ",boy's Pajamas,"['boys', 'Sleepwear']",[],"Shop Farmers for your baby, kids, boys, girls and teen clothing and accessories. ... BUY 1 GET 1 HALF PRICE on Kids' Clothing, Sleepwear, Underwear, Socks.",https://www.farmers.co.nz/children
38,Keedo: Shop for Babies & Kids,boy's Pajamas,['Boys'],[],"... playground-approved - we've got you covered with easy-wearing, versatile pieces that are made for play. SHOP NEW IN · Shop Baby Girls · Shop Baby Boys.",https://www.keedo.co.za/
39,Baby Boy Clearance | Carter's | Free Shipping,boy's Pajamas,"['boy', 'boys', 'boys', 'PJs']",[],Shop baby boy clothes clearance including infant boys clothes clearance and newborn boys clothes ... Baby 1-Piece Dinosaur 100% Snug Fit Cotton Footie PJs.,https://www.carters.com/carters-baby-boy-clearance
40,"Deals for Women, Men, Kids, Baby, and Home - Burlington",boy's Pajamas,['Boys'],[],Boys Jeans. Womens Deals at Burlington. 4pc Baby Apparel Set. Starting at. $10.99*. 4pc Baby Apparel Set. Ads. 3pc Baby Apparel. Starting at.,https://www.burlington.com/deals/
41,"Baby Clothes | Outfits, Accessories & Shoes | H&M US",boy's Pajamas,['nightwear'],[],"From comfy to cute, and oh so affordable, our baby range features sweet T-shirts, rompers, jeans, nightwear and more online at H&M. Shop now.",https://www2.hm.com/en_us/baby.html
42,Bowser : Kids' Pajamas and Slippers - Target,boy's Pajamas,"['pajamas', 'Pajamas', 'Boys', 'Pajama']",[],"Shop at Target for kids, toddler, and baby pajamas. ... Bowser : Kids' Pajamas and Slippers ... Boys' Nintendo Super Mario 4pc Pajama Set - Red.",https://www.target.com/c/kids-pajamas-and-slippers/bowser/-/N-627hiZff0r5
43,Magnetic Me | The Absolute Easiest Way To Dress A Baby,boy's Pajamas,['pjs'],[],we solved the tight fit issue with our transitional pjs for growing toddlers.,https://magneticme.com/
44,Shop - Bluey Official Website,boy's Pajamas,[],[],"Shop online for official Bluey merchandise, including toys, books, videos and more. Plus, explore a full list of our retail partners.",https://www.bluey.tv/grown-ups/shop/
45,Roblox : Kids' Pajamas and Slippers - Target,boy's Pajamas,"['pajamas', 'Pajamas', 'Boys', 'Pajama']",[],"Shop at Target for kids, toddler, and baby pajamas. Find our wide selection of ... Roblox : Kids' Pajamas and Slippers ... Boys' Piggy 3pc Pajama Set - Red.",https://www.target.com/c/kids-pajamas-and-slippers/roblox/-/N-627hiZwjs8i
46,Aquaman : Kids' Pajamas and Slippers - Target,boy's Pajamas,"['pajamas', 'Pajamas', 'Boys', 'Pajama']",[],"Shop at Target for kids, toddler, and baby pajamas. ... Aquaman : Kids' Pajamas and Slippers ... Boys' DC Comics Justice League 4pc Pajama Set - Blue.",https://www.target.com/c/kids-pajamas-and-slippers/aquaman/-/N-627hiZ55iv2
47,Toddler Boys' Clothing - Target,boy's Pajamas,"['pajamas', 'boys']",[],"If you're already thinking about the holidays, you can even find plaid pajamas & polo shirts that match with dad's, to make sure the boys look adorable in the ...",https://www.target.com/c/toddler-boys-clothing-kids/-/N-4uxip
48,Clothes codes for bloxburg,boy's Pajamas,"['pajamas', 'Boy', 'Boys']",[],in today's video we have layered clothing animal pajamas and slipper set codes for ... Bloxburg Clothing Codes Cute Boy Outfits Preppy Boys Vibe Clothes ...,https://supremaweb.it/clothes-codes-for-bloxburg.html
49,"Carter's: Baby clothes, children's clothes, toddler clothes",boy's Pajamas,[],[],"Shop for baby clothing, baby necessities and essentials at Carters.com, the most trusted name in baby, kids, and toddler clothing.",https://www.carters.com/
50,All Newborn & Baby Sale Styles - Peter Alexander,boy's Pajamas,"['sleepwear', 'pyjama']",[],"Shop newborn & baby sleepwear on sale at Peter Alexander. Save big on baby pyjama sets, onesies, bodysuits, rompers in a range of colours, prints & designs.",https://www.peteralexander.com.au/shop/en/peteralexander/sale-baby
51,Burt's Bees Baby® | Baby and Newborn Clothes and Bedding,boy's Pajamas,['pajamas'],[],"Shop the best for newborns, babies and toddlers. Award winning pajamas, crib sheets, shampoo and more. 100% organic cotton baby clothes, bedding, bath, ...",https://www.burtsbeesbaby.com/
52,"Peacocks: Mens, Womens & Kids Fashion, Cheap Clothes",boy's Pajamas,['Boys Nightwear'],[],Girls Nightwear · View All · Pyjamas · Nightdresses · Dressing Gowns · Slippers · Loungewear · Boys Nightwear · View All · Pyjamas · Dressing Gowns ...,https://www.peacocks.co.uk/
53,Kids' short-sleeve printed pajama set - J.Crew,boy's Pajamas,"['Boys', 'pajamas']",[],Sale · Women · Girls · Men · Boys · Home · girls · pajamas.,https://www.jcrew.com/au/p/girls/categories/clothing/pajamas-and-underwear/sleep-sets/kidsapos-short-sleeve-printed-pajama-set/BO132
54,"Lands' End: Winter Coats, Sweaters, Turtlenecks, Fleece, PJs ...",boy's Pajamas,"[""boy's"", 'pajamas']",[],"From boy's dress shirts to girl's dresses, we have it all. Shop girl's pajamas shorts, shirts, pants, and activewear for girls, and surprise her with cute ...",https://www.landsend.com/
55,Kids' Clothing & Shoes | Kids & Babies | H&M US,boy's Pajamas,['Boys'],[],... Boys (9-14Y): View all · New Arrivals · Clothing · Swimwear · Outerwear · Activewear · Accessories · Shoes · Costumes · Party Occasion; Shop by Product ...,https://www2.hm.com/en_us/kids.html
56,Sale - Boys | Seed Heritage,boy's Pajamas,"['boys', 'Pyjama']",[],Shop sale clothing and accessories for boys in the Seed Heritage Sale. ... Leopard Pyjama. $39.95 $24.95. Take A Further 20% Off All Sale Styles.,https://www.seedheritage.com/sale/boy/
57,"Gerber Childrenswear: Baby Clothing, Onesies Brand & Just ...",boy's Pajamas,"['pajamas', 'Boys']",[],"... Just Born apparel, baby bedding, infant pajamas and more. ... 2-Piece Baby & Toddler Boys Roaring Adventure Long Sleeve Shirt & Jogger Pants Set.",https://www.gerberchildrenswear.com/
58,Piggy : Kids' Pajamas and Slippers - Target,boy's Pajamas,"['pajamas', 'Pajamas', 'Boys', 'Pajama']",[],"Shop at Target for kids, toddler, and baby pajamas. Find our wide selection of ... Piggy : Kids' Pajamas and Slippers ... Boys' Piggy 3pc Pajama Set - Red.",https://www.target.com/c/kids-pajamas-and-slippers/piggy/-/N-627hiZq643le3u10c
59,Bb-8 : Kids' Pajamas and Slippers - Target,boy's Pajamas,"['pajamas', 'Boys', 'Pajama']",[],"Shop at Target for kids, toddler, and baby pajamas. Find our wide selection of Christmas ... Baby Boys' 4pc Star Wars Baby Yoda Snug Fit Pajama Set - Green.",https://www.target.com/c/kids-pajamas-and-slippers/bb-8/-/N-627hiZz565x
60,Baby Boy Sets | Carter's | Free Shipping,boy's Pajamas,"['Boy', 'Boy', 'Boy', 'Pajamas']",[],Baby Boy. Baby Boy. Shop All Baby Boy Clothes · Just Arrived · New Baby & Gifts · Matching Tops & Bottoms · Sets · Multipacks · Pajamas · One Piece ...,https://www.carters.com/carters-baby-boy-sets
61,Shop Girls (8 - 14 Years) Pyjamas On Sale | Peter Alexander,boy's Pajamas,['Boys'],[],"Girls Sale Styles 8-14 Years. 48. Items. Item. 48. of. Items. Clear All. All Kids Sale Styles, All Baby Sale Styles · All Girls Sale Styles · All Boys Sale ...",https://www.peteralexander.com.au/shop/en/peteralexander/sale-girls-8-14
62,Fashion Bug | Online Dress Shopping in Sri Lanka,boy's Pajamas,"['Boys', 'Boys', 'Nightwear']",[],Boys (2-16 Years). All Boys (2-16 years) · Shirt · T-shirt · Denim · Pant · Short · Nightwear · Innerwear. Girls (2-16 Years). All Girls (2-16 years) ...,https://www.fashionbug.lk/
63,"Boy's Sale & Clearance | Clothing, Shoes & Accessories",boy's Pajamas,"['boys', 'boys']",[],"Check out the Matalan's boys' sale for huge savings on clothes, shoes, accessories & more. Whether it's for newborn babies or teenage boys, shop now.",https://www.matalan.co.uk/kids-clothing/boys/offers/sale
64,"Rainbow: Womens, Plus Size and Kids | Everyday Low Prices",boy's Pajamas,"['Boys Pajamas', 'Boys Pajamas', 'Boy Pajamas']",[],Boys Pajamas. Boys Pajamas ... NewToddler Boy JeansToddler Boy Outfit SetsToddler Boy PajamasToddler Boy PantsToddler Boy ShortsToddler Boy TopsToddler Boy ...,https://www.rainbowshops.com/
65,Boys - Minnie Minors,boy's Pajamas,"['Boys', 'boys']",[],"Dress Up Your Kid with Style – Kids Dresses for Boys As winter approaches, you must take care while online shopping for boys' winter dresses.",https://www.minnieminors.com/collections/mm-boys
66,SpearmintLOVE,boy's Pajamas,[],[],"Shop the best brands in baby and kids clothing and accessories. Rylee & Cru, Mini Rodini, Oeuf, Little Unicorn, Milk Barn and more.",https://spearmintlove.com/
67,GapKids | Gap,boy's Pajamas,"['PJs', 'Boys', ""boy's""]",[],Big & Little Matching PJs · Halloween Shop. Kids Clothes for Boys and Girls Looking for cool and comfy styles for your ... In the market for boy's clothing?,https://www.gap.com/browse/division.do?cid=6170
68,Online Shopping for Men – Buy Mens Clothing ... - Westside,boy's Pajamas,"['SLEEPWEAR', 'BOYS', 'BOYS', 'BOYS']",[],ETHNIC WEAR · WESTERN WEAR · LINGERIE | SLEEPWEAR | LOUNGEWEAR ... INFANT GIRLS · TODDLER GIRLS · JUNIOR GIRLS · INFANT BOYS · TODDLER BOYS · JUNIOR BOYS ...,https://www.westside.com/collections/man
