position,title,query,snippet_highlighted_words,rich_snippet_list,snippet,link
1,Boys' Pajamas & Robes - Target,boy's Pajamas,['Pajamas'],[],"Shop Target for Pajamas & Robes you will love at great low prices. Choose from Same Day Delivery, Drive Up or Order Pickup. Free standard shipping with $35 ...",https://www.target.com/c/pajamas-robes-boys-clothing-kids/-/N-5xtxu
2,Boys' Pajamas: Cute PJs and Sleepwear For Kids | Kohl's,boy's Pajamas,"['Boys', 'Pajamas']",[],Enjoy free shipping and easy returns every day at Kohl's. Find great deals on Boys' Pajamas at Kohl's today!,https://www.kohls.com/catalog/boys-kids-sleepwear-clothing.jsp?CN=Gender:Boys+AgeAppropriate:Kids+Category:Sleepwear+Department:Clothing
3,Boys Pajamas - Macy's,boy's Pajamas,['Boys Pajamas'],[],"Boys Pajamas at Macy's come in all styles & colors. Buy boys footed, fleece, short pajamas & more at Macy's! Free shipping: Macy's Star Rewards Members!",https://www.macys.com/shop/kids-clothes/boys-pajamas?id=188759
4,"Boys Pajamas, PJ Sets & Sleepwear | The Children's Place",boy's Pajamas,"['boys pajamas', 'boys pjs']",[],"Shop for boys pajamas. Find comfy boys pjs and sleepwear at The Children's Place, where big fashion meets little prices with free shipping!",https://www.childrensplace.com/us/c/boys-clothing-sleepwear
5,Boys' Sleepwear / Boys' Clothing - Amazon.com,boy's Pajamas,['boys sleepwear'],[],Shop for boys sleepwear and robes on Amazon.com. Free shipping and free returns on eligible ... Boys' Single Long Sleeve Top and Pants 2 Piece Pajamas Sets.,https://www.amazon.com/Boys-Sleepwear/b?ie=UTF8&node=3455651
6,Boys' Pajamas & Sleepwear - Old Navy,boy's Pajamas,"['boys', 'sleepwear']",[],Tuck them in for a night's recharge with boys' sleepwear and pajamas from Old Navy. Find sleepwear separates in a range of styles.,https://oldnavy.gap.com/browse/category.do?cid=36319
7,Boys' Sleepwear in Kids' Pajamas & Robes - Walmart.com,boy's Pajamas,"['Boys', 'Sleepwear', 'Kids', 'Pajamas']",[],"Shop for Boys' Sleepwear in Kids' Pajamas & Robes. Buy products such as Minecraft Boys Long Sleeve Top and Pants, 2-Piece Pajamas Set, Sizes 4-16 at Walmart ...",https://www.walmart.com/browse/clothing/boys-sleepwear/5438_1228539_9216494_444554
8,Boys' Pajamas & Robes - JCPenney,boy's Pajamas,"['boys', 'pajamas']",[],"Shop JCPenney and save on boys' pajamas, pajama sets from Carter's, Arizona, and many more for toddler, big and little boys. Free shipping available.",https://www.jcpenney.com/g/baby-kids/pajamas-robes/boys?id=cat11100000057
9,Boys' Pajamas & Robes - Nordstrom,boy's Pajamas,"['boys', 'pajamas']",[],"Free shipping on boys' pajamas, robes and sleepwear at Nordstrom.com. Totally free shipping and returns.",https://www.nordstrom.com/browse/kids/boys-clothing/pajamas
1,Big Boys Pajamas | Kohl's,boy's Pajamas,['Boys Pajamas'],[],Enjoy free shipping and easy returns every day at Kohl's. Find great deals on Big Boys Pajamas at Kohl's today!,https://www.kohls.com/catalog/boys-kids-big-kids-sleepwear-clothing.jsp?CN=Gender:Boys+AgeAppropriate:Kids+ChildAgeRange:Big%20Kids+Category:Sleepwear+Department:Clothing
2,Boys Pajama Sets & Matching Pajamas | The Children's Place,boy's Pajamas,"['boys', 'pajamas', 'boys']",[],"Shop boys matching pajamas. Find comfy and cozy boys pj sets at The Children's Place, where big fashion meets little prices with free shipping!",https://www.childrensplace.com/us/c/boys-pajamas
3,Little Boys' Pajamas | 4-7 Pajamas - JCPenney,boy's Pajamas,"['boys', 'pajamas']",[],"Shop little boys' pajamas at JCPenney. Find a variety of cozy and fun pajama sets in boys' sizes 4-7. FREE SHIPPING available, and shop a variety of brands!",https://www.jcpenney.com/g/baby-kids/pajamas-robes/boys?boys_age_group=little+boys+4-7&id=cat11100000057
4,boys pajamas - Nordstrom,boy's Pajamas,['boys pajamas'],[],"Shop for boys pajamas at Nordstrom.com. Free Shipping. Free Returns. ... Kids' Fitted Two-Piece Pajamas (Toddler, Little Boy & Big Boy). New Markdown.",https://www.nordstrom.com/sr/boys-pajamas
5,Boys' Pajamas & Sleepwear - Old Navy,boy's Pajamas,"['boys', 'sleepwear']",[],Tuck them in for a night's recharge with boys' sleepwear and pajamas from Old Navy. Find sleepwear separates in a range of styles.,https://oldnavy.gap.com/browse/category.do?cid=36319&style=1127896
6,Boys' Pajamas Boys Shop By Size 5-20 | Old Navy,boy's Pajamas,"['boys pajamas', 'boys pajamas']",[],We're having a technical problem on this page. Refresh the page and try your search again. Related Items. boys pajamas bottoms · boys pajamas sleepwear ...,https://oldnavy.gap.com/browse/category.do?cid=39659&style=53671
7,Boys' Big Kid Pajamas - Lands' End,boy's Pajamas,"['boys', 'sleepwear', 'boys', 'pjs']",[],"Shop boys' big kid pajamas and sleepwear at Lands' End. FREE shipping available. Find quality big boys' sleepwear, pajamas for big boys, pjs for big boys, ...",https://www.landsend.com/shop/boys-big-kid-size-7-20-sleepwear/S-y8j-xfj-xez-y5e-xec
8,Toddler & Big Boy Pajamas & Loungewear| RuggedButts,boy's Pajamas,"['Boy', 'Pajamas', 'pajama', 'pajamas']",[],"Take Your Toddler or Big Boy to Dreamland with Pajamas & Loungewear. Classic pajama sets, jogger sets, and footie pajamas too—RuggedButts makes loungewear ...",https://www.rufflebutts.com/boys/shop-boys/pajamas-loungewear.html
9,Fun PJ Sets for Boys - Pajamas - Boscov's,boy's Pajamas,"[""boy's pajamas""]",[],Get ready for bed with a cozy selection of boy's pajamas & sets from top brands at discount pricing. Find fun styles and holiday designs. Shop online today!,https://www.boscovs.com/category/boys-pajamas
10,Boys (Sizes 8-20) Pajamas & Robes | Nordstrom Rack,boy's Pajamas,"['Boys', 'Pajamas', 'Pajamas', 'Boy', 'Boy']",[],"Find designer Boys (Sizes 8-20) Pajamas & Robes up to 70% off and get free shipping on ... Kids' Fitted Two-Piece Pajamas (Toddler, Little Boy & Big Boy).",https://www.nordstromrack.com/c/kids/boy/8-20/pajamas-and-robes
11,Boys Plaid Pajamas - Amazon.com,boy's Pajamas,"['Boys', 'Pajama', 'Pajamas', 'Pajamas', 'Boys', 'Sleepwear', 'Pajama']",[],The Children's Place Boys' Fleece Pajama Pants · PajamaGram Pajamas for Kids - Kids Pajamas · Calvin Klein Boys' 2 Piece Sleepwear Top and Bottom Pajama Set Pj.,https://www.amazon.com/boys-plaid-pajamas/s?k=boys+plaid+pajamas
12,Dinosaur Pajamas For Boys - Amazon.com,boy's Pajamas,"['Boys', 'Pajama']",[],Price and other details may vary based on product size and color. Best Seller. The Children's Place Boys' Long Sleeve Fleece Zip Up Onesie Pajama.,https://www.amazon.com/dinosaur-pajamas-boys/s?k=dinosaur+pajamas+for+boys
13,Boys Pajama Shorts in Boys Pajamas - Walmart.com,boy's Pajamas,"['Boys Pajama', 'Boys Pajamas']",[],"Shop for Boys Pajama Shorts in Boys Pajamas. Buy products such as Umbro Boys' Solid and Print Pajama Sleep Shorts, 2-Pack, Sizes 4-14 at Walmart and save.",https://www.walmart.com/browse/clothing/boys-pajama-shorts/5438_1228539_9216494_7223575_8740815
14,Boys Cotton Pajama - Target,boy's Pajamas,"['boys', 'pajama']",[],"Shop Target for boys cotton pajama you will love at great low prices. Choose from Same Day Delivery, Drive Up or Order Pickup plus free shipping on orders ...",https://www.target.com/s/boys+cotton+pajama
15,Cat & Jack : Boys' Pajamas & Robes - Target,boy's Pajamas,"['Boys', 'Pajamas']",[],"Target/Clothing, Shoes & Accessories/Kids' Clothing/Boys' Clothing/Cat & Jack : Pajamas & Robes (50)‎. How are you shopping today? Pickup.",https://www.target.com/c/pajamas-robes-boys-clothing-kids/cat-jack/-/N-5xtxuZqqqgm
16,Carter Boys Pajamas - Target,boy's Pajamas,['boys pajamas'],[],"Shop Target for carter boys pajamas you will love at great low prices. Choose from Same Day Delivery, Drive Up or Order Pickup plus free shipping on orders ...",https://www.target.com/s/carter+boys+pajamas
17,Leisure Home Boys Pajamas Sets Long Short Loose Cotton ...,boy's Pajamas,['Boys Pajamas'],[],Buy Leisure Home Boys Pajamas Sets Long Short Loose Cotton Sleepwear 2 Pieces PJS Big Kids 10-18 and other Pajama Sets at Amazon.com.,https://www.amazon.com/Leisure-Home-Pajamas-Sleepwear-12y-20y/dp/B07GYQXQFH
18,Boys' Novelty Pajama Sets - Amazon.com,boy's Pajamas,"[""Boy's"", 'Pajama']",[],Shop for Boy's Novelty Pajama Sets at Amazon.com. Eligible for free shipping and free returns.,https://www.amazon.com/Boys-Novelty-Pajama-Sets/b?ie=UTF8&node=9057109011
19,Baby Boys' Pajama Sets - Amazon.com,boy's Pajamas,"['Boys', 'Pajama']",[],Price and other details may vary based on product size and color. Gerber Baby Boys Toddler Snug Fit 4-Piece Pajama Set.,https://www.amazon.com/Baby-Boys-Pajama-Sets-12-18-mo/s?keywords=Baby+Boys%27+Pajama+Sets&rh=n%3A2475839011%2Cp_n_size_two_browse-vebin%3A1289786011&c=ts&ts_id=2475839011
20,Paw Patrol / Boys' Pajama Sets / Boys' Sleepwear - Amazon.com,boy's Pajamas,"[""Boy's Pajamas"", 'Boys', 'Pajamas']",[],"Boy's Pajamas, 4 Piece Slipper and PJ Bundle,Navy,100% Cotton, Toddler Size 2T to 5T · Boys' Pajamas · Pyjamas Kids 2 Pack Boys Girls Chase Marshall Pjs Sets.",https://www.amazon.com/Boys-Pajama-Sets-Paw-Patrol-Sleepwear/s?keywords=Boys%27+Pajama+Sets&rh=n%3A1046024%2Cp_89%3APaw+Patrol&c=ts&ts_id=1046024
21,Boys' Pajamas - Belk,boy's Pajamas,"['Boys', 'Pajamas']",[],Boys' Pajamas (162) · Avengers Boys 8-20 2 Piece Pajama Set · AME Toddlers Boys Trains 4 Piece Pajama Set · AME Boys 4-7 Pokemon 2-Piece Pajama Set · AME Boys 4-7 ...,https://www.belk.com/kids/boys-clothing/pajamas/
22,Boys Sleepwear & Boys Pajamas at Janie and Jack,boy's Pajamas,['boys pajamas'],[],Buy cute boys pajamas and sleepwear with fun designs from Janie and Jack online.,https://www.janieandjack.com/boys-sleepwear
23,Boys' Designer Pajamas | Saks Fifth Avenue,boy's Pajamas,"['boys', 'pajamas']",[],"Shop the best boys' designer pajamas and more at Saks Fifth Avenue. Plus, get free shipping and returns on every order.",https://www.saksfifthavenue.com/c/kids/boys/pajamas
24,Boys' Pajamas & Sleepwear - Old Navy,boy's Pajamas,"['boys', 'sleepwear']",[],Tuck them in for a night's recharge with boys' sleepwear and pajamas from Old Navy. Find sleepwear separates in a range of styles.,https://oldnavy.gap.com/browse/category.do?cid=36319&style=1138519
25,Toddler Boys' Pajamas & Sleepwear - Old Navy,boy's Pajamas,['boys pajamas'],[],Find cool toddler boys pajamas at Old Navy. Get separates and sets in this stock of pajamas for little boys.,https://oldnavy.gap.com/browse/category.do?cid=34722
26,Clearance : Boys' Pajama Sets - Target,boy's Pajamas,"['Boys', 'Pajamas', 'Pajama']",[],"Target/Clothing, Shoes & Accessories/Kids' Clothing/Boys' Clothing/Pajamas & Robes/Clearance : Pajama Sets (85)‎. How are you shopping today? Pickup.",https://www.target.com/c/pajama-sets-pajamas-robes-boys-clothing-kids/clearance/-/N-4xnwkZ5tdv1
27,Boy Character Pajamas - Target,boy's Pajamas,"['boy', 'pajamas']",[],"Shop Target for boy character pajamas you will love at great low prices. Choose from Same Day Delivery, Drive Up or Order Pickup plus free shipping on ...",https://www.target.com/s/boy+character+pajamas
28,Baby Boy Pajamas - Target,boy's Pajamas,['Pajamas'],[],Contactless options including Same Day Delivery and Drive Up are available with Target. Shop today to find Pajamas at incredible prices.,https://www.target.com/c/pajamas-baby-boy-clothing-kids/-/N-4y6l1
29,18 Month Boy Pajamas - Amazon.com,boy's Pajamas,['boy pajamas'],[],"Amazon.com: 18 month boy pajamas. ... Toddlers and Baby Boys' Snug-Fit Footed Cotton Pajamas, Pack of 3 ... Gerber Baby Boys' 2-Pack Footed Pajamas.",https://www.amazon.com/18-month-boy-pajamas/s?k=18+month+boy+pajamas
30,Boys Flannel Pajamas - Amazon.com,boy's Pajamas,"['boys', 'pajamas', 'Pajama', 'PJs', 'Boys']",[],"FREE delivery Mon, Jan 23 on $25 of items shipped by Amazon · ""boys plaid flannel pajamas"" · PRINCE OF SLEEP Plush Pajama Pants - Fleece PJs for Boys.",https://www.amazon.com/boys-flannel-pajamas/s?k=boys+flannel+pajamas
31,Pinks / Boys' Pajama Sets / Boys' Sleepwear - Amazon.com,boy's Pajamas,"['Boys', 'Pajama']",[],Boys' Pajama Sets. Filters (2). RESULTS. Price and other details may vary based on product size and color. Moon and Back by Hanna Andersson Unisex Kids' ...,https://www.amazon.com/Boys-Pajama-Sets-Pinks-Sleepwear/s?keywords=Boys%27+Pajama+Sets&rh=n%3A1046024%2Cp_n_size_browse-vebin%3A2343359011&c=ts&ts_id=1046024
32,Minecraft Boys' Sleepwear in Kids' Pajamas & Robes - Walmart,boy's Pajamas,"['Boys', 'Sleepwear']",[],Shop for Minecraft Boys' Sleepwear in Kids' Pajamas & Robes at Walmart and save.,https://www.walmart.com/browse/clothing/boys-sleepwear/minecraft/5438_1228539_9216494_444554/YnJhbmQ6TWluZWNyYWZ0
33,Sonic Pajamas For Boys - Amazon.com,boy's Pajamas,['Boys Pajamas'],[],Sonic The Hedgehog Boys' Cotton Pajamas · Boys Pajamas Sonic 2 Pieces Pjs Set Kids Nightgown Cartoon Game Sleepwear Child Loungewear Blue Comfortable · Sonic The ...,https://www.amazon.com/sonic-pajamas-boys/s?k=sonic+pajamas+for+boys
34,Size 14 Pajamas Boys - Amazon.com,boy's Pajamas,"['Boys', 'Sleepwear', 'Pajama']",[],"FREE delivery Fri, Jan 13 on $25 of items shipped by Amazon. Prime Try Before You Buy · Calvin Klein Boys' 2 Piece Sleepwear Top and Bottom Pajama Set Pj.",https://www.amazon.com/size-14-pajamas-boys/s?k=size+14+pajamas+boys
35,Boys' Pajama Sets - Star Wars - Amazon.com,boy's Pajamas,"['Pajama', 'Boys', 'Pajama Sleepwear', 'Boys']",[],"Disney Family Matching Pajama Sleep Sets · Disney | Marvel | Star Wars | Frozen Babies, Toddlers, and Boys' Snug-Fit Cotton Pajama Sleepwear Sets · Boys' The ...",https://www.amazon.com/Boys-Pajama-Sets-Star-Wars-Sleepwear/s?keywords=Boys%27+Pajama+Sets&rh=n%3A1046024%2Cp_lbr_characters_browse-bin%3AStar+Wars&c=ts&ts_id=1046024
36,Boys' Pajama Sets - Macy's,boy's Pajamas,"['Boys', 'Pajama']",[],"Shop our collection of Boys' Pajama Sets at Macys.com! Find the latest trends, styles and deals for your little one today!",https://www.macys.com/shop/kids-clothes/boys-pajamas/Sleepwear_type/Pajama%20Sets?id=188759
37,Tween (10-12 Years) : Boys' Pajamas & Robes - Target,boy's Pajamas,"['Boys', 'Pajamas']",[],"Target/Clothing, Shoes & Accessories/Kids' Clothing/Boys' Clothing/Tween (10-12 Years) : Pajamas & Robes (63)‎. How are you shopping today? Pickup.",https://www.target.com/c/pajamas-robes-boys-clothing-kids/tween-10-12-years-/-/N-5xtxuZ5xro3
38,Boys Summer Cotton Pajamas - Target,boy's Pajamas,"['boys', 'pajamas']",[],"Shop Target for boys summer cotton pajamas you will love at great low prices. Choose from Same Day Delivery, Drive Up or Order Pickup plus free shipping on ...",https://www.target.com/s/boys+summer+cotton+pajamas
39,Boys' Pajamas - TJ Maxx,boy's Pajamas,"['boys', 'pajamas']",[],"Shop boys' pajamas for brands that wow at prices that thrill. Free Shipping on $89+ orders online, easy, in store returns. New surprises everyday!",https://tjmaxx.tjx.com/store/shop/kids-baby-shop-by-category-kids-pajamas-boys-pajamas/_/N-324681577
40,Toddler Boys Pajama Sets in Toddler Boys Pajamas - Walmart,boy's Pajamas,"['Boys Pajama', 'Boys Pajamas', 'Boy Pajamas']",[],"Shop for Toddler Boys Pajama Sets in Toddler Boys Pajamas. Buy products such as Wonder Nation Toddler Boy Pajamas Cotton Tight Fit, 4pc pack, ...",https://www.walmart.com/browse/clothing/toddler-boys-pajama-sets/5438_7712430_2700757_9326390_2199183_3751593
41,"Boys Soft Pajamas for Babies, Toddlers & Kids at Baby Riddle",boy's Pajamas,['Boys Pajama'],[],"Boys Pajama Sets. Super Soft Pajamas for Babies, Toddlers and Big Kids. Do you love soft pajamas? We have you covered! We carry buttery soft ...",https://www.babyriddle.com/boys-pajamas/
42,BOYS PAJAMAS | Denny's - shopdennys,boy's Pajamas,['boys pajamas'],[],Shop boys pajamas on Denny's. ... $50.50. Sports Frenzy Boys Fuzzy Lounge Pant. View Product · Multi Stars Pajama. Baby Steps. 3. SKU: 1100258535.,https://shopdennys.com/pages/search-results/boys%20pajamas
43,Reds / Boys' Pajama Sets / Boys' Sleepwear - Amazon.com,boy's Pajamas,"['Boys', 'Pajamas', 'Pajamas', 'Boys', 'Sleepwear', 'Boys', 'Pajama']",[],"Boys Cars Pajamas · Pajamas Little And Big Boys' Raglan Shirt And Pants Sleepwear Set- (Gryffindor, Large, 10/12) · Boys Big Pajama Set · Family Sleep · 12M-12Years ...",https://www.amazon.com/Boys-Pajama-Sets-Reds-Sleepwear/s?keywords=Boys%27+Pajama+Sets&rh=n%3A1046024%2Cp_n_size_browse-vebin%3A2343361011&c=ts&ts_id=1046024
44,Scooby Doo / Boys' Pajama Sets / Boys' Sleepwear,boy's Pajamas,['Boys PJS'],[],Price and other details may vary based on product size and color. Scooby Doo Boys PJS Ruh-Roh! Pajamas Raglan Shirt and Pants ...,https://www.amazon.com/Boys-Pajama-Sets-Scooby-Doo-Sleepwear/s?keywords=Boys%27+Pajama+Sets&rh=n%3A1046024%2Cp_lbr_characters_browse-bin%3AScooby+Doo&c=ts&ts_id=1046024
45,Boys Baseball Pajamas - Amazon.com,boy's Pajamas,['Boys Pajama'],[],"Price and other details may vary based on product size and color. Amazon's Choice. A&J DESIGN Boys Pajama Sets, 100% Cotton 2-Piece Sport Theme Pjs Set.",https://www.amazon.com/boys-baseball-pajamas/s?k=boys+baseball+pajamas
46,Boys Nfl Pajamas - Amazon.com,boy's Pajamas,"['boys', 'pajamas', 'Boys', 'Pajama', 'Boys', 'Pajama']",[],"Amazon.com: boys nfl pajamas. ... Ultra Game Boys 2 Piece Tee Shirt & Lounge Pants Pajama Set ... NFL Youth Boys Team Colorway Printed PJ Pajama Pants, ...",https://www.amazon.com/boys-nfl-pajamas/s?k=boys+nfl+pajamas
47,Boys' Sleepwear and Pajamas Sale | Boden US,boy's Pajamas,"['boys', 'nightwear']",[],Make sleep time special with the comfiest pajamas from our boys' nightwear sale. Cheerful prints and glow-in-the-dark styles make bedtimes jolly with Boden.,https://www.bodenusa.com/en-us/clearance/boys-nightwear
48,Hanes Boys' Sleepwear in Kids' Pajamas & Robes(11),boy's Pajamas,"['Boys', 'Sleepwear']",[],Shop for Hanes Boys' Sleepwear in Kids' Pajamas & Robes at Walmart and save.,https://www.walmart.com/browse/clothing/boys-sleepwear/hanes/5438_1228539_9216494_444554/YnJhbmQ6SGFuZXMie
49,Polyester : Boys' Pajama Sets - Target,boy's Pajamas,"['Boys', 'Pajamas', 'Pajama']",[],"Target/Clothing, Shoes & Accessories/Kids' Clothing/Boys' Clothing/Pajamas & Robes/Polyester : Pajama Sets (287)‎. How are you shopping today? Pickup.",https://www.target.com/c/pajama-sets-pajamas-robes-boys-clothing-kids/polyester/-/N-4xnwkZ5y745
50,Clearance : Boys' Pajamas & Robes - Target,boy's Pajamas,"['Boys', 'Pajamas']",[],"Target/Clothing, Shoes & Accessories/Kids' Clothing/Boys' Clothing/Clearance : Pajamas & Robes (110)‎. How are you shopping today? Pickup.",https://www.target.com/c/pajamas-robes-boys-clothing-kids/clearance/-/N-5xtxuZ5tdv1
51,Yoda : Boys' Pajamas & Robes - Target,boy's Pajamas,"['Boys', 'Pajamas']",[],"Target/Clothing, Shoes & Accessories/Kids' Clothing/Boys' Clothing/Yoda : Pajamas & Robes (13)‎. How are you shopping today? Pickup.",https://www.target.com/c/pajamas-robes-boys-clothing-kids/yoda/-/N-5xtxuZ5x1mo
52,Boys Pajamas in Kids' Pajamas & Robes - Walmart.com,boy's Pajamas,['Boys Pajamas'],[],Shop for Boys Pajamas in Kids' Pajamas & Robes. Buy products such as Maxcozy Kids Big Girls Boys Satin Silk Pajamas Set Top Shirt + Pants Sleepwear at ...,https://www.walmart.com/browse/clothing/boys-pajamas/5438_1228539_9216494_7223575
53,Big Boys Pajama Sets - Walmart.com,boy's Pajamas,"['Boys Pajama', 'Boys Pajamas']",[],Shop for Big Boys Pajama Sets in Big Boys Pajamas & Robes. Buy products such as Micro Fleece Sleep Pants Value 2 Pack (Little Boy & Big Boy) at Walmart and ...,https://www.walmart.com/browse/clothing/big-boys-pajama-sets/5438_7712430_7809949_3361927_8291446_5388184
54,Boys Fleece Pajamas - Amazon.com,boy's Pajamas,['Boys Pajama'],[],"Toddlers and Baby Boys' Loose-Fit Flame Resistant Fleece Footed Pajamas, Pack of 3 ... Nautica Boys Pajama Pants and Fleece Sleep Shirt Sets 2 Piece Velvet ...",https://www.amazon.com/boys-fleece-pajamas/s?k=boys+fleece+pajamas
55,2t Pajamas Boys - Amazon.com,boy's Pajamas,"['Boys', 'Pajamas', 'Boys', 'Pajamas', 'Boys', 'Pajamas']",[],"Baby Boys' Pj Set, Tee and Pant 2-Piece Pajamas, 100% Organic Cotton · Baby Boys' 2-Pack Footed Pajamas · Toddlers and Baby Boys' Snug-Fit Footed Cotton Pajamas, ...",https://www.amazon.com/2t-pajamas-boys/s?k=2t+pajamas+boys
56,Stars / Boys' Pajama Sets / Boys' Sleepwear - Amazon.com,boy's Pajamas,"['Boys', 'Pajama']",[],Boys' Pajama Sets. Filters (2). RESULTS. Price and other details may vary based on product size and color. Moon and Back by Hanna Andersson Unisex Kids' ...,https://www.amazon.com/Boys-Pajama-Sets-Stars-Sleepwear/s?keywords=Boys%27+Pajama+Sets&rh=n%3A1046024%2Cp_n_feature_twelve_browse-bin%3A23575362011&c=ts&ts_id=1046024
57,Boys Santa Pajamas - Amazon.com,boy's Pajamas,"['Pajamas', 'Pjs', 'Boys', 'Pajamas']",[],RKOIAN Little Girls' Long Sleeve Pajamas Sets Toddler 100% Cotton Pjs Kids Sleepwears · DAUGHTER QUEEN 18 Months-12 Years Boys & Girls Christmas Pajamas 100% ...,https://www.amazon.com/boys-santa-pajamas/s?k=boys+santa+pajamas
58,Boys Pajamas - Etsy,boy's Pajamas,['boys pajamas'],[],"Check out our boys pajamas selection for the very best in unique or custom, handmade pieces from our pajamas shops.",https://www.etsy.com/market/boys_pajamas
59,Boys Pajamas - ShirtStop - Your home base for kids basics!,boy's Pajamas,"['Boys', 'Pajamas']",[],Bee & Dee Boys Girls Buds Print Cotton Pajamas - EAKS. $39.00. Add to Cart. Add to Wish List Add to Compare.,https://www.shirtstop.us/boys.html/boys-pajamas.html
60,Boys Pyjamas & Nightwear | Abercrombie kids,boy's Pajamas,['boys pyjamas'],[],Shop our quality boys pyjamas and nightwear sets at Abercrombie. Browse our collection of boys cosy and comfortable PJs online today.,https://www.abercrombie.com/shop/eu/kids/boys-sleep
61,Boys Superhero Pajamas - Target,boy's Pajamas,"['boys', 'pajamas']",[],"Shop Target for boys superhero pajamas you will love at great low prices. Choose from Same Day Delivery, Drive Up or Order Pickup plus free shipping on ...",https://www.target.com/s/boys+superhero+pajamas
62,Star Wars Boys Pajamas - Target,boy's Pajamas,['boys pajamas'],[],"Shop Target for star wars boys pajamas you will love at great low prices. Choose from Same Day Delivery, Drive Up or Order Pickup plus free shipping on ...",https://www.target.com/s/star+wars+boys+pajamas
63,Boys Polar Fleece Pajamas - Target,boy's Pajamas,"['boys', 'pajamas']",[],"Shop Target for boys polar fleece pajamas you will love at great low prices. Choose from Same Day Delivery, Drive Up or Order Pickup plus free shipping on ...",https://www.target.com/s/boys+polar+fleece+pajamas
64,Boys' Bamboo Pajamas - Bellabu Bear,boy's Pajamas,"['boys', 'pajamas']",[],Shop our boys' bamboo pajamas and let your imagination run away with us and watch these classic and bold prints come to life! View our collection today.,https://bellabubear.com/collections/boys
65,Quad Seven - Boys Pajama Sets - Walmart.com,boy's Pajamas,"['Boys Pajama', 'Boys Pajamas']",[],Shop for Quad Seven Boys Pajama Sets in Boys Pajamas at Walmart and save. ... Quad Seven Boy's Flannel Fleece Pajamas - 4 Piece Long Sleeve Button Down ...,https://www.walmart.com/browse/clothing/boys-pajama-sets/quad-seven/5438_1228539_9216494_7223575_5059183/YnJhbmQ6UXVhZCBTZXZlbgieie
66,Boys' Sleepwear in Kids' Pajamas & Robes | Blue - Walmart.com,boy's Pajamas,"['Boys', 'Sleepwear']",[],Shop for Boys' Sleepwear | Blue in Kids' Pajamas & Robes at Walmart and save.,https://www.walmart.com/browse/clothing/boys-sleepwear/blue/5438_1228539_9216494_444554/Y29sb3I6Qmx1ZQieie
67,Boys' Pajama Sets - Amazon.com,boy's Pajamas,"[""Boy's Pajama""]",[],Shop for Boy's Pajama Sets at Amazon.com. Eligible for free shipping and free returns.,https://www.amazon.com/Boys-Pajama-Sets/b?ie=UTF8&node=1046024
68,Boys Pajamas Size 14-16 - Amazon.com,boy's Pajamas,"['Boys', 'Pajama']",[],Price and other details may vary based on product size and color. Star Wars Boys' 2-Pack Pajama Pants.,https://www.amazon.com/boys-pajamas-size-14-16/s?k=boys+pajamas+size+14-16&page=2
69,CoComelon Boys Pajamas in Kids' Pajamas & Robes - Walmart,boy's Pajamas,['Boys Pajamas'],[],Shop for CoComelon Boys Pajamas in Kids' Pajamas & Robes at Walmart and save.,https://www.walmart.com/browse/clothing/boys-pajamas/cocomelon/5438_1228539_9216494_7223575/YnJhbmQ6Q29Db21lbG9u
70,Baby Boys' Pajama Sets - Little Hand / Baby ... - Amazon.com,boy's Pajamas,['Boys Pajamas'],[],Price and other details may vary based on product size and color. Little Boys Pajamas Fire Truck Kids Train 2 Piece Pjs Dinosaur Sleepwear Toddler ...,https://www.amazon.com/Baby-Boys-Pajama-Sets-Little-Hand/s?keywords=Baby+Boys%27+Pajama+Sets&rh=n%3A2475839011%2Cp_89%3ALittle+Hand&c=ts&ts_id=2475839011
71,Funny Kids Pajamas - Amazon.com,boy's Pajamas,['Boys'],[],"Price and other details may vary based on product size and color. Lazy One Warm Long-Sleeve PJ Sets for Girls and Boys, Cozy, Comfy.",https://www.amazon.com/funny-kids-pajamas/s?k=funny+kids+pajamas
72,Star Wars - Boys' Pajama Sets - Amazon.com,boy's Pajamas,['Boys Pajamas'],[],Boys' The Mandalorian 4-Piece Snug-fit Cotton Pajama Set · Boys' 2-Piece Loose-Fit Pajamas Set · Boys Pajamas Pack of 2 · Boys' 2-Piece Loose-Fit Button Down ...,https://www.amazon.com/Boys-Pajama-Sets-Star-Wars-Sleepwear/s?keywords=Boys%27+Pajama+Sets&rh=n%3A1046024%2Cp_89%3AStar+Wars&c=ts&ts_id=1046024
73,MyFav Big Boys Glow in Dark Skull Pjs Cotton Sleepwear ...,boy's Pajamas,"['Boys', 'Pajamas', 'Sleepwear', 'Pjs', 'Pajama']",[],"Buy MyFav Boys 100% Cotton Pajamas Kids Glow in The Dark Snug Fit Sleepwear 2 Piece Pjs Set, Green Skateboard, 6Y and other Pajama Sets at Amazon.com.",https://www.amazon.com/MyFav-Cotton-Sleepwear-Pajama-Shorts/dp/B0948HKP6L
