position,title,query,snippet_highlighted_words,rich_snippet_list,snippet,link74,Amazon.in: 2 - 3 Years - Clothing Sets / Boys,boys clothing set,['Boys Clothing Set'],[],"Boys Cotton All-Over Print T-Shirt with Jacket & Pant Set in Green Color ... Boys Clothing Set 3 Piece Dress for Boys, Set of Coat, ...",https://www.amazon.in/Clothing-Sets-2-3-years-Boys/s?srs=16143650031&rh=n%3A1967893031%2Cp_n_size_browse-vebin%3A2081569031
75,500 - ₹1000 - Clothing Sets / Baby Boys - Amazon.in,boys clothing set,"['Boys', 'Set', 'Clothing Set', 'Boy']",[],Boys Cotton All-Over Print T-Shirt with Jacket & Pant Set in Green ... Sweatshirt Joggers Pyjama Pant Clothing Set for Baby Boy Girl.,https://www.amazon.in/Clothing-Sets-%E2%82%B9500-%E2%82%B91-000/s?rh=n%3A1953173031%2Cp_36%3A4595086031
76,3 - 4 Years - Clothing Sets / Boys - Amazon.in,boys clothing set,"['Boys', 'Set', 'Boys', 'Dress', 'Boys']",[],"1,249-1,296 of over 1,000 results · Boys Shirt and Jeans Set Blue · Boys Cotton T-Shirt & Denim Short Dress (6 Months - 5 Years) · Baby Boys Cotton Applique Fruit- ...",https://www.amazon.in/Clothing-Sets-3-4-years-Boys/s?rh=n%3A1967893031%2Cp_n_size_browse-vebin%3A2081570031&page=27&hidden-keywords=Pack%7CSet
77,Amazon.in: Purples - Clothing Sets / Baby Boys,boys clothing set,"['Clothing Dress Set', 'Sets']",[],49-96 of 187 results. RESULTS · JSR Baby Girls Cool Cotton Clothing Dress Set of Top and Legging (Imported Baby · Paddy Baby 5 Pcs Sets New Born Baby Winter ...,https://www.amazon.in/Clothing-Sets-Purples-Baby-Boys/s?rh=n%3A1953173031%2Cp_n_size_two_browse-vebin%3A1975328031&page=2&hidden-keywords=-driving
78,Amazon.in: Greens - Clothing Sets / Boys,boys clothing set,"['Boys', 'Set', 'Dress']",[],Boys Cotton All-Over Print T-Shirt with Jacket & Pant Set in Green Color ... Culture Creation Kids Cotton Indian Army Dress/Costume/Uniform ...,https://www.amazon.in/Clothing-Sets-Greens-Boys/s?rh=n%3A1967893031%2Cp_n_size_two_browse-vebin%3A1975321031
79,Amazon.in: Multicoloured - Clothing Sets / Boys,boys clothing set,"['Boy', 'Set', 'Dress']",[],Ballroom Dance Boy Aqua Green Shirt Black Pant & Gallace Set Kids Fancy Dress Costume - (Material: Satin & Terricot).,https://www.amazon.in/Clothing-Sets-Multicoloured-Boys/s?rh=n%3A1967893031%2Cp_n_size_two_browse-vebin%3A1975325031&page=2&hidden-keywords=-Flip
80,Party Wear Clothes For Boys - Amazon.in,boys clothing set,"['Boys', 'Dress Clothing Set', 'Boys']",[],3 Piece Stripe Print Boys Party Suit - Coat with T-Shirt Trouser & Bowtie Dress Clothing Set for Infant Toddler Boys.,https://www.amazon.in/party-wear-clothes-for-boys/s?k=party+wear+clothes+for+boys
81,Amazon.in: Striped - Clothing Sets / Baby Boys,boys clothing set,"['Clothing Sets', 'Boys', 'Boys', 'Dress Set']",[],Cotton Fleece Clothing Sets for Boys & girls - Unisex Winter ... Boys Cotton Stripe Print Overall and Dress Set in Yellow Color.,https://www.amazon.in/Clothing-Sets-Striped-Baby-Boys/s?rh=n%3A1953173031%2Cp_n_feature_nine_browse-bin%3A28972544031
82,Amazon.in: 8 - 9 Years - Clothing Sets / Boys,boys clothing set,['Boys Clothing Set'],[],"1-48 of 458 results. RESULTS · 3BROS BodySuit/Dress/Baba Suit for Boys/Girls Full Pajama & Casual Full · Zolario Boys Clothing Set 3 Piece Dress for Boys, ...",https://www.amazon.in/Clothing-Sets-8-9-years-Boys/s?rh=n%3A1967893031%2Cp_n_size_browse-vebin%3A2081575031&hidden-keywords=-shoe
83,4 - 5 Years - Clothing Sets / Boys - Amazon.in,boys clothing set,"['Dress', 'Boys', 'Set']",[],BodySuit/Dress/Baba Suit for Boys/Girls Full Pajama & Casual Full Sleeves shirt With Cap Attached Top Combo Kid's Set FS-6009.,https://www.amazon.in/Clothing-Sets-4-5-years-Boys/s?srs=16118140031&rh=n%3A1967893031%2Cp_n_size_browse-vebin%3A2081571031
84,Amazon.in: 3 - 4 Years - Clothing Sets / Boys,boys clothing set,['Boys Clothing Set'],[],"Boys Clothing Set 3 Piece Dress for Boys, Set of Waist Coat, Pant, Bow & Shirt, Ideal for Wedding & Birthday.",https://www.amazon.in/Clothing-Sets-3-4-years-Boys/s?srs=14801783031&rh=n%3A1967893031%2Cp_n_size_browse-vebin%3A2081570031&page=4
85,Mothercare - Clothing Sets / Baby Boys - Amazon.in,boys clothing set,"['Boys', 'SET', 'boys Sets', 'Boys', 'Set', 'Boys', ""Boy's""]",[],1-48 of 149 results. RESULTS · Baby Boys JOGGER SET · baby-boys Sets & dungarees · Cotton Infant Boys Co-Ordinate Set · Baby Boys VH748 · Boy's Cotton VB361 ...,https://www.amazon.in/Clothing-Sets-Mothercare-Baby-Boys/s?rh=n%3A1953173031%2Cp_89%3AMothercare
86,Amazon.in: Evening - Clothing Sets / Boys,boys clothing set,"['Set', 'Dress', 'Boys']",[],Baby's Cotton Tshirt Pant Set ... 3BROS BodySuit/Dress/Baba Suit for Boys/Girls Full Pajama & Casual Full · +3 colors/patterns ...,https://www.amazon.in/Clothing-Sets-Evening-Boys/s?rh=n%3A1967893031%2Cp_n_special_occasion_browse-bin%3A1974807031
87,Amazon.in: 3 - 4 Years - Clothing Sets / Boys,boys clothing set,"['Sets', 'Set']",[],"865-912 of over 1,000 results. RESULTS · Kids T-Shirt Sets |Full Sleeves T-Shirt Set | Graphic Printed Best Outfits for Kids | Age 6 Months to 6 Years.",https://www.amazon.in/Clothing-Sets-3-4-years-Boys/s?rh=n%3A1967893031%2Cp_n_size_browse-vebin%3A2081570031&page=19&hidden-keywords=-sunglass+-eye+-watch+-bag+-glove+-sock+-belt
88,Amazon.in: 6 - 7 Years - Clothing Sets / Boys,boys clothing set,['Boys Clothing sets'],[],"Kiddos Boys Roundneck t Shirt Shorts 3/4 Set Dress Combo Pack of 5 (6-7 ... Boys Clothing sets, Kids clothing sets, Full Pant with ...",https://www.amazon.in/Clothing-Sets-6-7-years-Boys/s?rh=n%3A1967893031%2Cp_n_size_browse-vebin%3A2081573031&page=3&hidden-keywords=-khyati+-crepe+-leotude+-J+-thermal+-khushal+-adyk+-vivid+-easy+-slit+-cupid+-night+-ytrick+-aania+-krishav+-lucknow
89,Buy Boys Clothing Sets online in India - Myntra,boys clothing set,"['Boys Clothing Sets', 'Boys Clothing Sets']",[],Online shopping for Boys Clothing Sets ✯ Shop Online Boys Clothing Sets ✯ Free Shipping ✯ Cash on Delivery ✯ Easy returns and exchanges.,https://www.myntra.com/boys-clothing-sets-menu?src=tNav%3Fsrc%3DtNav
90,Buy Clothing Set for Boys online in India - Myntra,boys clothing set,['boys clothing set'],[],Shop for latest trendy boys clothing set from fresh collection at Myntra. ✯ Free Shipping ✯ COD ✯ Easy returns and exchanges.,https://www.myntra.com/boys-clothing-set
1,Buy Boys Clothing online at Best Prices in India | Flipkart.com,boys clothing set,"['Boys Clothing', 'Set']",[],"Boys Clothing ; DIGIMART. Boys Festive & Party Shirt, Waistcoat and Pant Set. Black Pack of 1. ₹207. ₹899 ; FTC FASHIONS. Boys Festive & Party Kurta, Dhoti Pant ...",https://www.flipkart.com/q/boys-clothing
2,Buy Latest Kids Boys Dresses Online at Best Prices in India,boys clothing set,"['Boys Dresses', 'Set']",[],"Boys Dresses ; Aashvi garments. Boys Festive & Party Shirt, Waistcoat and Pant Set. Beige Pack of 1 ; SHAURYA INNOVATION. Indi Boys Festive & Party Kurta and ...",https://www.flipkart.com/q/boys-dresses
3,"Boys' Clothes | Jeans, Jumpers & More | H&M IN",boys clothing set,"['boys', 'clothes', 'set']",[],"Discover all boys' clothes at H&M. ... Discover boys' T-Shirts and tank tops, as well as jeans, joggers and an array of pants in all ... 2-piece jersey set.",https://www2.hm.com/en_in/kids/boys/clothing.html
4,Boys Clothing UpTo 90% OFF - Snapdeal,boys clothing set,"['Boys', 'clothing', 'Boys', 'Set']",[],"Boys kids clothing online min 10% to 70% OFF. Browse for Kids t-shirts, ... Pichkari - Blue & Red Silk Boys Dhoti Kurta Set - Pack of 1.",https://www.snapdeal.com/products/boys-clothing
5,12-18 Months - Clothing Sets / Baby Boys - Amazon.in,boys clothing set,"['Boys', 'Dress Set']",[],Baby Boys and Baby Girls Cotton Half Sleeves Solid T-Shirt Animal Printed Dungaree Overall Dress Set in White Colour.,https://www.amazon.in/Clothing-Sets-12-18-Months-Baby-Boys/s?rh=n%3A1953173031%2Cp_n_size_browse-bin%3A1975476031&page=3
6,3 - 4 Years - Clothing Sets / Boys - Amazon.in,boys clothing set,"['Boys', 'Set', 'Boys', 'Dress', 'Boys']",[],"1,249-1,296 of over 1,000 results · Boys Shirt and Jeans Set Blue · Boys Cotton T-Shirt & Denim Short Dress (6 Months - 5 Years) · Baby Boys Cotton Applique Fruit- ...",https://www.amazon.in/Clothing-Sets-3-4-years-Boys/s?rh=n%3A1967893031%2Cp_n_size_browse-vebin%3A2081570031&page=27&hidden-keywords=Pack%7CSet
7,Amazon.in: Purples - Clothing Sets / Baby Boys,boys clothing set,"['Clothing Dress Set', 'Sets']",[],49-96 of 187 results. RESULTS · JSR Baby Girls Cool Cotton Clothing Dress Set of Top and Legging (Imported Baby · Paddy Baby 5 Pcs Sets New Born Baby Winter ...,https://www.amazon.in/Clothing-Sets-Purples-Baby-Boys/s?rh=n%3A1953173031%2Cp_n_size_two_browse-vebin%3A1975328031&page=2&hidden-keywords=-driving
8,Amazon.in: 6 - 7 Years - Clothing Sets / Boys,boys clothing set,['Boys Clothing sets'],[],"Kiddos Boys Roundneck t Shirt Shorts 3/4 Set Dress Combo Pack of 5 (6-7 ... Boys Clothing sets, Kids clothing sets, Full Pant with ...",https://www.amazon.in/Clothing-Sets-6-7-years-Boys/s?rh=n%3A1967893031%2Cp_n_size_browse-vebin%3A2081573031&page=3&hidden-keywords=-khyati+-crepe+-leotude+-J+-thermal+-khushal+-adyk+-vivid+-easy+-slit+-cupid+-night+-ytrick+-aania+-krishav+-lucknow
9,3 - 4 years - Clothing Sets / Boys - Amazon.in,boys clothing set,"['Boys', 'Outfit', 'Dress Clothes']",[],"Only 2 left in stock. Toddler Boys Tuxedo Outfit Kids Summer Dress Clothes White Shirt,Bowtie,Shorts ...",https://www.amazon.in/Clothing-Sets-3-4-years-Boys/s?rh=n%3A1967893031%2Cp_n_size_browse-vebin%3A2081570031&page=14&hidden-keywords=-raas+-scrub+-diego+-purvaja+-top+-tunic+-cottonwala+-colorfuel+-bumchum+-beauty+-tilism+-fashion2wear+-aarika+-petticoat+-poshak+-trendz+-sabaira+-things+-swag+-lcd+-herija+-bhutaiya+-stand+-hunputa+-mpitude+-fenical+-goodwill+-boldgal+-karmic+-oksale+-abiti+-stylistico+-yunloo+-maxi+-crown%29
10,3 - 4 years - Clothing Sets / Boys - Amazon.in,boys clothing set,['Boys Clothing sets'],[],"Panchani Fashion Boys Polycotton Blazer Style Printed Shirt and Pant Set with Bow ... Boys Clothing sets, Kids clothing sets, Three- ...",https://www.amazon.in/Clothing-Sets-3-4-years-Boys/s?rh=n%3A1967893031%2Cp_n_size_browse-vebin%3A2081570031&page=17&hidden-keywords=-cap
11,Generic - Clothing Sets / Boys: Clothing & Accessories,boys clothing set,"['Set', 'Boys', 'Dress', 'Dress', 'Boys']",[],"Indhrani Sweatshirt Pant Set For Boys | Kids Hosiery Cotton Printed Dress | Full Sleeves Dress For Kids, Boys.",https://www.amazon.in/Clothing-Sets-Generic-Boys/s?rh=n%3A1967893031%2Cp_89%3AGeneric
12,3 - 4 Years - Clothing Sets / Boys - Amazon.in,boys clothing set,"['Boys', 'Set', 'Boys']",[],"Boys Printed All-over Printed Casual Wear, Round Neck, Half Sleeves T-shirt and Denim Shorts I Tshirt and Half pant Set I Kidswear for Boys.",https://www.amazon.in/Clothing-Sets-3-4-years-Boys/s?rh=n%3A1967893031%2Cp_n_size_browse-vebin%3A2081570031&page=21&hidden-keywords=-sunglasses+-spectacles+-vogue
13,3 - 4 Years - Clothing Sets / Boys - Amazon.in,boys clothing set,"['Set', 'Boys Clothing']",[],"Baby Boys Cotton and Polyester Waistcoat and Pant Formal Set in Blue Color ... Zolario 3 Piece Boys Clothing Dress for Kids Boys, Coat, ...",https://www.amazon.in/Clothing-Sets-3-4-years-Boys/s?rh=n%3A1967893031%2Cp_n_size_browse-vebin%3A2081570031&page=2&hidden-keywords=-sunglass+-saree
14,Amazon.in: ₹500 - Clothing Sets / Boys: Clothing & Accessories,boys clothing set,"['Boys Clothing', 'Set']",[],"kids Ethnic Wear 3 Piece Suit Dress for 2 to 12 Years Boys Clothing Shirt Pant and Blended Waistcoat Set (Multicolor, Multiple Size).",https://www.amazon.in/Clothing-Sets-%E2%82%B9500-%E2%82%B91-000-Boys/s?rh=n%3A1967893031%2Cp_36%3A4595086031&page=3
15,9-12 Months - Clothing Sets / Baby Boys - Amazon.in,boys clothing set,"[""Boy's"", 'Set', 'Set', 'Boys']",[],"1-48 of over 1,000 results. RESULTS · Kid's Cotton T-Shirt · Baby Boy's Cotton Tshirt Pant Set · Girl's Cotton Short Set · Baby Boys and Baby Girls Super ...",https://www.amazon.in/Clothing-Sets-9-12-Months-Baby-Boys/s?rh=n%3A1953173031%2Cp_n_size_browse-bin%3A5836990031&hidden-keywords=-Rajrang
16,Amazon.in: Last 90 Days - Clothing Sets / Baby Boys,boys clothing set,"['Clothing Set', 'Boys']",[],Disney Mickey Mouse Cartoon Print Kids Full Sleeve T-shirt & Jogger Pajama Pant Clothing Set for Boys & Girls.,https://www.amazon.in/Clothing-Sets-Last-90-days/s?rh=n%3A1953173031%2Cp_n_date_first_available_absolute%3A1318488031
17,Amazon.in: 14 - 15 Years - Clothing Sets / Boys,boys clothing set,"['Boys', 'Set', 'dress set']",[],Boys' 100% Cotton Casual Chinses Collar Shirt and Plain Black Pant Set ... Three piece Indo Western Stylish dress set with Jacquard Blazer for kids and ...,https://www.amazon.in/Clothing-Sets-14-15-years-Boys/s?rh=n%3A1967893031%2Cp_n_size_browse-vebin%3A2081581031
18,Amazon.in: 50% Off or more - Clothing Sets / Boys,boys clothing set,"['Boys', 'Clothing Set', 'Sets']",[],Attis Boys and Girls Cotton Stylish Tshirt & Pant Kids Clothing Set (2-3 Years) Pack of 3 Sets - T1(WHBL)-T2(RDWH)-T7(BLWH).,https://www.amazon.in/Clothing-Sets-50-Off-or-more/s?rh=n%3A1967893031%2Cp_n_pct-off-with-tax%3A2665401031&page=3&hidden-keywords=-saree+-sunglasses+-eyewear+-accessories+-sock+-oyshome+-nighty+-egg+-Kimono+-jubination+-rain+-Aarvicouture+-Robe+-bra+-Dubai
19,Boys Clothing Sets - Meesho,boys clothing set,"['Boys Clothing Sets', 'Boys Clothing Sets']",[],Buy Boys Clothing Sets Online in India - Choose from a variety of options. Get Upto 15%-50% OFF on the latest collection of Boys Clothing Sets and enjoy ...,https://www.meesho.com/boys-clothing-sets/pl/9tg
20,Buy Baby Boy Dress Online Starting at Just ₹172 - Meesho,boys clothing set,"['boy dress', 'sets']",[],"Buying a baby boy dress online by shopping online will find several options like rompers, trousers, birthday suits, fancy accessories, clothing sets, bodysuits, ...",https://www.meesho.com/baby-boy-dresses/pl/3yt
21,Boys Clothing Sets Pack Of 1 - Meesho,boys clothing set,['Boys Clothing Sets'],[],Name: Boys Clothing Sets Pack Of 1 Top Fabric: Polycotton Bottom Fabric: Cotton Blend Sleeve Length: Long Sleeves Top Pattern: Solid Bottom Pattern: Checked ...,https://www.meesho.com/flawsome-comfy-boys-clothing-sets/p/2j03ei
22,8 - 9 Years - Clothing Sets / Boys - Amazon.in,boys clothing set,"['Boys', 'Set', 'Dress', 'Boys']",[],"Boys Festive & Party Shirt, Waistcoat and Pant Set Kids Party/Casual Western Dress for Boys Party Dark Blue_P.",https://www.amazon.in/Clothing-Sets-8-9-years-Boys/s?rh=n%3A1967893031%2Cp_n_size_browse-vebin%3A2081575031&page=2&hidden-keywords=-sponsored+-sweatshirts+-hoodies
23,Amazon.in: Eligible For Pay On Delivery - Clothing Sets / Boys,boys clothing set,"['Boys Clothing', 'Set']",[],"Boys Kurta Style T-Shirt with Denim Full Pant Combo, Blue ... Zolario 3 Piece Boys Clothing Dress for Kids Boys, Coat, Pant and Shirt Set ...",https://www.amazon.in/Clothing-Sets-Boys/s?rh=n%3A1967893031%2Cp_n_is_cod_eligible%3A4931671031&page=2
24,Wool - Clothing Sets / Boys: Clothing & Accessories - Amazon.in,boys clothing set,"['Boys', 'Dress set', 'Dress', 'Boys', 'Clothing Set']",[],Garments - Boys Winter Woolen Dress set | Woolen Winter Dress Round Neck Contains ... Woolen Girls / Boys / Kids Clothing Set Includes Full Sleeves Printed ...,https://www.amazon.in/Clothing-Sets-Wool-Boys/s?rh=n%3A1967893031%2Cp_n_material_browse%3A1974792031
25,Amazon.in: 4 - 5 Years - Clothing Sets / Boys,boys clothing set,"['Boys Clothing', 'Set']",[],"1-48 of over 1,000 results. RESULTS · 3 Piece Boys Clothing Dress for Kids Boys, Coat, Pant and Shirt Set, · 3 Piece Stripe Print Boys Party Suit - Coat ...",https://www.amazon.in/Clothing-Sets-4-5-years-Boys/s?rh=n%3A1967893031%2Cp_n_size_browse-vebin%3A2081571031&hidden-keywords=-showoff+-twist+-rodid+-sponsored
26,V MART - Clothing Sets / Boys - Amazon.in,boys clothing set,"['Boys', 'Clothing Sets', 'Boys', 'Boys']",[],1-48 of 292 results. RESULTS · Boys Printed Cotton Round Neck Clothing Sets · VMart Boys Printed Knit-Denim Round Neck Baba · VMart Boys Printed Knit-Knit ...,https://www.amazon.in/Clothing-Sets-V-MART-Boys/s?rh=n%3A1967893031%2Cp_89%3AV+MART
27,Amazon.in: 3 - 4 Years - Clothing Sets / Boys,boys clothing set,['Boys Clothing Set'],[],"Boys Clothing Set 3 Piece Dress for Boys, Set of Coat, Pant & Shirt, Ideal for Wedding and Birthday. 3.9 out of 5 stars (3.9)126.",https://www.amazon.in/Clothing-Sets-3-4-years-Boys/s?rh=n%3A1967893031%2Cp_n_size_browse-vebin%3A2081570031&hidden-keywords=-sponsored+-men
28,Amazon.in: Cotton - Clothing Sets / Baby Boys,boys clothing set,"['Boys', 'Set', 'Clothes', 'Sets', 'Boys']",[],Boys Cotton All-Over Print T-Shirt with Jacket & Pant Set in Green ... Winter Wear Keep Warm Baby Clothes 5Pcs Sets Cotton Baby Boys ...,https://www.amazon.in/Clothing-Sets-Cotton-Baby-Boys/s?rh=n%3A1953173031%2Cp_n_material_browse%3A1974776031
29,Boys clothing set online - Toothless.in,boys clothing set,"['Boys clothing set', 'Boys clothing sets']",[],Boys clothing set online: Shop for Clothes For Boys online at best prices in India. Choose from a wide range of Boys clothing sets at toothless.in latest ...,https://toothless.in/boys-clothing/clothing-set.html
30,Amazon.in: Sleeveless - Clothing Sets / Baby Boys,boys clothing set,"['Set', 'set', 'Dress', 'clothes', 'Boy']",[],Top & Shorts Set | Evrydaywear| Comfort Wear | Lounge Wear | Top and Shorts set for Kids | Kids Combo Dress | Baby clothes | Boy ...,https://www.amazon.in/Clothing-Sets-Sleeveless-Baby-Boys/s?rh=n%3A1953173031%2Cp_n_feature_three_browse-bin%3A31661156031
31,Amazon.in: Multicoloured - Clothing Sets / Baby Boys,boys clothing set,['Clothes'],[],"1-48 of over 6,000 results. RESULTS · HIKIPO Presents New Born Baby Winter Wear Keep Warm Baby Clothes 5Pcs · ADRIEL BRINGING JOY® New Born Woolen Winter ...",https://www.amazon.in/Clothing-Sets-Multicoloured-Baby-Boys/s?rh=n%3A1953173031%2Cp_n_size_two_browse-vebin%3A1975325031
32,199 - ₹200 - Clothing Sets / Baby Boys - Amazon.in,boys clothing set,['boys Clothing Set'],[],"TrendingTrunks Santa Claus Dress for Newborn To 3 Months Baby, Kids, Toddler, Unisex · Amazon Brand - Jam & Honey baby-boys Clothing Set ...",https://www.amazon.in/Clothing-Sets-%E2%82%B9199-%E2%82%B9200-Baby-Boys/s?rh=n%3A1953173031%2Cp_36%3A19900-20000
33,Amazon.in: 12 - 13 Years - Clothing Sets / Boys,boys clothing set,"['Boys Clothing', 'Set']",[],"Boys Clothing, Dress for Kids Boys, Coat, Pant and Shirt Set, Ideal for Wedding, Birthday and Party. 3.63.6 out of 5 stars (59).",https://www.amazon.in/Clothing-Sets-12-13-years-Boys/s?rh=n%3A1967893031%2Cp_n_size_browse-vebin%3A2081579031
34,Boys Clothing Sets – Buy Top & Bottom Sets for ... - Paytm Mall,boys clothing set,['clothes sets'],[],"Some of these brands include names like ELK Kids, Goodway Junior, Reliance Trends, Crazeis, Ginessa and many others. The clothes sets that we sell are available ...",https://paytmmall.com/boys-top-bottom-sets-glpid-18240
35,Zolario Boys Clothing Set 3 Piece Dress for Boys ... - Meesho,boys clothing set,['Boys Clothing Set'],[],"Name: Zolario Boys Clothing Set 3 Piece Dress for Boys, Set of Coat, Pant & Shirt, Ideal for Wedding and Birthday. Fabric: Cotton Blend Type: Three Piece ...",https://www.meesho.com/zolario-boys-clothing-set-3-piece-dress-for-boys-set-of-coat-pant-shirt-ideal-for-wedding-and-birthday/p/1nde05
36,Princess Stylish Boys Clothing Sets - Meesho,boys clothing set,['Boys Clothing Sets'],[],Name: Princess Stylish Boys Clothing Sets Top Fabric: Organza Bottom Fabric: Hosiery Sleeve Length: Short Sleeves Top Pattern: Printed Bottom Pattern: ...,https://www.meesho.com/princess-stylish-boys-clothing-sets/p/2hf5pr
37,Get Upto 50% Off on Boys Dress Clothing and Apparel,boys clothing set,"['Set', 'Set', 'Set']",[],Sort by · Briefs (71) · Caps (11) · Dhoti Kurta Set (26) · Jackets (183) · Jeans (301) · Kurta Pyjama Jacket Set (42) · Kurta Pyjama Set (80) · Kurtas (34).,https://www.shoppersstop.com/kids-boys/c-A4010
38,Boys' Clothing & Outfit Sets | Pant & Short Sets - JCPenney,boys clothing set,"['boys', 'clothing sets']",[],Choose boys' clothing sets that are matched and ready for play from JCPenney! Outfits with tops and bottoms are sure to make stocking his wardrobe ...,https://www.jcpenney.com/g/baby-kids/clothing-sets/boys?id=cat11100000054
39,Buy Mothercare Boys Clothing Set online in India - Myntra,boys clothing set,"['Boys Clothing Set', 'Boys Clothing Set', 'Boys Clothing Set']",[],Mothercare Boys Clothing Set Online. Shop for Mothercare Boys Clothing Set in India ✯ Buy latest range of Mothercare Boys Clothing Set at Myntra ✯ Free ...,https://www.myntra.com/mothercare-boys-clothing-set
40,Kids Clothing | Kids Wear Online at Best Prices in India - Flipkart,boys clothing set,"['set', 'boy']",[],"To enhance the look on traditional occasions, you can buy a dhoti pant set for your little boy and a lehenga choli for your little girl.",https://www.flipkart.com/q/kids-clothing
41,Boys Clothing Sets Pack Of 1 - Meesho,boys clothing set,['Boys Clothing Sets'],[],Name: Boys Clothing Sets Pack Of 1 Top Fabric: Hosiery Cotton Bottom Fabric: Hosiery Cotton Sleeve Length: Short Sleeves Top Pattern: Printed Bottom ...,https://www.meesho.com/boys-clothing-sets-pack-of-1/p/gp1qd
42,Boys Clothing Sets Pack Of 5 - Meesho,boys clothing set,['Boys Clothing Sets'],[],Name: Boys Clothing Sets Pack Of 5 Top Fabric: Cotton Bottom Fabric: Cotton Sleeve Length: Short Sleeves Top Pattern: Printed Bottom Pattern: Solid Net ...,https://www.meesho.com/boys-clothing-sets-pack-of-5/p/14x3qg
43,Buy Boys Clothing Sets online in India - Myntra,boys clothing set,"['Boys Clothing Sets', 'Boys Clothing Sets']",[],Online shopping for Boys Clothing Sets ✯ Shop Online Boys Clothing Sets ✯ Free Shipping ✯ Cash on Delivery ✯ Easy returns and exchanges.,https://www.myntra.com/boys-clothing-sets-menu?src=tNav
44,Buy Men Boys Clothing Set online in India - Myntra,boys clothing set,"['Boys Clothing Set', 'Boys Clothing Set', 'Boys Clothing Set']",[],Men Boys Clothing Set Online. Shop for Men Boys Clothing Set in India ✯ Buy latest range of Men Boys Clothing Set at Myntra ✯ Free Shipping ✯ COD ✯ Easy ...,https://www.myntra.com/men-boys-clothing-set
45,Buy Yk Boys Clothing Set online in India - Myntra,boys clothing set,"['Boys Clothing Set', 'Boys Clothing Set', 'Boys Clothing Set']",[],Yk Boys Clothing Set Online. Shop for Yk Boys Clothing Set in India ✯ Buy latest range of Yk Boys Clothing Set at Myntra ✯ Free Shipping ✯ COD ✯ Easy ...,https://www.myntra.com/yk-boys-clothing-set
46,Boys Clothing Sets & Outfits - Macy's,boys clothing set,['Boys Clothing Sets'],[],Shop Boys Clothing Sets & Outfits at Macys.com and find the best styles and deals from top brands! Free shipping available at macys.com and ...,https://www.macys.com/shop/kids-clothes/boys-clothing-sets-and-outfits?id=121344
47,Amazon.com: Boys' Clothing Sets,boys clothing set,"['Clothing', 'Sets', 'Sets']",[],"Online shopping for Clothing, Shoes & Jewelry from a great selection of Short Sets, Pant Sets & more at everyday low prices.",https://www.amazon.com/Boys-Clothing-Sets-Pinks/s?keywords=Boys%27+Clothing+Sets&rh=n%3A1288606011%2Cp_n_size_browse-vebin%3A2343359011&c=ts&ts_id=1288606011
48,Buy Cute Baby Boy Clothes Online | Mothercare India,boys clothing set,"['Boy Clothes', 'boy clothes', 'Set']",[],Baby Boy Clothes: Choose from wide range of trendy baby boy clothes from Mothercare India. Order cute baby boy ... Yellow Dinosaur T-Shirt And Shorts Set.,https://www.mothercare.in/baby-clothing-baby-boys-clothing-65299
49,Boys Clothing Sets Pack Of 1 - Meesho,boys clothing set,['Boys Clothing Sets'],[],Name: Boys Clothing Sets Pack Of 1 Top Fabric: Cotton Bottom Fabric: Cotton Sleeve Length: Long Sleeves Top Pattern: Printed Bottom Pattern: Solid Net ...,https://www.meesho.com/boys-clothing-sets-pack-of-1/p/1q3j44
50,Boys Clothing Sets Pack Of 1 - Meesho,boys clothing set,['Boys Clothing Sets'],[],Name: Boys Clothing Sets Pack Of 1 Top Fabric: Cotton Bottom Fabric: Cotton Sleeve Length: Sleeveless Top Pattern: Solid Bottom Pattern: Stripes Net ...,https://www.meesho.com/boys-clothing-sets-pack-of-1/p/16h5v0
51,"Baby Boy Dress, Baby Boy Cloth, Boys ke Kapde ... - Meesho",boys clothing set,['Boys Clothing Sets'],[],"Name: Baby Boy Dress, Baby Boy Cloth, Boys ke Kapde, Boys Clothing Sets, kids clothing set, cotton material dress, full sleeve t-shirt,long tshirt,1 year ...",https://www.meesho.com/baby-boy-dress-baby-boy-cloth-boys-ke-kapde-boys-clothing-sets-kids-clothing-set-cotton-material-dress-full-sleeve-tshirtlong-tshirt1-year-boy-dress-2-year-kids-clothing3-year-child-dress4-year-boy-kapde5-year-kids-clothing/p/23851c
52,Buy 2 Year Boys Dress online at Best Prices in India - Flipkart,boys clothing set,"['Boys Dress', 'Set']",[],2 Year Boys Dress ; Bright Garments Dresses. Boys Wedding Kurta and Dhoti Pant Set. Multicolor Pack of 1 ; Nubal. Boys Party(Festive) Jacket Pant. Blue ; ZADMUS.,https://www.flipkart.com/q/2-year-boys-dress
53,Boys Clothing Sets Pack Of 1 - Fashion Wear,boys clothing set,['Boys Clothing Sets'],[],Boys Clothing Sets Pack Of 1. Top Fabric: Hosiery Bottom Fabric: Hosiery Sleeve Length: Long Sleeves Top Pattern: Printed Bottom Pattern: Printed,https://fashion-wear.in/product/boys-clothing-sets-pack-of-1-2/
54,Buy Adira Boys Clothing online in India - Myntra,boys clothing set,['Boys Clothing Set'],[],Hopscotch. Boys Clothing Set. 319. Filter by. Categories. Baby apparel gift set. Baby bed sets. Baby care products. Baby gear & nursery. Bath towels.,https://www.myntra.com/adira-boys-clothing
