position,title,query,snippet_highlighted_words,rich_snippet_list,snippet,link2,Toddler Boys' Clothes: Find Cool Outfits For Your Little One,boys clothing,"['boy', 'Boys Kids', 'Clothing']",[],"From tops to bottoms, from activewear to swimwear and pajamas, your toddler boy will feel super supported and adorable. 2T Boys Kids Toddlers Clothing. Fine, ...",https://www.kohls.com/catalog/boys-kids-toddlers-clothing.jsp?CN=Gender:Boys+AgeAppropriate:Kids+ChildAgeRange:Toddlers+Department:Clothing
3,Boys Clothing Sets | Academy,boys clothing,"['Boys', 'Clothing', 'Boys Clothing']",[],"Kids, Boys' Clothing, Boys Clothing Sets. ... Nike Toddler Boys' Thrill Short Sleeve T-shirt and Shorts Set. $13 9813 dollars 98 cents.",https://www.academy.com/c/kids/boys-apparel/boys-clothing-sets
4,Boy's Clothing Hot Deals | Academy,boys clothing,"[""Boy's Clothing""]",[],"Hot Deals, Clothing, Boy's Clothing Hot Deals. ... Save 40%. Clearance. Magellan Outdoors Boys' Camo Hill Country 7-Pocket Twill Hunting Pants. 4.8(55).",https://www.academy.com/c/hot-deals/hot-deals-on-apparel/boys-apparel--1
5,Baby Boy Clothes - Macy's,boys clothing,"['Boy Clothes', 'Boy Clothing']",[],Baby Boy Clothes at Macy's come in a variety of styles and sizes. Shop Baby Boy Clothing and find the latest styles for your little one today.,https://www.macys.com/shop/kids-clothes/baby-boy-clothes?id=48693
6,Little Boys (4-7) Boys Clothing - Macy's,boys clothing,"['Boys', 'Clothing', 'boys', 'clothes']",[],Little Boys (4-7) Boys' Clothing at Macy's come in a variety of styles and sizes. Shop Little Boys (4-7) boys' clothes from top brands that your kids would ...,https://www.macys.com/shop/kids-clothes/boys-clothing/Size_range/Little%20Boys%20%284-7%29?id=61999
7,Shop Boys Clothes & Accessories | Brooks Brothers,boys clothing,['boys clothing'],[],Build a classic preppy look with the latest Brooks Brothers collection of boys clothing.,https://www.brooksbrothers.com/boys
8,Boys' Clothing & Outfit Sets | Pant & Short Sets - JCPenney,boys clothing,"['boys', 'clothing']",[],Choose boys' clothing sets that are matched and ready for play from JCPenney! Outfits with tops and bottoms are sure to make stocking his wardrobe ...,https://www.jcpenney.com/g/baby-kids/clothing-sets/boys?id=cat11100000054
9,"Boys' Clothes | Jeans, Jumpers & More | H&M SG",boys clothing,"['boys', 'clothes']",[],"Discover all boys' clothes at H&M. Refresh on everyday essentials, or scroll for the latest T-Shirts, jeans, jackets, jumpers and more.",https://www2.hm.com/en_sg/kids/boys/clothing.html
10,Little Boys Clothing | 1 to 6 Years | Joules US,boys clothing,"['Boys', 'clothing']",[],Kit out your Little Boys wardrobe with our range of colourful and hardwearing clothing and accessories. Here you will find our latest collection ...,https://www.joulesusa.com/Boys-Clothing/Little-Boys
11,Boys' Clothing Clearance | Academy,boys clothing,"['Boys', 'Clothing', 'Boys', 'Clothing']",[],"Clearance, Boys' Clothing + Shoes, Boys' Clothing Clearance.",https://www.academy.com/c/academy-clearance/boys-clearance-apparel-shoes/clearance-for-boys-apparel
12,Boys' Clothing Clearance | Academy - Academy Sports,boys clothing,"['boys', 'clothing', 'boys', 'clothing']",[],Find boys' clothing sale items and accessories for your little guy in the boys' clothing clearance section at Academy Sports + Outdoors.,https://www.academy.com/c/academy-clearance/clothing-clearance/boys-clothing-clearance
13,Boys Clothing | Journeys Kidz,boys clothing,['Boys Clothing'],[],Shop Boys Clothing at Journeys Kidz! FAST shipping and 365-day returns. Shop Now!,https://www.journeys.com/kidz/boys/boys-clothing
14,Boys' Outfits | Kohl's,boys clothing,"['Boys', 'Clothing']",[],Boys' Clothing Sets · Boys 8-20 Nike Tracksuit · Baby Boy Nike Logo Striped Bodysuit & Pants Set · Top Rated · Boys 10-16 OppoSuits Black Knight Solid Suit · Boys 4- ...,https://www.kohls.com/catalog/boys-kids-clothing-sets-clothing.jsp?CN=Gender:Boys+AgeAppropriate:Kids+Category:Clothing%20Sets+Department:Clothing
15,Boys' Dress Clothes - Target,boys clothing,[],[],Contactless options including Same Day Delivery and Drive Up are available with Target. Shop today to find Dresswear at incredible prices.,https://www.target.com/c/dresswear-boys-clothing-kids/-/N-5xtxw
16,Designer Clothing for Boys on Sale - FARFETCH,boys clothing,"['clothing', 'boys', 'wear']",[],"He'll love our designer clothing for boys on sale. ... Find the styles he'll wear time and time again, from logo hoodies to jeans and shirts.",https://www.farfetch.com/shopping/kids/sale/boys-clothing-3/items.aspx
17,Boy's Clothing | Pre-Teens & Teens Sizes 8-20 - Boscov's,boys clothing,"[""boy's clothing""]",[],"Explore trending styles of boy's clothing (sizes 8-20) from top brands at great prices. Find pants, sweaters, & tops for even the pickiest dressers.",https://www.boscovs.com/category/boys-8-20-clothing
18,Kids Clothing - Sam's Club,boys clothing,['Kids Clothing'],[],Kids Clothing · Member's Mark Boys' 2 Pack Flannel Shirt. View more options · Member's Mark Girls' 3 Pack Legging · Member's Mark Infant 6 Piece Sleep N Play.,https://www.samsclub.com/b/members-mark-kids-clothing/15340210
19,Boys Clothes | Everyday Low Prices - Rainbow Shops,boys clothing,"['Boys Clothes', 'boys clothes']",[],Boys Clothes at everyday low prices. Free shipping and free returns to our 1000+ stores. New affordable styles of boys clothes added daily.,https://www.rainbowshops.com/collections/boys-clothing
20,toddler boys clothing - Nordstrom,boys clothing,['boys clothing'],[],"Shop for toddler boys clothing at Nordstrom.com. Free Shipping. ... Kids' Long Sleeve Polo (Toddler, Little Kid & Big Kid). Black Owned/Founded.",https://www.nordstrom.com/sr/toddler-boys-clothing
21,Best Boys' Clothing Sets - Amazon.com,boys clothing,"['Boys', 'Clothing']",[],"Discover the best Boys' Clothing Sets in Best Sellers. Find the top 100 most popular items in Amazon Clothing, Shoes & Jewelry Best Sellers.",https://www.amazon.com/Best-Sellers-Boys-Clothing-Sets/zgbs/fashion/1288606011
22,Boys' Big Kids Clothing | XS-XL - Finish Line,boys clothing,['kids apparel'],[],"Shop online at Finish Line for boys' big kids apparel. Find the latest styles from top brands like Nike, adidas and Under Armour.",https://www.finishline.com/store/boys/clothing/big-kids/_/N-4ukr68
23,Big Boys (8-20) Boys Clothing - Macy's,boys clothing,"['Boys', 'Clothing', 'boys', 'clothes']",[],Big Boys (8-20) Boys' Clothing at Macy's come in a variety of styles and sizes. Shop Big Boys (8-20) boys' clothes from top brands that your ...,https://www.macys.com/shop/kids-clothes/boys-clothing/Size_range/Big%20Boys%20%288-20%29?id=61999
24,Boys Clothing Deals - Walmart.com,boys clothing,['Boys Clothing'],[],Shop for great Boys Clothing Deals at Walmart.com. Save Money. Live Better.,https://www.walmart.com/shop/deals/clothing-and-accessories/kids-and-baby/boys-clothing
25,Boys' Designer Luxury Clothes | Boy Kids Clothing | GUCCI® US,boys clothing,"['Clothing', 'Boys', 'Boys']",[],"Discover the Selection of Clothing for Boys Aged 4 - 12 Years at GUCCI.com. Shop Boys' Shirts, Trousers and More.",https://www.gucci.com/us/en/ca/children/boys/clothing-for-boys-4-12-years-c-children-boys-clothing-4-12
26,Boys Clothes & Accessories - Marshalls,boys clothing,['boys clothes'],[],"Shop boys clothes & accessories for brands that wow at prices that thrill. Free Shipping on $89+ orders online, easy, in store returns.",https://www.marshalls.com/us/store/shop/boys-clothes-accessories/_/N-369287662
27,Boys' Clothing and Accessories | Blain's Farm and Fleet,boys clothing,"['Boys', 'Clothing']",[],Find a wide selection of Boys' Clothing . We have all the best brands at great prices!,https://www.farmandfleet.com/boys-clothes/
28,Minecraft - Boys' Clothing / Boys' Fashion - Amazon.com,boys clothing,"['Clothing', 'Clothing']",[],"Online shopping for Clothing, Shoes & Jewelry from a great selection of Tops, Tees & Shirts, Fashion Hoodies & Sweatshirts, Active, Swim, Clothing Sets, ...",https://www.amazon.com/minecraft-Boys-Clothing-Fashion/s?k=minecraft&rh=n%3A1040666
29,Amazon Best Sellers: Best Boys' Clothing Sets,boys clothing,"['Boys', 'Clothing']",[],"Discover the best Boys' Clothing Sets in Best Sellers. Find the top 100 most popular items in Amazon Clothing, Shoes & Jewelry Best Sellers.",https://www.amazon.com/Best-Sellers-Boys'-Clothing-Sets/zgbs/fashion/1288606011
30,Boys' Clothes | Daily Deals on Top Brands for Toddler to Tween,boys clothing,"[""boy's clothing""]",[],It can be tricky keeping up with a growing boy's clothing needs. Discover Zulily's wide selection of clothes for every occasion that every kid should have in ...,https://www.zulily.com/category/boys
31,Fashion Boys Clothing | SHEIN USA,boys clothing,['Boys Clothing'],[],Free Returns ✓ Free Shipping On Orders $49+ ✓ 1000+ New Arrivals Dropped Daily ✓ Shop for Boys Clothing at SHEIN USA!,https://us.shein.com/category/Boys-Clothing-B-sc-00809642.html?lang=us
32,Kids Clothing & Accessories - Tillys,boys clothing,['Kids Clothing'],[],Shop Kids Clothing & Shoes from all the latest brands. Tillys carries Boys size 4-7 and 8-20 and Girls Size 4-6 and 7-16.,https://www.tillys.com/kids/
33,Boys' Youth Clothing | adidas US,boys clothing,"['Boys', 'Clothing']",[],"Find Boys' Youth Clothing at adidas today! Discover our wide selection of comfortable and stylish tees, jackets, hoodies, sweatshirts, pants and shorts.",https://www.adidas.com/us/boys-youth-clothing
34,Yellow : Boys' Clothes - Target,boys clothing,"['Boys', 'Clothing']",[],"Shop Target for Boys' Clothing you will love at great low prices. Choose from Same Day Delivery, Drive Up or Order Pickup. Free standard shipping with $35 ...",https://www.target.com/c/boys-clothing-kids/yellow/-/N-5xty4Z5y72c
35,Casual & Classic Boys Clothing - Vineyard Vines,boys clothing,"['Boys', 'Clothing']",[],Boys' Clothing · Boys' Marine Air Vest · Boys Performance Breaker Pants · Boys' Harbor Fleece Shep Shirt · Boys' Surfside Full-Zip Hoodie · Boys' Sherpa Fleece Vest.,https://www.vineyardvines.com/boys/
36,Toddler Boy Clothing - Old Navy,boys clothing,['boy clothes'],[],Toddler boy clothes from Old Navy are simply the cutest. Find graphic shirts & shorts to put together the perfect outfit for your little boy.,https://oldnavy.gap.com/browse/category.do?cid=37045
37,Harry Potter : Boys' Clothes - Target,boys clothing,"['Boys', 'Clothing']",[],"Shop Target for Boys' Clothing you will love at great low prices. Choose from Same Day Delivery, Drive Up or Order Pickup. Free standard shipping with $35 ...",https://www.target.com/c/boys-clothing-kids/harry-potter/-/N-5xty4Z5xkew
38,Boys' Tops - Target,boys clothing,"['Kids', 'Clothing', 'Boys', 'Clothing']",[],"Target/Clothing, Shoes & Accessories/Kids' Clothing/Boys' Clothing/Tops (10952)‎. Active Tops · Graphic Tees · Hoodies & Sweatshirts.",https://www.target.com/c/tops-boys-clothing-kids/-/N-5xtxr
39,Little Boys Clothing. Nike.com,boys clothing,['Boys Clothing'],[],Little Boys Clothing. Hoodies & Pullovers Pants & Tights Jackets & Vests Tops & T-Shirts Shorts Tracksuits Socks Sets. 267 Results,https://www.nike.com/w/little-boys-clothing-1onraz6dacez6ymx6
40,Boys' Clothing Sale & Clearance | Bass Pro Shops,boys clothing,"['boys', 'clothing']",[],Shop boys' clothing in the Bass Pro Shops Bargain Cave that is on sale and clearance. Great products are available online for discounted prices.,https://www.basspro.com/l/bargain-cave-boys-clothing-sale-and-clearance
41,Boys Clothing | Boys Streetwear - True Religion,boys clothing,"['boys', 'clothing']",[],"Browse our new arrivals in boys' clothing at True Religion. Create luxe streetwear looks with our tees, hoodies, jeans & more for boys from True Religion.",https://www.truereligion.com/boys-designer-clothes
42,BOY'S CLOTHING - Casa Raul Western Wear,boys clothing,['KIDS BOYS'],[],CINCH RELAXED FIT - KIDS BOYS JEANS - MB16682003. CINCH. MSRP: $46.95. Now: $44.95.,https://casaraulww.com/kids/boys-western-wear/
43,Kids' Clothes and Shoes - Academy Sports + Outdoors,boys clothing,"['kids', 'clothing', 'kids', 'clothes']",[],"Find kids' clothing and shoes, including kids' clothes and kids' shoes for boys, girls and toddlers, at Academy Sports + Outdoors.",https://www.academy.com/c/kids
44,Boys Clothing (Sizes 4-7) - Burkes Outlet,boys clothing,['boys clothing'],[],Shop for little boys clothing at Burkes Outlet for affordable clothes for little boys in the latest looks & top brand names at great quality & prices you'll ...,https://www.burkesoutlet.com/shop/kids/boys/little-boys-4-7/
45,Boys' Clothing | PUMA,boys clothing,"['Boys', 'clothing']",[],"Boys' clothing by PUMA keeps up with your child's active lifestyle – from the playground to the field, find activewear they'll love.",https://us.puma.com/us/en/kids/boys/clothing
46,Wholesale Boys Clothing - DollarDays,boys clothing,"['kids', 'apparel']",[],"Beat the high cost of kids' apparel when you shop the wholesale boys' pants, shirts, underwear and clothing available online at DollarDays.",https://www.dollardays.com/wholesale-clothing-boys.html
47,Little Boys (4-7) Clearance: Kids' Clothing Sale - Macy's,boys clothing,"['Kids', 'Clothing', 'Kids', 'Clothing']",[],Kids' Clearance Clothing at Macy's is a great opportunity to save. Shop Kids' Clearance Clothing at Macy's and find the latest styles for ...,https://www.macys.com/shop/kids-clothes/kids-clothes-clearance/Size_range/Little%20Boys%20%284-7%29?id=24359
48,"Boys' Clothing Clearance: Boys, Toddler & Baby Boy Styles",boys clothing,"['boys', 'clothing']",[],"Shop the boys' clothing clearance sale at Nautica to find high-quality, on-trend clothing for boys and toddlers, all at unmissable discount prices.",https://www.nautica.com/sale-boys/
49,"Boys Clothing - Shop & Find Brands Like Akademiks, Coogi ...",boys clothing,['Boys clothing'],[],"At DrJays, we carry a large selection of Boys clothing including brands like Akademiks, Coogi, Rocawear & Nike.",https://www.drjays.com/shop/G1-R379/boys.html
50,Boys' Dress Clothes & Outfits | Kohl's,boys clothing,"['boys', 'dress']",[],"Kids come in all sizes, and our collection of boys' dress up clothes accommodates accordingly. From tiny tikes to school-age boys, these dress clothes suit a ...",https://www.kohls.com/catalog/boys-dressy-kids-clothing.jsp?CN=Gender:Boys+Occasion:Dressy+AgeAppropriate:Kids+Department:Clothing
51,Amazon.com: Baby Boys' Clothing Sets,boys clothing,['boys clothing'],[],Look for baby boys clothing sets on Amazon.com. Free shipping and free returns on eligible items.,https://www.amazon.com/Baby-Boys-Clothing-Sets/b?ie=UTF8&node=13698211
52,Boys' Clothes - Toddler & Little Boys Outfits | Maisonette,boys clothing,['boys clothing'],[],Shop boys clothing and outfits for toddlers and little boys. Browse Maisonette's one-stop shop for your favorite brands that keep him stylish from day one.,https://www.maisonette.com/shop/kids/boy-clothing
53,Kids' & Baby Clothing Deals - Target,boys clothing,"['Kids', 'Clothing']",[],Contactless options including Same Day Delivery and Drive Up are available with Target. Shop today to find Kids' & Baby Clothing & Accessories Deals at ...,https://www.target.com/c/kids-clothing-deals/-/N-ywh7o
54,Quick Dry : Boys' Clothes - Target,boys clothing,"['Boys', 'Clothing']",[],"Shop Target for Boys' Clothing you will love at great low prices. Choose from Same Day Delivery, Drive Up or Order Pickup. Free standard shipping with $35 ...",https://www.target.com/c/boys-clothing-kids/quick-dry/-/N-5xty4Z174q1
55,5 Boys Kids Clothing | Kohl's,boys clothing,['Kids Clothing'],[],5 Boys Kids Clothing · Boys 8-20 Under Armour Pronto Medium Weight Puffer Jacket · Boys 4-8 Jumping Beans® 2 Pack Jogger Pants Set · Toddler Boy Jumping Beans® ...,https://www.kohls.com/catalog/5-boys-kids-clothing.jsp?CN=TopRated:5+Gender:Boys+AgeAppropriate:Kids+Department:Clothing
56,Boys Clothing | Shop Premium Outlets,boys clothing,"[""boy's"", 'dress']",[],"boy's track set in green. $91.00 $141.00 35% off · Freestyle Revolution. 3pc navy pinstripe dress shirt, vest & pant set. $25.95 $36.00 28% off.",https://shoppremiumoutlets.com/collections/kids-boys-clothing
57,Baby Boys' Clothing Sets - 18-24 Mo. / Baby ... - Amazon.com,boys clothing,['Clothing'],[],"Online shopping for Clothing, Shoes & Jewelry from a great selection of Pant Sets, Short Sets & more at everyday low prices.",https://www.amazon.com/Baby-Boys-Clothing-Sets-18-24-mo/s?keywords=Baby+Boys%27+Clothing+Sets&rh=n%3A13698211%2Cp_n_size_two_browse-vebin%3A1289787011&c=ts&ts_id=13698211
58,Boys' Clothing - Jimmy Jazz,boys clothing,"['Boys', 'Clothing']",[],Home / Boys' Clothing ... Jordan Boys (4-7) Cross Court Tape Short Sleeve $30.00 ... Nike Boys' JDI Illuminate Tee $22.00.,https://www.jimmyjazz.com/collections/boys-clothing
59,"Boys collections, clothing, accessories, toys, shoes - Everafter",boys clothing,"['boys', 'apparel']",[],"Shop boys collections of apparel, accessories, shoes, and cool stuff.",https://everaftershop.com/collections/boys
60,Boys' Clothing - Fingerhut,boys clothing,[],[],"For California residents, by proceeding to interact with Fingerhut, please be aware that your personal information may be collected. To ...",https://www.fingerhut.com/search/Clothing/Boys'%20Clothing?categoryId=5408
61,Boys Clothing on Sale | Bargain Cave - Cabela's,boys clothing,['boys clothing'],[],"Cabela's offers a wide range of boys clothing at a lower price than usual in the Bargain Cave at Cabela's. Shop from Bass Pro Shops, The North Face, ...",https://www.cabelas.com/l/bargain-cave-boys-clothing-sale-and-clearance
62,Boys' Apparel & Clothing | Champion,boys clothing,[],[],The store will not work correctly in the case when cookies are disabled. JavaScript seems to be disabled in your browser. For the best experience on our ...,https://www.champion.com/kids/boys.html
63,Our Latest Boys Clothing Collection | Quiksilver,boys clothing,"[""Boy's Clothes""]",[],Discover our Boy's Clothes Collection. Shop Online at Quiksilver Official Store. Free Shipping & Free Returns For Members.,https://www.quiksilver.com/kids-clothing/
64,Encanto : Boys' Clothes - Target,boys clothing,"['Boys', 'Clothing']",[],"Shop Target for Boys' Clothing you will love at great low prices. Choose from Same Day Delivery, Drive Up or Order Pickup. Free standard shipping with $35 ...",https://www.target.com/c/boys-clothing-kids/encanto/-/N-5xty4Zrg0d1
65,Purple : Boys' Clothes - Target,boys clothing,"['Boys', 'Clothing']",[],"Shop Target for Boys' Clothing you will love at great low prices. Choose from Same Day Delivery, Drive Up or Order Pickup. Free standard shipping with $35 ...",https://www.target.com/c/boys-clothing-kids/purple/-/N-5xty4Z5y6hb
66,"Little Boys (2-7) - Clothing, Shoes & Jewelry - Amazon.com",boys clothing,"['Clothing', 'Boys']",[],"Online shopping for Clothing, Shoes & Jewelry from a great selection of Tops, Tees & Shirts, ... Fruit of the Loom Boys Zone Cushion Ankle Socks 10 Pack.",https://www.amazon.com/Clothing-Little-Boys-2-7/s?rh=n%3A1040666%2Cp_n_size_six_browse-vebin%3A4940400011
67,Boys' Clothing – Shop New Arrivals - Gap,boys clothing,"['boys', 'clothing']",[],Style and fun meets quality and comfort with our wide selection of clothes for boys. Shop the latest styles in boys' clothing at Gap.,https://www.gap.com/browse/category.do?cid=63896
68,Boys Clothes | SweetHoney Clothing,boys clothing,['Boys Clothes'],[],Check out SweetHoney Clothing for all your Kids & Baby needs ⭐ Shop new items every week! ✔️ Boys Clothes and more.,https://sweethoneyclothing.com/collections/boys-clothing
69,Amazon.com: Baby Boy's Clothing,boys clothing,"['Clothing', 'Clothing']",[],"Online shopping for Clothing, Shoes & Jewelry from a great selection of Bodysuits, Tops, Footies & Rompers, Clothing Sets, Hoodies & Active, Jackets & Coats ...",https://www.amazon.com/Baby-Boys-Clothing-18-24-mo-Shoes/s?keywords=Baby+Boy%27s+Clothing&rh=n%3A1044510%2Cp_n_size_two_browse-vebin%3A1289787011&c=ts&ts_id=1044510
70,Designer Boys' Clothing | Ted Baker ROW,boys clothing,"['Boys', 'Clothes']",[],Shop Boys' Clothes at Ted Baker today. Feel the quality with everything from Boys' Jackets to quilted cotton sweats in our luxury designer collection.,https://www.tedbaker.com/row/c/kids/boys/554
71,Boy's Clothing - New In 2023 - Lacoste,boys clothing,"['Clothes', 'kids']",[],"Discover our collections on the official Lacoste online store: Clothes, shoes, bags and accessories for men, women and kids.",https://www.lacoste.com/us/lacoste/kids/kids---2-8-years/boy-s-clothing/
72,The Comfy : Boys' Clothes - Target,boys clothing,"['Boys', 'Clothing']",[],"Shop Target for Boys' Clothing you will love at great low prices. Choose from Same Day Delivery, Drive Up or Order Pickup. Free standard shipping with $35 ...",https://www.target.com/c/boys-clothing-kids/the-comfy/-/N-5xty4Zb4cyb
73,Clothing Fashion for Boys - Shop Online - RVCA,boys clothing,['Boys Clothing'],[],Browse our latest products from the Boys Clothing Collection. Find Inspiration & Shop online with RVCA's Official Website. Free Shipping & Free Returns.,https://www.rvca.com/boys-clothing/
74,Boys' 7-16 Years Clothes - George at ASDA,boys clothing,"['boys', 'clothing']",[],"Shop boys' clothing for 7-16 years at George at ASDA, from essential jeans & tops to the latest looks. Fantastic quality & style.","https://direct.asda.com/george/kids/boys-7-16-years/D25M1G1C24,default,sc.html"
75,Boys Clothing & Fashion | Tu clothing - Sainsbury's,boys clothing,['boys clothes'],[],Buy the latest boys clothes at Tu clothing online. Sainsbury's Tu clothing can be found in selected Sainsbury's stores across the UK.,https://tuclothing.sainsburys.co.uk/c/kids/Boys
76,Amazon.com: Baby Boy's Clothing,boys clothing,"['Clothing', 'Clothing']",[],"Online shopping for Clothing, Shoes & Jewelry from a great selection of Bodysuits, Tops, Footies & Rompers, Clothing Sets, Hoodies & Active, Jackets & Coats ...",https://www.amazon.com/Baby-Boys-Clothing-9-12-mo-Shoes/s?keywords=Baby+Boy%27s+Clothing&rh=n%3A1044510%2Cp_n_size_two_browse-vebin%3A1289785011&c=ts&ts_id=1044510
77,Amazon.com: Baby Boy's Clothing,boys clothing,"['Clothing', 'Clothing']",[],"Online shopping for Clothing, Shoes & Jewelry from a great selection of Bodysuits, Tops, Footies & Rompers, Clothing Sets, Hoodies & Active, Jackets & Coats ...",https://www.amazon.com/Baby-Boys-Clothing-12-18-mo-Shoes/s?keywords=Baby+Boy%27s+Clothing&rh=n%3A1044510%2Cp_n_size_two_browse-vebin%3A1289786011&c=ts&ts_id=1044510
78,Clearance Boys' Clothing - Macy's,boys clothing,"['Boys', 'Clothing']",[],"Shop our collection of Clearance Boys' Clothing at Macys.com! Find the latest trends, styles and deals with free delivery available!",https://www.macys.com/shop/kids-clothes/boys-clothing/Special_offers/Clearance%2FCloseout?id=61999
79,Boys Clothing - Children's Jackets - Columbia Sportswear,boys clothing,"['clothes', 'kids', 'apparel', 'boys']",[],"Up to 40% off select gear. Need clothes for your kids? Buy jackets, apparel and footwear for boys from Columbia Sportswear.",https://www.columbia.com/c/boys-outdoor-clothing/
80,Boys Clothing & Accessories | Tommy Hilfiger USA,boys clothing,"['boys', 'kids', 'clothing', 'boys']",[],"Shop Tommy Hilfiger for boys & kids' everyday clothing essentials. Browse our latest collection of boys' coats, jackets, backpacks, boxer briefs & more.",https://usa.tommy.com/en/tommy-hilfiger-children-kids-boys
81,"Gymboree: Kids, Toddler & Baby Clothes",boys clothing,"['kids clothes', 'kids clothes', 'kids clothing']",[],"Find timeless hand-me-down quality kids clothes at Gymboree. Shop kids clothes up to size 12 and discover the magic of coordinating, bow-to-toe kids clothing.",https://www.gymboree.com/us/home
82,Find your perfect Boys clothing here | C&A online shop,boys clothing,['Boys clothing'],[],Discover our new Boys clothing in various colors and sizes ➽ fast delivery✓ Wide selection✓ Sustainable products✓ Top quality✓ ➽ to the C&A online ...,https://www.c-and-a.com/eu/en/shop/kids-boys-clothing
83,Lulu Kids Clothing,boys clothing,['Kids Clothing'],[],Lulu Kids Clothing - we have a huge selections of children's wear - we offer free shipping on orders over $150 USD and free in store pickup in 5 of our ...,https://lulukidsclothing.com/
84,Billionaire Boys Club,boys clothing,"['Boys', 'clothing']",[],Official store of the Billionaire Boys Club and Icecream clothing lines by Pharrell Williams.,https://www.bbcicecream.com/
85,Boy (2-14yrs) - Hanna Andersson,boys clothing,"['boys clothes', 'boys clothing']",[],"Keep him in style, for less! Find durable boys clothes on sale from Hanna Andersson. Shop our boys clothing sale for the quality you love while ...",https://www.hannaandersson.com/sale-category-boys/
1,"Kids clothes - comfy fashion, great prices - C&A",boys clothing,['Kids'],[],Discover our new Kids collections in various colors and sizes ➽ Wide selection ✓ Many payment options ✓ Top quality ✓ ➽ to the C&A online shop.,https://www.c-and-a.com/eu/en/shop/kids
2,Kids' Clothing Aged 1-6 | Boys and Girls Clothes - Postie,boys clothing,"['Kids', 'Clothing']",[],Shop Kids' Clothing Aged 1-6 | Boys and Girls Clothes | Postie.,https://www.postie.co.nz/kids/kids-1-7
3,Billionaire Boys Club,boys clothing,"['Boys', 'clothing']",[],Official store of the Billionaire Boys Club and Icecream clothing lines by Pharrell Williams.,https://www.bbcicecream.com/
