position,title,query,snippet_highlighted_words,rich_snippet_list,snippet,link55,Buy Boys Clothing Sets online in India - Myntra,boys clothing set,"['Boys Clothing Sets', 'Boys Clothing Sets']",[],Online shopping for Boys Clothing Sets ✯ Shop Online Boys Clothing Sets ✯ Free Shipping ✯ Cash on Delivery ✯ Easy returns and exchanges.,https://www.myntra.com/amp/boys-clothing-sets-menu?sort=new
56,Boys - Max Fashion,boys clothing set,"['Dresses', 'Dresses', 'Dresses', 'Sets']",[],Fashion Bottoms- Curves (Plus Size) · Dresses & Jumpsuits · Dresses · Jumpsuits & Dungarees · Curves (Plus Size) · Sleepwear · Dresses & Gowns · Sets.,https://www.maxfashion.in/in/en/department/maxboys
57,Boys Clothing Sets Pack Of 1 - Meesho,boys clothing set,['Boys Clothing Sets'],[],Name: Boys Clothing Sets Pack Of 1 Top Fabric: Art Silk Bottom Fabric: Cotton Sleeve Length: Short Sleeves Top Pattern: Solid Bottom ...,https://www.meesho.com/boys-clothing-sets-pack-of-1/p/h2e4g
58,Boys Clothing Sets Pack Of 3 - Meesho,boys clothing set,['Boys Clothing Sets'],[],Name: Boys Clothing Sets Pack Of 3 Top Fabric: Cotton Blend Bottom Fabric: Cotton Blend Sleeve Length: Long Sleeves Top Pattern: Solid Bottom Pattern: Solid ...,https://www.meesho.com/boys-clothing-sets-pack-of-3/p/p2i6v
59,Full Sleeve Pink Shirt & Black Pant | Kids Clothing Set - Meesho,boys clothing set,"['Set', 'Boys Clothing']",[],Name: Full Sleeve Pink Shirt & Black Pant | Kids Clothing Set | Boys Clothing | Kids Fashion Top Fabric: Cotton Bottom Fabric: Cotton Sleeve ...,https://www.meesho.com/full-sleeve-pink-shirt-black-pant-kids-clothing-set-boys-clothing-kids-fashion/p/1sgfu7
60,Boys Clothes & Fashion Online - Matalan,boys clothing set,"['boys', 'clothing']",[],Our boys' clothing collection is full of ideas to help you kit him out with everything he needs this season - Free click & collect.,https://www.matalan.co.uk/kids-clothing/boys
61,Buy Kids Clothing Boys Dresses online in India - Myntra,boys clothing set,"['Boys Dresses', 'Boys Dresses', 'Set']",[],Shop for Kids Clothing Boys Dresses in India ✯ Buy latest range of Kids Clothing Boys Dresses at Myntra ... Boys Captain America Printed Clothing Set.,https://www.myntra.com/kids-clothing-boys-dresses
62,Buy Boys Apparel Set Bra online in India - Myntra,boys clothing set,"['Boys Apparel Set', 'Boys Apparel Set', 'Boys Apparel Set']",[],Boys Apparel Set Bra Online. Shop for Boys Apparel Set Bra in India ✯ Buy latest range of Boys Apparel Set Bra at Myntra ✯ Free Shipping ✯ COD ✯ Easy ...,https://www.myntra.com/boys-apparel-set-bra
63,Buy Boys Combo Sets Online at Best Prices in India - Flipkart,boys clothing set,"['sets', 'boys clothing']",[],Flipkart offers a wide range of combo sets for boys clothing to suit your specific preferences. They are available in a wide range of colours with images to ...,https://www.flipkart.com/kids-clothing/boys-wear/combo-sets/pr?sid=2oq%2Cmpf%2Cu6l%2Cfc1&page=33
64,Buy 5 Year Boys Dress online at Best Prices in India - Flipkart,boys clothing set,"['Boys', 'Boys', 'Set']",[],FTC Bazar Army Kids Costume Wear ; NAMMA OORU TREND. Boys Casual T-shirt Pant. Red ; R KAY FASHIONS. Boys Festive & Party Kurta and Pyjama Set. Orange Pack of 1.,https://www.flipkart.com/q/5-year-boys-dress
65,"Baby Boys Clothing Sets, Packaging Type: Box - IndiaMART",boys clothing set,['Boys Clothing Sets'],[],"Mamma Mia - Offering Baby Boys Clothing Sets, Packaging Type: Box at Rs 275/set in Jaipur, Rajasthan. Get Baby & Infant Clothes at lowest price | ID: ...",https://www.indiamart.com/proddetail/baby-boys-clothing-sets-20809002197.html
66,Boys Clothing Sets Pack Of 1 - Meesho,boys clothing set,['Boys Clothing Sets'],[],Name: Boys Clothing Sets Pack Of 1 Top Fabric: Cotton Bottom Fabric: Cotton Sleeve Length: Long Sleeves Top Pattern: Solid Bottom Pattern: Printed Net ...,https://www.meesho.com/flawsome-fancy-boys-top-bottom-sets/p/18mvl5
67,Boys Clothing Sets Pack Of 1 - Meesho,boys clothing set,['Boys Clothing Sets'],[],"Name: Boys Clothing Sets Pack Of 1 Top Fabric: Jute Cotton Bottom Fabric: Jute ... This party wear suit set comes with Shirt, Waist Coat, ...",https://www.meesho.com/boys-clothing-sets-pack-of-1/p/1uwol0
68,Boys Clothing Sets Pack Of 5 - Meesho,boys clothing set,['Boys Clothing Sets'],[],Name: Boys Clothing Sets Pack Of 5 Top Fabric: Cotton Bottom Fabric: Cotton Sleeve Length: Short Sleeves Top Pattern: Printed Bottom ...,https://www.meesho.com/boys-clothing-sets-pack-of-5/p/icqp9
69,Boys Clothing Sets Pack Of 1 - Meesho,boys clothing set,['Boys Clothing Sets'],[],Name: Boys Clothing Sets Pack Of 1 Top Fabric: Cotton Bottom Fabric: Cotton Bottom Pattern: Solid Net Quantity (N): Single Add-Ons: No Add Ons Sizes: 2-3 ...,https://www.meesho.com/boys-clothing-sets-pack-of-1/p/18i8t6
70,Buy Boys Dresses online - AJIO,boys clothing set,"['boys', 'Set']",[],"Buy latest collection of boys tshirts, shirts, jeans at a best price. Free Shipping, Cash On Delivery, ... Checked 3-Piece Suit Set with Bow Tie.",https://www.ajio.com/s/boys
71,Boys' Outfits | Kohl's,boys clothing set,"['Boys', 'Clothing Sets']",[],Boys' Clothing Sets · Boys 8-20 Nike Tracksuit · Baby Boy Nike Logo Striped Bodysuit & Pants Set · Top Rated · Boys 10-16 OppoSuits Black Knight Solid Suit · Boys 4- ...,https://www.kohls.com/catalog/boys-kids-clothing-sets-clothing.jsp?CN=Gender:Boys+AgeAppropriate:Kids+Category:Clothing%20Sets+Department:Clothing
72,Boys' Outfits & Clothing Sets 2T-7 | Dillard's,boys clothing set,"['Boys', 'Clothing Sets']",[],"Shop our collection of Boys' Outfits & Clothing Sets 2T-7 from your favorite brands including Nike, Under Armour, and more available at Dillard's.",https://www.dillards.com/c/kids-boys-outfits-sets
73,Boys Clothing Sets Pack Of 1 - Meesho,boys clothing set,['Boys Clothing Sets'],[],"Name: Boys Clothing Sets Pack Of 1 Top Fabric: Cotton Bottom Fabric: Cotton Blend ... be wear in any Occasion i.e Wedding Outfit , Party Wear, Casual Wear etc.",https://www.meesho.com/boys-clothing-sets-pack-of-1/p/17y48p
74,Boys Clothing Sets Pack Of 1 - Meesho,boys clothing set,['Boys Clothing Sets'],[],Name: Boys Clothing Sets Pack Of 1 Top Fabric: Jute Cotton Bottom Fabric: Jute Cotton Sleeve Length: Long Sleeves Top Pattern: Solid Bottom Pattern: Solid ...,https://www.meesho.com/boys-clothing-sets-pack-of-1/p/1cl66x
75,Boys Clothing Sets Pack Of 1 - Meesho,boys clothing set,['Boys Clothing Sets'],[],Name: Boys Clothing Sets Pack Of 1 Top Fabric: Cotton Bottom Fabric: Cotton Sleeve Length: Long Sleeves Top Pattern: Printed Bottom Pattern: Printed Net ...,https://www.meesho.com/boys-clothing-sets-pack-of-1/p/1v0z7u
76,Boys Clothing Sets Pack Of 1 - Meesho,boys clothing set,['Boys Clothing Sets'],[],"Name: Boys Clothing Sets Pack Of 1 Top Fabric: Cotton Bottom Fabric: Denim Sleeve ... Krazzy X Boy's Fancy Designer Blazer, T-Shirt and Jeans Set Party Wear.",https://www.meesho.com/pretty-classy-boys-top-bottom-sets/p/p7yd3
77,"Baby Boy Dress, Baby Boy Cloth, Boys ke Kapde ... - Meesho",boys clothing set,['Boys Clothing Sets'],[],"Name: Baby Boy Dress, Baby Boy Cloth, Boys ke Kapde, Boys Clothing Sets Top Fabric: Cotton Bottom Fabric: Cotton Sleeve Length: Long Sleeves Top Pattern: ...",https://www.meesho.com/baby-boy-dress-baby-boy-cloth-boys-ke-kapde-boys-clothing-sets/p/23851a
78,Boys Clothing Sets Pack Of 1 - Meesho,boys clothing set,['Boys Clothing Sets'],[],Name: Boys Clothing Sets Pack Of 1 Top Fabric: Hosiery Cotton Bottom Fabric: Hosiery Cotton Sleeve Length: Short Sleeves Top Pattern: ...,https://www.meesho.com/flawsome-funky-boys-clothing-set/p/1wb4mo
79,9 Year Boys Dress - Flipkart,boys clothing set,"['Boys Dress', 'Set']",[],"Check 9 Year Boys Dress Prices, Ratings & Reviews at Flipkart.com. ✓ Free Shipping ✓ Cash on ... Boys Festive & Party Shirt, Waistcoat and Pant Set.",https://www.flipkart.com/q/9-year-boys-dress
80,Buy 3 Year Boys Dress online at Best Prices in India - Flipkart,boys clothing set,"['Boys Dress', 'Set']",[],"Check 3 Year Boys Dress Prices, Ratings & Reviews at Flipkart.com. ... PECULIARITY. Boys Festive & Party Blazer, Shirt and Trouser Set. Pink Pack of 1.",https://www.flipkart.com/q/3-year-boys-dress
81,Buy 4 Years Boy Dress online at Best Prices in India - Flipkart,boys clothing set,"['Boys Dresses', 'Set']",[],"4 Years Boys Dresses - Buy Boys Party Wear Online at lowest prices on Flipkart. ... Boys Festive & Party Kurta, Churidar & Dupatta Set. White Pack of 1.",https://www.flipkart.com/q/4-years-boy-dress
82,Buy Stylish Party Wear Dresses for Boys & kids Online - Myntra,boys clothing set,['Boys Clothing Set'],[],"Shop for party wears dresses for boys at Myntra. Choose from an exclusive designer collection of shirts and trousers, white shirts ... Boys Clothing Set.",https://www.myntra.com/boys-party-clothing
83,Buy Baby Boy Clothes Online - Westside,boys clothing set,"['boys clothes', 'Set']",[],We at Westside offers a wide range of boys clothes online at best price. Shop now! ... HOP Baby Navy Printed Socks Set of Three. ₹ 299.00₹ 199.00.,https://www.westside.com/collections/baby-boy
84,8 Year Boys Dress - Flipkart,boys clothing set,"['Dress', 'Boys', 'Set']",[],Smuktar garments Kids Army Dress Kids Costume Wear · ₹545. ₹999. 45% off. Free delivery. FTC FASHIONS. Boys Festive & Party Kurta and Pyjama Set.,https://www.flipkart.com/q/8-year-boys-dress
85,13 Year Boys Dress - Flipkart,boys clothing set,"['Boys Dress', 'Set']",[],"Check 13 Year Boys Dress Prices, Ratings & Reviews at Flipkart.com. ✓ Free Shipping ✓ Cash on ... Indi Boys Festive & Party Shirt, Waistcoat and Pant Set.",https://www.flipkart.com/q/13-year-boys-dress
86,"Baby Boy Dress, Baby Boy Cloth, Boys ke Kapde ... - Meesho",boys clothing set,['Boys Clothing Sets'],[],"Name: Baby Boy Dress, Baby Boy Cloth, Boys ke Kapde, Boys Clothing Sets Top Fabric: Cotton Bottom Fabric: Cotton Sleeve Length: Long Sleeves Top Pattern: ...",https://www.meesho.com/baby-boy-dress-baby-boy-cloth-boys-ke-kapde-boys-clothing-sets/p/23851b
87,Boys Clothing Sets Pack Of 1 - Meesho,boys clothing set,['Boys Clothing Sets'],[],Name: Boys Clothing Sets Pack Of 1 Top Fabric: Denim Bottom Fabric: Denim Sleeve Length: Long Sleeves Top Pattern: Printed Bottom Pattern: ...,https://www.meesho.com/boys-clothing-sets-pack-of-1/p/14i5yo
88,"Boys Clothing Set, 3 Piece suit Boys Suits - Meesho",boys clothing set,['Boys Clothing Set'],[],"Name: Boys Clothing Set, 3 Piece suit Boys Suits Pattern: Solid Closure Type: Button Net Quantity (N): 1 Your boy will stand boldly in grace and attractive ...",https://www.meesho.com/boys-clothing-set-3-piece-suit-boys-suits/p/2fnwr8
89,Boys Clothing Sets Pack Of 1 - Meesho,boys clothing set,['Boys Clothing Sets'],[],Name: Boys Clothing Sets Pack Of 1 Top Fabric: Cotton Blend Bottom Fabric: Cotton Blend Sleeve Length: Long Sleeves Top Pattern: Solid Bottom Pattern: Self ...,https://www.meesho.com/boys-clothing-sets-pack-of-1/p/1asitx
90,Zolario Boys Clothing Set 3 Piece Dress for Boys ... - Meesho,boys clothing set,['Boys Clothing Set'],[],"Name: Zolario Boys Clothing Set 3 Piece Dress for Boys, Set of Coat, Pant & Shirt, Ideal for Wedding and Birthday. Fabric: Cotton Blend Type: Three Piece ...",https://www.meesho.com/zolario-boys-clothing-set-3-piece-dress-for-boys-set-of-coat-pant-shirt-ideal-for-wedding-and-birthday/p/1nde0c
91,Buy Boys Clothes & Dresses Online in India at FirstCry.com,boys clothing set,"['clothes', 'boys']",[],Shop for the trendy collection of baby & kids clothes for boys online in India at best prices on FirstCry.com with ✓Free Shipping ✓COD options.,https://www.firstcry.com/boys-clothes
1,Baby Boys' Outfits & Sets | H&M US,boys clothing set,"['clothing', 'boys', 'sets']",[],"Mix and match their everyday clothing with our baby boys' outfits and sets. Discover tops, pants, sweaters and more online at H&M.",https://www2.hm.com/en_us/baby/boys/clothing/sets-outfits.html
2,Baby Boys Clothes Size 0-24 Months - JCPenney,boys clothing set,"['boy clothing', 'sets']",[],"Shop now to get JCPenney's selection of baby boy clothing such as clothing sets, pants, shirts, and onesies for baby boys 0-24 months.",https://www.jcpenney.com/g/baby/baby-boy-clothes-0-24-months?id=cat100260040
3,Big Boys' Clothes Size 8-22 | JCPenney,boys clothing set,"['clothes', 'boys', 'clothing sets']",[],"From shirts to socks, JCPenney has the best deals on clothes for boys size 8-22. Shop our selection of pants, shorts, & clothing sets.",https://www.jcpenney.com/g/baby-kids/all-boys-clothing/big-boys-8-22-clothing?id=cat11100001199
4,Little Boys Clothes Size 4-7 | JCPenney,boys clothing set,"['clothes', 'boys', 'clothing set']",[],"JCPenney has the best selection and deals on clothes for boys size 4-7. Shop now to get pants, clothing set, tops, coats & jackets. Free shipping available!",https://www.jcpenney.com/g/baby-kids/all-boys-clothing/little-boys-4-7-clothing?id=cat11100001198
5,Size 8 Outfits & Sets for Boys for sale - eBay,boys clothing set,"['Sets', 'Boys', 'Boys', 'Outfit Set', 'Boys']",[],Get the best deals on Size 8 Outfits & Sets for Boys when you shop the ... LOONEY TUNES Boys Hoodie and Jogger Pants 2-Piece Outfit Set- Boys Sizes 4-16.,https://www.ebay.com/b/Size-8-Outfits-Sets-for-Boys/156790/bn_109662488
6,Boys Clothes - Cookie's Kids,boys clothing set,"['boys clothing', 'sets']",[],"We offer boys clothing, shoes, and accessories for any time of year. Check out swim trunks, shorts sets, T-shirts, and sandals for summer from Nautica, U.S. ...",https://www.cookieskids.com/boys_fashion.aspx
7,Off Campus Boys Clothing in Kids Clothing(8) - Walmart.com,boys clothing set,"['Boy', 'Outfit Set', 'Set']",[],"Off Campus Toddler Boy Sweatshirt, T-Shirt, & Joggers Outfit Set, 3-Piece Set, Sizes 2T-4T. Save with. Walmart Plus. 2-day shipping.",https://www.walmart.com/browse/clothing/boys-clothing/off-campus/5438_7712430_7809949/YnJhbmQ6T2ZmIENhbXB1cwieie
8,Boys' Clothes & Outfits - Splendid,boys clothing set,"[""boy's clothes"", 'Set']",[],... shop Splendid's boy's clothes. Shop clothes that keep him comfy and stylish today. ... Toddler Boys No More Blues Long Sleeve Set.,https://splendid.com/collections/kids-boys
9,Splendid - Clothing / Boys - Amazon.com,boys clothing set,"['Clothing', 'Clothing Sets']",[],"Online shopping for Clothing, Shoes & Jewelry from a great selection of Tops, Tees & Shirts, Fashion Hoodies & Sweatshirts, Active, Swim, Clothing Sets, ...",https://www.amazon.com/Clothing-Splendid-Boys/s?rh=n%3A1040666%2Cp_4%3ASplendid
10,Baby Boy Clothes: Find Adorable Infant & Coming Home Outfits,boys clothing set,['boy clothing sets'],[],"Our baby boy clothing sets are for all age groups, so regardless of what age your baby boy is, you'll find an outfit that fits him perfectly. The best part ...",https://www.kohls.com/catalog/boys-baby-clothing.jsp?CN=Gender:Boys+AgeAppropriate:Baby+Department:Clothing
11,Hurley - Clothing / Boys - Amazon.com,boys clothing set,"['Clothing', 'Clothing Sets']",[],"Online shopping for Clothing, Shoes & Jewelry from a great selection of Tops, Tees & Shirts, Fashion Hoodies & Sweatshirts, Active, Swim, Clothing Sets, ...",https://www.amazon.com/Clothing-Hurley-Boys/s?rh=n%3A1040666%2Cp_89%3AHurley
12,Boys Wedding Outfit - Amazon.com,boys clothing set,"['Clothing Set', 'Boys', 'Set']",[],"Clothing Set · Pants · Shirt. RESULTS. Price and other details may vary based on product size and color. Van Heusen Boys' 4-Piece Formal Suit Set, Vest, ...",https://www.amazon.com/boys-wedding-outfit/s?k=boys+wedding+outfit
13,The most popular items ordered as gifts in Boys' Clothing Sets,boys clothing set,"['Boys', 'Clothing Sets']",[],Amazon.com Gift Ideas: The most popular items ordered as gifts in Boys' Clothing Sets.,https://www.amazon.com/gp/most-gifted/fashion/1288606011
14,Boys Size 8 Clothes - Amazon.com,boys clothing set,['Clothing Set'],[],Clothing Set · Shorts · Pajamas · Coat · Socks. RESULTS. Price and other details may vary based on product size and color.,https://www.amazon.com/Boys-Size-8-Clothes/s?k=Boys+Size+8+Clothes
15,Amazon.com: Baby Boy's Clothing,boys clothing set,"['Clothing', 'Clothing Sets']",[],"Online shopping for Clothing, Shoes & Jewelry from a great selection of Bodysuits, Tops, Footies & Rompers, Clothing Sets, Hoodies & Active, Jackets & Coats ...",https://www.amazon.com/Baby-Boys-Clothing-12-18-mo-Shoes/s?keywords=Baby+Boy%27s+Clothing&rh=n%3A1044510%2Cp_n_size_two_browse-vebin%3A1289786011&page=3&c=ts&ts_id=1044510
16,Boys Indian Clothes - Amazon.com,boys clothing set,"['Clothing', 'Sets', 'Boys']",[],Price and other details may vary based on product size and color. Pro-Ethic Style Developer Kid's Indian Clothing Traditional Wear Silk Kurta Sets for Boys ...,https://www.amazon.com/boys-indian-clothes/s?k=boys+indian+clothes
17,Boys 24 Month Clothing - Target,boys clothing set,"['boys', 'clothing', 'Set']",[],Shop Target for boys 24 month clothing you will love at great low prices. ... Star Wars The Child Baby Fleece Pullover Sweatshirt and Pants Set Infant.,https://www.target.com/s/boys+24+month+clothing
18,"Baby Boys Clothes Set, Dress Shirt with Bowtie + Suspender ...",boys clothing set,['Boys Clothes Set'],[],"Arrives by Wed, Jan 25 Buy Baby Boys Clothes Set, Dress Shirt with Bowtie + Suspender Pants, 12Months - 7 Years at Walmart.com.",https://www.walmart.com/ip/Baby-Boys-Clothes-Set-Dress-Shirt-with-Bowtie-Suspender-Pants-12Months-7-Years/842100909
19,Smocked Baby Boys Clothing - Boutique Outfits - Marco & Lizzy,boys clothing set,"['boy clothes', 'Set']",[],Buy baby boy clothes at reasonable prices. ... Exclusive boy's boutique clothing with the best outfits. ... Baby Boy's Blue and White Argyle Short Set.,https://www.littlethreadsinc.com/collections/baby-boys
20,Boys Clothing - Worthy Threads,boys clothing set,['set'],[],Check out our new Shop by Fabric section for sibling coordinating outfits! Kids hand dyed hoodie in blue: matching loungewear set. Kids Hand Dyed ...,https://worthy-threads.com/collections/boys
21,Baby & Toddler Boys Clothing - Grandmas Gift Shop,boys clothing set,['Boys Clothes Sets'],[],0-5Y Denim Long Sleeve Single Breasted Patchwork Hooded Jackets. $29.99 $14.99. Sale! 1 2 3 Years Kids Boys Clothes Sets T-Shrit+Shorts. $29.99 $12.99.,https://grandmasgiftshop.com/collections/clothing/baby-toddler-boys-clothing/
22,Boy's Clothing Latest Styles | 6pm,boys clothing set,"[""Boy's Clothing"", 'Set']",[],Boy's Clothing. 3653 items found. Sort By ... Brand Name: Nike Kids; Product Name: Sportswear Graphic T-Shirt and Cargo Shorts Two-Piece Set (Toddler) ...,https://www.6pm.com/boys-clothing/CKvXAcABBOICAgEY.zso
23,6-9 Months : Baby Boy Clothing - Target,boys clothing set,"['Boy Clothing', 'Set']",[],Shop Target for Baby Boy Clothing you will love at great low prices. ... Baby Boys' Valentine's Day Denim Heart Suspender Set - Cat & Jack™ Cream.,https://www.target.com/c/baby-boy-clothing-kids/6-9-months/-/N-4y6l9Zb884m
24,Baby Boys' Clothing Sets - Polka Dots / Baby ... - Amazon.com,boys clothing set,"['Clothing', 'Sets', 'Sets']",[],"Online shopping for Clothing, Shoes & Jewelry from a great selection of Pant Sets, Short Sets & more at everyday low prices.",https://www.amazon.com/Baby-Boys-Clothing-Sets-Polka-Dots/s?keywords=Baby+Boys%27+Clothing+Sets&rh=n%3A13698211%2Cp_n_feature_twelve_browse-bin%3A23575361011&c=ts&ts_id=13698211
25,Spider-Man - Boys' Clothing Sets - Amazon.com,boys clothing set,"['Boys', 'Sets', 'Set', 'Boys', 'Boys', 'Sets']",[],"Spider-Man Boys 3 Piece Fleece Pants Sets, Spiderman T-Shirts and Pants 3-Pack Bundle Set for Boys · Avengers and Spider-Man Boys 2-Piece Fleece Sets, Fleece ...",https://www.amazon.com/Boys-Clothing-Sets-Spider-Man/s?keywords=Boys%27+Clothing+Sets&rh=n%3A1288606011%2Cp_lbr_characters_browse-bin%3ASpider-Man&c=ts&ts_id=1288606011
26,5-6 Size Outfits & Sets for Boys for sale - eBay,boys clothing set,"['Sets', 'Boys', 'Clothing', 'Sets']",[],5-6 Size Outfits & Sets for Boys. Side Refine Panel. Shop by Category. Boys' Clothing (Sizes 4 & Up); Outfits & Sets; Activewear · Jeans · Outerwear · Pants ...,https://www.ebay.com/b/5-6-Size-Outfits-Sets-for-Boys/156790/bn_109662802
27,Boys' (4-7) Sets & Outfits (87) - Belk,boys clothing set,"['Sets', 'boys', 'clothes']",[],"Browse Boys' (4-7) Sets & Outfits at Belk.com & receive FREE SHIPPING on qualifying purchases. Shop cute & super affordable boys' clothes, in all sizes.",https://www.belk.com/kids/shop-by-size/boys-4-7/sets-outfits/
28,boys clothing & accessories | abercrombie kids,boys clothing set,"['boys clothing', 'set', 'set']",[],"Shop boys clothing & accessories at abercrombie kids. You'll find jeans, hoodies, sweatpants, ... shorts pajama set, Black. 2 Colors. shorts pajama set.",https://www.abercrombie.com/shop/us/kids/boys
29,Minecraft Boys Clothes 3pc Top and Short Set Green - Walmart,boys clothing set,"['Boys Clothes', 'Set']",[],"Arrives by Fri, Jan 13 Buy Minecraft Boys Clothes 3pc Top and Short Set Green at Walmart.com.",https://www.walmart.com/ip/Minecraft-Boys-Clothes-3pc-Top-and-Short-Set-Green/171712945
30,boys clothing sets | Nordstrom,boys clothing set,['boys clothing sets'],[],You searched for “boys clothing sets” · Holiday Shine Sweatshirt & Sweatpants Set (Baby) · Henley Waffle Knit Cotton Henley & Pants Set (Baby) · Knight Two-Piece ...,https://www.nordstrom.com/sr/boys-clothing-sets
31,Toddler Boys Back to School Outfit Sets(1000+) - Walmart.com,boys clothing set,"['Boys', 'Outfit Sets', 'Boys', 'Clothing', 'Boy']",[],Shop for Toddler Boys Back to School Outfit Sets in Toddler Boys (12M-5T) Back to School Clothing. Buy products such as Athletic Works Baby and Toddler Boy ...,https://www.walmart.com/browse/clothing/toddler-boys-back-to-school-outfit-sets/5438_1432442_5391585_2219792_6178217_4065035
32,4T Boys' Clothings - Walmart,boys clothing set,"['Boys Clothes', 'Set']",[],"3T Baby Boys Clothes Baby Boys 2PCS Outfits 3-4T Boys Letter Print Long Sleeve ... Wonder Nation Baby and Toddler Unisex Athleisure Outfit Set, 2-Piece, ...",https://www.walmart.com/c/kp/4t-boys-clothings
33,Boys Clothing Deals - Walmart.com,boys clothing set,"['Boys Clothing', 'Set']",[],"Shop for great Boys Clothing Deals at Walmart.com. Save Money. Live Better. ... Hind Boys Active Shirts, Shorts and Jogger Pants 8-Piece Outfit Set, Sizes.",https://www.walmart.com/shop/deals/clothing-and-accessories/kids-and-baby/boys-clothing
34,Baby Boys Clothing | Handmade Organic Cotton Layette,boys clothing set,['sets'],[],"Our comfortable layette sets, sleepwear, onesies and outfits all match and are giftwrapped by hand with care. Filter Sort.",https://www.galantebaby.com/collections/boys-clothing
35,Newborn Baby Boy Clothes (0-24 Months) - Bloomingdale's,boys clothing set,"['boys', 'clothes', 'sets']",[],"Sweaters and jackets are essential layering pieces for your infant boys' clothes collection, and two-piece sets by Ralph Lauren and 7 For All ...",https://www.bloomingdales.com/shop/kids/newborn-baby-boy-clothes?id=23713
36,Boys Clothing | Trendy Clothes for Boys from Sears,boys clothing set,"['clothes', 'boys', 'boys', 'Dress', 'Boys', 'Set']",[],"Sears offers a huge collection of clothes for boys. You get to choose from boys' shirts, activewear, ... Johnnie Lene Dress Up Boys Designer Suit Set.",https://www.sears.com/clothing-boys-clothing/b-5000919
37,Boys Clothing - Luxury Designer Boutique | EGG New York,boys clothing set,"['clothing', 'boys', 'Set']",[],EGG New York offers premium clothing and accessories for boys ages newborn to 12 years. Explore top-sellers like ... Neon Dinosaur Tegan Set. $33.00 $65.00.,https://www.eggnewyork.com/collections/boys
38,Cute Little Boy Outfits | Sibling Outfits - Sydney So Sweet,boys clothing set,"['Boy', 'Boys', 'Clothing', 'Clothes', 'Boys', 'Boy', ""Boy's"", 'Sets', 'Sets']",[],"Boy Outfits, Boys' Boutique Clothing, Cute Clothes for Boys · Buy Baby & Boy Outfits, Boy's Pajamas & Jogger Sets, & Coordinating Sibling Sets · Subscribe.",https://sydneysosweet.com/collections/boys-clothing
39,Best Boys' Pant Sets - Amazon.com,boys clothing set,"['Boy Clothes', 'Sets']",[],"Find the top 100 most popular items in Amazon Clothing, Shoes & Jewelry Best ... Nwada Baby Boy Clothes Toddler Suit Dress Shirt and Pants Sets 4 Pcs Dressy ...",https://www.amazon.com/Best-Sellers-Boys'-Pant-Sets/zgbs/fashion/6323791011
40,Boys Clothing at wholesale prices - Faire,boys clothing set,"['Boys Clothing', 'set', 'Boys Clothing']",[],Shop wholesale Boys Clothing and all the latest products for your store. ... Navy duck print pocket boy set and other Boys Clothing at wholesale prices ...,https://www.faire.com/discover/boys-clothing
41,Baby Boys' Clothing (0-24M) - Carhartt,boys clothing set,"['boys', 'clothing', 'Set']",[],Shop Carhartt for a wide selection of baby boys' clothing for infants 0-24 ... Indigo Ticking Boys' Short-Sleeve Bodysuit & Ticking Stripe Shortall Set ...,https://www.carhartt.com/c/baby-boy
42,Buy Trendy Boys Clothes Online - Hopscotch,boys clothing set,"['Boys Apparel', 'Set']",[],"Showing 5,047 results for All Boys Apparel · Boys Navy Polka Dot Print Shirt And Pant Set With Bow · Boys Green All-Over Print T-Shirt With Jacket & Pant ...",https://www.hopscotch.in/boys
43,Baby Boy Outfits & Clothing Sets | Dillard's,boys clothing set,"['Boy', 'Clothing Sets']",[],"Shop our collection of Baby Boy Outfits & Clothing Sets from your favorite brands including Edgehill Collection, Starting Out, Ralph Lauren, ...",https://www.dillards.com/c/kids-baby-boys-outfits-sets?pageNumber=2
