position,title,query,snippet_highlighted_words,rich_snippet_list,snippet,link4,Boys' (2-10) Clothing & Accessories - Country Road,boys clothing,"['Boys', 'Clothing', 'clothes', 'boys']",[],"Boys' (2-10) Clothing & Accessories. Our new collection of clothes, accessories and shoes for little boys includes coats, jackets, pants, jeans, ...",https://www.countryroad.com.au/child-boys/
5,Boys' Sale | Boys' Clothing On Sale - Joules,boys clothing,"['boys', 'clothing']",[],Kit him out for the months and years ahead with the Joules boys' clothing sale. Save on a range of clothing and footwear and buy online today.,https://www.joules.com/Sale-Clothing/Boys-Sale
6,Kids Clothing - Dunnes Stores,boys clothing,"['kids', 'clothes']",[],"Shop Dunnes Stores wide selection of kids and baby clothes, school uniforms, shoes and fun accessories for children.",https://www.dunnesstores.com/c/kids
7,All Boys' Clothing | Scotch & Soda AU,boys clothing,"['Boys', 'Clothing']",[],Account · Find a store · Back · Home; All Boys' Clothing ... Kids Collection - New Arrivals. Tie-dye sweat shorts. $129.95.,https://scotch-soda.com.au/collections/all-boys-clothing
8,Shop Boys Clothing Online Now - Kids - DC Shoes,boys clothing,['Kids Clothes'],[],Discover our Kids Clothes Collection. Shop Online at DC Official Store. Free Shipping & Free Returns for Members.,https://www.dcshoes.com/kids-clothing/
9,vineyard vines | Casual & Classic Men's & Women's Clothing,boys clothing,['kids clothes'],[],"Shop Vineyard Vines! Classic men's clothing, women's clothing, signature men's silk ties, kids clothes. Designer sport shirts, women and men's polos and ...",https://www.vineyardvines.com/
10,Kids Clothes - our Boys Clothing Collection | Quiksilver,boys clothing,"['Clothes', 'Kids']",[],Browse our Clothes Collection for Kids. Shop Online at the Official Quiksilver Store. Free Shipping & Returns for Members.,https://www.quiksilver.co.uk/kids-clothing/
11,Baby & Child | Boys & Girls Clothing | John Lewis & Partners,boys clothing,['kids clothes'],[],"Shop for Baby & Child range at John Lewis & Partners for kids clothes, accessories, toys and more. Free UK mainland delivery when you spend over £50.",https://www.johnlewis.com/baby-child/c5000010
12,Kids' Clothing & Shoes | Kids & Babies | H&M IN,boys clothing,"['kids', 'clothes']",[],"Kit them out in style with our kids' clothes. Find everyday essentials, kids' shoes and accessories for babies and children at H&M.",https://www2.hm.com/en_in/kids.html
13,Kids' Clothes & Shoes | Kids & Babies | H&M GB,boys clothing,"['kids', 'clothes']",[],"Kit them out in style with our kids' clothes. Find everyday essentials, kids' shoes and accessories for babies and children at H&M.",https://www2.hm.com/en_gb/kids.html
14,"Gymboree: Kids, Toddler & Baby Clothes",boys clothing,"['kids clothes', 'kids clothes', 'kids clothing']",[],"Find timeless hand-me-down quality kids clothes at Gymboree. Shop kids clothes up to size 12 and discover the magic of coordinating, bow-to-toe kids clothing.",https://www.gymboree.com/us/home
15,Sale Boys - Clothing & Footwear Sale for summer - FatFace UK,boys clothing,['boys'],[],Kit him out in FatFace from our up to half price summer boys sale. We have everything from jeans to trainers to gloves and more.,https://www.fatface.com/sale/boys-sale
16,"Kids | Clothes, Shoes, Sportswear | Trainers, Tracksuits",boys clothing,['kids clothes'],[],"Buy the latest designer kids clothes, shoes, toys and sportswear. Our great value collection includes some of the biggest brands at the lowest prices!",https://www.sportsdirect.com/kids
17,Big Kids Clothing. Nike.com,boys clothing,['Kids Clothing'],[],Find Big Kids Clothing at Nike.com. Free delivery and returns.,https://www.nike.com/w/big-kids-clothing-6ymx6zagibjzv4dh
18,Lulu Kids Clothing,boys clothing,['Kids Clothing'],[],Lulu Kids Clothing - we have a huge selections of children's wear - we offer free shipping on orders over $150 USD and free in store pickup in 5 of our ...,https://lulukidsclothing.com/
19,Cat & Jack - Target,boys clothing,"['Kids', 'clothing', 'boys', 'clothing']",[],Kids' clothing with an imagination of its own. Only at Target◎ ... Shop your kiddo's size. Girls' & boys' clothing also available in extended sizes.,https://www.target.com/b/cat-jack/-/N-qqqgm
20,Kids' Clothes & Shoes | Kids & Babies | H&M CA,boys clothing,"['kids', 'clothes']",[],"Kit them out in style with our kids' clothes. Find everyday essentials, kids' shoes and accessories for babies and children at H&M.",https://www2.hm.com/en_ca/kids.html
21,Kids' Fashion - Primark,boys clothing,['kids clothing'],[],"Let your little one's personalities truly shine with our gender-neutral kids clothing. From kids' playsuits to joggers and jeans, discover the full range ...",https://www.primark.com/en-gb/c/kids
22,Kids Wear | Buy Kids Clothes Online in India,boys clothing,"['kids wear', 'kids clothes']",[],"Online Shopping for kids wear at best prices. Buy kids clothes, footwear, toys at hopscotch. ✓Cash on Delivery, ✓Latest Designs, ✓Pan India shipping.",https://www.hopscotch.in/
23,Kids Clothing Sale | Kids Accessories Offers | M&S IE,boys clothing,['Kids'],[],Shop the latest trends in Kids at M&S. Order online for home delivery or free collection from your nearest store.,https://www.marksandspencer.com/ie/l/sale/all-kids-sale
24,GapKids | Gap,boys clothing,"['Kids Clothes', 'kids', 'clothing']",[],"Kids Clothes for Boys and Girls Looking for cool and comfy styles for your kiddos? GapKids has fresh and fun kids' clothing that your littles will love, ...",https://www.gap.com/browse/division.do?cid=6170
25,Shop Kids' Clothing & Accessories | UNIQLO US,boys clothing,['kids clothing'],[],"Browse comfy kids clothing for boys and girls online from UNIQLO. Shop quality, affordable items in a variety of cute designs and sizes.",https://www.uniqlo.com/us/en/kids
26,Teen & Kids' Clothing Sale - M&Co,boys clothing,"['kids', 'clothing', 'boys clothing']",[],Grab a bargain in our kids' clothing sale at M&Co featuring plenty of discounts on a variety of girls and boys clothing. Shop the kids' sale online today.,https://www.mandco.com/sale-offers/kids-sale/
27,Wearing Kids Clothing? $943 Brooks Brothers ... - YouTube,boys clothing,[],[],"Most major clothing brands ignore shorter men, which means that many ""adult"" sizes are still too long, baggy or oversized for men who are ...",https://www.youtube.com/watch?v=5baILPlnDLs
28,Sale | Kids' Clothing & Accessories - Debenhams,boys clothing,[],[],"Get the latest discounts on children's Shirts, trousers, coats, jackets & accessories. Get it with FREE standard delivery & returns.",https://www.debenhams.com/category/kids-sale
29,"Kids Fashion | Girls, Boys, Baby to Teen Clothes | Cotton On",boys clothing,"['kids', 'clothes', 'dresses', 'kids', 'kids']",[],"Find cute kids & baby clothes at Cotton On! Shop baby dresses, kids raincoats, kids shoes, onesies, swimwear & pyjamas. Afterpay & free shipping over $60.",https://cottonon.com/AU/kids/
30,Kids' Sale | Boys' & Girls' Clothes & Shoes | H&M US,boys clothing,"['boys', 'clothes']",[],"Explore a range of sale styles of girls' and boys' clothes and find essential basics, including T-shirts, underwear, sweatshirts and more.",https://www2.hm.com/en_us/sale/kids/products.html
31,"Kids' Shoes, Clothing & Equipment - Sport Chek",boys clothing,"['kids', 'Kids', 'Clothing']",[],"Get your kids ready for Spring and getting outside to play with brands such as Nike, Puma, Under Armour and adidas. ... Kids' Shoes, Clothing & Sports Gear.",https://www.sportchek.ca/categories/kids.html
32,"Discount Men's, Women's & Boy's ... - Brooks Brothers Sale",boys clothing,['boys clothes'],[],"Get access to discount prices on premium clothes in the Brooks Brothers Sale. Shop online for sale pricing on men's, women's and boys clothes and ...",https://www.brooksbrothers.com/sale
33,Baby Boy Outfits | George at ASDA,boys clothing,"['Boy Clothes', 'boys clothing']",[],"Baby Boy Clothes. Browse our range of amazing value baby boys clothing and accessories at George at Asda, including sleepsuits, outfits and more.","https://direct.asda.com/george/baby-boy/D5M9G1,default,sc.html"
34,Keedo: Shop for Babies & Kids,boys clothing,"['clothes', 'kids']",[],"Keedo, a trusted and proudly South African brand, blends imagination, comfort and style to create functional and fashionable designer clothes for kids ...",https://www.keedo.co.za/
35,Guys Clothing & Fashion - Hot Topic,boys clothing,"['Clothing', 'guys']",[],"Find music and pop culture inspired Clothing, Shoes, Accessories, & Gifts for guys on Hot Topic.",https://www.hottopic.com/guys/
36,Shop Baby Clothing Online and in Store - Kmart,boys clothing,"['Kids', 'Clothing', 'Clothing']",[],Category Results for 3bd4ea3a13fcb7b58a2cbab1d712ec76. You are here: Home · Kids & Baby · Baby; Baby Clothing. Baby Clothing ...,https://www.kmart.com.au/category/kids-and-baby/baby-clothing/
37,Boys' UA Outlet Deals - Under Armour,boys clothing,"['boys', 'clothing']",[],"UA boys' clothing is built to perform. Our boys' athletic clothes and shoes in the Under Armour outlet give you an edge by keeping you comfortable, so you can ...",https://www.underarmour.com/en-us/c/outlet/boys/
38,The North Face Kids' Outdoor Clothing & Gear,boys clothing,"['kids', 'clothing', 'kids']",[],"Shop The North Face kids' outdoor clothing and gear and inspire adventure early. Find everything from baby, toddler, and kids' jackets and shirts to youth ...",https://www.thenorthface.com/en-us/kids
39,Frugi: Organic Baby Clothes | Organic Kids Clothes,boys clothing,"['clothing', 'boys', 'wear']",[],Frugi organic clothing; from new-born babies to girls and boys up to 10 years and women's breastfeeding wear for mums everywhere. Shop online.,https://www.welovefrugi.com/
40,Kid´s Clothes | Online Sale | ZARA United States,boys clothing,"['kids', 'clothes']",[],"SALE - Discover the latest kids' clothes, shoes, and accessories updated every week at ZARA online.",https://www.zara.com/us/en/kids-mkt1.html
41,"Polarn O. Pyret | Swedish, Organic Kids & Baby Clothes ...",boys clothing,['kids clothes'],[],"For over 45 years, we've specialised in quality, organic clothes for children. Our unisex, Swedish kids clothes are kind to the planet and made to last.",https://www.polarnopyret.co.uk/
42,"Pick 'n Pay Clothing | Shop Clothing, Accessories & Shoes for ...",boys clothing,"['Clothing', 'clothing', 'kids']",[],"Shop online with Pick 'n Pay Clothing & find our online shopping categories ranging from clothing, accessories & shoes for women, men, kids & babies.",https://www.picknpayclothing.co.za/
43,Latest Girls Clothing Fashion - Matalan,boys clothing,"['Clothes', 'clothes']",[],Shop Girls' Clothes at Matalan today and you will quickly discover our fantastic range of girls' clothes which are available with free click and collect.,https://www.matalan.co.uk/kids-clothing/girls
44,"H&M | Online Fashion, Homeware & Kids Clothes | H&M CA",boys clothing,['kids'],[],"Shop for women's, men's and kids' fashion, beauty and home essentials online! We offer quality styles at the best price and in a sustainable way.",https://www2.hm.com/en_ca/index.html
45,Sale | Kids' Clothes | Kids' Fashion | H&M CA,boys clothing,"['Kids', 'clothes', 'kids', 'clothing']",[],"Kids' clothes - sale. Looking for kids' clothing? Shop for denim jeans, sweaters, two piece sets, swimwear, and more for all ages at H&M online and ...",https://www2.hm.com/en_ca/sale/kids/products.html
46,Kids Shoes and Clothing | adidas US,boys clothing,['kids apparel'],[],"The adidas online store offers the latest colors and styles in kids apparel, shoes and more. Order online today.",https://www.adidas.com/us/kids
47,"J.Crew: Clothes, Shoes & Accessories For Women, Men & Kids",boys clothing,"['Clothing', 'Clothing', 'Dresses']",[],"Shop JCrew.com for the Highest Quality Women's and Men's Clothing and see the entire selection of Children's Clothing, Cashmere Sweaters, Women's Dresses ...",https://www.jcrew.com/
48,"Seed Heritage: Women's, Kids & Baby Clothing & Accessories",boys clothing,['clothing'],[],"Browse the latest baby, child, teen & women's clothing & accessories at Seed Heritage. Shop with Afterpay. Free shipping on purchases over $100. Shop now!",https://www.seedheritage.com/
49,"Baby clothing, outerwear, accessories and sets - Nutmeg",boys clothing,['clothing'],[],"Welcoming baby home with essentials at Nutmeg® → From the first days to the first few months, shop baby clothing, accessories and the...",https://nutmeg.morrisons.com/en/baby-clothes-accessories
50,The Market for Men's and Boys Clothing in Western Europe,boys clothing,"['boys', 'clothing']",[],8.25 4.90 4.25 2.80 Prices of boys ' clothing are for 12 - year - old sizes . All prices include the 11.11 - percent purchase tax .,https://books.google.ro/books?id=kZX1pzv2GF4C&pg=PA55&lpg=PA55&dq=boys+clothing&source=bl&ots=ig9lt4L4s8&sig=ACfU3U3W8M2Cbcs5XaMHyutypZy99MhtbQ&hl=ro&sa=X&ved=2ahUKEwj4keqa-cv8AhWbK0QIHdqSAQ04rAIQ6AF6BQjdARAD
51,Hanna Andersson | Premium Kids Clothes and Matching ...,boys clothing,['Kids'],[],"Hanna Pajamas look great and feel even better. Shop Babies, Kids, Adults, and Pets too! You'll understand why people say “best pajamas ever” since 1983.",https://www.hannaandersson.com/
52,Kids Clothes | Kids Fashion & Outfits Online - New Look,boys clothing,"['kids', 'clothing']",[],"Go from homework to hangouts in style with New Look's kids' clothing. From the latest trends to sustainable uniforms, shop with free delivery options.",https://www.newlook.com/uk/kids
53,"Making, Selling and Wearing Boys' Clothes in Late-Victorian ...",boys clothing,"['boys', 'wear clothing']",[],"roles in design innovation for boys, will be examined in Chapters 2 and 3. Detailed studies of British ready-to-wear clothing manufacturers by Andrew Godley ...",https://books.google.ro/books?id=57SoDQAAQBAJ&pg=PT27&lpg=PT27&dq=boys+clothing&source=bl&ots=gv2G3C5uLu&sig=ACfU3U3m-Sj6zk4NxVVpEyiurJwSxEGU6A&hl=ro&sa=X&ved=2ahUKEwj4keqa-cv8AhWbK0QIHdqSAQ04rAIQ6AF6BQjeARAD
54,Boys Clothes | Boys Fashion & Clothing Store - Boohoo,boys clothing,"['boys', 'clothing']",[],"Discover boohoo's boys' clothing. With a wide range to choose from, browse all our clothing for boys aged 5 to 12.",https://www.boohoo.com/kids/boys
1,vineyard vines | Casual & Classic Men's & Women's Clothing,boys clothing,['kids clothes'],[],"Shop Vineyard Vines! Classic men's clothing, women's clothing, signature men's silk ties, kids clothes. Designer sport shirts, women and men's polos and ...",https://www.vineyardvines.com/
2,Baby & Child | Boys & Girls Clothing | John Lewis & Partners,boys clothing,['kids clothes'],[],"Shop for Baby & Child range at John Lewis & Partners for kids clothes, accessories, toys and more. Free UK mainland delivery when you spend over £50.",https://www.johnlewis.com/baby-child/c5000010
3,All Boys - Dunnes Stores,boys clothing,['boys clothing'],[],"Comfort and style combine in our range of boys clothing. From classic knitwear, jeans and jackets to cool t-shirts and performance sportswear.",https://www.dunnesstores.com/c/kids/boys-2-14yrs/all-boys
4,"Nike Kids Shoes, Clothing, and Accessories. Nike.com . Nike ...",boys clothing,"['apparel', 'Kids', 'Clothing']",[],"Babies and Toddlers. Explore apparel (0M–4T) and shoes (0C–10C). Shop. Nike Kids Shoes, Clothing, and Accessories. Nike.com ...",https://www.nike.com/kids
5,Latest Girls Clothing Fashion - Matalan,boys clothing,"['Clothes', 'clothes']",[],Shop Girls' Clothes at Matalan today and you will quickly discover our fantastic range of girls' clothes which are available with free click and collect.,https://www.matalan.co.uk/kids-clothing/girls
6,Shop Baby Clothing Online and in Store - Kmart,boys clothing,"['Kids', 'Clothing', 'Clothing']",[],Category Results for 3bd4ea3a13fcb7b58a2cbab1d712ec76. You are here: Home · Kids & Baby · Baby; Baby Clothing. Baby Clothing ...,https://www.kmart.com.au/category/kids-and-baby/baby-clothing/
1,Kids Shoes and Clothing | adidas US,boys clothing,['kids apparel'],[],"The adidas online store offers the latest colors and styles in kids apparel, shoes and more. Order online today.",https://www.adidas.com/us/kids
2,"Nike Kids Shoes, Clothing, and Accessories. Nike.com . Nike ...",boys clothing,"['apparel', 'Kids', 'Clothing']",[],"Babies and Toddlers. Explore apparel (0M–4T) and shoes (0C–10C). Shop. Nike Kids Shoes, Clothing, and Accessories. Nike.com ...",https://www.nike.com/kids
