position,title,query,snippet_highlighted_words,rich_snippet_list,snippet,link
1,Buy Boys Clothing Sets online in India - Myntra,boys clothing set,"['Boys Clothing Sets', 'Boys Clothing Sets', 'Boys Clothing Sets']",[],Boys Clothing Sets Online shopping for Boys Clothing Sets in India. ✯ Buy Boys Clothing Sets ✯ Free Shipping ✯ Cash on Delivery ✯ Easy returns and ...,https://www.myntra.com/boys-clothing-sets
2,Buy Latest & Trendy Boys Clothes Online - Myntra,boys clothing set,"['Boys Clothing', 'Boys Dress']",[],"Boys Clothing - Myntra offers a wide range of Boys Dress Online in India. Shop for the latest collection of Boy's T-Shirts, Shirts, Jackets of top brands at ...",https://www.myntra.com/boys-clothing
3,Buy Boys Clothing Sets online in India - Myntra,boys clothing set,"['Boys Clothing Sets', 'Boys Clothing Sets']",[],Online shopping for Boys Clothing Sets ✯ Shop Online Boys Clothing Sets ✯ Free Shipping ✯ Cash on Delivery ✯ Easy returns and exchanges.,https://www.myntra.com/boys-clothing-sets-menu
4,Buy Trendy Boys Clothes Online - Hopscotch,boys clothing set,['boys clothes'],[],Online shopping for boys clothes in India at the best prices. Buy the latest trendy boys wear online with hopscotch.,https://www.hopscotch.in/boys
5,Buy Boys Combo Sets Online at Best Prices in India - Flipkart,boys clothing set,"['apparel', 'boys']",[],"There are many different types of apparel combos for kids that you can buy online. For boys, there are T-shirt and shorts combos, T-shirt and pyjama combos, T- ...",https://www.flipkart.com/clothing-and-accessories/kids-combos-and-costumes/kids-apparel-combos/pr?sid=clo%2Ceof%2C1bp
6,Buy Boy's Outfits & Clothing Sets Online at Low Prices in India,boys clothing set,"['Clothing Sets', ""Boy's"", 'Boys', 'Clothing Set']",[],Shop Outfits & Clothing Sets for Boy's from popular brands ... Attis Boys And Girls Cotton Stylish Tshirt & Pant Kids Clothing Set.,https://www.amazon.in/boys-outfit-clothing-sets/b?ie=UTF8&node=1967893031
7,Amazon.in: 50% Off Or More - Clothing Sets / Boys,boys clothing set,['Boys'],[],"1-48 of over 5,000 results. RESULTS · Bold N Elegant - Be Bold Inside & Elegant Outside Baby's Cotton Tshirt · Hopscotch Boys Gray Graphic Print Top and ...",https://www.amazon.in/Clothing-Sets-50-Off-or-more/s?rh=n%3A1967893031%2Cp_n_pct-off-with-tax%3A2665401031
8,Boys' Outfits & Sets | H&M IN,boys clothing set,"['boys', 'sets']",[],"Make everyday dressing a breeze with our boys' pre-packed outfits and sets. Find matching sweatshirts and joggers, as well as multipacks at H&M.",https://www2.hm.com/en_in/kids/boys/clothing/sets-outfits.html
9,Buy Casual Boys Dress with Top & Bottom Sets Online ...,boys clothing set,"['Boys Dress', 'Set']",[],"Casual Boys Dress get wide range of T-shirts, shorts Set & many more at best prices only at Snapdeal with FREE Shipping & COD options ...",https://www.snapdeal.com/products/boys-clothing-sets
10,Bestsellers in Boys' Clothing Sets - Amazon.in,boys clothing set,"['Boys', 'Clothing Sets']",[],Amazon BestsellersOur most popular products based on sales. Updated frequently. Bestsellers in Boys' Clothing Sets.,https://www.amazon.in/gp/bestsellers/apparel/1967893031
11,11 - 12 Years - Clothing Sets / Boys - Amazon.in,boys clothing set,"['Clothing Set', 'Dress', 'Boys', 'Set']",[],"Clothing Set, 3 Piece Dress for Kids Boys, Jacket, Pant, Bow and Shirt Set, Ideal for Wedding, Birthday and Party.",https://www.amazon.in/Clothing-Sets-11-12-years-Boys/s?rh=n%3A1967893031%2Cp_n_size_browse-vebin%3A2081578031
12,Amazon.in: ₹1000 - ₹1500 - Clothing Sets / Boys,boys clothing set,"['Clothing Set', 'Dress', 'Boys', 'Set']",[],"Clothing Set, Indo Western Dress for Kids Boys, Jacket and Pant Set, Ideal for Wedding, Birthday and Party.",https://www.amazon.in/Clothing-Sets-%E2%82%B91-000-500-Boys/s?rh=n%3A1967893031%2Cp_36%3A4595087031
13,Amazon.in: Casual - Clothing Sets / Boys,boys clothing set,"['Set', 'Boys Clothing']",[],"Googogaaga Boy's Cotton Printed Tie & Die T-shirt With Shorts in Blue Color Set for Boys ... Zolario Boys Clothing, Dress for Kids Boys, ...",https://www.amazon.in/Clothing-Sets-Casual-Boys/s?rh=n%3A1967893031%2Cp_n_special_occasion_browse-bin%3A1974809031&page=2
14,Amazon.in: 2 - 3 Years - Clothing Sets / Boys,boys clothing set,"['Boys', 'Set', 'Clothing Set', 'Dress']",[],"Baby Boys Cotton and Viscose Checked Full Sleeves Shirt and Pant Set in Yellow Color ... Zolario Clothing Set, Indo Western Dress for Kids ...",https://www.amazon.in/Clothing-Sets-2-3-years-Boys/s?rh=n%3A1967893031%2Cp_n_size_browse-vebin%3A2081569031
15,Amazon.in: 9 - 10 Years - Clothing Sets / Boys,boys clothing set,"['Clothing Set', 'Dress', 'Boys', 'Set']",[],"Clothing Set, Indo Western Dress for Kids Boys, Jacket and Pant Set, Ideal for Wedding, Birthday and Party. 3.83.8 out of 5 stars (255).",https://www.amazon.in/Clothing-Sets-9-10-years-Boys/s?rh=n%3A1967893031%2Cp_n_size_browse-vebin%3A2081576031
16,Amazon.in: 10 - 11 Years - Clothing Sets / Boys,boys clothing set,"['Clothing Set', 'Dress', 'Boys', 'Set']",[],"Clothing Set, Indo Western Dress for Kids Boys, Jacket and Pant Set, Ideal for Wedding, Birthday and Party. 3.83.8 out of 5 stars (255).",https://www.amazon.in/Clothing-Sets-10-11-years-Boys/s?rh=n%3A1967893031%2Cp_n_size_browse-vebin%3A2081577031
17,Plaid - Clothing Sets / Baby Boys - Amazon.in,boys clothing set,['Boys Clothes Set'],[],Boys Clothes Set 4 pcs Plaid Shirts+Bowtie+Suspender Pant Sets Infant ... Toddler Baby Boy Clothes Plaid Pocket Hoodie Sweatshirt+Pants Outfits Set.,https://www.amazon.in/Clothing-Sets-Plaid-Baby-Boys/s?rh=n%3A1953173031%2Cp_n_feature_nine_browse-bin%3A28972535031
18,5 - 6 Years - Clothing Sets / Boys - Amazon.in,boys clothing set,"[""Boy's"", 'Set', 'Set', 'Dress', 'Boys']",[],1-48 of 990 results. RESULTS · Googogaaga Boy's Cotton Printed Top with Jogger Set in Navy Blue Color Set · 3BROS BodySuit/Dress/Baba Suit for Boys/Girls ...,https://www.amazon.in/Clothing-Sets-5-6-years-Boys/s?rh=n%3A1967893031%2Cp_n_size_browse-vebin%3A2081572031
19,Amazon.in: 4 - 5 Years - Clothing Sets / Boys,boys clothing set,"['Set', 'Boys Clothing']",[],"Baby Boys Cotton and Viscose Checked Full Sleeves Shirt and Pant Set in Yellow Color ... Zolario 3 Piece Boys Clothing Dress for Kids Boys, ...",https://www.amazon.in/Clothing-Sets-4-5-years-Boys/s?rh=n%3A1967893031%2Cp_n_size_browse-vebin%3A2081571031
20,Amazon.in: 3 - 4 Years - Clothing Sets / Boys,boys clothing set,"['Boys', 'Set', 'Boys']",[],"1-48 of over 1,000 results. RESULTS · Hopscotch Boys Cotton All-Over Print T-Shirt with Jacket & Pant Set in · Hopscotch Boys Navy Polka Dot Print Top and ...",https://www.amazon.in/Clothing-Sets-3-4-years-Boys/s?rh=n%3A1967893031%2Cp_n_size_browse-vebin%3A2081570031
21,6-9 Months - Clothing Sets / Baby Boys - Amazon.in,boys clothing set,"['Boys', 'Set', 'boy']",[],"1-48 of over 2,000 results. RESULTS · Boys Cotton All-Over Print T-Shirt with Jacket & Pant Set in · Kid's Cotton T-Shirt · Baby boy & Baby Girl Teddy Bear ...",https://www.amazon.in/Clothing-Sets-6-9-Months-Baby-Boys/s?rh=n%3A1953173031%2Cp_n_size_browse-bin%3A5836989031
22,Amazon.in: 8 - 9 Years - Clothing Sets / Boys,boys clothing set,"['Boys Clothing', 'Set']",[],"1-48 of 483 results. RESULTS · 3 Piece Boys Clothing Dress for Kids Boys, Coat, Pant and Shirt Set, Ideal for Wedding and · 3 Piece Boys Suit for Kids Boys, ...",https://www.amazon.in/Clothing-Sets-8-9-years-Boys/s?rh=n%3A1967893031%2Cp_n_size_browse-vebin%3A2081575031
23,Buy Baby Boy's Outfits & Clothing Sets Online at ... - Amazon.in,boys clothing set,"[""Boy's"", 'Set', 'Clothing Sets', 'Boys']",[],Googo Gaaga Boy's Cotton Full Sleeves Printed Sweatshirt and Pant Set · Real Basics Cotton Fleece Clothing Sets for Boys & girls - Unisex ...,https://www.amazon.in/Baby-Boy-Clothing/b?ie=UTF8&node=1953173031
24,Amazon.in: Under ₹300 - Clothing Sets / Boys,boys clothing set,"['Dress', 'Boys']",[],1-48 of 508 results. RESULTS. Price and other details may vary based · BodySuit/Dress/Baba Suit for Boys/Girls Full Pajama & Casual Full Sleeves shirt With ...,https://www.amazon.in/Clothing-Sets-Under-%E2%82%B9300-Boys/s?rh=n%3A1967893031%2Cp_36%3A4595084031
25,Amazon.in: Casual - Clothing Sets / Boys,boys clothing set,['Boys Clothing Set'],[],"Boys Cotton All-Over Print T-Shirt with Jacket & Pant Set in Green Color ... Boys Clothing Set 3 Piece Dress for Boys, Set of Coat, ...",https://www.amazon.in/Clothing-Sets-Casual-Boys/s?rh=n%3A1967893031%2Cp_n_special_occasion_browse-bin%3A1974809031
26,Reds - Clothing Sets / Boys: Clothing & Accessories - Amazon.in,boys clothing set,"['Boys', 'Set', 'Clothing Set', 'Dress', 'Boys']",[],"Baby Boys and Girls Cotton Blazer Style Shirt and Pant Set for Newborn, Infants, ... Clothing Set, Indo Western Dress for Kids Boys, ...",https://www.amazon.in/Clothing-Sets-Reds-Boys/s?rh=n%3A1967893031%2Cp_n_size_two_browse-vebin%3A1975329031
27,The Children's Place Baby Boys' Clothing Set - Amazon.in,boys clothing set,"['Boys', 'Clothing Set']",[],Buy The Children's Place Baby Boys' Clothing Set (20749451120_Whisperpnk_0-3 M) from Clothing Sets at Amazon.in. 30 days free exchange or return.,https://p-yo-www-amazon-in-kalias.amazon.in/Childrens-Place-Baby-Boys-Clothing/dp/B06WRNZKDH
28,Amazon.in: Bold N Elegant - Clothing Sets / Baby Boys,boys clothing set,"['Clothing Set', 'Boy']",[],Disney Cartoon Mickey Mouse Print Kid's Winter T-shirt with Hood Jacket & Jogger Pant 3 piece Clothing Set for Infant Toddler Baby Boy Girl ...,https://www.amazon.in/Clothing-Sets-Bold-N-Elegant/s?rh=n%3A1953173031%2Cp_6%3AA1W0M1Z3DB1FPA
29,7 - 8 Years - Clothing Sets / Boys - Amazon.in,boys clothing set,"['Clothing Set', 'Dress', 'Boys', 'Set']",[],"Zolario Clothing Set, Indo Western Dress for Kids Boys, Jacket and Pant Set, ...",https://www.amazon.in/Clothing-Sets-7-8-years-Boys/s?rh=n%3A1967893031%2Cp_n_size_browse-vebin%3A2081574031
30,6-9 Months - Clothing Sets / Baby Boys - Amazon.in,boys clothing set,"['Boys', 'Clothing Set Dress']",[],Kids T-Shirt T-Shirts for Boys and Girls Kid Baby Half Sleeves Cotton Tshirt Tshirts Clothing Set Dress Pack of 4.,https://www.amazon.in/Clothing-Sets-6-9-Months-Baby-Boys/s?rh=n%3A1953173031%2Cp_n_size_browse-bin%3A5836989031&page=2
31,Amazon.in: 6 - 7 Years - Clothing Sets / Boys,boys clothing set,"['Dress', 'Boys']",[],1-48 of 684 results. RESULTS. Price and other details may vary based · BodySuit/Dress/Baba Suit for Boys/Girls Full Pajama & Casual Full Sleeves shirt With ...,https://www.amazon.in/Clothing-Sets-6-7-years-Boys/s?rh=n%3A1967893031%2Cp_n_size_browse-vebin%3A2081573031
32,Amazon.in: STS Shop - Clothing Sets / Boys,boys clothing set,['Boys Clothes Sets'],[],Toddler Dress Suits Baby Boys Clothes Sets Bowtie Shirts Suspenders Pants 4pcs Gentleman Outfits Suit 6 · +3 colors/patterns ...,https://www.amazon.in/Clothing-Sets-STS-Shop-Boys/s?rh=n%3A1967893031%2Cp_6%3AA1ZJ9VB2OVIKVD&hidden-keywords=-rakhi
33,Boys Clothing Sets Pack Of 1 - Meesho,boys clothing set,['Boys Clothing Sets'],[],Name: Boys Clothing Sets Pack Of 1 Top Fabric: Hosiery Cotton Bottom Fabric: Hosiery Cotton Sleeve Length: Long Sleeves Top Pattern: Printed Bottom Pattern: ...,https://www.meesho.com/boys-clothing-sets-pack-of-1/p/cjssy
34,Buy Boys Sets online for best prices in India - AJIO,boys clothing set,"['Sets', 'Boys', ""boy's sets""]",[],"Buy Sets for Boys. Huge collection of boy's sets at low offer price & discounts at COD, Easy Returns & Exchanges. Order Now.",https://www.ajio.com/boys-sets/c/830501008
35,8 - 9 Years - Clothing Sets / Boys - Amazon.in,boys clothing set,['Boys Dress'],[],Boys Dress Kids Dress for Boys Coat Pant Shirt for Boys Wear - Boy Birthday Dresses Fashion Suit - Kidsdressboys and Blazer for ...,https://www.amazon.in/Clothing-Sets-8-9-years-Boys/s?rh=n%3A1967893031%2Cp_n_size_browse-vebin%3A2081575031&page=2
36,9-12 Months - Clothing Sets / Baby Boys - Amazon.in,boys clothing set,"[""Boy's"", 'Set', 'Set', 'Boys']",[],"1-48 of over 1,000 results. RESULTS · Kid's Cotton T-Shirt · Baby Boy's Cotton Tshirt Pant Set · Girl's Cotton Short Set · Baby Boys Cotton Solid Half ...",https://www.amazon.in/Clothing-Sets-9-12-Months-Baby-Boys/s?rh=n%3A1953173031%2Cp_n_size_browse-bin%3A5836990031
37,Baby Boy Clothes - Amazon.in,boys clothing set,"['Boy Clothes', 'Set']",[],"1-48 of over 30,000 results for ""Baby Boy Clothes"" · Boys Cotton All-Over Print T-Shirt with Jacket & Pant Set in · Presents New Born Baby Winter Wear Keep ...",https://www.amazon.in/Baby-Boy-Clothes/s?k=Baby+Boy+Clothes
38,13 - 14 Years - Clothing Sets / Boys - Amazon.in,boys clothing set,"['Boys', 'Set', 'Boys', 'Set']",[],1-48 of 97 results. RESULTS · Boys Cotton Stripe Print Hoodie Neck Top and Pant Set in Navy Color · Boys Premium Cotton T-Shirt Pant with Pockets Set.,https://www.amazon.in/Clothing-Sets-13-14-years-Boys/s?rh=n%3A1967893031%2Cp_n_size_browse-vebin%3A2081580031
39,Amazon.in: Casual - Clothing Sets / Boys,boys clothing set,['Boys Clothing Set'],[],cotton clothing sets for boys & girls - T-shirt & pant combo for ... 100% Cotton Boys Clothing Set Tshirt & Shorts - Half Sleeve ...,https://www.amazon.in/Clothing-Sets-Casual-Boys/s?rh=n%3A1967893031%2Cp_n_special_occasion_browse-bin%3A1974809031&page=3
40,Boys Fashion - Shop for Boys Clothing Online in India,boys clothing set,"[""Boy's Clothing""]",[],"Boys Wear - Buy the latest Clothes for Boys Online at a starting price of ₹149 in India. Shop for Boy's Clothing like Jeans, T-Shirts & more on Max Fashion ...",https://www.maxfashion.in/in/en/c/maxboys
41,Boys Sets - Buy Baby Boy Clothing Sets Online in India,boys clothing set,"['clothing sets', 'boys', 'sets', 'boys', 'sets']",[],"There are several types of clothing sets for kids that are accessible at NNNOW.com. For boys, there are T-shirt and shorts sets, boys' pyjama sets, denim pant ...",https://www.nnnow.com/boys-sets
42,Buy Baby & Kids Clothing Sets Online in India at ... - Firstcry,boys clothing set,"['Sets', 'clothing sets', 'boys']",[],"Shop from 12747 Sets & Suits, ✓ Discount up to 85%, ✓ Prices start from ₹ 108. Buy clothing sets for baby boys & girls online in India at FirstCry.com ...",https://www.firstcry.com/sets-and-suits/6/166
43,Boys Clothing Sets – Buy Top & Bottom Sets for ... - Paytm Mall,boys clothing set,['clothes sets'],[],"Some of these brands include names like ELK Kids, Goodway Junior, Reliance Trends, Crazeis, Ginessa and many others. The clothes sets that we sell are available ...",https://paytmmall.com/boys-top-bottom-sets-glpid-18240
44,Amazon.in: Multicoloured - Clothing Sets / Boys,boys clothing set,"['Boys Dress', 'Set']",[],Geetham Galaxy- Boys Dress | Cotton T-Shirt & Shorts Set | Printed Baby Boy kids Dress 2-7 years Multicolor.,https://www.amazon.in/Clothing-Sets-Multicoloured-Boys/s?rh=n%3A1967893031%2Cp_n_size_two_browse-vebin%3A1975325031&page=3
45,Amazon.in: Blacks - Clothing Sets / Boys,boys clothing set,['Boys Clothing'],[],"Googogaaga Boy's Cotton Printed Sweatshirt With Joggers In White Color ... Zolario 3 Piece Boys Clothing Dress for Kids Boys, Coat, Pant ...",https://www.amazon.in/Clothing-Sets-Blacks-Boys/s?rh=n%3A1967893031%2Cp_n_size_two_browse-vebin%3A1975317031
46,6-9 Months - Clothing Sets / Baby Boys - Amazon.in,boys clothing set,"['Boy', 'Dress']",[],"KIDS PARYANIS Baby Boy and Baby Girl Half Sleeves Soft Hosiery Vests,Jhabla T-Shirt with Shorts Dress for Kids Infant Toddler New ...",https://www.amazon.in/Clothing-Sets-6-9-Months-Baby-Boys/s?rh=n%3A1953173031%2Cp_n_size_browse-bin%3A5836989031&page=2&hidden-keywords=-gleam+-len
47,18-24 Months - Clothing Sets / Baby Boys - Amazon.in,boys clothing set,"['Set', ""Boy's"", 'Set', 'Dress']",[],Baby's Cotton Tshirt Pant Set · Boy's Cotton Full Sleeves Printed Sweatshirt and Pant Set in Multi Color · BodySuit/Dress/Baba Suit for ...,https://www.amazon.in/Clothing-Sets-18-24-Months-Baby-Boys/s?rh=n%3A1953173031%2Cp_n_size_browse-bin%3A1975477031
48,Amazon.in: Cotton - Clothing Sets / Boys,boys clothing set,"['Dress', 'Boys', 'Set']",[],BodySuit/Dress/Baba Suit for Boys/Girls Full Pajama & Casual Full Sleeves shirt With Cap Attached Top Combo Kid's Set FS-6010.,https://www.amazon.in/Clothing-Sets-Cotton-Boys/s?rh=n%3A1967893031%2Cp_n_material_browse%3A1974776031
49,Amazon.in: Letter Print - Clothing Sets / Baby Boys,boys clothing set,"[""Boy's Clothing Set""]",[],SK Kids Wear & Baby Boy's Clothing Set of Fancy Cotton Blend Daddy Printed White T-Shirt and Black Track Pant for Kids (White & Black).,https://www.amazon.in/Clothing-Sets-Letter-print-Baby-Boys/s?rh=n%3A1953173031%2Cp_n_feature_nine_browse-bin%3A28972530031
50,Under ₹300 - Clothing Sets / Baby Boys - Amazon.in,boys clothing set,"['Set', 'set', 'Boy clothes']",[],Top & Shorts Set | Evrydaywear| Comfort Wear | Lounge Wear | Top and Shorts set for Kids | Kids Combo Dress | Baby clothes | Boy clothes ...,https://www.amazon.in/Clothing-Sets-Under-%E2%82%B9300-Baby-Boys/s?rh=n%3A1953173031%2Cp_36%3A4595084031
51,Bestsellers in Baby Boys' Clothing - Amazon.in,boys clothing set,"['Clothes', 'Sets', 'Boys', 'Clothes']",[],HIKIPO Presents New Born Baby Winter Wear Keep Warm Baby Clothes 5Pcs Sets Cotton Baby Boys Girls Unisex Baby Fleece/Falalen or Flannel Suit Infant Clothes ...,https://www.amazon.in/gp/bestsellers/apparel/1953149031
52,Pinks - Clothing Sets / Boys: Clothing & Accessories - Amazon.in,boys clothing set,"['Dress', 'Boys', 'Set']",[],BodySuit/Dress/Baba Suit for Boys/Girls Full Pajama & Casual Full Sleeves shirt With Cap Attached Top Combo Kid's Set FS-6009.,https://www.amazon.in/Clothing-Sets-Pinks-Boys/s?rh=n%3A1967893031%2Cp_n_size_two_browse-vebin%3A1975327031
53,Baby Boy Clothing Sets - Chicco,boys clothing set,['boys clothing sets'],[],"Grab the best boys clothing sets from different variety collections. You can get this from Chicco online, Chicco never fails to provide the best ...",https://www.chicco.in/boys/
54,3 - 4 Years - Clothing Sets / Boys - Amazon.in,boys clothing set,"['Clothing Set', 'Boys', 'Clothing Set', 'Dress', 'Boys']",[],"RC REYANSH CREATIONS Printed Half Length Clothing Set for (Boys & Girls) II Summer · Zolario Clothing Set, 3 Piece Dress for Kids Boys, ...",https://www.amazon.in/Clothing-Sets-3-4-years-Boys/s?rh=n%3A1967893031%2Cp_n_size_browse-vebin%3A2081570031&page=3&hidden-keywords=-sunglass+-eye+-watch+-bag+-glove+-sock+-belt
55,11 - 12 Years - Clothing Sets / Boys - Amazon.in,boys clothing set,['Boys Clothing sets'],[],"Boys Clothing sets, Kids clothing sets, Full Pant with T-Shirts, girls clothing sets, boys t shirt, Three-Fourth Pant, Pack of 5, ...",https://www.amazon.in/Clothing-Sets-11-12-years-Boys/s?srs=20594661031&rh=n%3A1967893031%2Cp_n_size_browse-vebin%3A2081578031&page=2
56,Amazon.in: Multicoloured - Clothing Sets / Boys,boys clothing set,"['Boys', 'Set', 'Boys', 'Set Dress']",[],Boys Cotton All-Over Print T-Shirt with Jacket & Pant Set in Green ... Boys Roundneck t Shirt Shorts 3/4 Set Dress Combo Pack of 5.,https://www.amazon.in/Clothing-Sets-Multicoloured-Boys/s?rh=n%3A1967893031%2Cp_n_size_two_browse-vebin%3A1975325031&hidden-keywords=-saree+-cold
57,Amazon.in: ₹500 - Clothing Sets / Boys: Clothing & Accessories,boys clothing set,"['Boys Clothing', 'Set']",[],"kids Ethnic Wear 3 Piece Suit Dress for 2 to 12 Years Boys Clothing Shirt Pant and Blended Waistcoat Set (Multicolor, Multiple Size).",https://www.amazon.in/Clothing-Sets-%E2%82%B9500-%E2%82%B91-000-Boys/s?rh=n%3A1967893031%2Cp_36%3A4595086031&page=3
58,Amazon.in: Synthetic - Clothing Sets / Baby Boys,boys clothing set,['Clothing'],[],Online shopping from a great selection at Clothing & Accessories Store.,https://www.amazon.in/Clothing-Sets-Synthetic-Baby-Boys/s?rh=n%3A1953173031%2Cp_n_material_browse%3A1974790031
59,199 - Clothing Sets / Boys - Amazon.in,boys clothing set,"['Set', 'Boy Clothing']",[],Printed Shirt and Blue Jeans 2 Pc Set Little Baby Boy Clothing Shirt Denim Pant Party Clothes for Kids Children. 3.1 out of 5 stars (3.1)12.,https://www.amazon.in/Clothing-Sets-%E2%82%B9199-Boys/s?rh=n%3A1967893031%2Cp_36%3A19900-19900
60,Amazon.in: Over ₹1500 - Clothing Sets / Boys,boys clothing set,"['Clothing Set', 'Boys']",[],"Dotson Clothing Set for Baby Boys- Jacket,Pant & Shirt (3-4 Years) ... Only 1 left in stock.",https://www.amazon.in/Clothing-Sets-Over-%E2%82%B91-500-Boys/s?rh=n%3A1967893031%2Cp_36%3A4595088031
61,Amazon.in: 3 - 4 Years - Clothing Sets / Boys,boys clothing set,['Boys Dress'],[],Boys Dress Kids Dress for Boys Coat Pant Shirt for Boys Wear - Boy Birthday Dresses Fashion Suit - Kidsdressboys and Blazer for ...,https://www.amazon.in/Clothing-Sets-3-4-years-Boys/s?rh=n%3A1967893031%2Cp_n_size_browse-vebin%3A2081570031&page=19&hidden-keywords=-badmash+-free+-triumphin+-fablab+-2Day+-syga+-jaybhavanifashion+-sretan+-krishna+-trazo+-jollify+-vimal+-cozami+-veirdo+-unisex+-ADYK+-couple+-NIVIK+-nighty+-bra+-lugai+-rimsha+-leotude+-melcom+-park+-leriya+-fabula+-WYO+-venisa+-sweety+-mallory+-sweety+-vivid+-fashmind+-nakoda+-silkova+-4XL+-chakudee
62,Generic - Clothing Sets / Baby Boys - Amazon.in,boys clothing set,"['Clothes', 'Sets', 'Boys']",[],Jhalak Industries Presents New Born Baby Winter Wear Keep Warm Baby Clothes 5Pcs Sets Cotton Baby Boys Girls Unisex Baby ...,https://www.amazon.in/Clothing-Sets-Generic-Baby-Boys/s?rh=n%3A1953173031%2Cp_89%3AGeneric
63,Amazon.in: 3 - 4 Years - Clothing Sets / Boys,boys clothing set,"['Set', 'Boys Clothes', 'Set']",[],"1,057-1,104 of over 1,000 results · Boy's Cotton Clothing Set · Boys Clothes Solid Adorable Long Sleeve Hoody Pants Set · Boy's Cotton Waistcoat, Shirt and Trouser ...",https://www.amazon.in/Clothing-Sets-3-4-years-Boys/s?rh=n%3A1967893031%2Cp_n_size_browse-vebin%3A2081570031&page=23&hidden-keywords=-badmash+-free+-triumphin+-fablab+-2Day+-syga+-jaybhavanifashion+-sretan+-krishna+-trazo+-jollify+-vimal+-cozami+-veirdo+-unisex+-ADYK+-couple+-NIVIK+-nighty+-bra+-lugai+-rimsha+-leotude+-melcom+-park+-leriya+-fabula+-WYO+-venisa+-sweety+-mallory+-sweety+-vivid+-fashmind+-nakoda+-silkova+-4XL+-chakudee
64,3 - 4 years - Clothing Sets / Boys - Amazon.in,boys clothing set,"['Clothing Set', 'Boys', 'Boys', 'Outfit', 'Dress Clothes']",[],"Dotson Clothing Set for Baby Boys- Waistcoat,Pant, Striped Shirt & Bow (3-4 ... Toddler Boys Tuxedo Outfit Kids Summer Dress Clothes White Shirt,Bowtie ...",https://www.amazon.in/Clothing-Sets-3-4-years-Boys/s?rh=n%3A1967893031%2Cp_n_size_browse-vebin%3A2081570031&page=22&hidden-keywords=-hat
65,3 - 4 years - Clothing Sets / Boys - Amazon.in,boys clothing set,['Boys Dress'],[],Boys Dress Kids Dress for Boys Coat Pant Shirt for Boys Wear - Boy Birthday Dresses Fashion Suit - Kidsdressboys and Blazer for Wedding Clothes - 3 year to ...,https://www.amazon.in/Clothing-Sets-3-4-years-Boys/s?rh=n%3A1967893031%2Cp_n_size_browse-vebin%3A2081570031&page=24&hidden-keywords=-accessories+-sunglasses
66,Amazon.in: Over ₹1500 - Clothing Sets / Boys,boys clothing set,['Boys Clothing sets'],[],"Boys Cotton Solid Faux Blazer and Pant Set in Black Color ... Boys Clothing sets, Kids clothing sets, Full Pant with T-Shirts, girls. SK ...",https://www.amazon.in/Clothing-Sets-Over-%E2%82%B91-500-Boys/s?rh=n%3A1967893031%2Cp_36%3A4595088031&page=2
67,Amazon.in: 3 - 4 Years - Clothing Sets / Boys,boys clothing set,"['Boys', 'Set', 'Boys']",[],"Boys Printed All-over Printed Casual Wear, Round Neck, Half Sleeves T-shirt and Denim Shorts I Tshirt and Half pant Set I Kidswear for Boys.",https://www.amazon.in/Clothing-Sets-3-4-years-Boys/s?rh=n%3A1967893031%2Cp_n_size_browse-vebin%3A2081570031&page=21&hidden-keywords=Pack%7CSet
68,Amazon.in: Under ₹300 - Clothing Sets / Boys,boys clothing set,"['Dress', 'Boys', 'Set']",[],BodySuit/Dress/Baba Suit for Boys/Girls Full Pajama & Casual Full Sleeves shirt With Cap Attached Top Combo Kid's Set FS-6009.,https://www.amazon.in/Clothing-Sets-Under-%E2%82%B9300-Boys/s?rh=n%3A1967893031%2Cp_36%3A4595084031&hidden-keywords=-sun
69,7 - 8 Years - Clothing Sets / Boys - Amazon.in,boys clothing set,['Boys Dress'],[],Boys Dress Kids Dress for Boys Coat Pant Shirt for Boys Wear - Boy Birthday Dresses Fashion Suit - Kidsdressboys and Blazer for ...,https://www.amazon.in/Clothing-Sets-7-8-years-Boys/s?srs=14916869031&rh=n%3A1967893031%2Cp_n_size_browse-vebin%3A2081574031&page=3
70,3 - 4 Years - Clothing Sets / Boys - Amazon.in,boys clothing set,"['Boys', 'Dress', 'Boys', 'Set']",[],"1,249-1,296 of over 1,000 results · Boys Cotton T-Shirt & Denim Short Dress (6 Months - 5 Years) · Baby Boys Cotton Applique Fruit-Shirt and Dungaree Set in Black ...",https://www.amazon.in/Clothing-Sets-3-4-years-Boys/s?rh=n%3A1967893031%2Cp_n_size_browse-vebin%3A2081570031&page=27&hidden-keywords=-hat
71,12-18 Months - Clothing Sets / Baby Boys - Amazon.in,boys clothing set,"['Boys', 'Dress Set']",[],Baby Boys and Baby Girls Cotton Half Sleeves Solid T-Shirt Animal Printed Dungaree Overall Dress Set in White Colour.,https://www.amazon.in/Clothing-Sets-12-18-Months-Baby-Boys/s?rh=n%3A1953173031%2Cp_n_size_browse-bin%3A1975476031&page=3
72,Buy Kids Boys Clothing online in India - Myntra,boys clothing set,"['Boys Clothing', 'Boys Clothing', 'Set']",[],Shop for Kids Boys Clothing in India ✯ Buy latest range of Kids Boys Clothing at Myntra ✯ Free Shipping ... Boys Captain America Printed Clothing Set.,https://www.myntra.com/kids-boys-clothing
73,Buy Clothes for Boys Online in India - Myntra,boys clothing set,"['boys clothes', 'boys clothes', 'Set']",[],Online shopping for boys clothes in India ✯ Buy boys clothes ✯ Free Shipping ✯ Cash on Delivery ... Boys Woven-Design Brocade Slim Fit Sherwani Set.,https://www.myntra.com/boys-clothes
