position,title,query,snippet_highlighted_words,rich_snippet_list,snippet,link
1,Boys Clothing,boys clothing,"['Boys', 'Clothing', 'boys', 'clothes']",[],Boys' Clothing at Macy's come in a variety of styles and sizes. Shop boys' clothes from top brands that your kids would love. FREE SHIPPING AVAILABLE!,https://www.macys.com/shop/kids-clothes/boys-clothing?id=61999
2,Boys' Clothes,boys clothing,"['Boys', 'Clothing']",[],"Shop Target for Boys' Clothing you will love at great low prices. Choose from Same Day Delivery, Drive Up or Order Pickup. Free standard shipping with $35 ...",https://www.target.com/c/boys-clothing-kids/-/N-5xty4
3,"Boys' Clothes | Jeans, Jumpers & More",boys clothing,"['boys', 'clothes']",[],"Discover all boys' clothes at H&M. Refresh on everyday essentials, or scroll for the latest T-shirts, jeans, jackets, sweaters and more.",https://www2.hm.com/en_us/kids/boys/clothing.html
4,Boys Clothes,boys clothing,['boys clothing'],[],"Shop for boys clothing at Old Navy, and create easy outfits for boys' everyday styles. Find essentials like school uniforms, boys' jeans, t-shirts, & more.",https://oldnavy.gap.com/browse/division.do?cid=5910
5,Boys Clothing | The Childrens Place | Free Shipping*,boys clothing,['boys clothing'],[],The Childrens Place has the best quality and variety of boys clothing around. Shop at the PLACE where big fashion meets little prices!,https://www.childrensplace.com/us/c/boys-clothing
6,"Boys' Clothes: Cool Dress Clothes, Outfits and More For Kids",boys clothing,"['Boys', 'Clothing']",[],Enjoy free shipping and easy returns every day at Kohl's. Find great deals on Boys' Clothing at Kohl's today!,https://www.kohls.com/catalog/boys-kids-clothing.jsp?CN=Gender:Boys+AgeAppropriate:Kids+Department:Clothing
7,Boys Clothing in Kids Clothing(1000+),boys clothing,"['Boys Clothing', 'Kids Clothing']",[],"Shop for Boys Clothing in Kids Clothing. Buy products such as Holiday Time Boys Long Sleeve Christmas 3-Pack Tee, Sizes 4-18 and Husky at Walmart and save.",https://www.walmart.com/browse/clothing/boys-clothing/5438_7712430_7809949
8,Little Boys' Clothing,boys clothing,"['boys', 'clothing']",[],"Free shipping and returns on little boys' clothing at Nordstrom.com. Find sizes 2T-7 for tops, bottoms, jeans, and more. Shop from top brands.",https://www.nordstrom.com/browse/kids/boys/clothing-sizes-2t-7
9,Kids Clothing,boys clothing,"['kids clothing', 'kids apparel']",[],"Shop kids clothing at Zumiez, carrying kids apparel from top skateboard and streetwear brands, like LRG, Volcom, and Neff. Free shipping to any Zumiez ...",https://www.zumiez.com/kids/
10,boys clothing & accessories | abercrombie kids,boys clothing,['boys clothing'],[],"Shop boys clothing & accessories at abercrombie kids. You'll find jeans, hoodies, sweatpants, t-shirts, and more.",https://www.abercrombie.com/shop/us/kids/boys
11,Big Boys' Clothes Size 8-22,boys clothing,"['clothes', 'boys', 'clothing']",[],"From shirts to socks, JCPenney has the best deals on clothes for boys size 8-22. Shop our selection of pants, shorts, & clothing sets.",https://www.jcpenney.com/g/baby-kids/all-boys-clothing/big-boys-8-22-clothing?id=cat11100001199
12,Boys' Clothing | REI Co-op,boys clothing,"['Boys', 'Clothing']",[],Shop for Boys' Clothing at REI - FREE SHIPPING With $50 minimum purchase. Curbside Pickup Available NOW! 100% Satisfaction Guarantee.,https://www.rei.com/c/boys-clothing
13,Boys' Clothes on Sale,boys clothing,"['Boys', 'Clothes', 'Boys', 'Clothes']",[],"Shop Boys' Clothes on Sale at DICK'S Sporting Goods. If you find a lower price on Boys' Clothes on Sale somewhere else, we'll match it with our Best Price ...",https://www.dickssportinggoods.com/f/boys-sale-apparel
14,All boys' clothing,boys clothing,"['boys', 'clothes']",[],"Kit out your kids with all they need in our boys' clothes collection. Find on-trend shorts, playful tops and underwear essentials at Marks & Spencer United ...",https://www.marksandspencer.com/us/l/kids/all-boys-clothing/
15,Baby Boy Clothing,boys clothing,"[""boy's clothing"", 'boy clothing']",[],"Find classic and current styles of boy's clothing at Belk. If your little one is still in diapers, our collection of baby boy clothing will keep him comfy.",https://www.belk.com/kids/boys-clothing/
16,Boys,boys clothing,"['Boys', 'Apparel']",[],Shop a great selection of Boys' Apparel with options for up to 70% off. Get free in-store returns at any Nordstrom Rack location.,https://www.nordstromrack.com/shop/kids/boy
17,Boys Clothing at Janie and Jack,boys clothing,"['boys clothing', 'boys clothes']",[],Janie and Jack crafts high quality boutique boys clothing and accessories. Shop our designer boys clothes featuring a wide assortment of classic styles and ...,https://www.janieandjack.com/boys-clothing
18,Boys Clothing Sizes 2-12,boys clothing,"['boys clothes', 'boys clothing']",[],"We think boys clothes should be as cool as the kid wearing them. Shop Tea Collection today for stylish, durable and adventurous boys clothing.",https://www.teacollection.com/boys-clothing
19,Boys' Clothing,boys clothing,"['Boys', 'Clothing']",[],Looking for Boys' Clothing? Shop Bootbarn.com for great prices and high quality products from all the brands you know and love. Check out more here!,https://www.bootbarn.com/kids/boys-clothing/boys-clothing/
20,Boys' Clothing | Burkes Outlet,boys clothing,"['boys clothing', 'boys clothing', 'boys clothes']",[],Shop affordable boys clothing at Burkes Outlet for cool clothes & boys clothing brands at prices you'll love! Great quality & style in cheap boys clothes.,https://www.burkesoutlet.com/shop/kids/boys/
21,"Boys: Clothing, Shoes & Jewelry",boys clothing,"['boys', 'clothing']",[],Shop a wide selection of boys' clothing at Amazon.com. Free shipping and returns on eligible items.,https://www.amazon.com/Boys-Clothes/b?ie=UTF8&node=1040666
22,Boys Clothing | Everyday Low Prices,boys clothing,"['Boys Clothing', 'boys clothes']",[],Boys Clothing at everyday low prices. Free shipping and free returns to our 1000+ stores. New affordable styles of boys clothes added daily.,https://www.rainbowshops.com/collections/boys-8-20
23,Boys Clothes,boys clothing,['Boys clothing'],[],"Find Boys clothing at Cookie's, the Kids' Department Store. Get discounted prices on...",https://www.cookieskids.com/boys_fashion.aspx
24,Boy's Clothing,boys clothing,"['Boys', 'Clothing']",[],"Shop the latest selection of Boys' Clothing at Foot Locker. Find the hottest sneaker drops from brands like Jordan, Nike, Under Armour ...",https://www.footlocker.com/category/boys/clothing.html
25,Teen Boys' Clothing & Men's Trendy Clothing,boys clothing,['boy clothing'],[],"Stay on trend with men's clothing and teen boy clothing from Aeropostale. Shop our selection of men's trendy clothing for jeans, shirts and more.",https://www.aeropostale.com/men-teen-boys/clothing/
26,"Boys Clothes | Kids, Toddler & Baby Clothing",boys clothing,"['boy clothes', 'boy clothes']",[],"Shop clothes for boys. Find baby boy clothes, toddler boy clothes, and more. Discover styles and clothing that your kids will love at Gymboree!",https://www.gymboree.com/us/c/boys-clothes
27,Clothing for Boys,boys clothing,"['Clothing', 'Boys', 'Clothing', 'Boys']",[],Find a great collection of Clothing for Boys at Costco. Enjoy low warehouse prices on name-brand Clothing for Boys products.,https://www.costco.com/boys-clothing.html
28,Buy Boys Clothes | Boyswear and Clothing | Next Official Site,boys clothing,"['boys clothes', 'boys clothing']",[],"Buy the latest boys clothes online at Next. Find wide range of boys clothing, schoolwear, boyswear and more for all ages. Shop online now!",https://www.next.us/en/boys
29,"500+ results for ""Boys' Clothing""",boys clothing,"['clothes', 'boys', 'boys', 'dresses']",[],"Sears offers a huge collection of clothes for boys. You get to choose from boys' shirts, activewear, dresses and more, which will make shopping a pleasant ...",https://www.sears.com/clothing-boys-clothing/b-5000919
30,Boys' Clothing For Sale Near You,boys clothing,"['Boys', 'Clothing']",[],Boys' Clothing. 65 results. Sort & filter ... Hurley Boys' Fleece Hoodie and Jogger Set. View more options ... Eddie Bauer Boys' Sherpa Lined Shirt Jacket.,https://www.samsclub.com/b/boys-clothing/13180126
31,Traditional Boys Clothing & Outfits,boys clothing,"['dress', 'boys']",[],"Discover the art of dress with La Coqueta's latest collection for boys. Choose from vintage-inspired silhouettes and timelessly tailored outfits, ...",https://us.lacoquetakids.com/pages/boy
32,New and used Boys' Clothing for sale - Marketplace,boys clothing,"['Boys', 'Clothing']",[],New and used Boys' Clothing for sale near you on Facebook Marketplace. Find great deals or sell your items for free.,https://www.facebook.com/marketplace/category/boys-clothing/
33,Boys' Clothing,boys clothing,"['boys', 'clothing']",[],Academy Sports + Outdoors is your one stop shop for young boys' clothing. Be ready for any event with boys' workout and athletic clothes.,https://www.academy.com/c/kids/boys-apparel
34,Little Boy's Clothing (Sizes 4-7) Discount Prices,boys clothing,"[""boy's clothing"", ""boy's clothing""]",[],Dress your handsome little man from head to toe with stylish boy's clothing in sizes 4-7 from Boscov's. Find little boy's clothing from top brands at ...,https://www.boscovs.com/category/boys-4-7-clothing
35,Shop Boys Clothing | Eighty Eight | United States,boys clothing,['Boys Clothing'],[],Shop Boys Clothing | Eighty Eight | United States.,https://www.eightyeightbrand.com/boys
36,Boy's Clothing Latest Styles,boys clothing,"[""Boy's Clothing""]",[],"Discounted shoes, clothing, accessories and more at 6pm.com! Score on the Style, Score on the Price. ... Boy's Clothing. 3653 items found. Sort By.",https://www.6pm.com/boys-clothing/CKvXAcABBOICAgEY.zso
37,Boys Clothing - Luxury Designer Boutique,boys clothing,"['clothing', 'boys']",[],"EGG New York offers premium clothing and accessories for boys ages newborn to 12 years. Explore top-sellers like the Perfect Pant, EGG pajamas, graphic tees ...",https://www.eggnewyork.com/collections/boys
38,Boys' & Teen Boys' Clothing,boys clothing,"['boys', 'clothing', 'boys', 'clothes', 'boy clothes']",[],Shop the latest in boys' & teen boys 'clothing at Tillys. Find surf and skater boys' clothes online. Browse our selection of trendy teen boy clothes now!,https://www.tillys.com/kids/boys/
39,Boys' Clothing,boys clothing,"['boys', 'clothing']",[],"Shop boys' clothing at Kids Foot Locker, your childrens' one stop athletic retailer. Kids Foot Locker boasts an unbeatable selection ...",https://www.kidsfootlocker.com/category/clothing/boys.html
40,Boy's Clothing,boys clothing,"['Boys', 'Boys', 'clothing']",[],Boys' Costume Waistcoat ... Boys' Costume Revolutionary War Coat ... 18th and early 19th Century clothing and personal accessories.,https://www.townsends.us/collections/boys-clothing
41,Boys' Clothing,boys clothing,"['boys', 'clothing']",[],"Check out our boys' clothing selection for the very best in unique or custom, handmade pieces from our shops.",https://www.etsy.com/c/clothing/boys-clothing
42,Favorite Places to Buy Boy Clothing,boys clothing,['boy clothing'],[],Finding clothes for baby boys can be difficult. I've rounded up my favorite places for boy clothing as well as accessories and shoes.,https://thehousethatlarsbuilt.com/2022/08/favorite-places-buy-boy-clothing.html/
43,Boys' Clothing - Kids,boys clothing,"['boys', 'clothing']",[],Check out Backcountry.com for a great selection of boys' clothing. Our expert gearheads will help outfit your kids for any adventure.,https://www.backcountry.com/boys-clothing
44,Boys' Clothes,boys clothing,"['boys', 'clothes', 'boy clothes']",[],"Whether you're searching for little boys' clothes or teen boy clothes, you know you'll find an excellent selection of boys' outfits when you shop at Lands' ...",https://www.landsend.com/shop/boys/S-y5e-xec
45,Boys' Clothes,boys clothing,"['boys', 'clothes', 'boys', 'clothes']",[],Shop boys' clothes at Gap Factory where everyday deals meet quality and comfort. Discover a wide selection of cool boys' clothes at a great value.,https://www.gapfactory.com/browse/division.do?cid=1079661
46,Boys' Clothing: Average savings of 49% at Sierra,boys clothing,"['Boys', 'Clothing']",[],"158 styles of Boys' Clothing from adidas, SmartWool, Cuddl Duds, and more at Sierra. Celebrating 30 Years Of Exploring.",https://www.sierra.com/boys-clothing~d~10650/
47,Boys Clothing,boys clothing,"['clothing', 'apparel', 'boys', 'boys', 'boys']",[],"Find the most adorable clothing and apparel for baby boys, toddler boys and big boys at Dillard's available from your favoirte brands.",https://www.dillards.com/c/boys-clothing
48,Boys' Clothing,boys clothing,"['Boys', 'clothing']",[],"SCHEELS has a top-performing collection of Boys' clothing featuring leading lifestyle brands like Nike, Patagonia, and more.",https://www.scheels.com/c/clothing/boys
49,Boys' Children's Clothes,boys clothing,"['boys', 'clothes']",[],"Outfit your child in style with boys' children's clothes at adidas. Discover solid colors, Trefoil graphics and more for the school, park or playground.",https://www.adidas.com/us/boys-children-clothing
50,Boys Clothes Lot for sale,boys clothing,['Boys Clothes'],[],Get the best deals on Boys Clothes Lot when you shop the largest online selection at eBay.com. Free shipping on many items | Browse your favorite brands ...,https://www.ebay.com/b/Boys-Clothes-Lot/11452/bn_7023544164
51,Discover the Boys' Clothing Collection,boys clothing,"['boys', 'clothes']",[],"Ready for any adventure, the Joules collection of boys' clothes has been designed with durability in mind. With bright colors and prints, discover the range ...",https://www.joulesusa.com/Boys-Clothing
52,Boys' Clothes Online,boys clothing,"['boys', 'clothing']",[],"Featuring supersoft fabrics and plenty of playful details, our boys' clothing collection pops with color and fizzes with style. Discover the range at Boden.",https://www.bodenusa.com/en-us/boys-clothing
53,Boys Kids' Clothes | Boys & Girls Clothes,boys clothing,['clothing'],[],"Shop kid's clothing from Hibbett Sports. Browse our collection of compression, hoodies, denim, hats and more. Get all the latest styles and brands online ...",https://www.hibbett.com/boys-and-girls/clothing/boys/
54,Boys' Designer Clothes & Accessories,boys clothing,"['boys', 'clothes']",[],Shop boys' designer clothes & accessories for everything from polo shirts and sweaters to jackets and suits. Free Fast Shipping With an ...,https://www.ralphlauren.com/kids-boys
55,Boy's Clothing Latest Styles + FREE SHIPPING,boys clothing,"['Clothing', 'Boys']",[],"Free shipping BOTH ways on Clothing, Boys from our vast selection of styles. Fast delivery, and 24/7/365 real-person service with a smile.",https://www.zappos.com/boys-clothing/CKvXAcABBOICAgEY.zso
56,Boys' Sale,boys clothing,"['boys', 'clothing']",[],Shop Brooks Brothers sale on boys' clothing and take advantage of discount prices. Legendary quality and customer service are a click away.,https://www.brooksbrothers.com/sale/boys
57,Boys Clothes (Sizes 4-14),boys clothing,['Boy Clothes'],[],Kid Boy Clothes. Find your kids' new favorites here! These easy styles have extra-special details that let their personalities shine.,https://www.carters.com/carters-kid-boy
58,"Boys' Clothing: Boardshorts, T-Shirts, Jackets, Button ...",boys clothing,['boys clothing'],[],Get them geared up in style with the latest boys clothing from Southern California surf brand Hurley.,https://www.hurley.com/collections/boys-clothing
59,Boys' Clothing,boys clothing,"['Boys', 'clothes', 'boys', 'wear']",[],Boys take a toll on their clothes. Shop Cavender's to find boys western wear that's dependable and ready for as much dirt as your little cowboy can find.,https://www.cavenders.com/boys-clothing/
60,Boys Clothes & Pajamas,boys clothing,['boys apparel'],[],"Keep your boy geared up in comfy clothes for all-day play, all year long. Rough-house rugged, our boys apparel is crafted with legendary softness.",https://www.hannaandersson.com/boys-clothes/
61,Boys' Clothing & Apparel,boys clothing,"['Boys', 'clothing', 'boys', 'apparel']",[],"Boys' clothing. Shop the latest boys' apparel from brands like Nike, Jordan, Kappa, and more. SHOP ...",https://www.jimmyjazz.com/pages/boys-clothing
62,Boys' Outdoor Clothing & Gear by Patagonia,boys clothing,"['boys', 'clothing']",[],Viva los fun piglets! We built our boys' outdoor clothing and gear to stand up to childhood—guaranteed. Free Shipping over $99 at Patagonia.com.,https://www.patagonia.com/shop/kids-boys
63,Boys Clothing (Sizes 4-14),boys clothing,"['Boy Clothes', 'boys apparel']",[],Iconic Kid Boy Clothes. OshKosh is iconic American boys apparel. Boys fashion with an enduring cool that's always on trend.,https://www.oshkosh.com/oshkosh-kid-boy
64,Vintage-Inspired Clothing for Boys,boys clothing,"['clothes', 'boys', 'boy']",[],"If you're shopping for classic toddler clothes, boys' outfits, or mix and match wardrobe pieces for a special little boy in your life, ...",https://www.bellabliss.com/collections/boys
65,Boys Clothing,boys clothing,['clothing'],[],Forget about lining up at clothing stores because we've got all of the essentials right here in our Kid's store. Explore a wonderful range of cute and ...,https://lordandtaylor.com/collections/little-big-boys-2-20
66,"Boys' Clothing & Athletic Apparel | Nike, Jordan, adidas",boys clothing,"['boys', 'apparel']",[],"Shop online at Finish Line for boys' apparel. Find the latest styles from top brands like Nike, adidas and Under Armour.",https://www.finishline.com/store/boys/clothing/_/N-sgacav
67,Chic Boys Clothes - Boys Apparel & Clothing,boys clothing,[],[],"Keep your little gentleman looking stylish in our polos, shorts, pullovers & more. You'll love our east coast prep meets west coast casual vibe. Shop Now!",https://www.johnnie-o.com/collections/boys
68,New Boys Clothing,boys clothing,['Boys Clothing'],[],New Boys Clothing. Hoodies & Pullovers Pants & Tights Jackets & Vests Tops & T-Shirts Shorts Tracksuits Jumpsuits & Rompers Socks Sets. 294 Results,https://www.nike.com/w/new-boys-clothing-1onraz3n82yz6ymx6
69,Boys Clothing And Accessories Sale (8 Products),boys clothing,['Boys Clothing'],[],"Shop the Boys Clothing & Accessories Sale at Journeys Kidz. Marks Downs and Discounted Boys Shirts, Jackets, Pants, Tracksuits, Socks, Windbreakers, ...",https://www.journeys.com/kidz/products/boys-sale-clothing-and-accessories
70,Boys' Clothing,boys clothing,"['Boys', 'Clothing']",[],Shop quality Boys' Clothing at Country Outfitter for hard to beat prices. You'll find your country when you shop Country Outfitter today!,https://www.countryoutfitter.com/kids/boys/boys_clothing/
71,Boys Clothes & Outfits (Big Boy Sizes 8-20),boys clothing,"['boys', 'clothing']",[],"Find all the latest big boys' designer clothing & accessories at Bloomingdale's. Free Shipping and Free Returns available, or buy online and ...",https://www.bloomingdales.com/shop/kids/big-boy-clothes-8-20?id=23723
72,Boys Clothes & Accessories | Cotton On Kids,boys clothing,['boys clothes'],[],"Shop on-trend boys clothes and accessories at Cotton On Kids. Brows boys jeans, tops, shirts, jumpers & more. Free Shipping Available*",https://cottonon.com/US/kids/kids-boys-1-8/
73,Boys' and Junior Boys' Outdoor Clothing,boys clothing,"['Boys', 'Apparel', 'Boys Clothing', 'Boys Clothes']",[],Boys' Apparel · Boys Clothing That Holds Up To Rough Play Time · T-Shirt To Down Jacket: Get Clothes For All Seasons · Boys Clothes They'll Love To Show Off · Shop ...,https://www.thenorthface.com/en-us/kids/boys-apparel-c211735
74,Shirts,boys clothing,['Boys Clothing'],[],SEARCH · LOCATIONS · PROCESSING & SHIPPING · RETURNS & EXCHANGES · JOBS. SIGN UP FOR OUR NEWSLETTER. © 2023 Jungle Boys Clothing.,https://jungleboysclothing.com/collections/jb-site
75,Disney Boys' Clothing | shopDisney,boys clothing,"[""Boy's Clothes"", 'boys', 'clothes']",[],"Shop Boy's Clothes featuring Disney boys' clothes and more featuring Marvel, Star Wars, Spiderman, Captain America, Toy Story and more at Disney's official ...",https://www.shopdisney.com/clothing/boys/
76,Boys' Clothing,boys clothing,['boys clothing'],[],"Shop great deals on boys clothing & apparel at Bass Pro Shops. Find hundreds of options from top brands Under Armour, Carhartt, Columbia & more in all ...",https://www.basspro.com/l/boys-clothing
77,Bailey Boys,boys clothing,"['clothing', 'Boys', 'clothing']",[],"Classic children's clothing of the highest quality, making Bailey Boys one of the best labels in children's clothing. Accepting new wholesale customers!",https://baileyboys.com/
78,Boys' Clothing,boys clothing,"['boys', 'clothing']",[],"Outfit outdoorsy boys with boys' clothing from Cabela's. Shop hoodies, pants, tee shirts, jeans and more from brands like Cabela's, The North Face, ...",https://www.cabelas.com/l/boys-clothing
79,Designer Clothing for Boys,boys clothing,['boys clothing'],[],Global shipping ✈. Get your mini me started early in the style stakes with our edit of designer boys clothing at Farfetch.,https://www.farfetch.com/shopping/kids/boys-clothing-3/items.aspx
80,Boys Clothing Sale,boys clothing,['boys'],[],Up to 40% off select gear. Find great deals for all weather and activities with outdoor gear for boys from Columbia Sportswear.,https://www.columbia.com/c/boys-clothing-sale/
81,Boys Clothing | Made in the USA,boys clothing,['boys clothes'],[],"City Threads offers quality boys clothes, pajamas and more all made and manufactured in America! Shop our selection of tees, pants, & more today.",https://www.citythreads.com/collections/boys
82,"Boys Clothing - Shop & Find Shirts, Jeans, Shoes & Sets at ...",boys clothing,['Boys clothing'],[],"At DrJays, we carry a large selection of Boys clothing including Shirts, Jeans, Shoes & Sets.",https://www.drjays.com/shop/G2-R400/boys.html
83,Boys' Clothing from 2 to 9 Years Old,boys clothing,"['Boys', 'Clothing']",[],"FREE SHIPPING from $150 and free returns BUY ONLINE Boys' Clothing from 2 to 9 years old: pants, coats, t-shirts, polo shirts, hoodies and sweatshirts, ...",https://www.mayoral.com/en-us/unitedstates/boy-usu1
84,Boys Clothing & Shoes On Sale Up To 90% Off,boys clothing,"[""boy's clothing""]",[],"thredUP has thousands of pre-owned boy's clothing, shoes & accessories at up to 90% off retail price! Enhance your wardrobe without breaking the bank with ...",https://www.thredup.com/kids/boys
85,Boys Clothes | Shirts & Pants,boys clothing,"['Boys', 'Clothing']",[],"Boys' Clothing 1–6 Years. Update their closet with stylish essentials, from sweaters and overalls to pants and T-shirts perfect for playtime.",https://www.thewhitecompany.com/us/Baby-and-Children/View-All-Childrens/Boys/c/boys-clothing
86,Boys Designer Clothes 4-14 Years,boys clothing,"['Boys', 'Clothes']",[],"Discover the exclusive Boys designer Clothes (4-14 Years) collection by VERSACE. Buy online the iconic VERSACE products, luxury and elegance models.",https://www.versace.com/us/en-us/children/boys-4-14-years/clothing/
87,"Boys Clothing | T Shirts, Shorts, Jeans",boys clothing,['boys clothing'],[],"Shop from a huge selection of boys clothing from brands like adidas, Nike, PUMA, Converse & more. Choose from sportswear or casual outfits.",https://www.sportsdirect.com/kids/clothing/boys
88,"Clothing for Boys | Tops, Bottoms & More",boys clothing,"['dress', 'clothing', 'boys']",[],"From skate park to school playground, dress your little guy in Volcom clothing. Find boys' tank tops, shirts, shorts & more with free shipping on orders ...",https://www.volcom.com/collections/kids-boys
89,Boys' Designer Clothes & Luxury Fashion,boys clothing,"[""Boy's Clothing""]",[],"Designer Boy's Clothing at Saks: Enjoy free shipping and returns, and discover new arrivals from today's top brands.",https://www.saksfifthavenue.com/c/kids/boys
90,Boys Clothes & Accessories,boys clothing,['boys clothes'],[],"Shop boys clothes & accessories for brands that wow at prices that thrill. Free Shipping on $89+ orders online, easy, in store returns.",https://www.marshalls.com/us/store/shop/boys-clothes-accessories/_/N-369287662
91,Boys' Clothing and Accessories,boys clothing,"['Boys', 'Clothing']",[],Find a wide selection of Boys' Clothing . We have all the best brands at great prices!,https://www.farmandfleet.com/boys-clothes/
92,Clothing for Boys (4-12 years),boys clothing,"['Clothing', 'Boys', 'Boys']",[],"Discover the Selection of Clothing for Boys Aged 4 - 12 Years at GUCCI.com. Shop Boys' Shirts, Trousers and More.",https://www.gucci.com/us/en/ca/children/boys/clothing-for-boys-4-12-years-c-children-boys-clothing-4-12
93,Boys' Clothes | Daily Deals on Top Brands for Toddler to ...,boys clothing,"[""boy's clothing""]",[],It can be tricky keeping up with a growing boy's clothing needs. Discover Zulily's wide selection of clothes for every occasion that every kid should have in ...,https://www.zulily.com/category/boys
94,Fashion Boys Clothing | SHEIN USA,boys clothing,['Boys Clothing'],[],Free Returns ✓ Free Shipping On Orders $49+ ✓ 1000+ New Arrivals Dropped Daily ✓ Shop for Boys Clothing at SHEIN USA!,https://us.shein.com/category/Boys-Clothing-B-sc-00809642.html?lang=us
95,Boys Clothing | Boys Streetwear,boys clothing,"['boys', 'clothing']",[],"Browse our new arrivals in boys' clothing at True Religion. Create luxe streetwear looks with our tees, hoodies, jeans & more for boys from True Religion.",https://www.truereligion.com/boys-designer-clothes
