position,title,query,snippet_highlighted_words,rich_snippet_list,snippet,link39,"Making, Selling and Wearing Boys' Clothes in Late-Victorian ...",boys clothing set,"['boys', 'clothes', 'set']",[],"drawings of boys ' clothes , presumably intended for a sales catalogue.17 They ... These showed between ten and thirty boys in different suits , set out in ...",https://books.google.ca/books?id=gyyD9fJh-GYC&pg=PA92&lpg=PA92&dq=boys+clothing+set&source=bl&ots=UxTBuRioGt&sig=ACfU3U19cUCoahiKcvOAWJUc8HABDmcfew&hl=en&sa=X&ved=2ahUKEwjv9OHP-sv8AhVcl1YBHRpRB584rAIQ6AF6BQiUARAD
40,Clothing Through American History: The Civil War Through the ...,boys clothing set,"['Boys', 'set', 'clothing']",[],"Boys could get dirty without worrying about their mothers' reactions, as the dirt did not ruin the overalls in the same way it would a nice set of clothing.",https://books.google.ca/books?id=Nbs8ks20tt8C&pg=PA353&lpg=PA353&dq=boys+clothing+set&source=bl&ots=Wp7_9VOfKx&sig=ACfU3U2X7hxmWv2jo4DjZ3dMT1msI6VE4Q&hl=en&sa=X&ved=2ahUKEwjv9OHP-sv8AhVcl1YBHRpRB584rAIQ6AF6BQiiARAD
41,"Men's, Youths' and Boys' Clothing Manufacturing Corporations",boys clothing set,"['BOYS', 'CLOTHING', 'set']",[],"Exhibit "" B "" MEN'S , YOUTHS ' AND BOYS ' CLOTHING MANUFACTURING ... Cost of goods sold : ( Exclusive of items set forth below as "" Expenses "" ) 5 .",https://books.google.ca/books?id=APCGnFvppPQC&pg=PA16&lpg=PA16&dq=boys+clothing+set&source=bl&ots=RqwfxidkAA&sig=ACfU3U0oNfnulV4u0A5stFoWJWVYJghnag&hl=en&sa=X&ved=2ahUKEwjv9OHP-sv8AhVcl1YBHRpRB584rAIQ6AF6BQioARAD
42,Federal Register,boys clothing set,"['Set', 'Set', 'boys', 'clothing']",[],Other Set - Asides ( g ) Set - asides and deliveries of rayon fabrics for other specified ... ( 2 ) Linings for certain men's and boys ' clothing .,https://books.google.ca/books?id=s1CP7txrhbIC&pg=PA5351&lpg=PA5351&dq=boys+clothing+set&source=bl&ots=1Yz4I3zYzR&sig=ACfU3U2XQaTmNxDJah_dpioYOLy-8QdhfA&hl=en&sa=X&ved=2ahUKEwjv9OHP-sv8AhVcl1YBHRpRB584rAIQ6AF6BQipARAD
43,"Location of Manufacturing Plants by County, Industry, and ...",boys clothing set,"['DRESS', 'SET', 'BOYS']",[],WOMEN'S & CHILDREN'S UNDERWEAR FABRIC DRESS AND WORK GLOVES . ... SET - UP PAPERBOARD BOXES . ... N नWNNN 1 13 2 12 MEN'S AND BOYS ' SUITS AND COATS .,https://books.google.ca/books?id=iplOU7slE2gC&pg=RA1-PA16&lpg=RA1-PA16&dq=boys+clothing+set&source=bl&ots=H1zDqqA3ZY&sig=ACfU3U3xeMrZEZnzF4sHzPt81Tgqzj-wYA&hl=en&sa=X&ved=2ahUKEwjv9OHP-sv8AhVcl1YBHRpRB584rAIQ6AF6BQieARAD
1,Clothing - Walmart.com,boys clothing set,"['Boys', 'Clothing', 'Sets']",[],Boys' Clothing · Activewear · Coats & Jackets · Hoodies & Sweatshirts · Jeans · Multipacks · Outfit Sets · Pajamas & Robes · Pants · Shorts · Socks ...,https://www.walmart.com/cp/clothing/5438
2,"Boy's Sale & Clearance | Clothing, Shoes & Accessories",boys clothing set,"['boys', 'clothes', 'boys']",[],"Check out the Matalan's boys' sale for huge savings on clothes, shoes, accessories & more. Whether it's for newborn babies or teenage boys, shop now.",https://www.matalan.co.uk/kids-clothing/boys/offers/sale
3,F&F boys' & girls' clothes | Kids' Clothes - Tesco,boys clothing set,"['clothing', 'sets']",[],"Kids' clothing. Keep them comfy this season with our selection of long-sleeve tees, graphic prints and mix and match sets – from as little as £3.",https://www.tesco.com/zones/clothing/kids
4,Bibicola Spring Autumn Baby Boys Clothing Set Casual Kids ...,boys clothing set,['clothing set'],[],"Get clothing set at a bigger saving. Casual cartoon print romper and floral trousers, which will make your kids look cool and attractive.",https://www.aliexpress.com/item/32802954967.html
5,"Baby Clothes | Outfits, Accessories & Shoes | H&M US",boys clothing set,"['Clothing', 'Boy', 'Clothing']",[],... Baby Girl: View all · New Arrivals · Clothing · Outerwear · Accessories · Shoes; Baby Boy: View all · New Arrivals · Clothing · Outerwear · Accessories ...,https://www2.hm.com/en_us/baby.html
6,Keedo: Shop for Babies & Kids,boys clothing set,['clothes'],[],"Keedo, a trusted and proudly South African brand, blends imagination, comfort and style to create functional and fashionable designer clothes for kids ...",https://www.keedo.co.za/
7,"Rainbow: Womens, Plus Size and Kids | Everyday Low Prices",boys clothing set,['clothing'],[],"Everyday low prices on clothing, shoes and accessories for women, plus size and kids. Free shipping and free returns to our 1000+ stores.",https://www.rainbowshops.com/
8,Kids Clearance & Sale Clothing | The Children's Place,boys clothing set,"['clothes', 'Boy', 'Set']",[],"Find kids clothes on sale at The Children's Place, where big fashion meets ... Toddler Boy Clearance ... Sugar & JadeGirls Merry' Long Sleeve Pajama Set.",https://www.childrensplace.com/us/c/clearance-us
9,Baby Clothes Clearance Doorbuster Deals,boys clothing set,"['clothes', 'clothes', 'Boys', 'Set']",[],"Shop doorbuster baby clothes sales from Gerber Childrenswear. Find baby clothes ... Arizona Cardinals 3-Piece Baby Boys Bodysuit, Bib, and Cap Set.",https://www.gerberchildrenswear.com/collections/doorbusters
10,New Design Fashion Boys Boy Clothes 2 Pieces Sets ...,boys clothing set,"['Boy Clothes', 'Sets']",[],"New Design Fashion Boys Boy Clothes 2 Pieces Sets Children Clothes For Kids 2-7 Years 20a518 , Find Complete Details about New Design Fashion Boys Boy ...",https://www.alibaba.com/product-detail/New-Design-Fashion-Boys-Boy-Clothes_62155347084.html
11,All Boys - Dunnes Stores,boys clothing set,"['boys clothing', 'Set']",[],"Comfort and style combine in our range of boys clothing. From classic knitwear, jeans and jackets to cool ... Ireland Football Set (6 months-14 years).",https://www.dunnesstores.com/c/kids/boys-2-14yrs/all-boys
12,Boy Hooded Tracksuit Clothes set Kids Clothing Sets,boys clothing set,"['Boy', 'Clothes set', 'Clothing Sets']",[],Boy Hooded Tracksuit Clothes set Kids Clothing Sets Style: Active Material: COTTON Gender: Unisex Sleeve Length(cm): Full Pattern Type: Patchwork Collar: ...,https://mywebstoreshopping.com/en-us/products/boy-hooded-tracksuit-clothes-set-kids-clothing-sets-4-6-8-10-12-14-year
13,Valentine's Day Shop | Carter's | Free Shipping,boys clothing set,"['clothes', 'Boy', 'Boy']",[],"Shop kids Valentine's Day Outfits, including baby Valentine's outfits and toddler Valentine's Day clothes. Baby Girl · Baby Boy · Toddler Girl · Toddler Boy.",https://www.carters.com/carters-valentines-day
14,"Kids clothes - comfy fashion, great prices - C&A",boys clothing set,['boys'],[],Kids ; SALE – new styles now available. Discover new favourites and save up to 50%. Save now ; Jumpers. Irresistible jumpers Shop girls' jumpersShop boys' jumpers.,https://www.c-and-a.com/eu/en/shop/kids
15,Clothing & Outfits for Stuffed Animals | Build-A-Bear®,boys clothing set,"['clothing', 'Clothing', 'Set']",[],Display yours with Teddy bear clothing from Build-A-Bear Workshop. ... Teddy Bears Clothing ... Online Exclusive Colorful Hearts PJ Set. $11.50. Add to Bag.,https://www.buildabear.com/stuffed-animals/clothing-for-stuffed-animals
16,Baby & Kids Clothing Sale | Special Offers - John Lewis,boys clothing set,['Boys Clothes'],[],All Nursery Offers · All Kids' Bedroom Offers · All Baby & Toddler Offers · All Girls Clothes Offers · All Boys Clothes Offers · All Toys Offers ...,https://www.johnlewis.com/special-offers/baby-childrenswear-offers/c600001289
17,"Tommy Bahama: Men's & Women's Clothing, Beach & Home",boys clothing set,"['clothing', 'dresses']",[],"Shop TommyBahama.com for luxury lifestyle clothing for men and women. Find shirts, dresses, swimwear, beach chairs and home décor inspired by the island ...",https://www.tommybahama.com/
18,"Polos, Clothing & Apparel Online | LACOSTE",boys clothing set,['clothing'],[],"Shop LACOSTE online for men's, women's & kids polos, clothing, shoes, watches, bags, fragrances and sportswear. Free shipping on orders over $75.",https://www.lacoste.com/us/
19,Hanna Andersson | Premium Kids Clothes and Matching ...,boys clothing set,[],[],"Hanna Pajamas look great and feel even better. Shop Babies, Kids, Adults, and Pets too! You'll understand why people say “best pajamas ever” since 1983.",https://www.hannaandersson.com/
20,Boys Clothes Set Short Sleeve T-Shirt +Pants Summer Kids ...,boys clothing set,['Boys Clothes Set'],[],Boys Clothes Set Short Sleeve T-Shirt +Pants Summer Kids Boy Sports Suit Children Clothing Outfits Teen 5 6 7 8 9 10 11 12 Years · FitFits true ...,https://wap.aliexpress.com/item/1005002794349788.html?browser_id=6bbc59595201493abf8caa14bdda9201&aff_trace_key=&aff_platform=msite&m_page_id=001182850d080017d0dc62f16249cb6a31b0d821ea&pdp_npi=2%40dis!USD!!10.1!!!!!%40210318be16601563530443611e395b!12000022218682602!sea&algo_pvid=753d4a01-7359-42de-be96-22bcd0924fea
21,Fashion Kids Boys Clothing Set Spring Autumn ... - AliExpress,boys clothing set,['Boys Clothing Set'],[],Fashion Kids Boys Clothing Set Spring Autumn Kids Clothes Set Boys Sports Suit Children Student Hip Hop Streetwear Clothes. Color : Green.,https://m.aliexpress.com/item/1005001927598319.html
22,Guys and Co.: Guys & Co. | Men's Clothing | Boys Clothing,boys clothing set,['boys'],[],"Latest trends in men's and boys fashion. Offering t-shirts, pants, shorts, loungewear, activewear, sweatshirts, dresswear, wallets, belts, socks and shoes.",https://guysandco.com/
23,Jungle Lion Boys Theme 1st Birthday Boy Bow Tie Bodysuit ...,boys clothing set,"['Boys', 'Boy', 'Outfit', 'Dress', 'Set', 'Dress']",[],Jungle Lion Boys Theme 1st Birthday Boy Bow Tie Bodysuit Outfit ... Infant Baby Girls Christmas Elk Costume Romper Dress+Hair Hoop Set Xmas Dress Up ...,https://dorencol.com.ar/mastere/Outfits-Sets-bcnox-651228-nq8fy/
24,Defense - Volume 3 - Page 25 - Google Books Result,boys clothing set,"['set', 'boys', 'clothing']",[],"A new category is set up under boys ' clothing to include sizes from 2 to 10 , inclu- sive , corresponding with a similar category for girls ' clothing in ...",https://books.google.com/books?id=Ow4rAAAAMAAJ&pg=RA19-PA25&lpg=RA19-PA25&dq=boys+clothing+set&source=bl&ots=UmKQd-MeVT&sig=ACfU3U1usPjHEMJWXlsLF0cLH2XszKF5jQ&hl=en&sa=X&ved=2ahUKEwjbq6LR-sv8AhV-KlkFHaZlBDg4kAMQ6AF6BAh2EAM
25,"Making, Selling and Wearing Boys' Clothes in Late-Victorian ...",boys clothing set,"['boys', 'set']",[],type.62 Photographs of boys from schools and institutional archives are analysed ... The first set had clear dates but little consumption data (prices and ...,https://books.google.com/books?id=57SoDQAAQBAJ&pg=PT340&lpg=PT340&dq=boys+clothing+set&source=bl&ots=gv2G3C5yJx&sig=ACfU3U0qLx-Vo1ECaqXakgvw6im7KFvD2w&hl=en&sa=X&ved=2ahUKEwjbq6LR-sv8AhV-KlkFHaZlBDg4kAMQ6AF6BAhkEAM
26,Official Gazette of the United States Patent and Trademark ...,boys clothing set,"['Apparel', 'Boys', 'Clothing', 'Sets']",[],"SILVER SPOON For Wearing Apparel - Namely , Men's and Ladies ' , Boys ' and ... For Infant's Clothing - Namely , Shawls ; Sweaters ; Booty Sets -Namely ...",https://books.google.com/books?id=WvvQAAAAMAAJ&pg=PA105&lpg=PA105&dq=boys+clothing+set&source=bl&ots=mu7NuBrsxK&sig=ACfU3U1Ya_SZhdRAVV3QOW9FbiePmeQRog&hl=en&sa=X&ved=2ahUKEwjbq6LR-sv8AhV-KlkFHaZlBDg4kAMQ6AF6BAhyEAM
27,The Complete Ministry of Curiosities Series: 10-Book Boxed Set,boys clothing set,"['boys', 'clothing']",[],"Thirteen year-old boys still have some growing to go, but you never changed. ... When she returned inside, I stole some boys' clothing from the line.",https://books.google.com/books?id=FRz0DwAAQBAJ&pg=PT124&lpg=PT124&dq=boys+clothing+set&source=bl&ots=qL17E79JS_&sig=ACfU3U04XyDeobqJ4dAfwptV7SvNAqYOdw&hl=en&sa=X&ved=2ahUKEwjbq6LR-sv8AhV-KlkFHaZlBDg4kAMQ6AF6BAhzEAM
28,The Boys' Outfitter - Volumes 1-2 - Page 57 - Google Books Result,boys clothing set,"['set', 'boys', 'clothing']",[],"Under the terms of the first the entire set of twelve cuts , either as ... Too little advertising has been allotted to style in boys ' clothing .",https://books.google.com/books?id=0RdbAAAAYAAJ&pg=PA57&lpg=PA57&dq=boys+clothing+set&source=bl&ots=L2oKl7v1D8&sig=ACfU3U2Tp9fy0wU1UAQgGQnxQCk7FQ--oA&hl=en&sa=X&ved=2ahUKEwjbq6LR-sv8AhV-KlkFHaZlBDg4kAMQ6AF6BAh1EAM
29,"Sessional Papers - Volume 22, Issue 3 - Page 54 - Google Books Result",boys clothing set,"['Boys', 'clothing', 'sets']",[],"Boys ' clothing ......... 25 18 Socks and neckties ;. do kilts , 2 sets 30 20 Spoons , knives and forks ..... Box of paints and brushes 5 Suits , 5 Brush ...",https://books.google.com/books?id=exBAAQAAMAAJ&pg=RA7-PA54&lpg=RA7-PA54&dq=boys+clothing+set&source=bl&ots=kTQc2yXPI5&sig=ACfU3U3nKQclbmlXRm4NUoRYd7FsHpUhMA&hl=en&sa=X&ved=2ahUKEwjbq6LR-sv8AhV-KlkFHaZlBDg4kAMQ6AF6BAhoEAM
30,Printers' Ink - Volume 100 - Page 110 - Google Books Result,boys clothing set,"['boys', 'clothing', 'set']",[],"... who are using a new plan for selling boys ' clothing through dealers from ... in which the system is set forth , “ but don't forget it needs ' elbow ...",https://books.google.com/books?id=DPg1AAAAMAAJ&pg=RA3-PA110&lpg=RA3-PA110&dq=boys+clothing+set&source=bl&ots=VKRJa-L7MI&sig=ACfU3U3nbfcw_c9Nk2mUEzRZn3VTRSeqDw&hl=en&sa=X&ved=2ahUKEwjbq6LR-sv8AhV-KlkFHaZlBDg4kAMQ6AF6BAh0EAM
31,"United States Economist, and Dry Goods Reporter",boys clothing set,"['boys', 'clothing']",[],"All clothing department . of them are simple , inexpensive and pracWhy Boys ' Business Is Lacking He buys a few lines of boys ' clothing tical .",https://books.google.com/books?id=62VFAQAAMAAJ&pg=RA5-PA19&lpg=RA5-PA19&dq=boys+clothing+set&source=bl&ots=ucp8GONTT-&sig=ACfU3U2QCzOFKyGFJGYzRIACTpmZwwcLig&hl=en&sa=X&ved=2ahUKEwjbq6LR-sv8AhV-KlkFHaZlBDg4kAMQ6AF6BAhjEAM
1,Boys Clothing Sets & Outfits - Macy's,boys clothing set,['Boys Clothing Sets'],[],Shop Boys Clothing Sets & Outfits at Macys.com and find the best styles and deals from top brands! Free shipping available at macys.com and ...,https://www.macys.com/shop/kids-clothes/boys-clothing-sets-and-outfits?id=121344
2,Boys' Clothing Sets - Amazon.com,boys clothing set,['boys clothing sets'],[],"Shop for boys clothing sets on Amazon.com. Free shipping and free returns on ... Boys' 3-Piece Pullover Sweater, Long Sleeve Dress Shirt, and Pants Set.",https://www.amazon.com/Boys-Clothing-Sets/b?ie=UTF8&node=1288606011
3,Big Boys (8-20) - Boys' Clothing Sets - Amazon.com,boys clothing set,"['Clothing', 'Sets', 'Sets']",[],"Online shopping for Clothing, Shoes & Jewelry from a great selection of Short Sets, Pant Sets & more at everyday low prices.",https://www.amazon.com/Boys-Clothing-Sets-Big-8-20/s?keywords=Boys%27+Clothing+Sets&rh=n%3A1288606011%2Cp_n_size_six_browse-vebin%3A4940401011&c=ts&ts_id=1288606011
4,Boys' Sets - Nordstrom Rack,boys clothing set,"['Boys', 'Sets', 'Boys', 'Sets']",[],Shop a great selection of Boys' Sets at Nordstrom Rack. Find designer Boys' Sets up to 70% off and get free shipping on orders over $100.,https://www.nordstromrack.com/shop/kids/boy/sets
5,Boys' Outfits | Kohl's,boys clothing set,"['Boys', 'Clothing Sets']",[],Boys' Clothing Sets ... Boys 4-7 Nike Sportswear Futura Taping Tricot Jacket & Pants Set ... Toddler Boy Nike Cyberpunk Tricot Zip Up Jacket & Pants Set.,https://www.kohls.com/catalog/boys-kids-clothing-sets-clothing.jsp?CN=Gender:Boys+AgeAppropriate:Kids+Category:Clothing%20Sets+Department:Clothing
6,Boys' Clothing & Outfit Sets | Pant & Short Sets - JCPenney,boys clothing set,"['boys', 'clothing sets']",[],Choose boys' clothing sets that are matched and ready for play from JCPenney! Outfits with tops and bottoms are sure to make stocking his wardrobe ...,https://www.jcpenney.com/g/baby-kids/clothing-sets/boys?id=cat11100000054
7,Boys' Outfits & Clothing Sets 2T-7 | Dillard's,boys clothing set,"['Boys', 'Clothing Sets']",[],"Shop our collection of Boys' Outfits & Clothing Sets 2T-7 from your favorite brands including Nike, Under Armour, and more available at Dillard's.",https://www.dillards.com/c/kids-boys-outfits-sets
8,boys' sets & outfits (2-8y) - H&M,boys clothing set,"['boys', 'sets']",[],"Make everyday dressing a breeze with our boys' pre-packed outfits and sets. Find matching sweatshirts and joggers, as well as multipacks at H&M.",https://www2.hm.com/en_us/kids/boys/clothing/sets-outfits.html
9,Toddler Boy Outfits - Belk,boys clothing set,"['boys', 'clothing sets']",[],"Save time and take the guesswork out of dressing your kids with the selection of boys' outfits at Belk. Discover matching clothing sets ideal for school, play ...",https://www.belk.com/kids/boys-clothing/sets-outfits/
10,Boys' Clothing Sets - Walmart,boys clothing set,"['Boys', 'Outfit', 'Clothes Set']",[],"IBTOM CASTLE Baby Boys First Birthday Cake Smash Outfit Bloomers Diaper Cover Pants + Suspenders + Bow Tie Leisure Clothes Set, 3-Piece.",https://www.walmart.com/c/kp/boys-clothing-sets
11,Little Boys Outfit Sets in Little Boys (4-7) Clothing - Walmart.com,boys clothing set,"['Boys', 'Boy', 'Boy', 'Set']",[],KIMI BEAR Toddler Boys Outfits 4T Toddler Boy Autumn Winter Outfits 5T Toddler Boy Black And White Dinosaur Print Hooded Long Sleeve Top + Pants 2PCs Set.,https://www.walmart.com/browse/clothing/little-boys-outfit-sets/5438_7712430_7809949_9487749_3429944
12,Big Boys Outfit Sets - Walmart.com,boys clothing set,"['Boy Clothes', 'Set']",[],6Y Kids Boy Clothes Little Boys 2PCS Outfits 6-7 Years Boys Long Sleeve Round Neckline Tops Pants Set Green. 94.3 out of 5 Stars. 9 reviews. Save with.,https://www.walmart.com/browse/clothing/big-boys-outfit-sets/5438_7712430_7809949_3361927_3808984
13,Clothing Sets for Boys | Costco,boys clothing set,"['Clothing Sets', 'Boys', 'Clothing Sets', 'Boys']",[],Find a great collection of Clothing Sets for Boys at Costco. Enjoy low warehouse prices on name-brand Clothing Sets for Boys products.,https://www.costco.com/boys-sets.html
14,Amazon Best Sellers: Best Boys' Clothing Sets,boys clothing set,"['Boys', 'Clothing Sets']",[],"Discover the best Boys' Clothing Sets in Best Sellers. Find the top 100 most popular items in Amazon Clothing, Shoes & Jewelry Best Sellers.",https://www.amazon.com/Best-Sellers-Boys'-Clothing-Sets/zgbs/fashion/1288606011
15,Amazon.com: Boys' Clothing Sets,boys clothing set,"['Boy Dress', 'Set']",[],2pcs Baby Boy Dress Clothes Toddler Outfits Infant Tuxedo Formal Suits for Kids Long Sleeve Shirt + Pants Set · baby-boys Toddler 2-piece Waffle Hooded Top & ...,https://www.amazon.com/Boys-Clothing-Sets-Solid/s?keywords=Boys%27+Clothing+Sets&rh=n%3A1288606011%2Cp_n_feature_twelve_browse-bin%3A23575358011&c=ts&ts_id=1288606011
16,Amazon.com: Boys' Clothing Sets,boys clothing set,"['Clothing', 'Sets', 'Sets']",[],"Online shopping for Clothing, Shoes & Jewelry from a great selection of Short Sets, Pant Sets & more at everyday low prices.",https://www.amazon.com/Boys-Clothing-Sets-Beige/s?keywords=Boys%27+Clothing+Sets&rh=n%3A1288606011%2Cp_n_size_browse-vebin%3A2343348011&c=ts&ts_id=1288606011
17,Little Boys Outfit Sets | Everyday Low Prices - Rainbow Shops,boys clothing set,['Boys Outfit Sets'],[],Little Boys Outfit Sets at everyday low prices. Free shipping and free returns to our 1000+ stores. New affordable styles of outfit sets for little boys ...,https://www.rainbowshops.com/collections/boys-outfit-sets-4-7
18,Sets Big Boys (8-20) Boys Clothing - Macy's,boys clothing set,"['Sets', 'Boys', 'Clothing', 'Sets', 'boys', 'clothes']",[],Sets Big Boys (8-20) Boys' Clothing at Macy's come in a variety of styles and sizes. Shop Sets Big Boys (8-20) boys' clothes from top brands that your kids ...,"https://www.macys.com/shop/kids-clothes/boys-clothing/Kids_apparel_type,Size_range/Sets,Big%20Boys%20%288-20%29?id=61999"
19,"Boys Clothing Sets | Pants, Suits and Sets for Boys from Sears",boys clothing set,"['clothing sets', 'boys', 'clothes']",[],"Buy fashionable clothing sets for boys from Sears. You get to choose colorful shorts, shirts, pants and other clothes for a blend of style and comfort.",https://www.sears.com/clothing-boys-clothing-boys-collections-sets/b-5006938
20,Boys' Clothing For Sale Near You - Sam's Club,boys clothing set,"['Boys', 'Clothing', 'Set', 'Set']",[],Boys' Clothing · Member's Mark Boys' 2 Pack Flannel Shirt. View more options · Hurley Boys' Fleece Hoodie and Jogger Set · Champion Boys' Lightweight Active Set.,https://www.samsclub.com/b/boys-clothing/13180126
21,Boys' Clothing Sets - Amazon.com,boys clothing set,"['Set', 'Set', 'Boy Dress']",[],Justice League Superman Big Boys Fleece 3 Piece Set Hoodie T-Shirt Pants · Pixar Cars Lightning McQueen Fleece Hoodie & Pants Set · 2pcs Baby Boy Dress Clothes ...,https://www.amazon.com/Boys-Clothing-Sets-Black/s?keywords=Boys%27+Clothing+Sets&rh=n%3A1288606011%2Cp_n_size_browse-vebin%3A2343349011&c=ts&ts_id=1288606011
22,US Polo Assn. - Boys' Clothing Sets - Amazon.com,boys clothing set,"['Clothing', 'Sets', 'Sets']",[],"Online shopping for Clothing, Shoes & Jewelry from a great selection of Short Sets, Pant Sets & more at everyday low prices.",https://www.amazon.com/Boys-Clothing-Sets/s?keywords=Boys%27+Clothing+Sets&rh=n%3A1288606011%2Cp_89%3AU.S.+Polo+Assn.&c=ts&ts_id=1288606011
23,Best Boys' Clothing Sets - Amazon.com,boys clothing set,"['Boys', 'Clothing Sets']",[],"Discover the best Boys' Clothing Sets in Best Sellers. Find the top 100 most popular items in Amazon Clothing, Shoes & Jewelry Best Sellers.",https://www.amazon.com/Best-Sellers-Boys-Clothing-Sets/zgbs/fashion/1288606011
24,Carter's - Boys' Clothing Sets - Amazon.com,boys clothing set,"['Clothing', 'Sets', 'Sets']",[],"Online shopping for Clothing, Shoes & Jewelry from a great selection of Short Sets, Pant Sets & more at everyday low prices.",https://www.amazon.com/Boys-Clothing-Sets-Carters/s?keywords=Boys%27+Clothing+Sets&rh=n%3A1288606011%2Cp_89%3ACarter%27s&c=ts&ts_id=1288606011
25,Amazon.com: Baby Boys' Clothing Sets,boys clothing set,['boys clothing sets'],[],Look for baby boys clothing sets on Amazon.com. Free shipping and free returns on eligible items.,https://www.amazon.com/Baby-Boys-Clothing-Sets/b?ie=UTF8&node=13698211
26,Baby Boys Outfit Sets in Baby Boys Clothing - Walmart.com,boys clothing set,['Boys Outfit Sets'],[],"Shop for Baby Boys Outfit Sets in Baby Boys Clothing. Buy products such as Carter's Child of Mine Baby Boy Bodysuits and Pants Outfit Set, 6 piece, ...",https://www.walmart.com/browse/clothing/baby-boys-outfit-sets/5438_7712430_8775031_6531901_5543846
27,Toddler Boys Outfit Sets in Toddler Boys (12M-5T) Clothing,boys clothing set,['Boys Outfit Sets'],[],"Shop for Toddler Boys Outfit Sets in Toddler Boys (12M-5T) Clothing. Buy products such as PAW Patrol Toddler Boy Valentine Terry Shirt and Joggers Set, ...",https://www.walmart.com/browse/clothing/toddler-boys-outfit-sets/5438_7712430_2700757_9326390_4993069
28,Boys' Clothing Sets | Kids Foot Locker,boys clothing set,"['Clothing Sets', 'Boys', 'boys']",[],"Stock Up on Clothing Sets for Boys. Get everything you need for your infant, toddler, preschooler, or grade school kid with boys' ...",https://www.kidsfootlocker.com/category/clothing/boys/sets.html
29,Toddler Boys' Outfits - Target,boys clothing set,['Outfit Set'],[],Disney Mickey Mouse Fleece Pullover Hoodie and Pants Outfit Set Toddler · Disney. $23.69. When purchased online. Sold and shipped by Imagikids.,https://www.target.com/c/outfits-toddler-boys-clothing-kids/-/N-4tfpt
30,Kimocat Baby Boys Clothing Set Fashion Casual Suit ...,boys clothing set,['Boys Clothing Set'],[],Buy Kimocat Baby Boys Clothing Set Fashion Casual Suit Long Sleeve and Denim Pants and other Pant Sets at Amazon.com. Our wide selection is elegible for ...,https://www.amazon.com/Kimocat-Clothing-Fashion-Casual-Sleeve/dp/B07CH4LJHY
31,Baby Boys' Clothing Sets - 3-6 Mo. / Baby Boys ... - Amazon.com,boys clothing set,"['Clothing', 'Sets', 'Sets']",[],"Online shopping for Clothing, Shoes & Jewelry from a great selection of Pant Sets, Short Sets & more at everyday low prices.",https://www.amazon.com/Baby-Boys-Clothing-Sets-3-6-mo/s?keywords=Baby+Boys%27+Clothing+Sets&rh=n%3A13698211%2Cp_n_size_two_browse-vebin%3A1289783011&c=ts&ts_id=13698211
32,Amazon.com: Boys' Clothing Sets,boys clothing set,"['Clothing', 'Sets', 'Sets']",[],"Online shopping for Clothing, Shoes & Jewelry from a great selection of Short Sets, Pant Sets & more at everyday low prices.",https://www.amazon.com/Boys-Clothing-Sets-Pinks/s?keywords=Boys%27+Clothing+Sets&rh=n%3A1288606011%2Cp_n_size_browse-vebin%3A2343359011&c=ts&ts_id=1288606011
33,Amazon.com: Boys' Clothing Sets,boys clothing set,"['Clothing', 'Sets', 'Sets']",[],"Online shopping for Clothing, Shoes & Jewelry from a great selection of Short Sets, Pant Sets & more at everyday low prices.",https://www.amazon.com/Boys-Clothing-Sets-Purples/s?keywords=Boys%27+Clothing+Sets&rh=n%3A1288606011%2Cp_n_size_browse-vebin%3A2343360011&c=ts&ts_id=1288606011
34,Little Boys (2-7) - Boys' Clothing Sets - Amazon.com,boys clothing set,"['Clothing', 'Sets', 'Sets']",[],"Online shopping for Clothing, Shoes & Jewelry from a great selection of Short Sets, Pant Sets & more at everyday low prices.",https://www.amazon.com/Boys-Clothing-Sets-Little-2-7/s?keywords=Boys%27+Clothing+Sets&rh=n%3A1288606011%2Cp_n_size_six_browse-vebin%3A4940400011&c=ts&ts_id=1288606011
35,Amazon.com: Baby Boys' Clothing Sets,boys clothing set,"['Clothing', 'Sets', 'Sets']",[],"Online shopping for Clothing, Shoes & Jewelry from a great selection of Pant Sets, Short Sets & more at everyday low prices.",https://www.amazon.com/Baby-Boys-Clothing-Sets-Oranges/s?keywords=Baby+Boys%27+Clothing+Sets&rh=n%3A13698211%2Cp_n_size_browse-vebin%3A2343358011&c=ts&ts_id=13698211
