position,title,query,snippet_highlighted_words,rich_snippet_list,snippet,link96,Casual & Classic Boys Clothing,boys clothing,"['Boys', 'Clothing']",[],Boys' Clothing · Boys' Marine Air Vest · Boys Performance Breaker Pants · Boys' Harbor Fleece Shep Shirt · Boys' Surfside Full-Zip Hoodie · Boys' Sherpa Fleece Vest.,https://www.vineyardvines.com/boys/
97,School Smocked & Classic Boys' Clothing,boys clothing,"['boys', 'clothes']",[],"Shop our latest smocked back to school classic boys' clothes collection. Order preppy back to school smocked outfits, monogrammed shirts, and much more!",https://www.elizajameskids.com/collections/boys/monogrammed
98,Boys' Clothing | PUMA,boys clothing,"['Boys', 'clothing']",[],"Boys' clothing by PUMA keeps up with your child's active lifestyle – from the playground to the field, find activewear they'll love.",https://us.puma.com/us/en/kids/boys/clothing
99,Boys' Clothes - Toddler & Little Boys Outfits,boys clothing,['boys clothing'],[],Shop boys clothing and outfits for toddlers and little boys. Browse Maisonette's one-stop shop for your favorite brands that keep him stylish from day one.,https://www.maisonette.com/shop/kids/boy-clothing
1,Discover the Boys' Clothing Collection | Joules® US,boys clothing,"['boys', 'clothes']",[],"Ready for any adventure, the Joules collection of boys' clothes has been designed with durability in mind. With bright colors and prints, discover the range ...",https://www.joulesusa.com/Boys-Clothing
2,Boys Kids' Clothes | Boys & Girls Clothes | Hibbett | City Gear,boys clothing,['clothing'],[],"Shop kid's clothing from Hibbett Sports. Browse our collection of compression, hoodies, denim, hats and more. Get all the latest styles and brands online ...",https://www.hibbett.com/boys-and-girls/clothing/boys/
3,Baby Boy Clothing - Target,boys clothing,['Boy Clothing'],[],"Shop Target for Baby Boy Clothing you will love at great low prices. Choose from Same Day Delivery, Drive Up or Order Pickup. Free standard shipping with ...",https://www.target.com/c/baby-boy-clothing-kids/-/N-4y6l9
4,Baby Boy Clothes (Sizes 0-24M) | Nordstrom Rack,boys clothing,"['Boy Clothing', 'Boy Clothes']",[],Shop a great selection of Baby Boy Clothing (Sizes 0-24M) at Nordstrom Rack. Find designer Baby Boy Clothes (Sizes 0-24M) up to 70% off.,https://www.nordstromrack.com/c/kids/baby-boy/0-24m
5,CLEARANCE Big Boys 8-22 Clothing for Baby & Kids,boys clothing,"['Boys', 'Clothing']",[],FREE SHIPPING AVAILABLE! Shop JCPenney.com and save on Clearance Big Boys 8-22 Clothing.,https://www.jcpenney.com/g/baby-kids/all-boys-clothing/big-boys-8-22-clothing?s1_deals_and_promotions=CLEARANCE&id=cat11100001199
6,Find Kids Clothing | Kohl's,boys clothing,"['kids', 'clothes']",[],"Enjoy free shipping and easy returns on adorable kids' clothes from Kohl's. Find kids' jeans, tops, sweaters, dresses and dress pants and more.",https://www.kohls.com/sale-event/kids-clothing.jsp
7,Boys' Clothes Online | Boden US,boys clothing,"['boys', 'clothing']",[],"Featuring supersoft fabrics and plenty of playful details, our boys' clothing collection pops with color and fizzes with style. Discover the range at Boden.",https://www.bodenusa.com/en-us/boys-clothing
8,Boys Clothes Lot for sale | eBay,boys clothing,['Boys Clothes'],[],Get the best deals on Boys Clothes Lot when you shop the largest online selection at eBay.com. Free shipping on many items | Browse your favorite brands ...,https://www.ebay.com/b/Boys-Clothes-Lot/11452/bn_7023544164
9,Boy's Clothing Latest Styles + FREE SHIPPING | Zappos.com,boys clothing,"['Clothing', 'Boys']",[],"Free shipping BOTH ways on Clothing, Boys from our vast selection of styles. Fast delivery, and 24/7/365 real-person service with a smile.",https://www.zappos.com/boys-clothing/CKvXAcABBOICAgEY.zso
10,Boys' Clothing & Fashion | FatFace US,boys clothing,['boys'],[],Get him set for the season ahead with the FatFace boys' collection - now avaliable in ages 2-3.,https://us.fatface.com/kids/boys-clothing
11,Boys' Designer Clothes & Accessories - Ralph Lauren,boys clothing,"['boys', 'clothes']",[],Shop boys' designer clothes & accessories for everything from polo shirts and sweaters to jackets and suits. Free Fast Shipping With an ...,https://www.ralphlauren.com/kids-boys
12,Kids' Clothing: Boys 8-20 - Sears,boys clothing,"['Kids', 'Clothing', 'Kids', 'Clothing']",[],Sears has the best selection of Kids' Clothing in stock. Get the Kids' Clothing you want from the brands you love today at Sears.,https://www.sears.com/clothing-kids-clothing/b-5006947?Fit=Boys%208-20&filterList=Fit
13,Boys' Sale - Brooks Brothers,boys clothing,"['boys', 'clothing']",[],Shop Brooks Brothers sale on boys' clothing and take advantage of discount prices. Legendary quality and customer service are a click away.,https://www.brooksbrothers.com/sale/boys
14,boys clothing - Boscov's,boys clothing,"['boys', 'clothing']",[],"Shop our amazing selection of boys 4-7 & 8-20 clothing at Boscov's. We offer a variety of stylish shirts, shorts, pants, hoodies, sets, blazers, and more.",https://www.boscovs.com/category/boys-4-20-clothing
15,Tween Boys' Clothing - Target,boys clothing,"['Boys', 'Clothing']",[],"Get Tween Boys' Clothing from Target at great low prices. Choose from Same Day Delivery, Drive Up or Order Pickup. Free standard shipping with $35 orders.",https://www.target.com/c/tween-boys-clothing/-/N-2ldf3
16,All Baby Boy Clothes | Nordstrom,boys clothing,['boy clothes'],[],"Free shipping on baby boy clothes at Nordstrom.com. Shop bodysuits, footies, coats & more for baby boys.",https://www.nordstrom.com/browse/kids/baby/boy-clothing
17,Boys Clothes (Sizes 4-14) | Carter's | Free Shipping,boys clothing,['Boy Clothes'],[],Kid Boy Clothes. Find your kids' new favorites here! These easy styles have extra-special details that let their personalities shine.,https://www.carters.com/carters-kid-boy
18,"Boys' Clothing: Boardshorts, T-Shirts, Jackets, Button ... - Hurley",boys clothing,['boys clothing'],[],Get them geared up in style with the latest boys clothing from Southern California surf brand Hurley.,https://www.hurley.com/collections/boys-clothing
19,Weekly Ad : Boys' Clothes - Target,boys clothing,"['Boys', 'Clothing']",[],"Shop Target for Boys' Clothing you will love at great low prices. Choose from Same Day Delivery, Drive Up or Order Pickup. Free standard shipping with $35 ...",https://www.target.com/c/boys-clothing-kids/weekly-ad/-/N-5xty4Z55dgn
20,Fall : Boys' Clothes - Target,boys clothing,"['Boys', 'Clothing']",[],"Shop Target for Boys' Clothing you will love at great low prices. Choose from Same Day Delivery, Drive Up or Order Pickup. Free standard shipping with $35 ...",https://www.target.com/c/boys-clothing-kids/fall/-/N-5xty4Z55em8
21,Little Boys' Clothing Size 4-7 - Belk,boys clothing,"['boys', 'clothing', 'boys', 'clothes']",[],Shop little boys' clothing at Belk. Belk has boys' clothes size 4-7 in styles for every occasion.,https://www.belk.com/kids/shop-by-size/boys-4-7/
22,Boys' Clothing & Apparel | Jimmy Jazz,boys clothing,"['Boys', 'clothing', 'boys', 'apparel']",[],"Boys' clothing. Shop the latest boys' apparel from brands like Nike, Jordan, Kappa, and more. SHOP ...",https://www.jimmyjazz.com/pages/boys-clothing
23,Boys' Clothes - Gap Factory,boys clothing,"['boys', 'clothes', 'boys', 'clothes']",[],Shop boys' clothes at Gap Factory where everyday deals meet quality and comfort. Discover a wide selection of cool boys' clothes at a great value.,https://www.gapfactory.com/browse/division.do?cid=1079661
24,Boys Clothing (Sizes 4-14) | OshKosh | Free Shipping,boys clothing,"['Boy Clothes', 'boys apparel']",[],Iconic Kid Boy Clothes. OshKosh is iconic American boys apparel. Boys fashion with an enduring cool that's always on trend.,https://www.oshkosh.com/oshkosh-kid-boy
25,Hind Boys Clothing in Kids Clothing(39) - Walmart.com,boys clothing,"['Boys Clothing', 'Kids Clothing']",[],"Shop for Hind Boys Clothing in Kids Clothing at Walmart and save. ... Clearance. Hind Boys Jersey Long Sleeve Tee and Jogger Pants Set, 2-Piece, Sizes.",https://www.walmart.com/browse/clothing/boys-clothing/hind/5438_7712430_7809949/YnJhbmQ6SGluZAieie
26,Big Boys (8-20) - Boys' Clothing Sets - Amazon.com,boys clothing,['Clothing'],[],"Online shopping for Clothing, Shoes & Jewelry from a great selection of Short Sets, Pant Sets & more at everyday low prices.",https://www.amazon.com/Boys-Clothing-Sets-Big-8-20/s?keywords=Boys%27+Clothing+Sets&rh=n%3A1288606011%2Cp_n_size_six_browse-vebin%3A4940401011&c=ts&ts_id=1288606011
27,Vintage-Inspired Clothing for Boys - Bella Bliss,boys clothing,"['clothes', 'boys', 'boy']",[],"If you're shopping for classic toddler clothes, boys' outfits, or mix and match wardrobe pieces for a special little boy in your life, ...",https://www.bellabliss.com/collections/boys
28,Boys Clothing - Lord & Taylor,boys clothing,['clothing'],[],Forget about lining up at clothing stores because we've got all of the essentials right here in our Kid's store. Explore a wonderful range of cute and ...,https://lordandtaylor.com/collections/little-big-boys-2-20
29,Boys' Outdoor Clothing & Gear by Patagonia,boys clothing,"['boys', 'clothing']",[],Viva los fun piglets! We built our boys' outdoor clothing and gear to stand up to childhood—guaranteed. Free Shipping over $99 at Patagonia.com.,https://www.patagonia.com/shop/kids-boys
30,Kids Clothing | Girls Sizes 2T - 18 | Boys 2T - 20 - Walmart.com,boys clothing,"['kids', 'clothing']",[],"Whether you're looking for comfortable, everyday clothing for your little one or a fun statement piece, you'll find a variety of kids' clothing at ...",https://www.walmart.com/cp/kids-clothing/7712430
31,Boys Clothing Sets | Academy,boys clothing,"['Boys', 'Clothing', 'Boys Clothing']",[],"Kids, Boys' Clothing, Boys Clothing Sets. ... Nike Toddler Boys' Thrill Short Sleeve T-shirt and Shorts Set. $13 9813 dollars 98 cents.",https://www.academy.com/c/kids/boys-apparel/boys-clothing-sets
32,"Boys' Clothing & Athletic Apparel | Nike, Jordan, adidas",boys clothing,"['boys', 'apparel']",[],"Shop online at Finish Line for boys' apparel. Find the latest styles from top brands like Nike, adidas and Under Armour.",https://www.finishline.com/store/boys/clothing/_/N-sgacav
33,Chic Boys Clothes - Boys Apparel & Clothing – johnnie-O,boys clothing,[],[],"Keep your little gentleman looking stylish in our polos, shorts, pullovers & more. You'll love our east coast prep meets west coast casual vibe. Shop Now!",https://www.johnnie-o.com/collections/boys
34,Boys' Clothing - Country Outfitter,boys clothing,"['Boys', 'Clothing']",[],Shop quality Boys' Clothing at Country Outfitter for hard to beat prices. You'll find your country when you shop Country Outfitter today!,https://www.countryoutfitter.com/kids/boys/boys_clothing/
35,New Boys Clothing. Nike.com,boys clothing,['Boys Clothing'],[],New Boys Clothing. Hoodies & Pullovers Pants & Tights Jackets & Vests Tops & T-Shirts Shorts Tracksuits Jumpsuits & Rompers Socks Sets. 294 Results,https://www.nike.com/w/new-boys-clothing-1onraz3n82yz6ymx6
36,Boys Clothing Sale - Tillys,boys clothing,['Boys'],[],"Shop Tillys for the latest Boys! From the best brands and latest trends, shop Tillys now!",https://www.tillys.com/sale/kids/boys/
37,Little Boys (2-7) - Boys' Clothing Sets - Amazon.com,boys clothing,['Clothing'],[],"Online shopping for Clothing, Shoes & Jewelry from a great selection of Short Sets, Pant Sets & more at everyday low prices.",https://www.amazon.com/Boys-Clothing-Sets-Little-2-7/s?keywords=Boys%27+Clothing+Sets&rh=n%3A1288606011%2Cp_n_size_six_browse-vebin%3A4940400011&c=ts&ts_id=1288606011
38,Sale | Boys' Clothes | 2-8Y | H&M US,boys clothing,"['Boys', 'clothes', 'boys', 'clothes']",[],"Boys' clothes - sale. Discover all boys' clothes at H&M. Refresh on everyday essentials, or scroll for the latest T-Shirts, jeans, jackets, sweaters and ...",https://www2.hm.com/en_us/sale/kids/boys.html
39,Art Class Boys Clothing in Kids Clothing - Walmart.com,boys clothing,"['Boys Clothing', 'Kids Clothing']",[],Shop for Art Class Boys Clothing in Kids Clothing at Walmart and save. ... Art Class Big Boy's Looking for Fun White T-Shirt XL (16). +2 options.,https://www.walmart.com/browse/clothing/boys-clothing/art-class/5438_7712430_7809949/YnJhbmQ6QXJ0IENsYXNz
40,Free Assembly Boys Clothing in Kids Clothing - Walmart.com,boys clothing,"['Boys Clothing', 'Kids Clothing']",[],"Shop for Free Assembly Boys Clothing in Kids Clothing at Walmart and save. ... Free Assembly Boys Long Sleeve Graphic and Slub Tee Shirts, 2-Pack, Sizes.",https://www.walmart.com/browse/clothing/boys-clothing/free-assembly/5438_7712430_7809949/YnJhbmQ6RnJlZSBBc3NlbWJseQieie
41,Boys Clothes & Outfits (Big Boy Sizes 8-20) - Bloomingdale's,boys clothing,"['boys', 'clothing']",[],"Find all the latest big boys' designer clothing & accessories at Bloomingdale's. Free Shipping and Free Returns available, or buy online and ...",https://www.bloomingdales.com/shop/kids/big-boy-clothes-8-20?id=23723
42,Boys Clothing & Accessories Sale | Journeys Kidz,boys clothing,['Boys Clothing'],[],"Shop the Boys Clothing & Accessories Sale at Journeys Kidz. Marks Downs and Discounted Boys Shirts, Jackets, Pants, Tracksuits, Socks, Windbreakers, ...",https://www.journeys.com/kidz/products/boys-sale-clothing-and-accessories
43,Baby Boy Clothes - Macy's,boys clothing,"['Boy Clothes', 'Boy Clothing']",[],Baby Boy Clothes at Macy's come in a variety of styles and sizes. Shop Baby Boy Clothing and find the latest styles for your little one today.,https://www.macys.com/shop/kids-clothes/baby-boy-clothes?id=48693
44,Kids' Clothing | REI Co-op,boys clothing,"['Kids', 'Clothing']",[],Shop for Kids' Clothing at REI - FREE SHIPPING With $50 minimum purchase. Curbside Pickup Available NOW! 100% Satisfaction Guarantee.,https://www.rei.com/c/kids-clothing
45,"Boys Clothing, Shoes & Accessories - Dillard's",boys clothing,['boys clothing'],[],"Shop for boys clothing, shoes and accessories at Dillard's. Find everything you need for the boys and little men in your life,",https://www.dillards.com/c/boys
46,Boys Clothes & Accessories | Cotton On Kids,boys clothing,['boys clothes'],[],"Shop on-trend boys clothes and accessories at Cotton On Kids. Brows boys jeans, tops, shirts, jumpers & more. Free Shipping Available*",https://cottonon.com/US/kids/kids-boys-1-8/
47,Toddler Boy Clothes | The Childrens Place | Free Shipping*,boys clothing,['boys clothing'],[],"There is only one place to get the best quality and cutest collection of toddler boys clothing at affordable prices, The Childrens Place.",https://www.childrensplace.com/us/c/toddler-boy-clothes
48,Boys' Clothing | Shop Your Navy Exchange - Official Site,boys clothing,"['Boys', 'Clothing', 'Boys', 'Clothing']",[],"Boys' Clothing | You Serve, You Save. Shop myNavyExchange.com for Boys' Clothing at the best prices.",https://www.mynavyexchange.com/browse/apparel/kids'-apparel/boys'-clothing/_/N-4224319467
49,Boys' Clothing - Zazzle,boys clothing,"['boys', 'clothes', 'boys', 'apparel']",[],Shop for boys' clothes from Zazzle. Choose your favorite designs for your boys' apparel.,https://www.zazzle.com/c/boys+clothing
50,Shirts - Jungle Boys Clothing,boys clothing,['Boys Clothing'],[],SEARCH · LOCATIONS · PROCESSING & SHIPPING · RETURNS & EXCHANGES · JOBS. SIGN UP FOR OUR NEWSLETTER. © 2023 Jungle Boys Clothing.,https://jungleboysclothing.com/collections/jb-site
51,Disney Boys' Clothing - shopDisney,boys clothing,"[""Boy's Clothes"", 'boys', 'clothes']",[],"Shop Boy's Clothes featuring Disney boys' clothes and more featuring Marvel, Star Wars, Spiderman, Captain America, Toy Story and more at Disney's official ...",https://www.shopdisney.com/clothing/boys/
52,Boys' Clothing | Bass Pro Shops,boys clothing,['boys clothing'],[],"Shop great deals on boys clothing & apparel at Bass Pro Shops. Find hundreds of options from top brands Under Armour, Carhartt, Columbia & more in all ...",https://www.basspro.com/l/boys-clothing
53,Boys' clothing | Zulily,boys clothing,"['Boys', 'clothing']",[],Boys' clothing - up to 70% off.,https://www.zulily.com/boys-clothing
54,Boy's Workout & Casual Clothes | adidas US,boys clothing,['Boys Apparel'],[],"Shop adidas Kids Boys Apparel on adidas.com. Browse all products, from shoes to clothing and accessories in this collection. Find all available syles and ...",https://www.adidas.com/us/boys-clothing
55,Boys' and Junior Boys' Outdoor Clothing | The North Face,boys clothing,"['Boys', 'Apparel', 'Boys Clothing', 'Boys Clothes']",[],Boys' Apparel · Boys Clothing That Holds Up To Rough Play Time · T-Shirt To Down Jacket: Get Clothes For All Seasons · Boys Clothes They'll Love To Show Off · Shop ...,https://www.thenorthface.com/en-us/kids/boys-apparel-c211735
56,Boys Clothing & Accessories - RVCA,boys clothing,"['Boys', 'Clothing']",[],"Shop the largest selection of RVCA Boys T-Shirts, Clothing, Denim, Boardshorts, Flannels, Hats & more. Free Shipping & Returns on all orders.",https://www.rvca.com/boys/
57,Boys' Clothing | Cabela's,boys clothing,"['boys', 'clothing']",[],"Outfit outdoorsy boys with boys' clothing from Cabela's. Shop hoodies, pants, tee shirts, jeans and more from brands like Cabela's, The North Face, ...",https://www.cabelas.com/l/boys-clothing
58,Designer Clothing for Boys - Farfetch,boys clothing,['boys clothing'],[],Global shipping ✈. Get your mini me started early in the style stakes with our edit of designer boys clothing at Farfetch.,https://www.farfetch.com/shopping/kids/boys-clothing-3/items.aspx
59,Target Brands : Boys' Clothes,boys clothing,"['Boys', 'Clothing']",[],"Shop Target for Boys' Clothing you will love at great low prices. Choose from Same Day Delivery, Drive Up or Order Pickup. Free standard shipping with $35 ...",https://www.target.com/c/boys-clothing-kids/target-brands/-/N-5xty4Zxmf9o
60,Boys Clothing Sale | Columbia Sportswear,boys clothing,['boys'],[],Up to 40% off select gear. Find great deals for all weather and activities with outdoor gear for boys from Columbia Sportswear.,https://www.columbia.com/c/boys-clothing-sale/
61,"Boys Clothing - Shop & Find Shirts, Jeans ... - DrJays.com",boys clothing,['Boys clothing'],[],"At DrJays, we carry a large selection of Boys clothing including Shirts, Jeans, Shoes & Sets.",https://www.drjays.com/shop/G2-R400/boys.html
62,Bailey Boys,boys clothing,"['clothing', 'Boys', 'clothing']",[],"Classic children's clothing of the highest quality, making Bailey Boys one of the best labels in children's clothing. Accepting new wholesale customers!",https://baileyboys.com/
63,Boys Clothing & Shoes On Sale Up To 90% Off | thredUP,boys clothing,"[""boy's clothing""]",[],"thredUP has thousands of pre-owned boy's clothing, shoes & accessories at up to 90% off retail price! Enhance your wardrobe without breaking the bank with ...",https://www.thredup.com/kids/boys
64,Paw Patrol - Boys' Clothing / Boys' Fashion - Amazon.com,boys clothing,"['Clothing', 'Clothing']",[],"Online shopping for Clothing, Shoes & Jewelry from a great selection of Tops, Tees & Shirts, Fashion Hoodies & Sweatshirts, Active, Swim, Clothing Sets, ...",https://www.amazon.com/paw-patrol-Boys-Clothing-Fashion/s?k=paw+patrol&rh=n%3A1040666
65,"Clothing, Shoes & Jewelry - Boys - Amazon.com",boys clothing,"['boys', 'clothing']",[],"Shop a wide selection of boys' clothing, shoes, watches, accessories and jewelry at Amazon.com. Free shipping and free returns on eligible items.",https://www.amazon.com/Boys-Fashion/b?ie=UTF8&node=7147443011
66,Boys Clothes | Shirts & Pants | The White Company US,boys clothing,"['Boys', 'Clothing']",[],"Boys' Clothing 1–6 Years. Update their closet with stylish essentials, from sweaters and overalls to pants and T-shirts perfect for playtime.",https://www.thewhitecompany.com/us/Baby-and-Children/View-All-Childrens/Boys/c/boys-clothing
67,Kirby : Boys' Clothes - Target,boys clothing,"['Boys', 'Clothing']",[],"Shop Target for Boys' Clothing you will love at great low prices. Choose from Same Day Delivery, Drive Up or Order Pickup. Free standard shipping with $35 ...",https://www.target.com/c/boys-clothing-kids/kirby/-/N-5xty4Z9tm8h
68,Clearance : Boys' Clothes - Target,boys clothing,"['Boys', 'Clothing']",[],"Shop Target for Boys' Clothing you will love at great low prices. Choose from Same Day Delivery, Drive Up or Order Pickup. Free standard shipping with $35 ...",https://www.target.com/c/boys-clothing-kids/clearance/-/N-5xty4Z5tdv1
69,Boys Clothing | Made in the USA - City Threads,boys clothing,['boys clothes'],[],"City Threads offers quality boys clothes, pajamas and more all made and manufactured in America! Shop our selection of tees, pants, & more today.",https://www.citythreads.com/collections/boys
70,Boys' Clothing from 2 to 9 Years Old | Mayoral ®,boys clothing,"['Boys', 'Clothing']",[],"FREE SHIPPING from $150 and free returns BUY ONLINE Boys' Clothing from 2 to 9 years old: pants, coats, t-shirts, polo shirts, hoodies and sweatshirts, ...",https://www.mayoral.com/en-us/unitedstates/boy-usu1
71,"Boys Clothing | T Shirts, Shorts, Jeans - Sports Direct",boys clothing,['boys clothing'],[],"Shop from a huge selection of boys clothing from brands like adidas, Nike, PUMA, Converse & more. Choose from sportswear or casual outfits.",https://www.sportsdirect.com/kids/clothing/boys
72,"Clothing for Boys | Tops, Bottoms & More - Volcom",boys clothing,"['dress', 'clothing', 'boys']",[],"From skate park to school playground, dress your little guy in Volcom clothing. Find boys' tank tops, shirts, shorts & more with free shipping on orders ...",https://www.volcom.com/collections/kids-boys
73,"Boys Clothing Clearance | Kids, Toddler & Baby | Gymboree",boys clothing,['boy clothes'],[],Shop boys clearance clothes. Find baby and toddler boy clothes on clearance. Discover styles and clothing that your kids will love at Gymboree!,https://www.gymboree.com/us/c/boys-clearance-clothes
74,Clothing / Boys - Popular Brands - Amazon.com,boys clothing,"['Clothing', 'Clothing']",[],"Online shopping for Clothing, Shoes & Jewelry from a great selection of Tops, Tees & Shirts, Fashion Hoodies & Sweatshirts, Active, Swim, Clothing Sets, ...",https://www.amazon.com/Clothing-Popular-Brands-Boys/s?rh=n%3A1040666%2Cp_n_feature_eighteen_browse-bin%3A14630392011
75,Amazon.com: Boys' Clothing Sets,boys clothing,['Clothing'],[],"Online shopping for Clothing, Shoes & Jewelry from a great selection of Short Sets, Pant Sets & more at everyday low prices.",https://www.amazon.com/Boys-Clothing-Sets-Pinks/s?keywords=Boys%27+Clothing+Sets&rh=n%3A1288606011%2Cp_n_size_browse-vebin%3A2343359011&c=ts&ts_id=1288606011
76,Boys Designer Clothes 4-14 Years | VERSACE US,boys clothing,"['Boys', 'Clothes']",[],"Discover the exclusive Boys designer Clothes (4-14 Years) collection by VERSACE. Buy online the iconic VERSACE products, luxury and elegance models.",https://www.versace.com/us/en-us/children/boys-4-14-years/clothing/
77,Teen Boys' Clothing | DICK'S Sporting Goods,boys clothing,"['Boys', 'Clothing', 'Boys', 'Clothing']",[],"Shop Teen Boys' Clothing at DICK'S Sporting Goods. If you find a lower price on Teen Boys' Clothing somewhere else, we'll match it with our Best Price ...",https://www.dickssportinggoods.com/f/teen-boys-clothing
78,Boys' Clothing Sets - Amazon.com,boys clothing,['Boy Dress'],[],"Online shopping for Clothing, Shoes & Jewelry from a great selection of Short ... HZXVic 2pcs Baby Boy Dress Clothes Toddler Outfits Infant Tuxedo Formal ...",https://www.amazon.com/Boys-Clothing-Sets-Black/s?keywords=Boys%27+Clothing+Sets&rh=n%3A1288606011%2Cp_n_size_browse-vebin%3A2343349011&c=ts&ts_id=1288606011
79,Amazon Warehouse - Clothing / Boys,boys clothing,"['Clothing', 'Clothing']",[],"Online shopping for Clothing, Shoes & Jewelry from a great selection of Tops, Tees & Shirts, Fashion Hoodies & Sweatshirts, Active, Swim, Clothing Sets, ...",https://www.amazon.com/Clothing-Amazon-Warehouse-Boys/s?rh=n%3A1040666%2Cp_6%3AA2L77EE7U53NWQ
80,Boy's Clothing - Lands' End,boys clothing,"['Boys', 'clothes', 'wear']",[],"From swim trunks to parkas, we are happy to offer almost everything your child needs, all year long. Boys need clothes they can outgrow, not wear out. Our ...",https://www.landsend.com/shop/boys-clothing/S-xe5
81,All In Motion : Boys' Clothes - Target,boys clothing,"['Boys', 'Clothing']",[],"Shop Target for Boys' Clothing you will love at great low prices. Choose from Same Day Delivery, Drive Up or Order Pickup. Free standard shipping with $35 ...",https://www.target.com/c/boys-clothing-kids/all-in-motion/-/N-5xty4Z4apdi
82,SONOMA Goods for Life - Boys Clothing - Walmart.com,boys clothing,"['Boys Clothing', 'Kids Clothing']",[],Shop for SONOMA Goods for Life Boys Clothing in Kids Clothing at Walmart and save.,https://www.walmart.com/browse/clothing/boys-clothing/sonoma-goods-for-life/5438_7712430_7809949/YnJhbmQ6U09OT01BIEdvb2RzIGZvciiBMaWZl
83,Baby Boys Clothing in Baby Clothes - Walmart.com,boys clothing,['Boys Clothing'],[],"Shop for Baby Boys Clothing in Baby Clothes. Buy products such as Carter's Child of Mine Baby Boy Bodysuits and Pants Outfit Set, 6 piece, Preemie-24M at ...",https://www.walmart.com/browse/clothing/baby-boys-clothing/5438_7712430_8775031_6531901
1,Little Boys Clothes: Find Cool Outfits For Your Little Man | Kohl's,boys clothing,['Boys Clothes'],[],Enjoy free shipping and easy returns every day at Kohl's. Find great deals on Little Boys Clothes at Kohl's today!,https://www.kohls.com/catalog/boys-kids-little-kids-clothing.jsp?CN=Gender:Boys+AgeAppropriate:Kids+ChildAgeRange:Little%20Kids+Department:Clothing
