position,title,query,snippet_highlighted_words,rich_snippet_list,snippet,link4,Boys Clothes (Sizes 4-14) | Carter's | Free Shipping,Children Clothes,"['Kid', 'Clothes', 'kids']",[],Kid Boy Clothes. Find your kids' new favorites here! These easy styles have extra-special details that let their personalities shine.,https://www.carters.com/carters-kid-boy
5,"Baby & Kids' Clothing Sale | Shirts, Pants & More - JCPenney",Children Clothes,"['kids', 'clothing', 'dresses']",[],"Revamp your kids' wardrobe with trendsetting clothing from JCPenney. Buy T-shirts, dresses, shirts, jeans and more. Free shipping available!",https://www.jcpenney.com/g/baby-kids?s1_deals_and_promotions=SALE&id=dept11100000014
6,"Newborn, baby, children's clothes on Sale - Jacadi Paris",Children Clothes,"['clothing', 'Clothes', 'boys']",[],"Find our clothing collection on Sale! Clothes for newborns and babies, toddlers and boys and girls up to size 12 years. Enjoy the Sale on Jacadi Paris, ...",https://www.jacadi.us/sale
7,Once Upon A Child: Buy & Sell Gently Used Kids' Clothes ...,Children Clothes,"['kids', 'clothes']",[],"At Once Upon A Child, we buy gently used kids' clothes, shoes, toys, and baby gear that meet current style, safety, and condition standards.",https://www.onceuponachild.com/
8,Kids' & Baby Clothing Deals - Target,Children Clothes,['Baby Clothing'],[],Contactless options including Same Day Delivery and Drive Up are available with Target. Shop today to find Kids' & Baby Clothing & Accessories Deals at ...,https://www.target.com/c/kids-clothing-deals/-/N-ywh7o
9,"THE BEST 10 Children's Clothing in Providence, RI - Yelp",Children Clothes,['baby clothes'],[],"""Adorable boutique for moms and kids alike! The selection of adorable baby clothes and innovative kid-friendly products is unbeatable. Why scour the internet ...",https://m.yelp.com/search?cflt=childcloth&find_loc=Providence%2C+RI
10,adidas Children's Clothing & Apparel,Children Clothes,"[""children's clothing"", ""children's clothing""]",[],Shop our selection of adidas children's clothing & apparel at adidas.com. See the latest styles of children's clothing & apparel from adidas.,https://www.adidas.com/us/kids-children-clothing
11,trendy kids clothes - Nordstrom,Children Clothes,['kids clothes'],[],Shop for trendy kids clothes at Nordstrom.com. Free Shipping. Free Returns. All the time.,https://www.nordstrom.com/sr/trendy-kids-clothes
12,Buy Kids Clothes Online for Sale - PatPat US Mobile,Children Clothes,"['kids', 'dresses']",[],"Shop stylish kids sets, dresses, sweatshirts, pants & more online with great prices and quality at PatPat US. Free Shipping On Orders $35+✓30 Days to ...",https://us-m.patpat.com/category/Kids.html
13,Marie Nicole Clothing - Wholesale Pricing On Boutique Clothing!,Children Clothes,"[""children's"", 'clothing']",[],"Adorable, Affordable and Comfortable children's boutique clothing & more for wholesale prices.",https://marienicoleclothing.com/
14,Wheat Kids Clothing,Children Clothes,"['clothing', 'kids']",[],Danish designed clothing for babies and kids combining comfort with beautiful Scandinavian inspiration. Sizes 3mo to 10yr. Shipping to Canada & USA.,https://www.wheatkidsclothing.com/
15,Children Clothes Box Online | Outfits for Boys & Girls - Kidpik,Children Clothes,['kids clothing'],[],What makes the best kids clothing subscription box? What should you look for before joining one? Follow our checklist to help choose the best option.,https://www.kidpik.com/children-clothes-box-online
16,"THE BEST 10 Children's Clothing in Manhattan, NY - Yelp",Children Clothes,"[""Children's Clothing""]",[],"Best Children's Clothing in Manhattan, NY - Little Moony, Couture Kids, An Me, Stoopher & Boots, Lucky Wang 2, Spring Flowers Children's Boutique, ...",https://www.yelp.com/search?cflt=childcloth&find_loc=Manhattan%2C+NY
17,Designer Kids' Clothing | Stella McCartney Kids US,Children Clothes,['Kids'],[],"Our Stella McCartney Kids collection wardrobe for a new generation of eco-warriors. Discover playful, colorful pieces full of personality, including t-shirts ...",https://www.stellamccartney.com/us/en/kids
18,11 Places To Find Organic Clothes For Kids And Toddlers,Children Clothes,"['clothing', 'kids']",[],Organic cotton can be softer and gentler on sensitive skin—here are our favorite organic clothing brands for kids.,https://www.thegoodtrade.com/features/childrens-organic-clothing
19,Children's Clothing & Gifts - Caroline & Company,Children Clothes,"[""children's clothing""]",[],"Shop our adorable baby & children's clothing, as well as gifts for the little ones! Complimentary gift wrapping available!",https://www.carolineandco.com/collections/children-s-clothes-gifts
20,"Melijoe: Kids Clothes, Girl, Boy & Baby - More than 150 Brands",Children Clothes,['baby clothing'],[],"At Melijoe, discover a wide selection of children and baby clothing. More than 150 designer brands available for your kids. Shipping within 24 hours.",https://www.melijoe.com/en
21,"THE BEST 10 Children's Clothing near Cedar Park, TX - Yelp",Children Clothes,"[""Children's Clothing""]",[],"Best Children's Clothing in Cedar Park, TX - Kid to Kid, Grit & Grace Boutique, Bright Beginnings Boutique, Suley & Jaxs, Haute Boutique, Children's ...",https://www.yelp.com/search?cflt=childcloth&find_loc=Cedar+Park%2C+TX
22,"THE BEST 10 Children's Clothing in San Francisco, CA - Yelp",Children Clothes,['children clothes'],[],"""Great selection of baby and children clothes. Nice wooden toys, unique outfits that go along with the extremely unique prices. It's about quality here folks.",https://www.yelp.com/search?cflt=childcloth&find_loc=San+Francisco%2C+CA
23,Shop 4 Kids Clothes,Children Clothes,"['kids', 'clothes']",[],We love this store for our kids! Such a good option for cute clothes and we love supporting the owners! They are so kind and helpful to help with anything ...,https://shop4kidsclothes.com/
24,Cute Kids Clothes - Amazon.com,Children Clothes,"['Outfits', 'Dress']",[],RESULTS. Price and other details may vary based on product size and color. Romwe Girl's 2 Piece Outfits Print Cami Short Dress with Crop Top Tee.,https://www.amazon.com/cute-kids-clothes/s?k=cute+kids+clothes
25,"BOUJIE KIDZ: Designer Kids Clothes | Trendy Baby, Toddler ...",Children Clothes,"['kids clothes', 'baby clothes']",[],Boujie Kidz provides affordable designer kids clothes & trendy baby clothes that will turn your little ones into most hip & stylish kids!,https://boujiekidz.com/
26,"Top 10 Best ""Children's Clothing"" in Austin, TX - Yelp",Children Clothes,"[""Children's Clothing""]",[],"Reviews on Children's Clothing in Austin, TX - SparkleKids Upscale Resale, Kinda Krazy Kids & Kompany, Bright Beginnings Boutique, Alexa James Baby, ...",https://www.yelp.com/search?find_desc=Children%27s+Clothing&find_loc=Austin%2C+TX
27,"THE BEST 10 Children's Clothing in Naples, FL - Yelp",Children Clothes,"[""children's clothing""]",[],"1301 3rd St S, Naples, FL 34102. ""Best children's clothing store in Naples, hands down. I got my clothes there when I was a child and now my kid is getting ...",https://www.yelp.com/search?cflt=childcloth&find_loc=Naples%2C+FL
28,LUCKY PANDA KIDS: Trendy Baby & Kids Clothes from ...,Children Clothes,['kids clothes'],[],"Cute, affordable baby and kids clothes for your little ones. Most adorable, trendy outfits, shoes, headbands, socks and accessories.",https://luckypandakids.com/
29,"Shop Gap for Casual Women's, Men's, Maternity, Baby & Kids ...",Children Clothes,['baby clothes'],[],"Shop casual women's, men's, maternity, kids' & baby clothes at Gap. Our style is clean and confident, comfortable and accessible, classic and modern.",https://www.gap.com/
30,Connie's Kids Children's Clothing,Children Clothes,"[""children's clothing""]",[],"About Us. Established in 1987, Connie's Kids has set the standard in quality children's clothing. We dress children like children. Designer classic looks and ...",https://connieskids.com/
31,"Kids, Baby & Teens Clothing & Shoes - La Redoute",Children Clothes,['Kids clothes'],[],"Looking for something a bit different for your little or not so little ones? Kids clothes for girls and boys, from babies through to teens to browse today.",https://www.laredoute.com/pplp/100/cat-368.aspx
32,Sale & Clearance Kids' & Baby Clothing & Accessories | Dillard's,Children Clothes,['Baby Clothing'],[],"Shop for Sale & Clearance Kids' & Baby Clothing & Accessories at Dillard's. Visit Dillard's to find clothing, accessories, shoes, cosmetics & more.",https://www.dillards.com/c/sale-clearance/kids
33,Baby & Child | Boys & Girls Clothing | John Lewis & Partners,Children Clothes,['kids clothes'],[],"Shop for Baby & Child range at John Lewis & Partners for kids clothes, accessories, toys and more. Free UK mainland delivery when you spend over £50.",https://www.johnlewis.com/baby-child/c5000010
34,"The Best 10 Children's Clothing near me in Miami, Florida - Yelp",Children Clothes,"[""Children's Clothing""]",[],"Best Children's Clothing in Miami, FL - Boy Meets Girl, State of Kid, Macanoco & Co, El Palacio Del Nino, Little Royals Boutique, Just For Me Kids Boutique, ...",https://www.yelp.com/search?cflt=childcloth&find_loc=Miami%2C+FL
35,"Buy Kids Clothes, Dresses & Bottom wear Online in India",Children Clothes,"['Kids Clothing', 'Kids Dresses', 'Children clothing']",[],"Kids Clothing - Online Shopping for Kids Buy kids wear, Kids Dresses, Kids shoes, Children clothing & accessories @ Myntra. ✯ Free Shipping ✯ COD.",https://www.myntra.com/shop/kids
36,Children's Clothing & Baby Clothes in Wauwatosa - Mayfair Mall,Children Clothes,"[""children's clothing"", ""kid's clothes""]",[],Shop children's clothing stores at Mayfair. We carry a wide assortment of kid's clothes & infant clothing in top styles & brands.,https://www.mayfairmall.com/en/directory/childrens_clothing/
37,PLAY kids clothes,Children Clothes,['kids clothing'],[],"Kids Vintage, contemporary preloved kids clothing.",http://www.playkidsclothes.com/
38,Kids Clothing. Nike.com,Children Clothes,['Kids Clothing'],[],Find Kids Clothing at Nike.com. Free delivery and returns.,https://www.nike.com/w/kids-clothing-6ymx6zv4dh
39,Where to Find Kids Clothes for Cheap? - MyUS.com,Children Clothes,"[""children's clothes""]",[],8 Websites Every Parent Needs to Know About. Shop American retailers online for cheap children's clothes from your favorite brands...,https://www.myus.com/blog/kids-clothes-for-cheap-online-us-stores/
40,Little Trendsetter - Unique Children's Clothing | Kids Clothes ...,Children Clothes,"[""children's clothing"", 'baby clothes', 'boys clothes', 'kids clothing']",[],Unique and trendy children's clothing online boutique with cute baby clothes for girls and cool boys clothes. Online kids clothing based out of Los Angeles.,https://www.littletrendsetter.com/
41,The 10 Best Kids Clothing Subscription Boxes - 2023 Winners,Children Clothes,"[""Kid's clothes""]",[],"Kid's clothes shopping doesn't have to be hard anymore though. The subscription box world actually makes it incredibly easy and surprisingly painless, ...",https://www.mysubscriptionaddiction.com/best-subscription-boxes/best-kids-clothing-boxes
42,Porsche Children's Clothing: Boys and Girls,Children Clothes,"[""children's clothing""]",[],"Cool outfits for little Porsche fans. Discover a large variety of Porsche children's clothing now and buy high-quality sweatshirts, t-shirts and more.",https://shop.porsche.com/us/en-US/c/porsche-childrens-clothing-boys-and-girls
43,"Kids Clothing, Shoes & Accessories - Nordstrom Rack",Children Clothes,['kids clothing'],[],"Shop a great selection of kids clothing, shoes and accessories at great price points at Nordstrom Rack.",https://www.nordstromrack.com/category/Kids
44,Shop Our Kids Apparel and Clothing Selection - Big Lots,Children Clothes,['kids apparel'],[],"Make your little one's smile with clothes from Big Lots. Find kids apparel that feature fun catch phrases or beloved characters, ...",https://www.biglots.com/c/clothing-footwear-accessories/kids-clothing/_/N-2964617499
45,Clothes to Kids Denver – clothing can change a life,Children Clothes,"['clothing', 'children', 'Clothes', 'Kids']",[],"A warm coat, shoes that fit and a wardrobe of school clothing helps children and ... See how Clothes To Kids of Denver makes a big impact on the lives of ...",https://clothestokidsdenver.org/
46,"THE BEST 10 Children's Clothing in Seattle, WA - Yelp",Children Clothes,['kids clothing'],[],"""Is it pricey? Yes. But the clothes seem of wonderful quality and are adorable. There is a selection of Washington/Seattle based kids clothing and band tees but ...",https://www.yelp.com/search?cflt=childcloth&find_loc=Seattle%2C+WA
47,Buy children clothing with free shipping on AliExpress,Children Clothes,['baby clothes'],[],Kids Girls Clothing Sets Cartoon Daisy Sports Sweatshirts+Pants Toddler Girls Clothes Girls Outfits School Girls Outfits 2-7Y. Free Shipping. KISS baby clothes ...,https://www.aliexpress.com/w/wholesale-children-clothing.html
48,Handmade baby and kids clothes • TunTun Baby ...,Children Clothes,['kids clothes'],[],Handmade baby and kids clothes made in Peru with love.,https://www.tuntunkids.com/
49,Vann & Liv: Boutique Children's Clothes | Girls + Boys + Baby,Children Clothes,"['Apparel', 'Kids']",[],"Boutique Apparel for Babies, Kids, and Tweens. Located in Greenville, SC.",https://www.vannandliv.com/
50,Garanimals | Mix + Match Clothing for Babies + Toddlers,Children Clothes,"[""children's clothing""]",[],Garanimals is a children's clothing brand featuring mix-and-match separates for baby and toddlers at affordable prices for all families.,https://www.garanimals.com/
51,"THE BEST 10 ""Children's Clothing"" in Berkeley, CA - Yelp",Children Clothes,['baby clothes'],[],"I can always find quality baby clothes and accessories in colors and prints that garner an, ""Awwwe"" from the recipient. The store also has a nice selection of ...",https://www.yelp.com/search?cflt=childcloth&find_loc=Berkeley%2C+CA
52,"THE BEST 10 Children's Clothing in New Orleans, LA - Yelp",Children Clothes,['children clothing'],[],"""Sweet children clothing store that carries clothes your kids will love and you enjoy seeing them in them. Nice selection of boy and girl clothing.…"" Pippen ...",https://www.yelp.com/search?cflt=childcloth&find_loc=New+Orleans%2C+LA
53,"THE BEST 10 Children's Clothing in Winston-Salem, NC - Yelp",Children Clothes,"[""Children's Clothing""]",[],"Best Children's Clothing in Winston-Salem, NC - McCalls Reynolda Village, Lime Lollies, Rollys Baby Boutique, Mommy & Me, Crazy 8, Mommy And Children ...",https://www.yelp.com/search?cflt=childcloth&find_loc=Winston-Salem%2C+NC
54,"THE BEST 10 Children's Clothing in Newport Beach, CA - Yelp",Children Clothes,['baby clothes'],[],Came here to buy for Lil O Blossom baby wash as they're the only 3 luxury boutiques that carry this brand in OC! The store has tons of cute baby clothes. The ...,https://www.yelp.com/search?cflt=childcloth&find_loc=Newport+Beach%2C+CA
55,Kids Clothes made with Organic Cotton - Pact,Children Clothes,['Kids Clothing'],[],Earth's Favorite™ Kids Clothing made with organic cotton in fair trade factories. Get 20% off your first order. Free Shipping on orders $50+.,https://wearpact.com/kids
56,"Kids, Infants and Toddlers | Clothing Accessories",Children Clothes,"[""Children's Clothing""]",[],Shop Cracker Barrel Children's Clothing for unique apparel and accessories for your child today!,https://shop.crackerbarrel.com/clothing-accessories/kids-infants-toddlers
57,Children's Clothing & Baby Clothes in Northridge,Children Clothes,"[""children's clothing"", ""kid's clothes""]",[],Shop children's clothing stores at Northridge Fashion Center. We carry a wide assortment of kid's clothes & infant clothing in top styles & brands.,https://www.northridgefashioncenter.com/en/directory/childrens_clothing/
58,Children's Clothing & Baby Clothes in Coral Gables,Children Clothes,"[""children's clothing"", ""kid's clothes""]",[],Shop children's clothing stores at Shops at Merrick Park. We carry a wide assortment of kid's clothes & infant clothing in top styles & brands.,https://www.shopsatmerrickpark.com/en/directory/childrens_clothing/
59,cute trendy stylish modern handmade baby toddler kids ...,Children Clothes,['Kids clothing'],[],Kids clothing designed for both play time and party time. Designer babies and girls clothing for ages newborn to 8. Shop our handmade designer boutique ...,https://www.cuteheads.com/
60,"THE BEST 10 Children's Clothing in Washington, DC - Yelp",Children Clothes,"['baby', 'dress', 'clothes']",[],"I used to buy blankets and onesies as gifts for baby showers, but now I have my own little one and can finally dress him up in these comfy clothes, too! The ...",https://www.yelp.com/search?cflt=childcloth&find_loc=Washington%2C+DC
61,"THE BEST 10 Children's Clothing in Memphis, TN - Yelp",Children Clothes,"[""Children's Clothing""]",[],"Best Children's Clothing in Memphis, TN - Spoiled Sweet Boutique, The Pink Door, Cotton Tails, Itty Bitty Bella, The Woman's Exchange of Memphis, Sachi, ...",https://www.yelp.com/search?cflt=childcloth&find_loc=Memphis%2C+TN
62,"THE BEST 10 Children's Clothing in White Plains, NY - Yelp",Children Clothes,['children clothing'],[],"""I've only had great experiences at this gorgeously curated boutique of fabulous baby and children clothing, accessories, toys, gift + more.",https://www.yelp.com/search?cflt=childcloth&find_loc=White+Plains%2C+NY
63,Baby & Kids Clothing - Burkes Outlet,Children Clothes,['kids clothing'],[],"Shop kids clothing, baby items & outfits, toys, and more for children online at Burkes Outlet with new arrivals all the time at prices you'll love.",https://www.burkesoutlet.com/shop/kids/
64,Made in USA Clothing for Kids : The Ultimate Source List,Children Clothes,"[""children's clothing""]",[],"Believe it or not, there ARE a lot of companies out there that manufacture children's clothing in America. Here is a list to prove it!",https://www.usalovelist.com/made-in-usa-kids-clothing-childrens-clothing/
65,"Kids Clothes: Shirts, Shorts, Hats - Ben Sherman",Children Clothes,"['clothing', 'kids', 'kids']",[],"Shop clothing for kids at Ben Sherman. Find stylish shirts, shorts, and hats for kids of all ages. Discover our collection!",https://www.bensherman.com/collections/kids
66,ittikid • Scandinavian Children's Clothes • Organic and Eco ...,Children Clothes,"[""Children's Clothes""]",[],"Scandinavian Baby & Children's Clothes in the US. Danish, Swedish, Norwegian, Finnish, and Icelandic kids brands Smafolk, Maxomorra, Moromini, Malinami, ...",https://www.ittikid.com/
67,"Children's Clothing & Apparel Stores in Honolulu, HI",Children Clothes,"[""Children's clothing""]",[],Come visit us to find the best selection of Children's clothing stores in the Honolulu area. Shop our wide assortment today at Ala Moana Center.,https://www.alamoanacenter.com/en/directory/childrens_clothing/
68,Unique Children's Clothing & Accessories : Mommy & Me ...,Children Clothes,"['kids clothes', 'kids dresses', 'kids outfits']",[],"Shop cute kids clothes and accessories at Sparkle In Pink! With our variety of kids dresses, mommy + me clothes, and complete kids outfits, your child is ...",https://sparkleinpink.com/
69,"THE BEST 10 Children's Clothing in Albuquerque, NM - Yelp",Children Clothes,"[""Children's Clothing""]",[],"Best Children's Clothing in Albuquerque, NM - Southwestern Handcrafts & Gifts, Spur Line Supply Co, Kidz Shack, Retail Therapy ABQ, Kiddie Klosets, ...",https://www.yelp.com/search?cflt=childcloth&find_loc=Albuquerque%2C+NM
70,"THE BEST 10 Children's Clothing in Bridgewater, NJ - Yelp",Children Clothes,"[""Children's Clothing""]",[],"Best Children's Clothing in Bridgewater, NJ - Janie and Jack, Fairytales Boutique, Max & Mia's, Once Apon A Time Baby, Once Upon A Child, Main St Kidz, ...",https://www.yelp.com/search?cflt=childcloth&find_loc=Bridgewater%2C+NJ
71,"THE BEST 10 Children's Clothing in New York, NY - Yelp",Children Clothes,"[""Children's Clothing""]",[],"Best Children's Clothing in New York, NY - Little Moony, An Me, Pink Olive, Smoochie Baby, Jane's Exchange, Two Kids and A Dog, My Little Sunshine, ...",https://www.yelp.com/search?cflt=childcloth&find_loc=New+York%2C+NY
72,5 Best Places to Buy Children's Clothing in Tucson,Children Clothes,"['clothing', 'Kids', 'clothes']",[],"Although it may not seem like it, I never pay full price for clothing. Kids grow too quickly and clothes are expensive. I have shopped at many stores in Tucson ...",https://www.tucsontopia.com/5-best-places-buy-childrens-clothing/
73,Shop Fine Classic Children and Baby Clothes – Little Threads ...,Children Clothes,"['Baby', 'children', 'clothes']",[],"Baby Boy's birthday Outfit & bubble romper - Buy classic children special occasion clothes from Little Threads, Inc. Here you will be able to shop all our ...",https://www.littlethreadsinc.com/
74,"Rock Baby Clothes, Rock Kids Clothes - Metal and Punk Kids ...",Children Clothes,"['Baby Clothes', 'Kids Clothes']",[],"Rock Baby Clothes & Rock Kids Clothes for littlerockers ☆ How to dress like a real Rockstar? ☆ Littlerockstore is your #1 webstore for Rock, Metal and ...",https://www.littlerockstore.com/
75,Kids' Clothes Sale at vineyard vines,Children Clothes,"['kids', 'clothes']",[],Add new clothes to your child's closet with the kids' clothes sale from vineyard vines. Free shipping available on $125+.,https://www.vineyardvines.com/sale-kids/
76,Children's Clothing & Baby Clothes in Rancho Cucamonga,Children Clothes,"[""children's clothing"", ""kid's clothes""]",[],Shop children's clothing stores at Victoria Gardens. We carry a wide assortment of kid's clothes & infant clothing in top styles & brands.,https://www.victoriagardensie.com/en/directory/childrens_clothing/
77,New and used Kids' Clothing for sale | Facebook Marketplace,Children Clothes,"['Kids', 'Clothing']",[],New and used Kids' Clothing for sale near you on Facebook Marketplace. Find great deals or sell your items for free.,https://www.facebook.com/marketplace/category/kids-clothing/
78,Children's Clothing & Baby Clothes in Sugar Land,Children Clothes,"[""children's clothing"", ""kid's clothes""]",[],Shop children's clothing stores at First Colony Mall. We carry a wide assortment of kid's clothes & infant clothing in top styles & brands.,https://www.firstcolonymall.com/en/directory/childrens_clothing/
79,"THE BEST 10 Children's Clothing in Sarasota, FL - Yelp",Children Clothes,"[""Children's Clothing""]",[],"Best Children's Clothing in Sarasota, FL - Janie and Jack, Little Bo-Tique, Childrens World, Once Upon a Child - Sarasota, Pitter Patter SRQ, Breezin' Up, ...",https://www.yelp.com/search?cflt=childcloth&find_loc=Sarasota%2C+FL
80,"THE BEST 10 Children's Clothing in Jersey City, NJ - Yelp",Children Clothes,"[""Children's Clothing""]",[],"Best Children's Clothing in Jersey City, NJ - Little Moony, Different Strokes For Little Folks, Hazel Baby & Kids, Little Smoochie, Livly, Kids Paradise, ...",https://www.yelp.com/search?cflt=childcloth&find_loc=jersey+city%2C+nj
81,"THE BEST 10 Children's Clothing in Portland, OR - Yelp",Children Clothes,"[""Children's Clothing""]",[],"Best Children's Clothing in Portland, OR - Grasshopper Store, Mako The Childrens Shop, Black Wagon, Posh Baby, The Yo! Store, TreeHouse Children's Boutique, ...",https://www.yelp.com/search?cflt=childcloth&find_loc=Portland%2C+OR
82,"THE BEST 10 Children's Clothing in Queens, NY - Yelp",Children Clothes,"[""Children's Clothing""]",[],"Best Children's Clothing in Queens, NY - Lovely Kids, The Ridgewood Kid, Sir Lance's Lot, Malawi, Bambino Elegante, Cookie's The Kids Department Store, ...",https://www.yelp.com/search?cflt=childcloth&find_loc=Queens%2C+NY
83,THE BEST 10 Children's Clothing near Upper West Side ...,Children Clothes,"[""Children's Clothing""]",[],"Best Children's Clothing in Upper West Side, Manhattan, NY - Stoopher & Boots, Monica & Andy, Greenstones, Couture Kids, Le Petit Kids, Z'Baby Company, ...",https://www.yelp.com/search?cflt=childcloth&find_loc=Upper+West+Side%2C+Manhattan%2C+NY
84,Kids' Clothes & Baby Clothes - Belk,Children Clothes,"['kids', 'clothes', 'baby clothes']",[],Dress your little one in style with kids' clothes and baby clothes from Belk. Receive free shipping and easy returns on qualifying orders.,https://www.belk.com/kids/?pmid=BelkClearancePricing
85,How to Buy Clothes for Children (with Pictures) - wikiHow Life,Children Clothes,"[""children's clothing""]",[],"Children need clothes—and lots of them, given how fast they grow. With so many options and styles, shopping for children's clothing can be overwhelming.",https://www.wikihow.life/Buy-Clothes-for-Children
86,Negatives About the Children's Clothing Industry,Children Clothes,"[""children's clothing""]",[],"The children's clothing industry was one of two specialty retailers to experience growth between 2006 and 2010, according to a 2010 IBISWorld study.",https://smallbusiness.chron.com/negatives-childrens-clothing-industry-34338.html
87,Vintage-Inspired Children's Clothing: Styles Stitched for Summer,Children Clothes,"['clothes', 'kids']",[],"From pool parties to beach days and playdates at the park, bella bliss has the best summer clothes for kids that suit their every adventure.",https://www.bellabliss.com/blogs/news/summer-clothes-for-kids
88,Pepa & Co: Traditional Children's & Baby Clothing,Children Clothes,['baby clothing'],[],"Pepa & Co. is a traditional children's & baby clothing boutique based in London, from newborn to age 10. Worldwide and free delivery options available.",https://www.pepaandcompany.com/
