position,title,query,snippet_highlighted_words,rich_snippet_list,snippet,link10,"Boys Clothes | Kids, Toddler & Baby Clothing | Gymboree",Children Clothes,"['clothes', 'boys', 'baby', 'clothes', 'clothes', 'clothing', 'kids']",[],"Shop clothes for boys. Find baby boy clothes, toddler boy clothes, and more. Discover styles and clothing that your kids will love at Gymboree!",https://www.gymboree.com/us/c/boys-clothes
11,Pastel: Impeccable clothes for kids & young adults,Children Clothes,"[""children's clothing""]",[],"Meticulously crafted children's clothing with an emphasis on style, quality, and fit. European chic & the cutest boutique shops.",https://pastelcollections.com/
12,Kids' Clothing | Children's Clothing - Marks & Spencer,Children Clothes,"['kids', 'clothing']",[],"Shop for kids' clothing, school uniforms and accessories at M&S. Order online for home delivery or free collection from your nearest store.",https://www.marksandspencer.com/c/kids
13,Clothing Hints for Young Children - BE BOLD. Shape the Future.,Children Clothes,"['baby', 'child', 'clothes']",[],A baby or young child cannot be expected to cooperate very much in the job of dressing. Many are far more interested in taking clothes off than putting them ...,https://pubs.nmsu.edu/_c/C401/index.html
14,Be Mi Los Angeles | Stylish Children's Clothing Made in LA,Children Clothes,['clothing'],[],"Be Mi Los Angeles was born in Los Angeles, CA in 2019, Be Mi - is cool, stylish, and comfy to wear clothing brand. Their modern collections break from ...",https://www.bemilosangeles.com/
15,Kids' Clothing Sale & Clearance - Macy's,Children Clothes,"['Kids', 'Clothing', 'Kids', 'Clothing']",[],Shop Kids' Clothing Sales at Macy's are a great opportunity to save. View the Kids' Clothing Sale at Macy's & find the latest styles for your little one ...,https://www.macys.com/shop/kids-clothes/kids-clothes-sale?id=6086
16,Cecil and Lou: Classic Outfits for Boys & Girls,Children Clothes,"[""children's clothing""]",[],"Find classic children's clothing for everyday and special occasions at Cecil and Lou. We carry heirloom-quality, traditional, smocked, & monogrammed styles ...",https://www.cecilandlou.com/
17,The Simple Folk - Organic & High-Comfort Children's Clothes,Children Clothes,"['Clothing', 'Children']",[],our promise · Ethical & Sustainable Clothing Made by Local Artisans · Organic and Non-Toxic Living for Babies and Children.,https://thesimplefolk.co/
18,Kids' Clothing - Nordstrom,Children Clothes,"['Kids', 'Clothing']",[],Free shipping and returns on Kids' Clothing at Nordstrom.com. Top brands. New trends.,https://www.nordstrom.com/browse/kids/clothing
19,Kids Clothes In 7/8 - Amazon.com,Children Clothes,['Kids Clothes'],[],Amazon.com: Kids Clothes in 7/8. ... Marvel Avengers Spider-Man Miles Morales Baby Fleece Pullover Hoodie and Jogger Pants Outfit Set.,https://www.amazon.com/Kids-Clothes-7-8/s?k=Kids+Clothes+in+7%2F8
20,Children's Clothing & Baby Clothes in Towson,Children Clothes,"[""children's clothing"", ""kid's clothes""]",[],Shop children's clothing stores at Towson Town Center. We carry a wide assortment of kid's clothes & infant clothing in top styles & brands.,https://www.towsontowncenter.com/en/directory/childrens_clothing/
21,Kids' Clothes | Great Value Kidswear - George at ASDA,Children Clothes,"['kids', 'clothes']",[],"Buy kids' clothes from our kidswear collection online from George at ASDA. Shop boys' and girls' tops, party dresses, jeans, T-shirts and more.","https://direct.asda.com/george/kids/D25,default,sc.html"
22,Petite Maison Kids: Children's Luxury Online Clothing Store,Children Clothes,"[""Children's"", 'Clothing', 'Clothing']",[],"U.S. Based Children's Luxury Clothing Brand featuring European, Designer, High Quality Clothing Newborn - 10 Years Old. Fast Shipping & Easy Returns!",https://petitemaisonkids.com/
23,Children's Clothing & Baby Clothes in Murray | Fashion Place,Children Clothes,"[""children's clothing"", ""kid's clothes""]",[],Shop children's clothing stores at Fashion Place. We carry a wide assortment of kid's clothes & infant clothing in top styles & brands.,https://www.fashionplace.com/en/directory/childrens_clothing/
24,Clothes To Kids,Children Clothes,"['Clothes', 'Kids', 'clothing', 'children']",[],"Clothes To Kids is a Tampa, Florida based 501(c)3 non-profit organization that provides free clothing for school-age children in low income families or in ...",https://clothestokids.org/
25,OMAMImini: Children's clothes designed in Los Angeles,Children Clothes,"[""children's"", 'clothes', 'clothes', 'children']",[],"Order children's, women's, men's designer clothes ➤ OMAMIMINI ➤ Wholesale and retail store ➤ Unique clothes for children and adults ➤ High quality ...",https://omamimini.com/
26,Kids' Clothes and Shoes - Academy Sports + Outdoors,Children Clothes,"['kids', 'clothing', 'kids', 'clothes']",[],"Find kids' clothing and shoes, including kids' clothes and kids' shoes for boys, girls and toddlers, at Academy Sports + Outdoors.",https://www.academy.com/c/kids
27,The Stylish Mom Behind the Site Selling Kids' Clothes ... - Vogue,Children Clothes,"['clothes', 'kids', 'dress']",[],"Milk Teeth offers a selection of clothes for the most stylish kids. In the mix, there is a T-shirt dress with a light elastic waist in a ...",https://www.vogue.com/article/im-a-cool-mom-catherine-newell-hanson-milk-teeth
28,Children's Clothing | adidas US,Children Clothes,"[""Children's Clothing""]",[],"Shop adidas Children's Clothing for Little Girls and Little Boys on adidas.com. Browse all little kids products, from shoes to clothing and accessories in ...",https://www.adidas.com/us/children-clothing
29,Kids Designer Clothes | BAMBINIFASHION.COM,Children Clothes,"['kids', 'clothes', 'boys']",[],"Shop the latest kids designer clothes, lifestyle accessories & shoes for babies, boys & girls with 750+ luxury brands at BAMBINIFASHION.COM.",https://bambinifashion.com/
30,Posh Tots Children's Boutique - Shop Children's Clothes ...,Children Clothes,"[""Children's"", 'apparel', 'clothes', 'kids', 'clothes']",[],"Children's boutique with apparel, accessories, and gear! Quality clothes for your kids. Shop some of your favorite brands from clothes to shoes.",https://shopposhtots.com/
31,Angelibebe: Kids Clothes SALE | Luxury Kidswear Online,Children Clothes,['Kids'],[],"New Year Sale- Extra 20% OFF* Site wide, with a minimum purchase of US$80. Use code CHRISTMAS. Top Kids Designer brands, Mini Rodini - Bobo Choses - Nikolia ...",https://www.angelibebe.com/
32,childrens clothes - Pottery Barn Kids,Children Clothes,"['childrens', 'Kids', 'kids', 'baby']",[],"Shop childrens%20clothes from Pottery Barn Kids. Find expertly crafted kids and baby furniture, decor and accessories, including a variety of ...",https://www.potterybarnkids.com/search/results.html?words=childrens+clothes
33,Kids Clothes: Boys & Girls | J.Crew CrewCuts,Children Clothes,"['Boys', 'clothing', 'clothes kids']",[],"Shop Boys & Girls clothing at J.Crew for clothes kids love and look good in! From sweaters, graphic tees, pants and shoes! Join J.Crew Rewards for free ...",https://www.jcrew.com/kids
34,Baby Clothes | Toddler Clothes | Kids Clothes - Mud Pie,Children Clothes,"['baby clothes', ""kid's clothes""]",[],See all new arrivals including our latest seasonal styles for every age from baby clothes to toddler clothes. Buy kid's clothes online and save with Mud ...,https://www.mudpie.com/category/baby-kids/clothing
35,"The Best 10 Children's Clothing near me in Austin, Texas - Yelp",Children Clothes,"[""Children's Clothing""]",[],"Best Children's Clothing in Austin, TX - SparkleKids Upscale Resale, Kinda Krazy Kids & Kompany, Alexa James Baby, Bright Beginnings Boutique, Little Limbo, ...",https://www.yelp.com/search?cflt=childcloth&find_loc=Austin%2C+TX
36,"THE BEST 10 Children's Clothing in Raleigh, NC - Yelp",Children Clothes,"[""children's clothes""]",[],"I found Lamb's Ear while shopping in North Hills, and I have to say this store has the largest selection of high quality baby and children's clothes that I ...",https://www.yelp.com/search?cflt=childcloth&find_loc=Raleigh%2C+NC
37,mabo clothier | sustainable children's clothing handmade in ...,Children Clothes,"[""children's"", 'clothing', 'child', 'apparel']",[],"we're a children's brand that makes sustainable clothing designed to grow with your child. founded in 2010, we have a soft spot for thoughtful apparel that ...",https://maboclothier.com/
38,Buy Clothes for Mommy and Me | Family Outfits | PatPat US ...,Children Clothes,['baby clothes'],[],"PatPat US Mobile offers a big range of newborn baby clothes, kids designer clothes, matching family outfits online and home accessories more.",https://us-m.patpat.com/
39,A Collection of Children Clothing Online - Oso & Me,Children Clothes,"[""children's clothing""]",[],"Shop Oso & Me collection of children's clothing for boys and girls online. Our clothes are pre-shrunk, 100% cotton, reversible, soft, growable, ...",https://www.osoandme.com/collections/child
40,"Honeydewusa: Kids Boutique Clothing, Baby Girls Boutique ...",Children Clothes,"['kids clothing', ""children's apparel""]",[],"Honeydew is a US-based, industry-leading wholesale kids clothing distributor. We offering high-quality and affordable children's apparel & accessories.",https://honeydewusa.com/
41,"Kids' Clothing for Boys and Girls | Shorts, Jeans, Shirts, Dresses",Children Clothes,"['kids', 'clothing']",[],"Browse our collection of kids' clothing for boys & girls at JCPenney! From blue jeans and shoes, to dresses and blouses, shop and save online today!",https://www.jcpenney.com/d/kids/
42,Kids Clothing & Accessories - Tillys,Children Clothes,['Kids Clothing'],[],Shop Kids Clothing & Shoes from all the latest brands. Tillys carries Boys size 4-7 and 8-20 and Girls Size 4-6 and 7-16.,https://www.tillys.com/kids/
43,Children's Clothing - PA 211,Children Clothes,"['clothes', 'children', 'clothing']",[],Offers new and gently used clothes for children sizes newborn to 16 to those in need of clothing. Families are able to visit the closet every six weeks.,https://www.pa211.org/get-help/clothing-household/childrens-clothing
44,Vintage Kids Clothes - Etsy,Children Clothes,['kids clothes'],[],"Check out our vintage kids clothes selection for the very best in unique or custom, handmade pieces from our t-shirts shops.",https://www.etsy.com/market/vintage_kids_clothes
45,Best Way to Sell Used Baby Clothes (2023 Guide),Children Clothes,"[""baby's clothes""]",[],Thinking of selling your baby's clothes to make extra cash? Here are a few great tips to get you on the right track.,https://momlovesbest.com/selling-baby-clothes
46,Kids Clothing | Girls & Boys Clothing - Nautica,Children Clothes,"['kids', 'clothes', ""children's clothing""]",[],Outfit them for every activity by shopping the array of kids' clothes and toddler clothes at Nautica. Find the latest styles of children's clothing at ...,https://www.nautica.com/kids/
47,GapKids | Gap,Children Clothes,"['Kids Clothes', 'kids', 'clothing']",[],"Kids Clothes for Boys and Girls Looking for cool and comfy styles for your kiddos? GapKids has fresh and fun kids' clothing that your littles will love, ...",https://www.gap.com/browse/division.do?cid=6170
48,Petit Pli,Children Clothes,"['Clothes', 'child']",[],"Petit Pli, Clothes that grow with your child. We address the wasteful nature of fashion. Inspired by aerospace engineering, Petit Pli builds sustainable ...",https://shop.petitpli.com/
49,"Buy & Sell Gently Used Kids' Clothes, Shoes, Toys, and Baby ...",Children Clothes,"['kids', 'clothes']",[],"At Once Upon A Child, we buy gently used kids' clothes, shoes, toys, and baby gear that meet current style, safety, and condition standards.",https://www.onceuponachild.com/home/what-we-buy
50,"Cute Baby Clothes, Kids & Matching Family Outfits: Posh ...",Children Clothes,['baby clothes'],[],"Shop Posh Peanut for stylish, premium-quality bamboo baby clothes, toddler clothes, and coordinated looks for the whole family. Free US shipping.",https://poshpeanut.com/
51,"Top 10 Best Children's Clothing in San Antonio, TX - Yelp",Children Clothes,"[""Children's Clothing""]",[],"Best Children's Clothing in San Antonio, TX - Belles & Beaux, Janie And Jack, Best Friends Kids Boutique, Nordstrom Rack, Just Boyz, Annie James Boutique, ...",https://www.yelp.com/search?cflt=childcloth&find_loc=San+Antonio%2C+TX
52,"THE BEST 10 Children's Clothing in Fort Wayne, IN - Yelp",Children Clothes,"[""Children's Clothing""]",[],"Best Children's Clothing in Fort Wayne, IN - Crazy 8, Everything Sweet Boutique, The Find, Carter's Babies & Kids, Kids Trade, Gap Factory, Kohl's, ...",https://www.yelp.com/search?cflt=childcloth&find_loc=Fort+Wayne%2C+IN
53,Kid's Clothes Made in the USA,Children Clothes,"['baby clothes', 'kids', 'clothes']",[],Shop top quality & American made children's and baby clothes at All USA Clothing. You support local workers when you buy kids' clothes ...,https://allusaclothing.com/kids.html
54,"Custom Kids & Teen Clothing - Create, Buy & Sell - Printful",Children Clothes,"['kids', 'clothing']",[],Buy custom kids & teen clothing or sell online with print-on-demand dropshipping. ✓ Free signup ✓ No minimums ✓ 20% Discount on samples.,https://www.printful.com/custom/kids-teen-clothing
55,Babyshop.com: Shop premium children's clothes and baby gear,Children Clothes,"[""children's clothes""]",[],"At Baby Shop you find premium children's clothes for your baby and child from 0-10 years. We have brands like Ralph Lauren, Little Marc Jacobs and United ...",https://www.babyshop.com/
56,Little English - Classic Children's Boys & Girls Clothing,Children Clothes,"[""children's clothing""]",[],"Upscale, classic children's clothing and gifts for sizes newborn to 14. New Fall collections available. Shop Now!",https://www.littleenglish.com/
57,Cinnamon Baby Children's Clothing Boutique,Children Clothes,"[""children's clothing""]",[],Ready to dress your little one in the cutest of outfits? Premium children's clothing boutique providing clothing & accessories for newborns up to the age of ...,https://cinnamonbabyau.com/
58,Little Nutmeggers: Four Centuries of Children's Clothes and ...,Children Clothes,"['children', 'clothing']",[],"By Karen DePauw. During the Colonial Era, children were seen as adults in the making whose clothing and actions mirrored those of their parents.",https://connecticuthistory.org/little-nutmeggers-four-centuries-of-childrens-clothes-and-games/
59,Children's Clothing & Baby Clothes in Columbia,Children Clothes,"[""children's clothing""]",[],"Shop children's clothing stores at The Mall in Columbia at stores like The Children's Place, GAP Kids, Gymboree, J. Crew, Justice, Hanna Andersson and more!",https://www.themallincolumbia.com/en/directory/childrens_clothing/
60,Children's Outdoor Clothing & Gear by Patagonia,Children Clothes,"['kids', 'baby', 'clothing']",[],Viva los fun piglets! We built our kids' and baby outdoor clothing and gear to stand up to childhood—guaranteed. Free Shipping over $99.,https://www.patagonia.com/kids/
61,"THE BEST 10 Children's Clothing in Boston, MA - Yelp",Children Clothes,"[""Children's Clothing""]",[],"Best Children's Clothing in Boston, MA - Bringing Up Baby, Tadpole, The Nutshell, CouCou, Magpie Kids, Whitney + Winston, babycottons, Emily & Addie, ...",https://www.yelp.com/search?cflt=childcloth&find_loc=Boston%2C+MA
62,Kids - Shop Children's Clothing - Maisonette,Children Clothes,"['kids clothes', ""children's clothing""]",[],"Maisonette is your one-stop shop for kids clothes including boys and girls clothing, accessories and more. Shop children's clothing from your favorite ...",https://www.maisonette.com/shop/kids
63,Marleylilly Kids: Monogrammed Kids' Clothes & Shoes,Children Clothes,"['kids', 'clothes']",[],"Shop Marleylilly Kids for classic monograms for kids. Check out our selection for the best monogrammed kids' clothes, fun monogrammed shirts and more.",https://kids.marleylilly.com/
64,Childrens Clothing - The Strategist - New York Magazine,Children Clothes,"[""Children's Clothing""]",[],"Children's Clothing ; something for everyone Sept. 29, 2022. 16 Baby Halloween Costumes, Vetted 16 Different Ways ; the best. really. Aug. 1, 2018. The Best Kids' ...",https://nymag.com/strategist/tags/children%27s-clothing/
65,Kids & Babies' Clothes for Sale - Redbubble,Children Clothes,['baby clothes'],[],"Kids', toddler, & baby clothes designed and sold by independent artists. Shop high-quality t-shirts, masks, onesies, and hoodies for the perfect gift.",https://www.redbubble.com/shop/kids-clothes
66,Children's Clothing & Baby Clothes in The Woodlands,Children Clothes,"[""children's clothing"", ""kid's clothes""]",[],Shop children's clothing stores at The Woodlands Mall. We carry a wide assortment of kid's clothes & infant clothing in top styles & brands.,https://www.thewoodlandsmall.com/en/directory/childrens_clothing/
67,Clothing for Boys - Costco Wholesale,Children Clothes,"['Clothing', 'Boys', 'Clothing', 'Boys']",[],Find a great collection of Clothing for Boys at Costco. Enjoy low warehouse prices on name-brand Clothing for Boys products.,https://www.costco.com/boys-clothing.html
68,"THE BEST 10 Children's Clothing in Eugene, OR - Yelp",Children Clothes,['kids clothes'],[],"""My favorite store to trade in my kids clothes. They give a good trade value and do not have a bunch of rules. Other places in town require only their ...",https://www.yelp.com/search?cflt=childcloth&find_loc=Eugene%2C+OR
69,"THE BEST 10 Children's Clothing in San Jose, CA - Yelp",Children Clothes,"[""children's clothing""]",[],"Willow Glen. ""Kool Kids is hands down one of the best children's clothing store in the south bay--offering gorgeous, stylish clothes for newborn to pre-teen ...",https://www.yelp.com/search?cflt=childcloth&find_loc=San+Jose%2C+CA
70,Boys Clothes - Cookie's Kids,Children Clothes,['Boys clothing'],[],"Find Boys clothing at Cookie's, the Kids' Department Store. Get discounted prices on...",https://www.cookieskids.com/boys_fashion.aspx
71,Florence Eiseman Children's Clothing,Children Clothes,"['garments', 'children']",[],"Proudly designing exceptional, quality and iconic garments in Milwaukee since 1945, Florence Eiseman continues to outfit the playful children of today.",https://www.florenceeiseman.com/
72,REISS Children's Clothes | Boys & Girls Clothes - REISS USA,Children Clothes,"['Children', 'boys', 'clothes']",[],"Tailored for Modern Children, every piece is designed by the same teams behind our grown-up ranges, ... Shop our exciting boys and girls clothes range.",https://www.reiss.com/us/en/childrens
73,Pink Chicken,Children Clothes,"[""children's clothes""]",[],"... and playful palette of colors for girls, women, babies and boys. ... Pink Chicken makes vintage-meets-boho children's clothes that are designed to last.",https://www.pinkchicken.com/
74,High Quality Children's Clothes | TINY - TINYCOTTONS,Children Clothes,"['clothing', 'kids']",[],"For the happy and bold. Discover our colorful organic clothing for kids from 2 to 12 years. High Quality. We are gender-neutral, we are TINYCOTTONS.",https://www.tinycottons.com/eur_en/kids-clothes
75,Kids' & Baby Clothing & Accessories - Dillard's,Children Clothes,"['clothes', 'kid']",[],"From cute clothes to the newest gear and toys, Dillard's has you covered for all your kid needs! Shop Nuna, Roller Rabbit, Mud Pie and more!",https://www.dillards.com/c/kids
76,"THE BEST 10 Children's Clothing in Houston, TX - Yelp",Children Clothes,['Kids clothes'],[],"Kids clothes for tons of different styles. Highly recommend them for children's gifts too. Seriously a great shop!!"" ...",https://www.yelp.com/search?cflt=childcloth&find_loc=Houston%2C+TX
77,"THE BEST 10 Children's Clothing in Columbus, OH - Yelp",Children Clothes,"[""Children's Clothing""]",[],"Best Children's Clothing in Columbus, OH - Fireflies & Fairytales, Cub Shrub, lilylimes, Nicole's for Children, Small Talk, Janie and Jack, Team Chipmunk, ...",https://www.yelp.com/search?cflt=childcloth&find_loc=Columbus%2C+OH
78,Kids Clothes for Boys and Girls | AnthroLiving - Anthropologie,Children Clothes,"['dresses', 'kids', 'clothing']",[],"Discover dresses, pants, rompers and more for kids at Anthropologie. Shop our clothing assortment. Free shipping for AnthroPerks members! Sign up today.",https://www.anthropologie.com/anthroliving/collection-kids-clothing
79,Children's Clothing & Baby Clothes in Durham,Children Clothes,"[""children's clothing"", ""kid's clothes""]",[],Shop children's clothing stores at The Streets at Southpoint. We carry a wide assortment of kid's clothes & infant clothing in top styles & brands.,https://www.streetsatsouthpoint.com/en/directory/childrens_clothing/
80,Childhoods Clothing,Children Clothes,"[""children's clothing""]",[],"We're a family business making the coziest baby & toddler clothing. Previous ... ""Soft, cozy + darling --- it's like the unicorn of children's clothing!"".",https://childhoodsclothing.com/
81,Kids' Clothing | REI Co-op,Children Clothes,"['Kids', 'Clothing']",[],Shop for Kids' Clothing at REI - FREE SHIPPING With $50 minimum purchase. Curbside Pickup Available NOW! 100% Satisfaction Guarantee.,https://www.rei.com/c/kids-clothing
82,Kids Clothing ⋅ Kids Fashion ⋅ Smallable,Children Clothes,"['kids', 'clothing']",[],"The biggest kids' clothing designers and brands are on Smallable: Bobo Choses, Emile et Ida, Louise Louise, Finger in the Nose…",https://www.smallable.com/en/fashion/children
83,"THE BEST 10 Children's Clothing in Providence, RI - Yelp",Children Clothes,['baby clothes'],[],"""Adorable boutique for moms and kids alike! The selection of adorable baby clothes and innovative kid-friendly products is unbeatable. Why scour the internet ...",https://m.yelp.com/search?cflt=childcloth&find_loc=Providence%2C+RI
84,"THE BEST 10 Children's Clothing in Las Vegas, NV - Yelp",Children Clothes,"[""Children's Clothing""]",[],"Best Children's Clothing in Las Vegas, NV - Little Divas Fashion, Childrens Orchard Rio Vista Plaza, Le Petits Cheris, Janie and Jack, The Forum Shops at ...",https://www.yelp.com/search?cflt=childcloth&find_loc=Las+Vegas%2C+NV
85,Lemon Loves Lime - Children's Clothes,Children Clothes,"['children', 'baby']",[],Lemon Loves Lime collection was created for every mother and grand mom to express their unconditional love and devotion for their children. baby and ...,https://lemonloveslime.com/
86,"THE BEST 10 Children's Clothing in Santa Barbara, CA - Yelp",Children Clothes,"[""kid's clothes""]",[],"You can sell used kid's clothes and receive store credit. You can also consign baby gears and maternity wears. Its also very casual,…"" ...",https://www.yelp.com/search?cflt=childcloth&find_loc=Santa+Barbara%2C+CA
87,"THE BEST 10 Children's Clothing in Stockton, CA - Yelp",Children Clothes,"[""Children's Clothing""]",[],"Best Children's Clothing in Stockton, CA - Sassy Pants Children's Boutique, Caterpillar Childrens Boutique, Carter's Babies & Kids, Blackbird Boutique, ...",https://www.yelp.com/search?cflt=childcloth&find_loc=Stockton%2C+CA
88,Mini Ruby Contemporary Childrenswear | Modern Kids ...,Children Clothes,['Kids Clothes'],[],"Fine, Contemporary, Cool Kids Clothes for Girls, Boys and Baby from Baby to Tween and Teen Sizes. Featuring a wide selection of designer, modern and trendy ...",https://miniruby.com/
89,"THE BEST 10 Children's Clothing in Walnut Creek, CA - Yelp",Children Clothes,['baby clothes'],[],"""I was looking for cute baby clothes for my brand new niece and nephew. Stumbled on this super cute shop. The owner and manager are so sweet and helpful!",https://www.yelp.com/search?cflt=childcloth&find_loc=Walnut+Creek%2C+CA
90,Marie Nicole Clothing - Wholesale Pricing On Boutique Clothing!,Children Clothes,"[""children's"", 'clothing']",[],"Adorable, Affordable and Comfortable children's boutique clothing & more for wholesale prices.",https://marienicoleclothing.com/
91,Children Clothes Box Online | Outfits for Boys & Girls - Kidpik,Children Clothes,['kids clothing'],[],What makes the best kids clothing subscription box? What should you look for before joining one? Follow our checklist to help choose the best option.,https://www.kidpik.com/children-clothes-box-online
92,"THE BEST 10 Children's Clothing in Manhattan, NY - Yelp",Children Clothes,"[""Children's Clothing""]",[],"Best Children's Clothing in Manhattan, NY - Little Moony, Couture Kids, An Me, Stoopher & Boots, Lucky Wang 2, Spring Flowers Children's Boutique, ...",https://www.yelp.com/search?cflt=childcloth&find_loc=Manhattan%2C+NY
1,Shop Kids' Clothing - Kohl's,Children Clothes,['Kids Clothing'],[],Enjoy free shipping and easy returns every day at Kohl's. Find great deals on Kids Clothing at Kohl's today!,https://www.kohls.com/catalog/kids-clothing.jsp?CN=AgeAppropriate:Kids+Department:Clothing
2,"Boys' Clothes | Jeans, Jumpers & More | H&M US",Children Clothes,"['boys', 'clothes']",[],"Discover all boys' clothes at H&M. Refresh on everyday essentials, or scroll for the latest T-shirts, jeans, jackets, sweaters and more.",https://www2.hm.com/en_us/kids/boys/clothing.html
3,Kids' Clearance Clothing - $4.99 and under - Zulily,Children Clothes,['kids clothing'],[],"Discover kids clothing clearance at zulily. Find great discounts on dresses, tops, leggings, pants, shorts and much more. Hurry, these deals go fast!",https://www.zulily.com/kids-clothes-clearance?rtn=y&page=cms
