position,title,query,snippet_highlighted_words,rich_snippet_list,snippet,link35,bella bliss® Classic Baby Clothes,Children Clothes,"[""children's clothing""]",[],"If you're looking for the best high quality clothing for babies & kids, shop bella bliss® for classic children's clothing featuring our vintage inspired ...",https://www.bellabliss.com/
36,Kids Clothes Box - Stitch Fix,Children Clothes,['Kids clothes'],[],Easily get the best-fitting Stitch Fix Kids clothes for your kid. Sizes 2T–18. Free shipping and returns. No subscription required.,https://www.stitchfix.com/kids
37,Hanna Andersson | Premium Kids Clothes and Matching ...,Children Clothes,['Kids'],[],"Hanna Pajamas look great and feel even better. Shop Babies, Kids, Adults, and Pets too! You'll understand why people say “best pajamas ever” since 1983.",https://www.hannaandersson.com/
38,32 Best Children's Clothing Brands: Kids And Baby Clothing,Children Clothes,"['kids clothes', 'baby clothing']",[],And the best kind of retail therapy is surely kids clothes shopping. ... these are the best children and baby clothing brands to shop now.,https://www.elle.com/uk/fashion/g38198973/best-children-clothing-brands/
39,Kids Fashion: Kids Clothing & Accessories - Bloomingdale's,Children Clothes,"['Kids Clothes', ""kid's clothes""]",[],"Kid's Fashion: Designer Kids Clothes & Accessories. Find trending kid's clothes at Bloomingdale's. From casual everyday pieces to dressy designer clothes, shop ...",https://www.bloomingdales.com/shop/kids?id=3866
40,Fantaisie Kids: Home,Children Clothes,"['Kids', 'Dress']",[],Fantaisie Kids offers the best hand smocked and embroidered wear for upscale casual and special ... Blue & White SeerSucker Sailing Boat Sailor Dress.,https://www.fantaisiekids.com/
41,Baby & Kids' Clothing and Accessories - JCPenney,Children Clothes,"['kids', 'clothing']",[],Shop adorable pieces from JCPenney's baby & kids' clothing collection. Dress them up in styles they love at affordable prices. Free shipping available!,https://www.jcpenney.com/d/baby-kids
42,"Next Official Site: Online Fashion, Kids Clothes & Homeware",Children Clothes,"[""children's""]",[],"Shop the latest women's, men's and children's fashion plus homeware, beauty and more. Next day delivery and free returns available. Shop now!",https://www.next.us/en
43,Classic Childrens Clothing with a Timeless Appeal – The ...,Children Clothes,['childrens clothing'],[],Fine hand-sewn classic childrens clothing. Designed with a timeless eye towards the elegant clothing of yesteryear. Traditional kids designs fashioned in a ...,https://oaksapparel.com/
44,"Catimini USA - European Baby Clothes, Toddler and ...",Children Clothes,['kids clothing'],[],Shop Catimini now for European inspired & designed baby & kids clothing at the official Catimini USA website. We offer a wide selection of playful and ...,https://catiminiusa.com/
45,Kids Clothes | Girls & Boys Clothes | Primark USA,Children Clothes,['kids clothes'],[],"From tiny clothes for newborn babies to older kids clothes, our kids fashion range has everything you need for the little (and not so little) ...",https://www.primark.com/en-us/all-products/kids/c/kids
46,"Busy Bees: Classic, American preppy clothing for baby, ...",Children Clothes,"[""children's clothing""]",[],"Busy Bees is a classic, preppy children's clothing brand for boys and girls 3 months to 16 years. Timeless classics for a modern lifestyle, recognized for ...",https://www.busybeeskids.com/
47,SEVIIN Children's Apparel,Children Clothes,['Childrens Apparel'],[],By signing up you agree to receive recurring automated marketing messages from Seviin Childrens Apparel. View Terms & Privacy. © 2023 SEVIIN Children's ...,https://seviinchildrensapparel.com/
48,Bentex Recalls Children's Clothing Sets Due to Violation ...,Children Clothes,"[""children's clothing""]",[],Consumers should immediately take the recalled children's clothing sets away from children and contact Bentex for instructions on how to ...,https://www.cpsc.gov/Recalls/2023/Bentex-Recalls-Childrens-Clothing-Sets-Due-to-Violation-of-the-Federal-Lead-Paint-and-Lead-Content-Ban-Lead-Poisoning-Hazard
49,"Cute Kids Clothes & Shoes Online, Personalized from FabKids!",Children Clothes,['kids clothes'],[],"Shop online for cute kids clothes and shoes with FabKids. FabKids delivers high quality, ready-to-play boys and girls clothing & shoes every month!",https://www.fabkids.com/
50,adidas Kids' Clothes & Outfits,Children Clothes,['Kids Apparel'],[],"Shop adidas Kids Apparel on adidas.com. Browse all products, from shoes to clothing and accessories in this collection. Find all available syles and colors ...",https://www.adidas.com/us/kids-clothing
51,CARING CHILDREN CLOTHING CHILDREN - Home,Children Clothes,['Children Clothing'],[],"Caring Children Clothing Children of Martin County, FL USA.",http://www.4cmartin.org/
52,800 Best Kids clothes ideas - Pinterest,Children Clothes,"['Kids clothes', 'kids outfits']",[],"Feb 6, 2022 - Explore Maya Kuzman's board ""Kids clothes"", followed by 7246 people on Pinterest. See more ideas about kids outfits, kids fashion, ...",https://www.pinterest.com/littletreasures/kids-clothes/
53,"Classic Prep | Classic, Preppy Kids' Clothes",Children Clothes,"['kids', 'clothes']",[],"Introducing a new generation to the kind of classic, preppy kids' clothes that look great in any era and stand the test of time.",https://classicprep.com/
54,Kids Clothes - Zumiez,Children Clothes,"['kids clothing', 'kids clothes', 'kids apparel']",[],"Shop kids clothing and kids clothes at Zumiez, carrying kids apparel from top skateboard and streetwear brands, like Thrasher, Diamond, Volcom, and Vans.",https://www.zumiez.com/kids.html
55,Children Clothing - Etsy,Children Clothes,['children clothing'],[],"Check out our children clothing selection for the very best in unique or custom, handmade pieces from our shops.",https://www.etsy.com/market/children_clothing
56,Kountry Cuties Inc. - Unique Children's Clothing for Every ...,Children Clothes,"[""children's clothing""]",[],"At Kountry Cuties, our goal is to offer unique children's clothing that your little one will absolutely love. Each outfit we offer is cuter than the last!",https://www.kountrycuties.com/
57,Maisonette | Boutique Clothes & Decor for Kids & Babies,Children Clothes,['baby clothing'],[],"Your favorite kids brands and independent boutiques, all in one magical place. Shop Maisonette for the best in kids and baby clothing, furniture, decor, ...",https://www.maisonette.com/
58,"1217952 Children Clothes Images, Stock Photos & Vectors",Children Clothes,"[""child's clothes""]",[],"Soft Focus of a Two Years Old Child Choosing her own Dresses from Kids Cloth Rack · Rack with different child's clothes near coral wall, closeup Stock Photo.",https://www.shutterstock.com/search/children-clothes
59,Tutti Frutti Clothing | Award Winning Organic Children's Clothes,Children Clothes,"['clothes', 'kids']",[],Award winning organic clothes for kids age 0-6 years. Made in the UK.,https://tuttifrutticlothing.com/
60,Childrens Clothing & Shoes | Kids Clothes | Monsoon Global,Children Clothes,"['boys', ""children's"", 'clothes', 'boys', 'baby']",[],"Discover our latest looks for girls and boys from the Monsoon children's collection. Shop clothes and accessories for girls, boys and baby at Monsoon ...",https://www.monsoonlondon.com/us/children/
61,Children's Clothing & Baby Clothes in Natick - Natick Mall,Children Clothes,"[""children's clothing"", ""kid's clothes""]",[],Shop children's clothing stores at Natick Mall. We carry a wide assortment of kid's clothes & infant clothing in top styles & brands.,https://www.natickmall.com/en/directory/childrens_clothing/
62,Children's Clothing Regulations in the United States,Children Clothes,"[""children's clothing""]",[],"Guide to CPSIA, FFA, CA Prop 65, textiles labeling, certification, and lab testing requirements for baby and children's clothing in the US.",https://www.compliancegate.com/children-clothing-regulations-united-states/
63,Cygnet Living: Vintage Style Children's Clothing,Children Clothes,"[""children's clothing""]",[],Cygnet Living offers vintage style children's clothing and classic outfits! We carry luxury knitted pieces with FREE monograms. Click here to learn more.,https://www.cygnetliving.com/
64,Traditional Spanish Children's Clothes | La Coqueta Kids,Children Clothes,[],[],"La Coqueta, a leading designer fashion brand and boutique for babies aged 0 months to 10 years was founded in 2013 with the aim to promote and support ...",https://www.lacoquetakids.com/
65,"RAGS.com: Kids and Baby Clothes | Rompers, T-Shirts, & More",Children Clothes,"['kids', 'Baby', 'kid', 'boys']",[],"We're breaking all the romper rules. Shop for kids rompers, jumpsuits, and tees. Baby, toddler, and kid sizes available for girls and boys. Shop now!",https://rags.com/
66,Cookie's Kids Clothing for Boys and Girls,Children Clothes,['kids clothing'],[],"Shop for kids clothing at incredibly low discount prices and free shipping. Find school uniforms, clothes for boys and girls including baby and childrens ...",https://www.cookieskids.com/
67,Smockingbird: Classic Children's Clothing at Child-sized Prices,Children Clothes,"[""children's clothing""]",[],Shop for affordable classic children's clothing at Smockingbird. This handmade clothing line was started by two moms who believe adorable clothes should be ...,https://smockingbirdkids.com/
68,Tottini: Quality Children Clothes at Affordable Prices,Children Clothes,"[""children's clothing""]",[],Tottini is more than just a children's clothing store. Tottini was founded on a mission of creating stylish and up to date clothing while not compromising ...,https://tottini.com/
69,AlexandAlexa: Kids designer clothes & Kids fashion,Children Clothes,"[""children's clothes""]",[],"The latest European designer children's clothes, shoes, sportswear, home & toys. Boys, girls, baby, teens.",https://www.alexandalexa.com/
70,Children's Clothing - QVC.com,Children Clothes,"[""Children's Clothing""]",[],Clear All Filters Your Selections: Children's Clothing · Sherpy for Kids Comfy Hoodie Wearable Blanket - A262644. New.,https://www.qvc.com/fashion/childrens-clothing/_/N-45qu86/c.html
71,Kids Clothes | Children's Clothing - Splendid,Children Clothes,"['kids', 'clothing', ""children's clothing""]",[],"Shop kids' clothing from Splendid for fashionable and casual outfits. Explore our collection of children's clothing for baby, toddler and kids' sizes.",https://splendid.com/collections/kids
72,Baby and children clothes - Mina exclusive collection - Home,Children Clothes,['outfits'],[],Mina Exclusive collection is an online boutique store for luxury festive knitted sets and day to day comfortable stylish outfits for your little ones.,https://mina-usa.com/
73,MAKIÉ - Minimalist & Delicate Baby and Children Clothes.,Children Clothes,['baby clothing'],[],"Minimalist and delicate children and baby clothing with exquisite fabrics and gift items. Carefully curated housewares, accessories and women's clothing.",https://www.makieclothier.com/
74,Baby & Kids Clothing For Sale Near You - Sam's Club,Children Clothes,['Kids Clothing'],[],"Baby & Kids Clothing · Member's Mark Girls' 3 Pack Legging · Eddie Bauer Boys' Sherpa Lined Shirt Jacket · Champion Toddler Girls' Active Hoodie, Joggers and T- ...",https://www.samsclub.com/b/children-s-clothing/3010101
75,Children's clothing - Wikipedia,Children Clothes,"[""Children's clothing"", 'kids', 'clothing', ""Children's clothing""]",[],Children's clothing or kids' clothing is clothing for children who have not yet grown to full height. Children's clothing is often more casual than adult ...,https://en.wikipedia.org/wiki/Children%27s_clothing
76,Eliza James Kids: Adorable Classic Children's Clothing,Children Clothes,"[""children's clothing"", 'kids clothes']",[],Shop adorable classic children's clothing at Eliza James Kids. We have smocked & monogrammed kids clothes for every occasion and celebration!,https://www.elizajameskids.com/
77,100+ Multicultural Children's Clothes - Colours of Us,Children Clothes,"[""Children's Clothes""]",[],"100+ Multicultural Children's Clothes: Baby, Toddler, Kids & Teenager Clothing with African, Asian, Hispanic and Native American Motifs, Ages 0 to 18.",https://coloursofus.com/100-multicultural-childrens-clothes/
78,"THE BEST 10 Children's Clothing in San Diego, CA - Yelp",Children Clothes,['kids clothes'],[],"""Awesome selection of baby and kids clothes. They also have very cute handmade accessories! Can't find many resale shops that have quality items.…"" ...",https://www.yelp.com/search?cflt=childcloth&find_loc=San+Diego%2C+CA
79,"Gerber Childrenswear: Baby Clothing, Onesies Brand & Just ...",Children Clothes,['baby clothes'],[],"Shop the best selection of baby clothes for your newborn or toddler at Gerber Childrenswear. We offer a variety of baby Onesies Brand bodysuits, Just Born ...",https://www.gerberchildrenswear.com/
80,Kids' Clothes | Curbside Pickup Available at DICK'S,Children Clothes,"['Kids', 'Clothes', 'kids', 'clothing']",[],"Shop Kids' Clothes at DICK'S Sporting Goods. Browse a wide selection of kids' clothing including workout clothes for kids, warm winter clothes and more at ...",https://www.dickssportinggoods.com/f/youth-apparel
1,Kids' Clothing - Target,Children Clothes,"['Kids', 'Clothing']",[],"Shop Target for Kids' Clothing you will love at great low prices. Choose from Same Day Delivery, Drive Up or Order Pickup. Free standard shipping with $35 ...",https://www.target.com/c/kids/-/N-xcoz4
2,Kids' Clothes & Baby Clothes - Belk,Children Clothes,"['kids', 'clothes', 'baby clothes']",[],Dress your little one in style with kids' clothes and baby clothes from Belk. Receive free shipping and easy returns on qualifying orders.,https://www.belk.com/kids/
3,Kids' Clothes - Macy's,Children Clothes,"['kids', 'clothes']",[],"FREE SHIPPING & RETURNS! Shop kids' clothes and get great deals & discounts on the latest clothing fashion and trends for kids, in store and online.",https://www.macys.com/shop/kids-clothes?id=5991
4,The Children's Place: Kids Clothes & Baby Clothes,Children Clothes,"[""children's clothes"", 'kids clothes', 'baby clothes']",[],"Shop for children's clothes. From kids clothes to baby clothes, find it all at The Children's Place, where big fashion meets little prices with free shipping!",https://www.childrensplace.com/us/home
5,Find Kids Clothing | Kohl's,Children Clothes,"['kids', 'clothes']",[],"Enjoy free shipping and easy returns on adorable kids' clothes from Kohl's. Find kids' jeans, tops, sweaters, dresses and dress pants and more.",https://www.kohls.com/sale-event/kids-clothing.jsp
6,Kids Clothes (Sizes 4-14) | Carter's | Free Shipping,Children Clothes,['kids clothing'],[],"Shop for fashionable & affordable kids clothing at Carters.com. Explore our assortment of children tops, pants & more available in sizes 4- 14.",https://www.carters.com/kid-clothes
7,"Gymboree: Kids, Toddler & Baby Clothes",Children Clothes,['kids clothes'],[],"Celebrate the magic of childhood with kids clothes in patterns and prints from our latest themed collections. Shop all our styles including dresses, skirts, ...",https://www.gymboree.com/us/home
8,Kids' Clothing & Shoes | Kids & Babies | H&M US,Children Clothes,"['kids', 'clothes']",[],"Kit them out in style with our kids' clothes. Find everyday essentials, kids' shoes and accessories for babies and children at H&M.",https://www2.hm.com/en_us/kids.html
9,"Kids Clothing, Shoes & Accessories - Nordstrom",Children Clothes,['kids clothing'],[],"Free shipping and returns on kids clothing, shoes and accessories at Nordstrom.com. Find everything for boys, girls, and baby from top brands.",https://www.nordstrom.com/browse/kids
10,"Kids' Clothing, Shoes, And More | Girls' and Boys' ... - Zulily",Children Clothes,"['kids', 'clothing', 'boys', 'clothes']",[],"Explore kids' clothing at Zulily. Shop daily discounts on girls' and boys' clothes, shoes, and accessories.",https://www.zulily.com/category/kids
11,Children's Clothing and Newborn Clothing at Janie and Jack,Children Clothes,"[""children's clothing"", 'kids clothes']",[],"Janie and Jack offers classic, designer children's clothing in rich fabric, design and detail. Shop our selection of finely crafted kids clothes in sizes ...",https://www.janieandjack.com/
12,Kids Clothing (Sizes 4-14) | OshKosh | Free Shipping,Children Clothes,"['kids', 'clothing', 'kids clothes']",[],Shop kids' clothing from OshKosh for timeless style and durable quality. Enjoy free shipping on all kids clothes online at Oshkosh.com.,https://www.oshkosh.com/oshkosh-kid-clothes
13,"Tea Collection | Children's Clothes for Kids, Baby & Newborn",Children Clothes,['kids clothes'],[],"At Tea Collection, we travel the world to bring you globally inspired, well-made kids clothes for all of life's adventures. Shop Tea Collection children's ...",https://www.teacollection.com/
14,Kid´s Clothes | Online Sale | ZARA United States,Children Clothes,"['kids', 'clothes']",[],"SALE - Discover the latest kids' clothes, shoes, and accessories updated every week at ZARA online.",https://www.zara.com/us/en/kids-mkt1.html
15,Kids' Clothes - Lands' End,Children Clothes,"['kids', 'clothes', ""children's clothes"", 'kids', 'clothes']",[],"Shop kids' clothes at Lands' End. FREE shipping available. Find quality children's clothes, kids' winter clothing, trendy kids' clothes, and more. Shop now!",https://www.landsend.com/shop/kids/S-yuh-xec
16,Children's Clothing - Amazon.com,Children Clothes,"[""children's clothing"", 'Kids Clothes']",[],Amazon.com: children's clothing. ... Heritage Girls 2 (Two) Piece Fleece Hoodie Fleece Jogger Set Kids Clothes Toddler and Little Girls.,https://www.amazon.com/childrens-clothing/s?k=children%27s+clothing
17,Authentic American Kids Clothing Since 1892 - abercrombie kids,Children Clothes,"['clothing', 'dresses']",[],"Casual, All-American clothing with laidback sophistication. Shop jeans, tees, dresses, skirts, sweaters, outerwear, fragrance & accessories.",https://www.abercrombie.com/shop/us/kids
18,"Jacadi Paris: Baby, toddler and kids clothes, children's ...",Children Clothes,['kids clothes'],[],"Take a look at the timelessly elegant collections of baby, toddler and kids clothes, shoes and accessories that Jacadi designed for children of all ages.",https://www.jacadi.us/
19,SweetHoney Clothing: Kids Boutique Clothing - Children's ...,Children Clothes,"['Clothing', 'Kids', 'Baby', 'Clothing']",[],Check out SweetHoney Clothing for all your Kids & Baby needs ⭐Shop new items every week! ✔️ Clothing ✔️ Swimwear ✔️ Loungewear and more.,https://sweethoneyclothing.com/
20,Primary Clothing - Brilliant Basics for Baby & Kids,Children Clothes,"['clothes', 'kids']",[],"Welcome to Primary. No labels, no slogans. Just soft, simpler clothes that kids and babies will love. Shop gender neutral, sustainable basics for the whole ...",https://www.primary.com/
21,Kids Designer Clothes & Shoes | Childsplay Clothing USA,Children Clothes,"['kids', 'Clothing', 'boys']",[],"Shop the latest kids designer fashion at Childsplay Clothing. Find Luxury brands for babies, boys and girls. Worldwide shipping available.",https://www.childsplayclothing.com/us/en
22,Boys Clothes - Old Navy,Children Clothes,['boys clothing'],[],"Shop for boys clothing at Old Navy, and create easy outfits for boys' everyday styles. Find essentials like school uniforms, boys' jeans, t-shirts, & more.",https://oldnavy.gap.com/browse/division.do?cid=5910
23,Kids Clothing | Girls Sizes 2T - 18 | Boys 2T - 20 - Walmart.com,Children Clothes,"['kids', 'clothing']",[],"Whether you're looking for comfortable, everyday clothing for your little one or a fun statement piece, you'll find a variety of kids' clothing at ...",https://www.walmart.com/cp/kids-clothing/7712430
24,"Children's Clothing, Shoes & Accessories | Boden US",Children Clothes,"[""children's clothing""]",[],"Our children's clothing, shoes, and accessories ensure bright and breezy every day. Rainbow-hued tops, embellished jeans, and vibrant sweaters?",https://www.bodenusa.com/en-us/children-clothing
25,Kids' Clothes - French Children's and Baby Clothes on ...,Children Clothes,"[""children's clothes""]",[],"I➨Vertbaudet - Shop online for baby & children's clothes, shoes, maternity wear, school wear & nursery items.",https://www.vertbaudet.com/en/
26,Kids Designer Clothes & Shoes - Ralph Lauren,Children Clothes,"['kids', 'clothes']",[],Shop kids designer clothes & shoes for everything from polos and sneakers to outerwear and accessories. Free Fast Shipping With an RL Account & Free ...,https://www.ralphlauren.com/kids
27,15 Websites for Cheap (And Adorable!) Kids Clothes,Children Clothes,['kids clothing'],[],15 American retailers that make it super easy to find adorable kids clothing at fantastic prices! Shop their websites now for great deals.,https://www.myus.com/blog/15-best-childrens-discount-adorable-clothing-sites-perfect-for-eid/
28,Free Birdees | The Softest Bamboo Baby & Children's Clothes ...,Children Clothes,"[""children's clothes""]",[],"At Free Birdees, we offer the softest premium Bamboo baby and children's clothes and accessories made from Bamboo Viscose. We specialize in Baby and ...",https://freebirdees.com/
29,"Children's Clothing for Girls, Boys, Baby | Bealls Florida",Children Clothes,['kids clothing'],[],"Affordable, but trendy clothes for kids and baby. For vacation, bright summer days and back to school, find kids clothing at prices that make you smile.",https://www.beallsflorida.com/online/shop/kids-clothing
30,Kidizen - Buy & Sell Gently Used Kids' Clothes and Shoes,Children Clothes,"['kids', 'kids']",[],Kidizen is the top marketplace to buy and sell kids' fashion. Shop thousands of your favorite brands at up to 70% off retail. Sell your kids' and women's.,https://www.kidizen.com/
31,Limonada US,Children Clothes,"['clothing', 'boys', 'kids']",[],"Discover exclusive design clothing for girls and boys: newborns, babies, toddlers and kids. Stylish designs and rich fabrics for them at Limonada US.",https://limonadashop.com/
32,The Best Places to Buy Kids Clothes - Verywell Family,Children Clothes,"['kids', 'clothes', 'kids']",[],"Whether your kids need formal attire, casual clothes, or outerwear, it's helpful to know where to shop. Here are the best places to buy kids ...",https://www.verywellfamily.com/best-places-to-buy-kids-clothes-5190552
33,The 11 best places to shop for kids clothes in 2021 - Insider,Children Clothes,['kids clothing'],[],We did the testing to find the best kids clothing stores and brands for kids of all ages and needs. We also rounded up our favorite back-to- ...,https://www.insider.com/guides/parenting/best-kids-clothes
34,Children's Apparel Archives - Brick House in the City,Children Clothes,"['children', 'apparel']",[],"Catholic t-shirts for women, men, and children. Catholic home decor and accessories. Catholic devotionals. Catholic apparel for the whole family.",https://brickhouseinthecity.com/product-category/childrens-apparel/
35,bella bliss® Classic Baby Clothes,Children Clothes,"[""children's clothing""]",[],"If you're looking for the best high quality clothing for babies & kids, shop bella bliss® for classic children's clothing featuring our vintage inspired ...",https://www.bellabliss.com/
36,Kids Clothes Box - Stitch Fix,Children Clothes,['Kids clothes'],[],Easily get the best-fitting Stitch Fix Kids clothes for your kid. Sizes 2T–18. Free shipping and returns. No subscription required.,https://www.stitchfix.com/kids
37,Hanna Andersson | Premium Kids Clothes and Matching ...,Children Clothes,['Kids'],[],"Hanna Pajamas look great and feel even better. Shop Babies, Kids, Adults, and Pets too! You'll understand why people say “best pajamas ever” since 1983.",https://www.hannaandersson.com/
38,32 Best Children's Clothing Brands: Kids And Baby Clothing,Children Clothes,"['kids clothes', 'baby clothing']",[],And the best kind of retail therapy is surely kids clothes shopping. ... these are the best children and baby clothing brands to shop now.,https://www.elle.com/uk/fashion/g38198973/best-children-clothing-brands/
39,Kids Fashion: Kids Clothing & Accessories - Bloomingdale's,Children Clothes,"['Kids Clothes', ""kid's clothes""]",[],"Kid's Fashion: Designer Kids Clothes & Accessories. Find trending kid's clothes at Bloomingdale's. From casual everyday pieces to dressy designer clothes, shop ...",https://www.bloomingdales.com/shop/kids?id=3866
40,Fantaisie Kids: Home,Children Clothes,"['Kids', 'Dress']",[],Fantaisie Kids offers the best hand smocked and embroidered wear for upscale casual and special ... Blue & White SeerSucker Sailing Boat Sailor Dress.,https://www.fantaisiekids.com/
41,Baby & Kids' Clothing and Accessories - JCPenney,Children Clothes,"['kids', 'clothing']",[],Shop adorable pieces from JCPenney's baby & kids' clothing collection. Dress them up in styles they love at affordable prices. Free shipping available!,https://www.jcpenney.com/d/baby-kids
42,"Next Official Site: Online Fashion, Kids Clothes & Homeware",Children Clothes,"[""children's""]",[],"Shop the latest women's, men's and children's fashion plus homeware, beauty and more. Next day delivery and free returns available. Shop now!",https://www.next.us/en
43,Classic Childrens Clothing with a Timeless Appeal – The ...,Children Clothes,['childrens clothing'],[],Fine hand-sewn classic childrens clothing. Designed with a timeless eye towards the elegant clothing of yesteryear. Traditional kids designs fashioned in a ...,https://oaksapparel.com/
