position,title,query,snippet_highlighted_words,rich_snippet_list,snippet,link8,Girls' Clothes: Shop Cute Clothes for Girls of All Ages | Kohl's,Girls clothing,"['Girls', 'Clothing']",[],Enjoy free shipping and easy returns every day at Kohl's. Find great deals on Girls' Clothing at Kohl's today!,https://www.kohls.com/catalog/girls-kids-clothing.jsp?CN=Gender:Girls+AgeAppropriate:Kids+Department:Clothing
9,Girls Clothing (Sizes 7-16) - Nordstrom,Girls clothing,['girls clothing'],[],"Free shipping and returns on girls clothing at Nordstrom.com. Find dresses, tops, tees, sweatshirts, jeans, and more from top brands like Zella Girl, ...",https://www.nordstrom.com/browse/kids/girls/clothing-sizes-7-16
10,"Girls Clothes | Bathing Suits, Leggings, Jeans, Shorts | Shop ...",Girls clothing,['girls clothing'],[],"Justice's online girls clothing store has leggings, girls bikinis and one piece swimsuits, shorts, pajamas, dresses for tweens and teens, and fashion in ...",https://www.shopjustice.com/
11,"Girls' Clothing | Dresses, Shorts, Jeans & Tops | JCPenney",Girls clothing,"['girls', 'clothing']",[],"Shop the latest girls' clothing trends at JCPenney! From dresses and shorts, to jeans and tops, we have everything to make the perfect outfit.",https://www.jcpenney.com/g/baby-kids/all-girls-clothing?id=cat11100001191
12,Girls' Hoodies & Sweatshirts - Belk,Girls clothing,['girl clothes'],[],"Our toddler girl clothes include cute designs like unicorn graphics, animal prints and festive fabrics for the holidays. The girls' character apparel collection ...",https://www.belk.com/kids/girls-clothing/
13,Girls Clothing in Kids Clothing - Walmart.com,Girls clothing,['Girls Clothing'],[],"Shop for Girls Clothing in Kids Clothing. Buy products such as Wonder Nation Girls Long Sleeve Kid Tough T-Shirt, Sizes 4-18 & Plus at Walmart and save.",https://www.walmart.com/browse/clothing/girls-clothing/5438_7712430_1660851
14,Girls' Clothes: Cute and Affordable Looks for All Occasions,Girls clothing,"['girls', 'clothing']",[],Stay on top of her growth spurts and wardrobe makeovers with girls' clothing at Zulily. We have a broad assortment of cute clothes for girls in a wide range of ...,https://www.zulily.com/category/girls
15,Cute Clothes for Girls & Teens - Tillys,Girls clothing,"['girls', 'clothing']",[],"The girls want to look chic too. Treat her to some comfortable clothing, shoes and accessories by shopping Tillys.",https://www.tillys.com/kids/girls/
16,Girls Clothing at Janie and Jack,Girls clothing,"['girls', 'clothing', 'girls clothes']",[],"Janie and Jack crafts distinctive, boutique girls' clothing. Shop our designer girls clothes featuring precious detailing and luxurious fabrics.",https://www.janieandjack.com/girls-clothing
17,All Girls Clothes at Tea Collection,Girls clothing,['girls clothes'],[],Shop all the girls clothes at Tea Collection and help her stand out in the pack.,https://www.teacollection.com/girls-clothing
18,Shop Cute Clothes for Girls sizes 7-14 - Maurices,Girls clothing,['girls clothing'],[],"Shop maurices' selection of cute girls clothing for girls sizes 7 through 14. Find the latest and best picks across girls jeans, t-shirts, and more.",https://www.maurices.com/c/girls/N-13979
19,Girls Clothes & Outfits (Big Girl Sizes 7-16) - Bloomingdale's,Girls clothing,['Girls Apparel'],[],"Designer Girls Apparel Sizes 7-16: Girls Dresses, Sweaters, Jackets, and Leggings. Fashion your daughter in your own stylish image with ...",https://www.bloomingdales.com/shop/kids/big-girl-clothes-7-16?id=23720
20,Girls' Clothes | Girls' Fashion | Boden US,Girls clothing,"['girls', 'clothes']",[],"For a pop of cheerful color every day, browse our girls' clothes online. Find hard-wearing leggings, snuggly sweaters, adventure-ready dresses, ...",https://www.bodenusa.com/en-us/girls-clothing
21,Cute Teen Girls' & Women's Clothing - Aeropostale,Girls clothing,"['clothing', 'clothes', 'girls']",[],"Keep up with the latest teen clothing trends in Aeropostale's cute clothes for girls and teens. Shop popular shirts, jeans, sleepwear and more here.",https://www.aeropostale.com/women-teen-girls/clothing/
22,"Girls Clothes – Dresses, Hoodies, Sweaters and School ...",Girls clothing,['girls clothing'],[],"Find girls clothing at Cookie's, the Kids' Department Store. Get discounted prices on...",https://www.cookieskids.com/girls_fashion.aspx
23,Shop Girls Clothes | GapKids,Girls clothing,"['girls clothing', 'girls clothes']",[],"Shop girls clothing at Gap, where clothes are fun, stylish and comfortable. Browse the latest in girls clothes, from playwear and activewear to school ...",https://www.gap.com/browse/division.do?cid=1137865
24,Girls' Clothes | Lands' End,Girls clothing,"['girls', 'clothes', 'girls', 'clothing', 'girls', 'apparel', 'girls', 'clothes']",[],"Shop girls' clothes at Lands' End. FREE shipping available. Find quality girls' clothing, clothes for girls, apparel for girls, clothes for tweens, ...",https://www.landsend.com/shop/girls-clothing/S-xez-y5d-xec
25,Girls Clothing | Everyday Low Prices - Rainbow Shops,Girls clothing,"['clothes', 'girls', 'girls']",[],"Rainbow Shops selection of clothes for teenage girls makes it easy for all the moms and dads to shop with their growing girls. We're budget friendly too, so you ...",https://www.rainbowshops.com/collections/girls-7-16
26,Girls' Clothing – Shop New Arrivals - Old Navy,Girls clothing,"['Girls', 'clothes']",[],"Girls' clothes at Old Navy are always cute, current, and affordable. Stock up on new arrivals, seasonal must-haves, wardrobe staples, and activewear.",https://oldnavy.gap.com/browse/category.do?cid=6036
27,"Disney Girls Clothing T-shirts, Dresses & More | shopDisney",Girls clothing,"['clothing', 'girls']",[],"Explore our magical collection of Disney clothing for girls with t-shirts, dresses, & sweaters featuring Moana, Belle, Minnie Mouse & more.",https://www.shopdisney.com/clothing/girls/
28,Clothing for Girls - Costco Wholesale,Girls clothing,"['Clothing', 'Girls', 'Clothing', 'Girls']",[],Find a great collection of Clothing for Girls at Costco. Enjoy low warehouse prices on name-brand Clothing for Girls products.,https://www.costco.com/girls-clothing.html
29,Tween Girls' Clothing - Target,Girls clothing,"['Girls', 'Clothing']",[],"Get Tween Girls' Clothing from Target at great low prices. Choose from Same Day Delivery, Drive Up or Order Pickup. Free standard shipping with $35 orders.",https://www.target.com/c/tween-girls-clothing/-/N-vzfhf
30,Toddler Girls' Clothing - Target,Girls clothing,"['Girls', 'Clothing']",[],"Shop Target for Toddler Girls' Clothing you will love at great low prices. Choose from Same Day Delivery, Drive Up or Order Pickup.",https://www.target.com/c/toddler-girls-clothing-kids/-/N-4uxiz
31,Kids' Clothing - Target,Girls clothing,"['Girls', 'Clothing']",[],"Kids' Clothing. Target/Clothing, Shoes & Accessories/Kids' Clothing (32576)‎. Clothing & Accessories Clearance · Boys' Clothing · Girls' Clothing.",https://www.target.com/c/kids/-/N-xcoz4
32,Cat & Jack : Girls' Clothes - Target,Girls clothing,"['Girls', 'Clothing']",[],"Shop Target for Girls' Clothing you will love at great low prices. Choose from Same Day Delivery, Drive Up or Order Pickup. Free standard shipping with $35 ...",https://www.target.com/c/girls-clothing-kids/cat-jack/-/N-5xtwaZqqqgm
33,Girls' Clothing | Amazon.com,Girls clothing,"['girls', 'clothing']",[],Shop a wide selection of styles and brands for girls' clothing at Amazon.com. Free shipping and free returns on eligible items.,https://www.amazon.com/Girls-Clothing/b?ie=UTF8&node=1040664
34,Girls' Clothing - Boot Barn,Girls clothing,"['Girls', 'Clothing']",[],Looking for Girls' Clothing? Shop Bootbarn.com for great prices and high quality products from all the brands you know and love. Check out more here!,https://www.bootbarn.com/kids/girls-clothing/girls-clothing/
35,Girls - Nordstrom Rack,Girls clothing,"['Girls', 'Apparel']",[],Shop a great selection of Girls' Apparel at Nordstrom Rack. Free in-store returns at any Nordstrom Rack location.,https://www.nordstromrack.com/shop/kids/girl
36,New Arrivals - Girls' Clothing - Macy's,Girls clothing,"['Girls', 'Clothing']",[],"Check out all of the hot New Arrivals in Girls' Clothing at Macy's including girls' dresses, skirts, leggings, tops, jackets and more.",https://www.macys.com/shop/kids-clothes/new-arrivals?id=166942
37,Girls Clothing | Next Official Site,Girls clothing,"['girls clothes', 'girls clothes']",[],Shop for girls clothes at Next. Browse through our amazing selection of girls clothes to suit all occasions that are available to buy online today!,https://www.next.us/en/girls
38,Girls' Clothes | Outfits for Girls | Marks & Spencer US,Girls clothing,"['girls', 'clothes']",[],Our collection of girls' clothes includes modern and classic outfits for kids from toddlers to teens. Be inspired by the latest kidswear at Marks & Spencer ...,https://www.marksandspencer.com/us/l/kids/all-girls-clothing/
39,Girls' Clothes - Buckle,Girls clothing,"['girls', 'clothing']",[],"Find the cutest selection of girls' clothing at Buckle. Shop jeans, shorts, tees, shoes, & more in your favorite brands.",https://www.buckle.com/girls
40,Buy French Girls Clothes Online - Vertbaudet,Girls clothing,"['clothes', 'Dress', 'clothing', 'girls']",[],"Looking for beautiful clothes for your daughter, that are unusual as well as fashionable? Dress your child in one of our clothing designs for girls; ...",https://www.vertbaudet.com/en/girls.htm
41,Hayden Girls: Cute Clothes for Girls - Trendy Tweens' Clothing,Girls clothing,"['girls', 'clothing']",[],Shop the latest trends in girls' clothing at Hayden Girls. We stock the cutest clothes for girls and tweens. Discover our new collections and sales today!,https://www.haydengirls.com/
42,Girls' Clothing For Sale Near You - Sam's Club,Girls clothing,"['Girls', 'Clothing']",[],Girls' Clothing. 61 results. Sort & filter. Prices may vary in club and online. Member's Mark Girls' 3 Pack Legging. View more options ...,https://www.samsclub.com/b/girls-clothing/13180127
43,Girls Clothing - Amazon.com,Girls clothing,['girls clothing'],[],Amazon.com: girls clothing.,https://www.amazon.com/girls-clothing/s?k=girls+clothing
44,Girls Clothing (Sizes 7-16) | Burkes Outlet,Girls clothing,"['girls clothing', 'girls clothes']",[],"Shop affordable girls & tween girls clothing at Burkes Outlet for the latest fashion, trends, & brands in big girls clothes at prices you'll absolutely ...",https://www.burkesoutlet.com/shop/kids/girls/girls-7-16/
45,Girls' Clearance - Discount Clothing - Old Navy,Girls clothing,"['girls', 'clothing']",[],Shop online for discount girls' clothing at Old Navy. Our trendy values in clothes and accessories could be what you've been looking for.,https://oldnavy.gap.com/browse/category.do?cid=96906
46,Girls Apparel & Clothing | adidas US,Girls clothing,"['girls apparel', 'girls apparel']",[],"Shop for girls apparel including track pants, hoodies and sweatshirts & more from adidas. See all available girls apparel at adidas.com.",https://www.adidas.com/us/girls-clothing
47,"Women's Clothing, Juniors Clothing, Girls Clothing | Zumiez",Girls clothing,['girls clothing'],[],"Shop for women's, juniors, and girls clothing at online at Zumiez. Browse adorable outfits, t-shirts, tanks, tops, jeans, pants, shorts, and more from top ...",https://www.zumiez.com/womens/
48,Amazon Best Sellers: Best Girls' Clothing,Girls clothing,"['Girls', 'Clothing']",[],"Discover the best Girls' Clothing in Best Sellers. Find the top 100 most popular items in Amazon Clothing, Shoes & Jewelry Best Sellers.",https://www.amazon.com/Best-Sellers-Girls'-Clothing/zgbs/fashion/1040664
49,Girls Clothing Latest Styles + FREE SHIPPING | Zappos.com,Girls clothing,"['Clothing', 'Girls']",[],"Free shipping BOTH ways on Clothing, Girls from our vast selection of styles. Fast delivery, and 24/7/365 real-person service with a smile.",https://www.zappos.com/girls-clothing/CKvXAcABA-ICAgEY.zso
50,Girls Clothes | Hanna Andersson,Girls clothing,['Girls clothes'],[],"Girls clothes that encourage her to run, jump, and twirl in supremely soft organic outfits. A rainbow of colors and great Scandinavian-inspired ...",https://www.hannaandersson.com/girls-clothes/
51,Girls Clothing Hut: Boutique Clothing at Wholesale Pricing,Girls clothing,['Girls Clothing'],[],Girls Clothing Hut is a USA boutique clothing supplier providing you with quality children's clothing at wholesale prices. We offer the cheapest prices ...,https://shopgch.com/
52,Designer Girls' Clothing & Accessories - Best Dressed Child,Girls clothing,"['girls', 'clothing']",[],"Dress your little one to the nines with Best Dressed Child's assortment of baby, toddler and girls' clothing by size. We stock our shelves with the most stylish ...",https://www.bestdressedchild.com/giclbo.html
53,Girls' Clothing - Etsy,Girls clothing,"['girls', 'clothing']",[],"Check out our girls' clothing selection for the very best in unique or custom, handmade pieces from our shops.",https://www.etsy.com/c/clothing/girls-clothing
54,Girls Clothing - Dillard's,Girls clothing,"['clothing', 'apparel', 'girls', 'girls', 'girls']",[],"Find the most adorable clothing and apparel for baby girls, toddler girls and big girls at Dillard's available from your favoirte brands.",https://www.dillards.com/c/girls-clothing
55,Big Girls (7-16) Girls Clothing - Macy's,Girls clothing,"['Girls Clothing', ""girl's clothes""]",[],Shop the Latest Girls Clothing at Macys.com. Find a variety of girl's clothes styles and occasions from top brands and much more. FREE SHIPPING AVAILABLE!,https://www.macys.com/shop/kids-clothes/girls-clothing/Size_range/Big%20Girls%20%287-16%29?id=61998
56,Girls - April Cornell,Girls clothing,"['girls', 'clothing']",[],"Timeless, magical, beautiful dresses for little girls of any age! Designer children's clothing, jackets and dolls with vintage details and sweet, ...",https://www.aprilcornell.com/prod_detail_list/girls
57,Baby Girls' Clothing - Amazon.com,Girls clothing,['girls clothing'],[],Shop baby girls clothing on Amazon.com. Free shipping and free returns on eligible items.,https://www.amazon.com/Baby-Girls-Clothing/b?ie=UTF8&node=1044512
58,All Girls Clothing & Swim - O'Neill,Girls clothing,"[""girl's clothing""]",[],Shop stylish and trendy O'Neill girl's clothing and swim! Free ground shipping on US orders over $99.,https://us.oneill.com/collections/girls-main-page
59,Girls Clothing Sets - Amazon.com,Girls clothing,['girls clothing'],[],Shop for girls clothing sets on Amazon.com. Free shipping and free returns on eligible items.,https://www.amazon.com/Girls-Clothing-Sets/b?ie=UTF8&node=1288617011
60,Mia Belle Girls: Designer girls clothing boutique,Girls clothing,['girls clothing'],[],"Welcome to Mia Belle Girls! We are a girls clothing boutique little girls dresses, kids halloween costumes, girls accessories & girls special occasion ...",https://www.miabellebaby.com/
61,Kids Girls Clothes - Target,Girls clothing,['girls clothes'],[],"Shop Target for kids girls clothes you will love at great low prices. Choose from Same Day Delivery, Drive Up or Order Pickup plus free shipping on orders ...",https://www.target.com/s/kids+girls+clothes
62,Girls' Clothing | Backcountry.com,Girls clothing,"['girls', 'clothing']",[],Check out Backcountry.com for a great selection of girls' clothing. Our expert gearheads will help outfit your kids for any adventure.,https://www.backcountry.com/girls-clothing
63,"500+ results for ""Girls' Clothing"" - Sears",Girls clothing,['girls clothing'],[],"Dress your girl for special events with girls clothing from Sears. We have a wide collection of dresses, shirts and other loungewear of all sizes in ...",https://www.sears.com/clothing-girls-clothing/b-5000918
64,Girls Clothing Sets & Outfits - Macy's,Girls clothing,['Girls Clothing'],[],Shop Girls Clothing Sets & Outfits at Macys.com and find the best styles and deals right now! Free shipping available and free pickup in-store!,https://www.macys.com/shop/kids-clothes/sets-outfits?id=121243
65,Girls' Clothing from 2 to 9 Years Old | Mayoral ®,Girls clothing,"['Girls', 'Clothing']",[],"FREE SHIPPING from $150 and free returns BUY ONLINE Girls' Clothing from 2 to 9 years old: dresses, coats, sets, t-shirts, accessories and complements, ...",https://www.mayoral.com/en-us/unitedstates/girl-usu1
66,"Girls Clothes (7-16) | Outfits For Teens, Tweens & More",Girls clothing,"['girls', 'clothes']",[],"Check out Marshalls' selection of girls' (7-16) clothes! Shop outfits, dresses and more for your teen or tween and get more for less!",https://www.marshalls.com/us/store/shop/girls-7-16-clothes/_/N-378486618
67,Girls Kids' Clothing Sale & Clearance - Macy's,Girls clothing,"['Clothing', 'Clothing']",[],Shop Kids' Clothing Sales at Macy's are a great opportunity to save. View the Kids' Clothing Sale at Macy's & find the latest styles for your little one ...,https://www.macys.com/shop/kids-clothes/kids-clothes-sale/Gender/Girls?id=6086
68,Girls' Clothing Sale | Old Navy,Girls clothing,"['clothing', 'girls']",[],"Find the best deals on clothing for girls which include dresses, tops, jeans, accessories & more.",https://oldnavy.gap.com/browse/category.do?cid=26175
69,Girls' Clothing - Shop By Size - Old Navy,Girls clothing,"['Girls', 'clothes']",[],"Girls' clothes at Old Navy are always cute, current, and affordable. Shop by size on new arrivals, seasonal must-haves, wardrobe staples, and activewear.",https://oldnavy.gap.com/browse/category.do?cid=39656
70,Girls' Clothing | REI Co-op,Girls clothing,"['Girls', 'Clothing']",[],Shop for Girls' Clothing at REI - FREE SHIPPING With $50 minimum purchase. Curbside Pickup Available NOW! 100% Satisfaction Guarantee.,https://www.rei.com/c/girls-clothing
71,Tween (10-12 Years) : Girls' Clothes - Target,Girls clothing,"['Girls', 'Clothing']",[],"Shop Target for Girls' Clothing you will love at great low prices. Choose from Same Day Delivery, Drive Up or Order Pickup. Free standard shipping with $35 ...",https://www.target.com/c/girls-clothing-kids/tween-10-12-years-/-/N-5xtwaZ5xro3
72,Clothes for Girls (Sizes 4-14) | OshKosh | Free Shipping,Girls clothing,"['Girl Clothes', 'girls apparel', 'Girls clothing']",[],Iconic Kid Girl Clothes. OshKosh is iconic American girls apparel. Girls clothing with an enduring cool that's always on trend.,https://www.oshkosh.com/oshkosh-kid-girl
1,7/8 : Girls' Clothes - Target,Girls clothing,"['Girls', 'Clothing']",[],"Shop Target for Girls' Clothing you will love at great low prices. Choose from Same Day Delivery, Drive Up or Order Pickup. Free standard shipping with $35 ...",https://www.target.com/c/girls-clothing-kids/7-8/-/N-5xtwaZx0a68
