position,title,query,snippet_highlighted_words,rich_snippet_list,snippet,link
1,Girls' Clothes - Target,Girls clothing,"['Girls', 'Clothing']",[],"Shop Target for Girls' Clothing you will love at great low prices. Choose from Same Day Delivery, Drive Up or Order Pickup. Free standard shipping with $35 ...",https://www.target.com/c/girls-clothing-kids/-/N-5xtwa
2,"Girls' Clothes | Dresses, Jeans & More | H&M US",Girls clothing,"['girls', 'clothes']",[],"Shop all girls' clothes at H&M. Find everyday T-shirts, dresses and jeans, as well as overalls and stylish pants in all the latest styles.",https://www2.hm.com/en_us/kids/girls/clothing.html
3,Girls Clothing - Macy's,Girls clothing,"['Girls Clothing', ""girl's clothes""]",[],Shop the Latest Girls Clothing at Macys.com. Find a variety of girl's clothes styles and occasions from top brands and much more. FREE SHIPPING AVAILABLE!,https://www.macys.com/shop/kids-clothes/girls-clothing?id=61998
4,Shop Girls Clothing: Sizes 4-18 | The Children's Place,Girls clothing,['girls clothing'],[],"Shop for girls clothing. Find clothes for girls at The Children's Place, where big fashion meets little prices with free shipping!",https://www.childrensplace.com/us/c/girls-clothing
5,Girls Clothes - Old Navy,Girls clothing,"['Girls', 'clothes']",[],"Girls' clothes at Old Navy are always cute, current, and affordable. Stock up on new arrivals, seasonal must-haves, wardrobe staples, and activewear.",https://oldnavy.gap.com/browse/division.do?cid=6027
6,girls clothing & accessories | abercrombie kids,Girls clothing,['girls clothing'],[],"Find girls clothing & accessories at abercrombie kids. You'll find jeans, hoodies, sweatpants, t-shirts, and more.",https://www.abercrombie.com/shop/us/kids/girls
7,"Girl's Clothing - Dresses, Jeans & Tops - Forever 21",Girls clothing,"['girls', 'clothing']",[],"Keep your mini-me ahead of the style curve in FOREVER 21 girls' clothing. Explore our entire selection of outerwear, dresses, jeans, skirts, tees, and more!",https://www.forever21.com/us/shop/catalog/category/girls/girls_main
8,Girls' Clothes: Shop Cute Clothes for Girls of All Ages | Kohl's,Girls clothing,"['Girls', 'Clothing']",[],Enjoy free shipping and easy returns every day at Kohl's. Find great deals on Girls' Clothing at Kohl's today!,https://www.kohls.com/catalog/girls-kids-clothing.jsp?CN=Gender:Girls+AgeAppropriate:Kids+Department:Clothing
9,Girls Clothing (Sizes 7-16) - Nordstrom,Girls clothing,['girls clothing'],[],"Free shipping and returns on girls clothing at Nordstrom.com. Find dresses, tops, tees, sweatshirts, jeans, and more from top brands like Zella Girl, ...",https://www.nordstrom.com/browse/kids/girls/clothing-sizes-7-16
10,"Girls Clothes | Bathing Suits, Leggings, Jeans, Shorts | Shop ...",Girls clothing,['girls clothing'],[],"Justice's online girls clothing store has leggings, girls bikinis and one piece swimsuits, shorts, pajamas, dresses for tweens and teens, and fashion in ...",https://www.shopjustice.com/
11,"Girls' Clothing | Dresses, Shorts, Jeans & Tops | JCPenney",Girls clothing,"['girls', 'clothing']",[],"Shop the latest girls' clothing trends at JCPenney! From dresses and shorts, to jeans and tops, we have everything to make the perfect outfit.",https://www.jcpenney.com/g/baby-kids/all-girls-clothing?id=cat11100001191
12,Girls' Hoodies & Sweatshirts - Belk,Girls clothing,['girl clothes'],[],"Our toddler girl clothes include cute designs like unicorn graphics, animal prints and festive fabrics for the holidays. The girls' character apparel collection ...",https://www.belk.com/kids/girls-clothing/
13,Girls Clothing in Kids Clothing - Walmart.com,Girls clothing,['Girls Clothing'],[],"Shop for Girls Clothing in Kids Clothing. Buy products such as Wonder Nation Girls Long Sleeve Kid Tough T-Shirt, Sizes 4-18 & Plus at Walmart and save.",https://www.walmart.com/browse/clothing/girls-clothing/5438_7712430_1660851
14,Girls' Clothes: Cute and Affordable Looks for All Occasions,Girls clothing,"['girls', 'clothing']",[],Stay on top of her growth spurts and wardrobe makeovers with girls' clothing at Zulily. We have a broad assortment of cute clothes for girls in a wide range of ...,https://www.zulily.com/category/girls
15,Cute Clothes for Girls & Teens - Tillys,Girls clothing,"['girls', 'clothing']",[],"The girls want to look chic too. Treat her to some comfortable clothing, shoes and accessories by shopping Tillys.",https://www.tillys.com/kids/girls/
16,Girls Clothing at Janie and Jack,Girls clothing,"['girls', 'clothing', 'girls clothes']",[],"Janie and Jack crafts distinctive, boutique girls' clothing. Shop our designer girls clothes featuring precious detailing and luxurious fabrics.",https://www.janieandjack.com/girls-clothing
17,All Girls Clothes at Tea Collection,Girls clothing,['girls clothes'],[],Shop all the girls clothes at Tea Collection and help her stand out in the pack.,https://www.teacollection.com/girls-clothing
18,Shop Cute Clothes for Girls sizes 7-14 - Maurices,Girls clothing,['girls clothing'],[],"Shop maurices' selection of cute girls clothing for girls sizes 7 through 14. Find the latest and best picks across girls jeans, t-shirts, and more.",https://www.maurices.com/c/girls/N-13979
19,Girls Clothes & Outfits (Big Girl Sizes 7-16) - Bloomingdale's,Girls clothing,['Girls Apparel'],[],"Designer Girls Apparel Sizes 7-16: Girls Dresses, Sweaters, Jackets, and Leggings. Fashion your daughter in your own stylish image with ...",https://www.bloomingdales.com/shop/kids/big-girl-clothes-7-16?id=23720
20,Girls' Clothes | Girls' Fashion | Boden US,Girls clothing,"['girls', 'clothes']",[],"For a pop of cheerful color every day, browse our girls' clothes online. Find hard-wearing leggings, snuggly sweaters, adventure-ready dresses, ...",https://www.bodenusa.com/en-us/girls-clothing
21,Cute Teen Girls' & Women's Clothing - Aeropostale,Girls clothing,"['clothing', 'clothes', 'girls']",[],"Keep up with the latest teen clothing trends in Aeropostale's cute clothes for girls and teens. Shop popular shirts, jeans, sleepwear and more here.",https://www.aeropostale.com/women-teen-girls/clothing/
22,"Girls Clothes – Dresses, Hoodies, Sweaters and School ...",Girls clothing,['girls clothing'],[],"Find girls clothing at Cookie's, the Kids' Department Store. Get discounted prices on...",https://www.cookieskids.com/girls_fashion.aspx
23,Girls' Clothes | Lands' End,Girls clothing,"['girls', 'clothes', 'girls', 'clothing', 'girls', 'apparel', 'girls', 'clothes']",[],"Shop girls' clothes at Lands' End. FREE shipping available. Find quality girls' clothing, clothes for girls, apparel for girls, clothes for tweens, ...",https://www.landsend.com/shop/girls-clothing/S-xez-y5d-xec
24,Girls Clothing | Everyday Low Prices - Rainbow Shops,Girls clothing,"['clothes', 'girls', 'girls']",[],"Rainbow Shops selection of clothes for teenage girls makes it easy for all the moms and dads to shop with their growing girls. We're budget friendly too, so you ...",https://www.rainbowshops.com/collections/girls-7-16
25,"Disney Girls Clothing T-shirts, Dresses & More | shopDisney",Girls clothing,"['clothing', 'girls']",[],"Explore our magical collection of Disney clothing for girls with t-shirts, dresses, & sweaters featuring Moana, Belle, Minnie Mouse & more.",https://www.shopdisney.com/clothing/girls/
26,Clothing for Girls - Costco Wholesale,Girls clothing,"['Clothing', 'Girls', 'Clothing', 'Girls']",[],Find a great collection of Clothing for Girls at Costco. Enjoy low warehouse prices on name-brand Clothing for Girls products.,https://www.costco.com/girls-clothing.html
27,Girls' Clothing | Amazon.com,Girls clothing,"['girls', 'clothing']",[],Shop a wide selection of styles and brands for girls' clothing at Amazon.com. Free shipping and free returns on eligible items.,https://www.amazon.com/Girls-Clothing/b?ie=UTF8&node=1040664
28,Girls' Clothing - Boot Barn,Girls clothing,"['Girls', 'Clothing']",[],Looking for Girls' Clothing? Shop Bootbarn.com for great prices and high quality products from all the brands you know and love. Check out more here!,https://www.bootbarn.com/kids/girls-clothing/girls-clothing/
29,Girls - Nordstrom Rack,Girls clothing,"['Girls', 'Apparel']",[],Shop a great selection of Girls' Apparel at Nordstrom Rack. Free in-store returns at any Nordstrom Rack location.,https://www.nordstromrack.com/shop/kids/girl
30,Girls' Clothes | Outfits for Girls | Marks & Spencer US,Girls clothing,"['girls', 'clothes']",[],Our collection of girls' clothes includes modern and classic outfits for kids from toddlers to teens. Be inspired by the latest kidswear at Marks & Spencer ...,https://www.marksandspencer.com/us/l/kids/all-girls-clothing/
31,Girls Clothing | Next Official Site,Girls clothing,"['girls clothes', 'girls clothes']",[],Shop for girls clothes at Next. Browse through our amazing selection of girls clothes to suit all occasions that are available to buy online today!,https://www.next.us/en/girls
32,Girls' Clothes - Buckle,Girls clothing,"['girls', 'clothing']",[],"Find the cutest selection of girls' clothing at Buckle. Shop jeans, shorts, tees, shoes, & more in your favorite brands.",https://www.buckle.com/girls
33,Buy French Girls Clothes Online - Vertbaudet,Girls clothing,"['clothes', 'Dress', 'clothing', 'girls']",[],"Looking for beautiful clothes for your daughter, that are unusual as well as fashionable? Dress your child in one of our clothing designs for girls; ...",https://www.vertbaudet.com/en/girls.htm
34,Hayden Girls: Cute Clothes for Girls - Trendy Tweens' Clothing,Girls clothing,"['girls', 'clothing']",[],Shop the latest trends in girls' clothing at Hayden Girls. We stock the cutest clothes for girls and tweens. Discover our new collections and sales today!,https://www.haydengirls.com/
35,Girls' Clothing For Sale Near You - Sam's Club,Girls clothing,"['Girls', 'Clothing']",[],Girls' Clothing. 61 results. Sort & filter. Prices may vary in club and online. Member's Mark Girls' 3 Pack Legging. View more options ...,https://www.samsclub.com/b/girls-clothing/13180127
36,Girls Clothing (Sizes 7-16) | Burkes Outlet,Girls clothing,"['girls clothing', 'girls clothes']",[],"Shop affordable girls & tween girls clothing at Burkes Outlet for the latest fashion, trends, & brands in big girls clothes at prices you'll absolutely ...",https://www.burkesoutlet.com/shop/kids/girls/girls-7-16/
37,Girls Apparel & Clothing | adidas US,Girls clothing,"['girls apparel', 'girls apparel']",[],"Shop for girls apparel including track pants, hoodies and sweatshirts & more from adidas. See all available girls apparel at adidas.com.",https://www.adidas.com/us/girls-clothing
38,"Women's Clothing, Juniors Clothing, Girls Clothing | Zumiez",Girls clothing,['girls clothing'],[],"Shop for women's, juniors, and girls clothing at online at Zumiez. Browse adorable outfits, t-shirts, tanks, tops, jeans, pants, shorts, and more from top ...",https://www.zumiez.com/womens/
39,Girls Clothing Latest Styles + FREE SHIPPING | Zappos.com,Girls clothing,"['Clothing', 'Girls']",[],"Free shipping BOTH ways on Clothing, Girls from our vast selection of styles. Fast delivery, and 24/7/365 real-person service with a smile.",https://www.zappos.com/girls-clothing/CKvXAcABA-ICAgEY.zso
40,Girls Clothes | Hanna Andersson,Girls clothing,['Girls clothes'],[],"Girls clothes that encourage her to run, jump, and twirl in supremely soft organic outfits. A rainbow of colors and great Scandinavian-inspired ...",https://www.hannaandersson.com/girls-clothes/
41,Girls Clothing Hut: Boutique Clothing at Wholesale Pricing,Girls clothing,['Girls Clothing'],[],Girls Clothing Hut is a USA boutique clothing supplier providing you with quality children's clothing at wholesale prices. We offer the cheapest prices ...,https://shopgch.com/
42,Designer Girls' Clothing & Accessories - Best Dressed Child,Girls clothing,"['girls', 'clothing']",[],"Dress your little one to the nines with Best Dressed Child's assortment of baby, toddler and girls' clothing by size. We stock our shelves with the most stylish ...",https://www.bestdressedchild.com/giclbo.html
43,Girls' Clothing - Etsy,Girls clothing,"['girls', 'clothing']",[],"Check out our girls' clothing selection for the very best in unique or custom, handmade pieces from our shops.",https://www.etsy.com/c/clothing/girls-clothing
44,Girls Clothing - Dillard's,Girls clothing,"['clothing', 'apparel', 'girls', 'girls', 'girls']",[],"Find the most adorable clothing and apparel for baby girls, toddler girls and big girls at Dillard's available from your favoirte brands.",https://www.dillards.com/c/girls-clothing
45,Mia Belle Girls: Designer girls clothing boutique,Girls clothing,['girls clothing'],[],"Welcome to Mia Belle Girls! We are a girls clothing boutique little girls dresses, kids halloween costumes, girls accessories & girls special occasion ...",https://www.miabellebaby.com/
46,Girls' Clothing from 2 to 9 Years Old | Mayoral ®,Girls clothing,"['Girls', 'Clothing']",[],"FREE SHIPPING from $150 and free returns BUY ONLINE Girls' Clothing from 2 to 9 years old: dresses, coats, sets, t-shirts, accessories and complements, ...",https://www.mayoral.com/en-us/unitedstates/girl-usu1
47,"Girls Clothes (7-16) | Outfits For Teens, Tweens & More",Girls clothing,"['girls', 'clothes']",[],"Check out Marshalls' selection of girls' (7-16) clothes! Shop outfits, dresses and more for your teen or tween and get more for less!",https://www.marshalls.com/us/store/shop/girls-7-16-clothes/_/N-378486618
48,Girls' Clothing | Backcountry.com,Girls clothing,"['girls', 'clothing']",[],Check out Backcountry.com for a great selection of girls' clothing. Our expert gearheads will help outfit your kids for any adventure.,https://www.backcountry.com/girls-clothing
49,"500+ results for ""Girls' Clothing"" - Sears",Girls clothing,['girls clothing'],[],"Dress your girl for special events with girls clothing from Sears. We have a wide collection of dresses, shirts and other loungewear of all sizes in ...",https://www.sears.com/clothing-girls-clothing/b-5000918
50,Girls' Clothing | REI Co-op,Girls clothing,"['Girls', 'Clothing']",[],Shop for Girls' Clothing at REI - FREE SHIPPING With $50 minimum purchase. Curbside Pickup Available NOW! 100% Satisfaction Guarantee.,https://www.rei.com/c/girls-clothing
51,Clothes for Girls (Sizes 4-14) | OshKosh | Free Shipping,Girls clothing,"['Girl Clothes', 'girls apparel', 'Girls clothing']",[],Iconic Kid Girl Clothes. OshKosh is iconic American girls apparel. Girls clothing with an enduring cool that's always on trend.,https://www.oshkosh.com/oshkosh-kid-girl
52,Girls' Clothes and Active Wear | Academy,Girls clothing,"['girls', 'clothes']",[],Our girls' clothes are fashionable and functional. Shop Academy's girls' workout and athletic clothes for your mini fashionista's every need.,https://www.academy.com/c/kids/girls-apparel
53,"Affordable Clothing For Girls, Tween & Young Women | rue21",Girls clothing,"['girls', 'Girl', 'Dress']",[],shop all girls · rue21 faves · new · graphic tees · jeans · tops ... Baby Girl Embroidered Velour Shorts ... Light Purple Double Lined Scoop Neck Mini Dress.,https://www.rue21.com/store/girls-clothing/girls/_/N-bpoZ952
54,Girls Clothes (Sizes 4-14) | Carter's | Free Shipping,Girls clothing,"['girls', 'clothes']",[],"Shop Carters.com for cute girls' clothes that are in style. Explore our selection of affordable shirts, pants, dresses & more in sizes 4- 14.",https://www.carters.com/carters-kid-girl
55,Girls (Age 7-16) Clothing & Apparel - Boscov's,Girls clothing,"['apparel', 'girls']",[],Shop our amazing collection of apparel for girls ages 7-16 at discount pricing. Find unbeatable deals online & in-store with free shipping on qualified ...,https://www.boscovs.com/category/girls-7-16-clothing
56,"Cute Girls Clothes | Kids, Toddler & Baby | Gymboree",Girls clothing,"['girl clothes', 'girls clothes']",[],"Shop clothes for girls. Find baby girl clothes, toddler girls clothes, and more. Discover styles and clothing that your kids will love at Gymboree!",https://www.gymboree.com/us/c/girls-clothes
57,Girls' Clothing - Country Outfitter,Girls clothing,"['Girls', 'Clothing']",[],Shop quality Girls' Clothing at Country Outfitter for hard to beat prices. You'll find your country when you shop Country Outfitter today!,https://www.countryoutfitter.com/kids/girls/girls_clothing/
58,"Women's Clothing & Outfits: Tops, Pants & Jackets | Hollister Co.",Girls clothing,['clothing'],[],"Check out effortlessly cool clothing for Women at Hollister. From jeans to skirts and hoodies to jackets, shop the collection now!",https://www.hollisterco.com/shop/us/womens
59,"Girls Fashion, Clothes & Accessories | Cotton On Kids",Girls clothing,['girls clothes'],[],"Shop on-trend girls clothes and accessories at Cotton On Kids. New season skirts, shorts, knitwear, dresses & accessories. Free Shipping Available*",https://cottonon.com/US/kids/kids-girls-1-8/
60,Girls' Clothing (Sizes 7-20) - Kids - Saks Fifth Avenue,Girls clothing,"['girls', 'clothing']",[],"Shop the best girls' (7–16) designer clothing and more at Saks Fifth Avenue. Plus, get free shipping and returns on every order.",https://www.saksfifthavenue.com/c/kids/girls/girls--7-16-
61,Girls' Clothing | Kids Foot Locker,Girls clothing,"['girls', 'clothing']",[],"Shop girls' clothing at Kids Foot Locker, your childrens' one stop athletic retailer. Kids Foot Locker boasts an unbeatable selection ...",https://www.kidsfootlocker.com/category/clothing/girls.html
62,Cute Clothes For Girls | Joules® US,Girls clothing,"['girls', 'clothing']",[],"Be ready for any adventure with stylish yet durable girls' clothing from Joules. Discover the full girls' range full of bright colors and bold prints, ...",https://www.joulesusa.com/Girls-Clothing
63,Girls Clothing Latest Styles - 6pm,Girls clothing,['clothing'],[],"Shop for brands you love on sale. Discounted shoes, clothing, accessories and more at 6pm.com! Score on the Style, Score on the Price.",https://www.6pm.com/girls-clothing/CKvXAcABA-ICAgEY.zso
64,Casual & Classic Girls Clothing - Vineyard Vines,Girls clothing,"['Girls', 'Clothing']",[],Girls' Clothing. Mom and Me. Just Arrived! Girls' Channeled Puffer Vest.,https://www.vineyardvines.com/girls/
65,New and used Girls' Clothing for sale | Facebook Marketplace,Girls clothing,"['Girls', 'Clothing']",[],New and used Girls' Clothing for sale near you on Facebook Marketplace. Find great deals or sell your items for free.,https://www.facebook.com/marketplace/category/girls-clothing/
66,Designer Clothing for Girls - Designer Kidswear - Farfetch,Girls clothing,"['clothing', 'girls']",[],"Shop 100s of styles at Farfetch, including a whole range of designer clothing for girls. From Dolce & Gabbana to Stella McCartney. ✈ Express shipping.",https://www.farfetch.com/shopping/kids/girls-clothing-4/items.aspx
67,Girls Clothing. Nike.com,Girls clothing,['Girls Clothing'],[],Find Girls Clothing at Nike.com. Free delivery and returns.,https://www.nike.com/w/girls-clothing-3aqegz6ymx6
68,Girls' Clothing (Sizes 4 & Up) for sale | eBay,Girls clothing,"['girls', 'clothes']",[],"When choosing girls' outfits, it is important that they are the appropriate size and are easy for the girl to put on and take off. The choice of girls' clothes ...",https://www.ebay.com/b/Girls-Clothing-Sizes-4-Up/11462/bn_1650057
69,Girls Clothing & Shoes Online On Sale Up To 90% Off | thredUP,Girls clothing,"[""girl's clothing""]",[],thredUP has thousands of pre-owned girl's clothing & accessories at up to 90% off retail price! Enhance your wardrobe without breaking the bank with ...,https://www.thredup.com/kids/girls
70,Girls' Clothing Sale | Brooks Brothers,Girls clothing,"['girls', 'clothing']",[],Shop Brooks Brothers sale on girls' clothing and take advantage of discount prices. Legendary quality and customer service are a click away.,https://www.brooksbrothers.com/sale/girls
71,"Cute dresses, pajamas & clothing for girls - American Girl",Girls clothing,"['Girl', 'clothes', 'girls', 'clothes', 'girls', 'girl']",[],"American Girl offers clothes for girls, too! Shop cute outfits and fun clothes for girls, everything from dresses to pajamas to matching doll-girl outfits.",https://www.americangirl.com/collections/girl-clothing
72,Kids' Clothes for Girls | GUCCI® US,Girls clothing,"['Clothes', 'Girls']",[],"Shop Designer Clothes for Girls, Including Sweaters, T-Shirts, Dresses and Skirts at GUCCI.com. Enjoy Free Shipping, Returns & Complimentary Gift Wrapping.",https://www.gucci.com/us/en/ca/children/girls/clothes-for-girls-c-children-girls-clothing-4-12
73,Girls' Designer Clothes & Accessories - Ralph Lauren,Girls clothing,"['girls', 'clothes']",[],Shop girls' designer clothes & accessories for everything from cute dresses to polo shirts and more. Free Fast Shipping With an RL ...,https://www.ralphlauren.com/kids-girls
74,Girls' Designer Clothing at Neiman Marcus - Kids,Girls clothing,"['girls', 'clothing']",[],"Get free shipping on designer girls' clothing at Neiman Marcus. Shop for cute clothing for girls in a variety of sizes, styles & prints.",https://www.neimanmarcus.com/c/kids-girls-cat10000733
75,Girl's Clothes - Gap Factory,Girls clothing,"['girls', 'clothing', 'girls', 'clothing']",[],"Gap Factory girls' clothing has her favorite staple pieces and style essentials, from dresses and leggings to school uniforms . Find girls' clothing designed ...",https://www.gapfactory.com/browse/division.do?cid=1040943
76,Girls' Activewear | Kids' Clothes - DICK'S Sporting Goods,Girls clothing,"['girls', 'clothes', 'girls']",[],"Shop girls' activewear and gym clothes at DICK'S Sporting Goods. Find girls' tees, jackets, shorts and more from Nike, Under Armour and more top brands.",https://www.dickssportinggoods.com/c/girls-apparel
77,Sweet Girls Boutique - Girls Clothing,Girls clothing,"['Girls Clothing', 'Girl Clothing', 'girls clothes']",[],"Easy. Cute. Affordable Girls Clothing - Sweet Girls Boutique Boutique Girl Clothing, trendy toddler/girls clothes for wholesale prices Free ship on $75.",https://www.sweetgirlsboutique.com/
78,Girls Clothing | Columbia Sportswear,Girls clothing,"['girls', 'apparel']",[],Up to 40% off select gear. Get ready for the outdoors with Columbia Sportswear girls outdoor apparel.,https://www.columbia.com/c/girls-outdoor-clothing/
79,"Girls Will Be - A New Direction In Girls Clothing: No Limits, No ...",Girls clothing,"['Girls', 'clothes', 'girls']",[],Girls Will Be...so many different things! Our clothes celebrate that by breaking stereotypes and giving girls options beyond pink and sparkles and skinny ...,https://girlswillbehq.com/
80,Cool Clothes for Girls & Girls Apparel - Hot Topic,Girls clothing,"['Clothing', 'girls']",[],"Find music and pop culture inspired Clothing, Shoes, Accessories, & Gifts for girls on Hot Topic.",https://www.hottopic.com/girls/
81,Girls' Clothing - Cavender's,Girls clothing,"['girls', 'clothing']",[],"Shop for girls' clothing at Cavender's for the best prices and selection. Discover why loyal customers love our collection of western clothing, cowboy boots ...",https://www.cavenders.com/girls-clothing/
82,Girls Clothing - Rip Curl,Girls clothing,"['girls', 'clothing', 'girls', 'girls']",[],"Shop girls' surf clothing, rashies, and boardshorts for girls aged 10 to 16 years. Find the perfect fit with our girls' surf and beach tees, shorts, & more!",https://www.ripcurl.com/us/kids/girls-clothing.html
83,Girls Clothes 7-14 - Splendid,Girls clothing,['girls clothes'],[],"Shop Splendid for a variety of girls clothes in sizes 7-14. Get the latest denim, dresses and sweaters for girls.",https://splendid.com/collections/kids-girls-youth-size-7-14
84,Joyfolie: Boutique Clothing For Women & Girls,Girls clothing,"['Girls', 'clothing']",[],"Find new, stunning designs and style in Joyfolie! Our Girls & Women's clothing and accessories will wow you! Stop by and shop today.",https://www.joyfolie.com/
85,Girls' Clothing - PUMA.com,Girls clothing,"['Girls', 'Clothing']",[],"Girls' Clothing. Add an easy splash of color into favorite outfits with PUMA girls' graphic tees. Merging classic styles and contemporary graphics, ...",https://us.puma.com/us/en/kids/girls/clothing
86,Be Girl Clothing: Sweet children clothing with a twist of vintage ...,Girls clothing,['Girl Clothing'],[],Children's clothing that ranges from size 6m-12y. Designed in the USA. Be Girl Clothing.,https://www.begirlclothing.com/
87,Girl's Clothing - Girl's Tees - Girl's Hoodies | Cabela's,Girls clothing,['girls clothing'],[],From girls hoodies and girls tees to pants and girls outerwear Cabela's has the variety of styles in girls clothing to match every little girl to their ...,https://www.cabelas.com/l/girls-clothing
88,"Girls' Clothing: Dresses, Tops, Pants & More | Hurley",Girls clothing,"['clothing', 'girls']",[],"Shop beach-inspired clothing, dresses, pants, tees and more for girls from leading surf brand Hurley.",https://www.hurley.com/collections/girls-clothing
89,Girls Clothing | John Lewis & Partners,Girls clothing,"['Girls', 'clothing']",[],"Browse Girls' clothing at John Lewis & Partners. Keep her wardrobe updated with a stylish outfit from our range, including girls' dresses and tops.",https://www.johnlewis.com/baby-child/girls-clothes-2-yrs/c600001343
90,Sugar & Jade: Tween & Teen Girls Clothing,Girls clothing,['girls clothing'],[],Check out Sugar & Jade for a great selection of tween girls clothing & accessories. Shop our cute and trendy styles that she will love to wear for any ...,https://www.sugarandjade.com/us/home
