position,title,query,snippet_highlighted_words,rich_snippet_list,snippet,link
1,Girls Coats - Shop Jackets for Girls - Macy's,Girls Jackets & Coats,"['girls', 'coats', 'jackets', 'coats', 'jackets', 'girls']",[],Looking for the best collection of girls' coats and jackets available? Shop coats and jackets for girls at Macy's! Free shipping available.,https://www.macys.com/shop/kids-clothes/girls-coats-jackets?id=188692
2,Girls' Coats & Jackets - Target,Girls Jackets & Coats,"['Coats', 'Jackets', 'Girls', 'Jacket']",[],"Shop Target for Coats & Jackets you will love at great low prices. Choose from Same Day Delivery, ... Girls' Hooded Jean Jacket - Cat & Jack™ Light Wash.",https://www.target.com/c/coats-jackets-girls-clothing-kids/-/N-5xtvy
3,Girls' Outerwear Jackets & Coats - Amazon.com,Girls Jackets & Coats,"['girls jackets', 'coats', 'Girls', 'Jacket', 'Coat']",[],Shop for girls jackets and coats on Amazon.com. ... ZeroXposur Girls Puffer Jacket Fleece lined Winter Coat with Lined Hood and Removable Faux Fur Trim.,https://www.amazon.com/Girls-Jackets-and-Coats/b?ie=UTF8&node=1045206
4,"Girl's Coats, Jackets & Outerwear - Nordstrom",Girls Jackets & Coats,"[""girl's coats"", 'jackets & outerwear', 'coats', 'girls']",[],"Free shipping and returns on girl's coats, jackets & outerwear at Nordstrom.com. Find coats for toddler, little, and big girls in rain, hooded, ...",https://www.nordstrom.com/browse/kids/girls-clothing/coats-jackets
5,Girls' Coats & Jackets - Nordstrom Rack,Girls Jackets & Coats,"['Girls', 'Coats', 'Jackets', 'Girls', 'Coats', 'Jackets']",[],Shop a great selection of Girls' Coats & Jackets at Nordstrom Rack. Find designer Girls' Coats & Jackets up to 70% off online or in-store.,https://www.nordstromrack.com/shop/kids/girl/coats-and-jackets
6,"Girls' Outerwear | Jackets, Pants & Boots | H&M US",Girls Jackets & Coats,"['girls', 'outerwear', 'jackets', 'coats']",[],"Get her ready for fun adventures with our girls' outerwear clothing. Discover waterproof jackets, coats, pants and more online at H&M.",https://www2.hm.com/en_us/kids/girls/outerwear.html
7,"Girls Outerwear: Puffer, Fleece & More | The Children's Place",Girls Jackets & Coats,"['girls', 'coats', 'jackets', 'outerwear']",[],Keep her warm and ready to brave the elements with stylish girls' coats and jackets from The Children's Place. She'll stay bundled up and cozy in any outerwear ...,https://www.childrensplace.com/us/c/girls-outerwear-girls-jackets-girls-blazers
8,girls jackets & coats | abercrombie kids,Girls Jackets & Coats,"['jackets & coats', 'girls', 'jackets', 'jackets', 'jacket']",[],"Shop fall jackets & coats for girls at abercrombie kids. From shirt jackets to denim jackets, puffers, and bombers, there's a jacket she'll love to wear!",https://www.abercrombie.com/shop/us/kids/girls-outerwear-and-jackets
9,Girls Jackets and Coats | Girls Outerwear - Appaman,Girls Jackets & Coats,"['girls outerwear', 'jackets']",[],"Shop a variety of girls outerwear styles from Appaman, including windbreakers and other jackets in fun colors and patterns. Discover new arrivals today.",https://www.appaman.com/collections/girls-outerwear
10,Girls' Coats & Jackets | Denim Jackets for Girls - JCPenney,Girls Jackets & Coats,"['girls coats', 'outerwear', 'coats', 'girls', 'jackets']",[],Shop and save on girls coats and outerwear at JCPenney. Find rain coats and girls winter jackets from a variety of name brands at unbeatable prices.,https://www.jcpenney.com/g/baby-kids/outerwear/coats-jackets/girls?id=cat11100000067
11,Girls Outerwear | Kohl's,Girls Jackets & Coats,"['Outerwear', 'Coats', 'Jackets', 'Girls', 'coats']",[],"Outerwear: Coats & Jackets for Girls. Baby, it gets cold outside. Don't let rain, wind or winter slow down your youngster. Fortunately, Kohl's coats and ...",https://www.kohls.com/catalog/girls-kids-outerwear-clothing.jsp?CN=Gender:Girls+AgeAppropriate:Kids+Category:Outerwear+Department:Clothing
12,Girls Coats & Jackets in Girls Clothing - Walmart.com,Girls Jackets & Coats,"['Girls Jacket', 'Coats Outerwear']",[],TAIAOJING Baby Girls Jacket Toddler Kids Boys Winter Warm Solid Coats Outerwear Bear Ears Hooded Padded Outwear Outwear Clothes 18-24 Months.,https://www.walmart.com/browse/clothing/girls-coats-jackets/5438_7712430_1660851_9875551
13,Girls' Jackets & Vests - DICK'S Sporting Goods,Girls Jackets & Coats,"['jackets', 'coats', 'girls']",[],Get ready for the cold weather with jackets & winter coats for girls from DICK'S Sporting Goods. Find a better price somewhere else?,https://www.dickssportinggoods.com/f/girls-jackets-vests
14,"Girls' Jackets, Coats & Outerwear | Old Navy",Girls Jackets & Coats,"['girls', 'jackets', 'coat']",[],"Shop girls' jackets, coat and more online at Old Navy. Update her wardrobe with our selection of girls' outerwear and more.",https://oldnavy.gap.com/browse/category.do?cid=60050
15,Girls' Jackets & Coats (66) - Belk,Girls Jackets & Coats,"['girls', 'jackets', 'girls', 'coats', 'jackets']",[],"Keep your child warm and dry in any weather with girls' jackets from Belk. Shop girls' coats, puffers, raincoats, jean jackets & more.",https://www.belk.com/kids/girls-clothing/jackets-coats/
16,Little Girls' Coats & Jackets 2T-6X - Dillard's,Girls Jackets & Coats,"['girls', 'coats', 'jackets']",[],Shop Dillard's for girls' coats & jackets. Browse our selection of styles from fleece to puffer.,https://www.dillards.com/c/kids-girls-jackets-little-girls-2t-6x-jackets
17,"Girls' Outdoor & Winter Jackets, Coats & Vests by Patagonia",Girls Jackets & Coats,"['girls', 'outerwear', 'jackets']",[],"Keep her warm all season long with our girls' outerwear—cozy fleece, warm down and waterproof jackets and vests—at Patagonia.com. Free Shipping over $99.",https://www.patagonia.com/shop/kids-girls-jackets-vests
18,Girls' Jackets and Winter Coats | The North Face,Girls Jackets & Coats,"['jackets', 'coats', 'girls', 'outerwear']",[],"Shop outdoor jackets, winter coats, and vests for girls at The North Face. Level up the outerwear for your little one's next adventure.",https://www.thenorthface.com/en-us/kids/girls-apparel/girls-jackets-and-vests-c211742
19,Girls' Winter Coats and Jackets | Lands' End,Girls Jackets & Coats,"['girls', 'coats', 'girls', 'jackets', 'coats', 'girls', 'jackets', 'girls']",[],"Shop girls' winter coats at Lands' End. FREE shipping available. Find quality girls' winter jackets, winter coats for girls, winter jackets for girls, ...",https://www.landsend.com/shop/girls-winter-coats-jackets-outerwear/S-xfi-xez-y5d-yib-xhi-xec
20,Jackets and Coats for Girls | Online Sale - Zara,Girls Jackets & Coats,"['Jackets', 'Coats', 'Girls', 'COAT']",[],Jackets and Coats For Girls · PLAID BLAZER. 49.90 USD. -39%. 29.99 USD · LINEN BLEND BLAZER. 45.90 USD. -34%. 29.99 USD · HEAT SEALED FEATHER AND DOWN PUFFER COAT.,https://www.zara.com/us/en/kids-girl-outerwear-l394.html
21,Jackets for Women & Teenage Girls | Aeropostale,Girls Jackets & Coats,"[""Girl's"", 'Coats', 'Jackets', 'jackets', 'girls']",[],"Girl's Winter Coats and Jackets. When you need something a little warmer, cuddle into the latest styles of winter jackets for teenage girls and women from Aero.",https://www.aeropostale.com/women-teen-girls/jackets-coats/
22,Outerwear for Girls - Costco Wholesale,Girls Jackets & Coats,"['Outerwear', 'Girls', 'Outerwear', 'Girls']",[],Find a great collection of Outerwear for Girls at Costco. Enjoy low warehouse prices on name-brand Outerwear for Girls products.,https://www.costco.com/girls-outerwear.html
23,Girls Coats & Jackets at Janie and Jack,Girls Jackets & Coats,"['girls coats', 'jackets', 'girls', 'girls']",[],"Buy stylish girls coats, jackets and other distinctive girls outwear at Janie and Jack. Available in girls sizes newborn to 12.",https://www.janieandjack.com/girls-jackets-coats
24,"Stylish & Cute Girls Jackets, Coats & Vests | Gymboree",Girls Jackets & Coats,"['coats', 'girls', 'girls', 'jackets']",[],Shop cute and warm coats for girls. Find girls vests and jean jackets here. Discover styles and clothing that your kids will love at Gymboree!,https://www.gymboree.com/us/c/girls-jackets-coats
25,Girls' Coats & Jackets - Boden,Girls Jackets & Coats,"['girls', 'coats', 'jackets']",[],Snuggle up when the temperature dips in one of our girls' coats and jackets. Find seriously durable styles with added sparkle at Boden.,https://www.bodenusa.com/en-us/girls-coats-jackets
26,"Girls' Outerwear – Winter Coats & Jackets, Hats & Gloves",Girls Jackets & Coats,"['girls', 'coats', 'jackets', 'girl', 'outerwear']",[],"ShopJustice.com just dropped new tween girls winter coats and jackets your girl will love at great low prices. Plus, we made our outerwear with Repreve® ...",https://www.shopjustice.com/collections/girls-outerwear
27,Girls Coats - Girls Jackets - Padded Coats - Vertbaudet,Girls Jackets & Coats,"['coat', 'coats']",[],No child can go through winter without a good quality coat. Treat your daughter to warmth and softness with our comprehensive collection of coats and ...,https://www.vertbaudet.com/en/girls/coats-jackets.htm
28,"Girls' Coats, Puffer Jackets, Snow Pants and Outerwear | Zulily",Girls Jackets & Coats,"[""girl's coat"", 'girls', 'jackets', 'coats']",[],"Bundle her up in a girl's coat from Zulily. Discover great deals on girls' puffer jackets, raincoats, winter coats, ski pants and more from top brands.",https://www.zulily.com/category/girls-coats-outerwear
29,Girls Designer Coats & Jackets - Childrensalon,Girls Jackets & Coats,"['Girls', 'Coat', 'Girls', 'Jacket', 'Girls']",[],Mayoral-Girls Red Trench Coat | Childrensalon · Stella McCartney Kids-Girls Blue Star Print Denim Jacket | Childrensalon · Hugo-Girls White Logo Windbreaker ...,https://www.childrensalon.com/girl/coats-jackets
30,Girls' Jackets & Coats | Joules®‎ US,Girls Jackets & Coats,"[""girl's Jacket"", 'Coat']",[],Choose a girl's Jacket or Coat from the full range available at Joules. Stay stylish whatever the weather this season.,https://www.joulesusa.com/Girls-Clothing/Jackets-Coats-Parkas
31,Coats & Jackets - Girls - Neiman Marcus,Girls Jackets & Coats,"['girls coats', 'jackets', 'jackets']",[],Shop girls coats and jackets at Neiman Marcus. Get the look no matter how cold it is with these versatile jackets.,https://www.neimanmarcus.com/c/kids-girls-coats-jackets-cat73830738
32,Girls Coats & Jackets | Raincoats - Next US,Girls Jackets & Coats,"['girls coats', 'jackets', 'coats']",[],Stylish girls coats & jackets for transitional weather. Shop the range featuring raincoats & winter coats. Next day delivery & free returns available.,https://www.next.us/en/shop/gender-oldergirls-gender-youngergirls-productaffiliation-coatsandjackets-0
33,Coats & Jackets - Girls - Saks OFF 5TH,Girls Jackets & Coats,['jackets'],[],"Shop a wide selection of rain, hooded, fleece jackets and more at Saks OFF 5TH. Up to 70% OFF on designer brands with fast shipping.",https://www.saksoff5th.com/c/kids/girls/girls--7-16-/outerwear
34,"Coats for girls (3-12 years), parkas, blazers | Jacadi Paris",Girls Jackets & Coats,"['coats', 'Girl', 'jacket', 'Girl', 'coat']",[],"Take a look at the collection of coats, parkas and blazers in different sizes, colors and cuts ... Girl mid-length down jacket ... Girl 3-in-1 trench coat.",https://www.jacadi.us/child/girls/outerwear/c/m1-3-1-7
35,Junior Girls' Jackets and Coats Collection 2022 | Benetton,Girls Jackets & Coats,"['Jackets', 'coats', 'girl', 'jackets']",[],"Jackets and coats for junior girl. From technical fabric bombers to denim jackets, not to mention sleeveless or more elegant style models: the collection of ...",https://us.benetton.com/jackets-coats-junior-girl/
36,"Girls' Outerwear, Coats, & Jackets in Sizes 2-16",Girls Jackets & Coats,"['girls', 'outerwear', 'coats', 'jackets']",[],Shop girls' outerwear in sizes 2-16 and find everything from winter coats and jackets to down vests. Free Fast Shipping With an RL Account ...,https://www.ralphlauren.com/girls-clothing-outerwear
37,Girls Coats & Outerwear + FREE SHIPPING | Clothing - Zappos,Girls Jackets & Coats,"['Coats', 'Outerwear', 'Girls']",[],"Free shipping BOTH ways on Coats & Outerwear, Girls from our vast selection of styles. Fast delivery, and 24/7/365 real-person service with a smile ...",https://www.zappos.com/girls-coats-outerwear/CKvXARDH1wHAAQPiAgMBAhg.zso
38,Girls' Coats & Jackets | J.Crew,Girls Jackets & Coats,"['Girls', 'coats', 'jackets', 'coats', 'jackets', 'Girls']",[],Shop Girls' coats & jackets at J.Crew. Find the best coats & jackets and see the entire selection of Girls' clothing.,https://www.jcrew.com/plp/girls/categories/clothing/coats-and-jackets
39,Girls' Coats and Jackets Collection 2021 | Sisley Young,Girls Jackets & Coats,"['girls', 'Girls', 'outerwear', 'Coats', 'jackets']",[],"Much loved by girls, Sisley Young Girls' outerwear combines the latest trends with cult trends that drives every generation crazy. Coats, jackets, bombers ...",https://us.sisley.com/girls-jackets-coats/
40,Girls Coats - Bloomingdale's,Girls Jackets & Coats,"['Girls', 'Coat']",[],"Polo Ralph Lauren Girls' Water Resistant Down Long Coat - Little Kid, Big Kid. $235.00 - $245.00. Now $176.25 - $183.75 (25% OFF).",https://www.bloomingdales.com/buy/girls-coats
41,Girls' Designer Outerwear | Saks Fifth Avenue,Girls Jackets & Coats,"['girls', 'outerwear']",[],"Shop the best girls' designer outerwear and more at Saks Fifth Avenue. Plus, get free shipping and returns on every order.",https://www.saksfifthavenue.com/c/kids/girls/girls-coats-jackets
42,Girls Coats & Outerwear | RookieUSA,Girls Jackets & Coats,"['Girls Coats', 'Outerwear', 'Jacket']",[],Girls Coats & Outerwear. 85 Results. Show Filters Hide Filters ... Shiny Chevron Quilting Jacket (Toddler/Little Kids). Jordan Kids.,https://www.rookieusa.com/girls-coats-outerwear/CKvXARDH1wHAAQPiAgMBAhg.zso?s=isNew%2Fdesc%2FgoLiveDate%2Fdesc%2FrecentSalesStyle%2Fdesc%2F
43,Women's Jackets & Coats | Coats & Jackets for Teenagers,Girls Jackets & Coats,"['Jackets & Coats', 'Jacket', 'Coat', 'Coat']",[],"Women's Jackets & Coats · 1 Color. Corduroy Shirt Jacket. Was $19.95, now $6.99$54.95$16.48. Vegan Shearling Coat, Black · 2 Colors. Vegan Shearling Coat. Was ...",https://www.hollisterco.com/shop/us/womens-jackets-and-coats
44,Girls' Coats & Jackets | Abel&Lula ® - Abelandlula.Com,Girls Jackets & Coats,"['Coats', 'Girls', 'coats', 'jackets', 'coats']",[],"FREE SHIPPING from $250 SHOP ONLINE Coats for Girls by Abel&Lula. Wool coats, jackets, coats...",https://www.abelandlula.com/en-us/usa/girl-coats-and-jackets-usu1
45,"Girls' Designer Coats, Jackets & Down Jackets - Smallable",Girls Jackets & Coats,"[""girl's coat"", 'girls', 'coats', 'coats']",[],"Come rain, snow or shine, you'll find the perfect girl's coat for your child. From girls' winter coats or fur coats for colder days and high-tech pieces ...",https://www.smallable.com/en/fashion/children/girl/coat-down-jacket-pram-suit
46,Girls Jackets & Vests | Columbia Sportswear,Girls Jackets & Coats,['jacket'],[],Up to 40% off select gear. Columbia's exclusive technology for warmth and protection is built into every jacket.,https://www.columbia.com/c/girls-jackets/
47,Girls' Jackets & Coats - SCHEELS.com,Girls Jackets & Coats,"['girls', 'coats', 'jackets']",[],SCHEELS carries a wide selection of girls' coats and jackets from leading brands like Columbia and The North Face.,https://www.scheels.com/c/jackets-coats/girls
48,Girls' Jackets and Coats - Hayden Girls,Girls Jackets & Coats,"['Girls', 'Jackets & Coats']",[],"Girls' Jackets & Coats. If there's one thing girls and tweens can't be without this winter, it's a cute, cozy jacket or coat! We ...",https://www.haydengirls.com/collections/coats-jackets
49,Girls' Jackets & Coats - Etsy,Girls Jackets & Coats,"['jackets & coats', 'Jacket', 'Coat', 'Girls', 'jacket']",[],"Check out our jackets & coats selection for the very best in unique or custom, ... Bear Jacket - Bear Coat - Boys clothes - Girls clothing - Baby jacket ...",https://www.etsy.com/c/clothing/girls-clothing/jackets-and-coats
50,New and used Girls' Coats for sale | Facebook Marketplace,Girls Jackets & Coats,"['Girls', 'Girls', 'Coats', 'Girls', 'Coats', 'Girls coat']",[],"Marketplace › Apparel › Kids' Clothing › Girls' Clothing › Girls' Coats. Girls' Coats. Filters. Girls coat and pants in Independence, KS.",https://www.facebook.com/marketplace/category/girls-coats/
51,"Girl's Winter Coats, Raincoats, Jackets - Outerwear",Girls Jackets & Coats,"['outerwear', 'girls', 'coats', 'jackets']",[],"Catimini outerwear for girls 2-14 years features trench coats, parkas, raincoats and jackets in a selection of colors and fabrics. Shop now!",https://catiminiusa.com/collections/girl-outerwear
52,Girls' Coats and Jackets | Gap Factory,Girls Jackets & Coats,"['girls', 'coats', 'girls', 'jackets']",[],Help her stay stylish and warm with girls' coats from Gap Factory. Get girls' jackets and more in top styles and colors.,https://www.gapfactory.com/browse/category.do?cid=1041731
53,Girls' Jackets | REI Co-op,Girls Jackets & Coats,"['Girls', 'Jackets']",[],Shop for Girls' Jackets at REI - FREE SHIPPING With $50 minimum purchase. Curbside Pickup Available NOW! 100% Satisfaction Guarantee.,https://www.rei.com/c/girls-jackets
54,"Girls' Vests, Hoodies, Jackets & Coats - Momorii",Girls Jackets & Coats,"['Girls', 'Jackets & Coats']",[],"Girls' Vests, Hoodies, Jackets & Coats. Price.",https://momorii.com/collections/hoodies-jackets-coats-girls
55,"Girls' Coats, Jackets & Windbreakers | Nike, Jordan, adidas",Girls Jackets & Coats,"['coats', 'jackets', 'girls']",[],"Shop online at JD Sports for the hottest winter coats and jackets for girls. Cop the freshest winter sportswear from their favorite brands like Jordan, ...",https://www.jdsports.com/store/kids/girls/clothing/jackets/_/N-1uhgnje
56,"Girls Hoodies, Sweaters, Jackets, Coats & Outerwear",Girls Jackets & Coats,"['girls', 'jackets', 'coats', 'outerwear', 'jackets', 'girls', 'girls coats']",[],"Keep her warm & looking good with girls' jackets, hoodies, sweaters, coats and outerwear from Tea. Shop today for cozy jackets for girls, girls coats ...",https://www.teacollection.com/girls-outerwear
57,Shop Girls' Coats and Jackets | Tommy Hilfiger USA,Girls Jackets & Coats,"['girls', 'jackets', 'coats', 'jackets', 'jackets']",[],"Shop girls' jackets and coats from Tommy Hilfiger. Including windbreakers, puffer jackets and vests, trenchcoats, trucker jackets and more.",https://usa.tommy.com/en/kids-girls-jackets-coats
58,Girl Jackets & Outerwear | Carter's | Free Shipping,Girls Jackets & Coats,['Girl Jackets & Outerwear'],[],"Girl Jackets & Outerwear 70 Items. Shop girl spring jackets, girls summer jackets and girls spring coats. Style Finder ...",https://www.carters.com/carters-kid-girl-jackets-and-outerwear
59,Girls' Coats & Jackets | T.J.Maxx,Girls Jackets & Coats,"['girls', 'coats', 'jackets']",[],"Shop girls' coats & jackets for brands that wow at prices that thrill. Free Shipping on $89+ orders online, easy, in store returns. New surprises everyday!",https://tjmaxx.tjx.com/store/shop/kids-baby-shop-by-category-kids-coats-jackets-girls-coats-jackets/_/N-1172322942
60,Girls Coats & Jackets - Rachel Riley,Girls Jackets & Coats,[],[],"Rachel Riley is a British award-winning children's clothing brand. We design classic luxury childrenswear & are best known for our quality & style, with prints ...",https://www.rachelriley.com/collections/girl-coats
61,Girls' Jackets - Under Armour,Girls Jackets & Coats,"['girls', 'jackets', 'coats', 'jackets']",[],"UA makes a full range of girls' jackets, vests, puffer coats, ski jackets, windbreakers, and more—to give you the options you need to keep getting better no ...",https://www.underarmour.com/en-us/c/girls/clothing/outerwear/
62,Jackets & Outerwear - Girls' Sale - Brooks Brothers,Girls Jackets & Coats,"['girls', 'outerwear', 'coats', 'jackets']",[],Shop Brooks Brothers sale on girls' outerwear and take advantage of discount prices on a great selection of coats and jackets.,https://www.brooksbrothers.com/jackets-%26-outerwear/1561
63,"500+ results for ""Girls' Coats & Jackets"" - Sears",Girls Jackets & Coats,"['girls', 'coat', 'girls', 'jacket']",[],"However, in the cold months, bundle her up in a heavy girls'winter coat in her favorite colors. The right girls' winter jacket can make venturing outside more ...",https://www.sears.com/clothing-girls-clothing-girls-coats-jackets/b-5000941
64,Coats & Jackets 3-8 years Girl - childrenswear at YOOX,Girls Jackets & Coats,"['Coats', 'Jackets', 'Girls', 'Jacket']",[],Coats & Jackets 3-8 years on YOOX: Italian and international designer item with delivery ... Nike Sportswear Big Kids' (Girls') Synthetic-Fill Hooded Jacket.,https://mobile.yoox.com/us/girl/collections/kids/shoponline/coats%20&%20jackets_mc
65,Girls' Coats & Jackets - Marshalls,Girls Jackets & Coats,"['girls', 'coats', 'jackets']",[],"Shop girls' coats & jackets for brands that wow at prices that thrill. Free Shipping on $89+ orders online, easy, in store returns. New surprises everyday!",https://www.marshalls.com/us/store/shop/kids-baby-kids-baby-shop-by-category-kids-coats-jackets--girls-coats-jackets/_/N-3023515690
66,Girls Coats & Jackets – Chasing Fireflies,Girls Jackets & Coats,"['outerwear', 'girls', 'jackets']",[],"Stylish and warm outerwear, right this way! Our curated collection has girls covered for spring, summer, winter and fall – which means lightweight jackets, ...",https://www.chasing-fireflies.com/collections/girls-coats-jackets
67,Girls Coats & Outerwear | Clothing - 6pm,Girls Jackets & Coats,[],[],"Shop for brands you love on sale. Discounted shoes, clothing, accessories and more at 6pm.com! Score on the Style, Score on the Price.",https://www.6pm.com/girls-coats-outerwear/CKvXARDH1wHAAQPiAgMBAhg.zso
68,Girls Jackets & Coats | Augusta Sportswear Brands,Girls Jackets & Coats,['girls jackets & coats'],[],"Browse girls jackets & coats from Augusta Sportswear Brands. All the latest wholesale styles for team jackets, warmup jackets, and rain jackets for girls.",https://www.augustasportswear.com/girls-outerwear-jackets
69,Girls' Coats & Jackets | Buckle,Girls Jackets & Coats,"['girls', 'coats', 'jackets']",[],Shop new styles of girls' coats and jackets at Buckle.,https://www.buckle.com/girls/coats-jackets
70,Kids' Trench Coats & Jackets | London Fog,Girls Jackets & Coats,"['coats', 'jackets', 'Girl', 'Jacket']",[],"Shop London Fog high-quality trench coats, raincoats, jackets & more for children. ... Flounce Midweight Toddler/Girl Reversible Fleece-Lined Jacket.",https://londonfog.com/collections/kids-outerwear
71,Girls' Jackets & Outerwear - FOREVER 21,Girls Jackets & Coats,"['girls', 'jackets', 'outerwear', 'jackets', 'jackets']",[],"Shop adorable girls' jackets and outerwear at FOREVER 21 for your mini fashionista. Discover faux leather moto jackets, bomber styles, denim jackets, ...",https://www.forever21.com/us/shop/catalog/category/girls/girls_outerwear
72,Kids Jackets for Girls - Girls Coats | Maisonette,Girls Jackets & Coats,"['coats', 'jackets', 'girls', 'girls coats']",[],Shop Maisonette's selection of kids coats and jackets for girls. Stay warm all season by discovering fun and cozy designs of girls coats in one simple ...,https://www.maisonette.com/shop/kids/girl-clothing/outerwear
73,Girls' Jackets | adidas,Girls Jackets & Coats,"['girls', 'jackets', 'coats']",[],"Find girls' jackets, coats, outerwear and parkas at adidas. Keep your kid warm and covered in any weather.",https://www.adidas.com/us/girls-jackets
74,Jackets & Coats for Girls | Nautica,Girls Jackets & Coats,"['jackets', 'girls', 'girls', 'jackets', 'girl', 'jackets']",[],Keep her warm all winter long with jackets for girls from Nautica. Shop girls' lightweight jackets for fall and toddler girl puffer jackets for cold ...,https://www.nautica.com/kids-girls-outerwear/
75,"Girls coats, jackets, vests, puffers - Everafter",Girls Jackets & Coats,['Girls outerwear'],[],Girls outerwear to keep you warm and cozy.,https://everaftershop.com/collections/outerwear-girls
76,Girls Jackets Coats - Shein,Girls Jackets & Coats,['Girls Jackets Coats'],[],Free Returns ✓ Free Shipping On Orders $49+ ✓ 1000+ New Arrivals Dropped Daily ✓ Shop for Girls Jackets Coats at SHEIN USA!,https://us.shein.com/category/Girls-Jackets-Coats-sc-00809154.html?lang=us
77,"Preppy Girls Outerwear, Coats, Vests, and Jackets",Girls Jackets & Coats,"['girls', 'jackets']",[],"Find perfect preppy sweaters for girls, plus iconic vests, jackets and more at ClassicPrep.com. Cardigans, crew necks, Fair Isles, and sweater dresses for ...",https://classicprep.com/collections/preppy-girls-outerwear
78,Girls Jackets & Vests. Nike.com,Girls Jackets & Coats,"['Girls', 'Jackets', 'Coats']",[],"Girls' Jackets, Coats & Vests. Bomber JacketsParka JacketsPuffer JacketsVests Windbreakers Rain JacketsFleece JacketsInsulated JacketsTrack Jackets.",https://www.nike.com/w/girls-jackets-vests-3aqegz50r7y
79,Little Girls Coats - Mia Belle Girls,Girls Jackets & Coats,"[""girl's"", 'jackets']",[],"But, here at Mia Belle, it is! We have everything for every fashion-loving cutie. For the denim divas, we have girl's tie-die denim jackets, frayed.",https://www.miabellebaby.com/collections/girls-outerwear
80,Jackets and Coats - Girls' outerwear - Aspesi,Girls Jackets & Coats,"['Jackets', 'coats']",[],Enrich your wardrobe: explore our products as Jackets and coats Enter and buy in the Aspesi online shop.,https://www.aspesi.com/en_jp/bambino/girls/jackets-and-coats.html
